title,text,date,place,placeURL,placeLocation,placeType,reviewScore,avgScoreMust see in the day & also at night,"A visit to Jemaa el-Fnaa is a must in Marrakech. Photos that you see in travel catalogs, etc, do not do it justice. It is the main social meeting point for locals. Thus this main square is crowded with locals, tourists & vendors. On our 1st visit with our guide at night, we were fascinated with the sights & sounds. Our last day in Marrakech was spent there whereby we had fun doing last minute shopping. We bargained for poufs, babouches, caftan, and souvenirs. Saw metal work being done, leather poufs being hand stitched & kaftans being sewn. Lunch was at a local cafe whereby we ate chicken shawarma & beef tagine that were delicious & cheap. I recommend going there in the day & also at night for 2 different experiences.",March 2017,Jemaa el-Fnaa,https://www.tripadvisor.com/Attraction_Review-g293734-d318047-Reviews-Jemaa_el_Fnaa-Marrakech_Marrakech_Safi.html,"Marrakech, Morocco",attractions,4.0,4.0
A must see mosque for non Muslims can visit,This marvelous mosque was built on reclaimed land by the Atlantic Ocean. It took 6 years with workers working on shifts 24/7 to build this imposing mosque. There is a retractable roof that we were fortunate to see it half opened on our visit. Chandeliers were from Italy. It has the highest minaret in the world. The artisan work inside is gorgeous. Beautiful marble everywhere. French architect had an ingenious way of hiding the speakers.,March 2017,Hassan II Mosque,https://www.tripadvisor.com/Attraction_Review-g293732-d317997-Reviews-Hassan_II_Mosque-Casablanca_Casablanca_Settat.html,"Casablanca, Morocco",attractions,4.0,4.5
Tempting pastries and tasty pastilla,"There is a large selection of Moroccan and French pastries. Prices are reasonable, thus it is very popular. If possible buy one of each variety of pastry to sample. They also sell pastilla (Moroccan meat pie) which is made to order an hour in advance. We ordered the chicken pastilla and walked around the Quartier Habosh for an hour before we picked up our hot pastilla poulet. We ate the pastilla for our meal and some of the pastries as our dessert.",March 2017,Patisserie Bennis Habous,https://www.tripadvisor.com/Restaurant_Review-g293732-d1219380-Reviews-Patisserie_Bennis_Habous-Casablanca_Casablanca_Settat.html,"Casablanca, Morocco",restaurants,4.0,4.5
Better than expected,Rick's Cafe was chosen by our tour group as a welcome dinner to begin our 10 day tour of Morocco. Much to my surprise the food was better than expected. There is a nice ambiance and lovely Moroccan decoration throughout. It is owned by an American lady.,March 2017,Rick's Cafe,https://www.tripadvisor.com/Restaurant_Review-g293732-d938987-Reviews-Rick_s_Cafe-Casablanca_Casablanca_Settat.html,"Casablanca, Morocco",restaurants,4.0,4.0
Enjoyable first Moroccan dinner,"Basmane is located on the ground floor of our hotel, Val D'Anfa. We dined on chicken with lemon and olives, and lamb with prunes and almonds tangines. Both were simply mouth watering. Basmane's decor is very Moroccan which gives it a great dining experience. Service was good too.",March 2017,Basmane,https://www.tripadvisor.com/Restaurant_Review-g293732-d1576804-Reviews-Basmane-Casablanca_Casablanca_Settat.html,"Casablanca, Morocco",restaurants,4.0,4.0
Inedible curry,"Having read good reviews about Thanying, we went there for dinner. Beef in the curry main dish was so over cooked that it was inedible. We returned that dish and our dining experience was ruined. The prices are not cheap but that curry dish tasted bad. There was also an air of snobbiness.",January 2017,Thanying,https://www.tripadvisor.com/Restaurant_Review-g293916-d1491803-Reviews-Thanying-Bangkok.html,"Bangkok, Thailand",restaurants,2.0,4.0
Location and Lana style,"After a night at a terrible hotel (more like a hostel in disguise), we went in search for another hotel to stay. We walked to 3 other hotels and have the staff show us the rooms before choosing Kodchasri Thani. We got a good price for our room, which included a daily breakfast buffet. Every morning we will eat breakfast outside by the pool, which has many potted orchids of various colours. Our room was comfortable for 3 nights and quiet. Being near the Old Town made it easy for us to walk and explore this charming city. The front desk staff was helpful and pleasant.",January 2017,Kodchasri Thani Chiang Mai,https://www.tripadvisor.com/Hotel_Review-g293917-d1964900-Reviews-Kodchasri_Thani_Chiang_Mai-Chiang_Mai.html,"Chiang Mai, Thailand",hotels,4.0,4.5
An exhilarating one day trek,"Since both my partner and I enjoy hiking we decided to go on a full day trek. It started with a ride to the Anka village and from there we hiked to various terrains and we saw rubber trees, wild papaya trees, banana plantation, waterfall, etc. The trek comprised of flat, to steep uphill to crossing brooks and walking along rice fields. Lunch was at our guide's house in his Lahu village. We had pork with snow peas, stir fried eggplant, jasmine rice and fresh cut pineapple for dessert. To spice up our food, we were given homemade chili - hot! At the end of our lunch we had a delightful time seeing our guide relaxed with his wife, son and baby grandson, before we continued our hike. Towards the end of our trek, our guide stopped us when he heard bells. It was a mahout riding his elephant after a day's work. We were thrilled to see a working elephant passed us by. On our way back to Chiang Rai we were driven to a place where we soaked our tired feet in thermal water. A final stop was at the Big Buddha temple where we climbed up to the highest part of the pagoda. Our guide made bamboo cups & rings for each of us, which became our reminder of an enjoyable and exhilarating trek. Do wear a hat, sunglasses, breathable long sleeve shirts and trousers. Bring a day pack that has insect repellent, wet wipes, tissues and lots of water to drink.",January 2017,Lanna Trek,https://www.tripadvisor.com/Attraction_Review-g297920-d2516635-Reviews-Lanna_Trek-Chiang_Rai_Chiang_Rai_Province.html,"Chiang Rai, Thailand",attractions,4.0,5.0
Tom Yum Pizza anyone?,Partner needed a pizza. He got his fix and I ate the Tom Yum pizza (Thai taste). Both of our pizzas accompanied by good cold beers were tasty. Delectable pizzas and friendly service made it a pleasurable meal for us.,January 2017,Hungry Wolf's Steak & Ale House,https://www.tripadvisor.com/Restaurant_Review-g297920-d6513144-Reviews-Hungry_Wolf_s_Steak_Ale_House-Chiang_Rai_Chiang_Rai_Province.html,"Chiang Rai, Thailand",restaurants,4.0,4.5
Curious,"Clock Tower is in the middle of a circle where vehicles drive by. It is golden. At 7 and 8 pm, it will have different colours on it with music being played for about 8 minutes. Meanwhile vehicles still drive around it. Curious night tourist attraction.",January 2017,Clock Tower Chiang Rai,https://www.tripadvisor.com/Attraction_Review-g297920-d555158-Reviews-Clock_Tower_Chiang_Rai-Chiang_Rai_Chiang_Rai_Province.html,"Chiang Rai, Thailand",attractions,3.0,4.0
Elegant Mansion with history,A road trip brought us to Milwaukee. Pabst Mansion was a must see for us and we were not disappointed. The guided tour was interesting as we toured this lovely mansion. It was an enjoyable way to spend the morning.,July 2016,Pabst Mansion,https://www.tripadvisor.com/Attraction_Review-g60097-d272129-Reviews-Pabst_Mansion-Milwaukee_Wisconsin.html,"Milwaukee, Wisconsin",attractions,4.0,4.5
AVOID THIS PLACE,"The reviews do not match the property. For the same price you can stay at a hotel that includes breakfast and at a good location. Villa Duang Champa's price does not include breakfast. Their wifi is terrible. Our room is very, very, basic and is comparable to a 2 star hotel at best. For the same price you can find other hotels that have more amenities, with breakfast included in their price located within the old city. Many people will be tempted to stay here because the Sunday night market is just at their front door but once again do not let this persuade you to do so. We endured a night here and ended up in a nicer hotel that was only 5 minutes walk from the night market.",January 2017,Villa Duang Champa,https://www.tripadvisor.com/Hotel_Review-g293917-d668586-Reviews-Villa_Duang_Champa-Chiang_Mai.html,"Chiang Mai, Thailand",hotels,2.0,4.5
Reclining Buddha and more,"Reclining Buddha is gargantuan. After seeing it from the front (head to toe), do walk around to see its back. You will find 108 bowls along the right wall, where one can put coins in them. For 20 Baht, you get a bowl of coins & simply drop one into each of those bowls & you will walk to the end of the room. A stroll around the temple ground is pleasant and will entice you to take more photographs. From there we walked to the Amulet market (parts of it along the river).",January 2017,Wat Phra Chetuphon,https://www.tripadvisor.com/Attraction_Review-g293916-d311043-Reviews-Wat_Phra_Chetuphon-Bangkok.html,"Bangkok, Thailand",attractions,5.0,4.5
Riding above the streets of Bangkok,"A great way to get around the business and shopping centers of Bangkok, without having to deal with taxis and tuk tuks. It does require some or a lot of walking. The trains are clean and air conditioned. We have used it in conjunction with the MRT.",January 2017,BTS Skytrain,https://www.tripadvisor.com/Attraction_Review-g293916-d450970-Reviews-BTS_Skytrain-Bangkok.html,"Bangkok, Thailand",attractions,4.0,4.5
Architecture and Intrigue,Jim Thompson was an American who retired in Bangkok and revived the silk industry. This is an interesting place to visit. Go early. The tour is short and no photography is allowed inside the house. However there are lots outside that one can photograph. Walk around the small garden and into smaller buildings. There is also a good gift shop selling silk.,January 2017,Jim Thompson House,https://www.tripadvisor.com/Attraction_Review-g293916-d447276-Reviews-Jim_Thompson_House-Bangkok.html,"Bangkok, Thailand",attractions,4.0,4.5
Easy to use and affordable,"We took the MRT to the weekend market in Chatuchak. It was fast and convenient. Trains are clean, air conditioned and safe. It is very easy to use and you can buy a pass.",January 2017,MRT,https://www.tripadvisor.com/Attraction_Review-g293916-d8554759-Reviews-MRT-Bangkok.html,"Bangkok, Thailand",attractions,4.0,4.5
Fine Thai dining experience,"Prices here are high but the quality is good. We made a reservation for 2 and were seated at a table that was nice and cozy downstairs. This is a Thai fine dining restaurant. We had the Taster's menu at 2,200 Baht each. There was a lot of food. Only complaint was that the shrimp was a little over cooked for our liking but the flavour was satisfying. Their crab curry (lump crab meat) and salmon laab were outstanding. The mango with sticky rice and coconut ice cream was a delighful finale. Great service too.",January 2017,Blue Elephant Restaurant,https://www.tripadvisor.com/Restaurant_Review-g293916-d864325-Reviews-Blue_Elephant_Restaurant-Bangkok.html,"Bangkok, Thailand",restaurants,4.0,4.5
Affordable and delicious Thai food,"Fried spring rolls were non greasy & good. Pad Thai was flavourful. You must try their apple pie for dessert. It gets busy during peak dining hours, so a reservation (especially for dinner) will guarantee a table. We went early or late and was seated without any reservation. Dined there for 3 meals because we felt that we got value for our money.",January 2017,Dash! Restaurant and Bar,https://www.tripadvisor.com/Restaurant_Review-g293917-d2437001-Reviews-Dash_Restaurant_and_Bar-Chiang_Mai.html,"Chiang Mai, Thailand",restaurants,4.0,4.5
MISLEADING,"We did not get the room we reserved. Apparently our reserved room was already occupied. When we made the reservation to request for that particular room, we were told to go through Airbnb. Handling of this issue was very poorly done by Alexa, who lacked social skills and was uncongenial. We stayed the night because it took 90 minutes to get there and I was too tired to argue with her. Our room was VERY basic and had a hole (at least 2 inches in diameter) in the wood floor. I covered it with my suitcase but when I woke up the next morning, my suitcase was wet. Vehicle noise from the road could be heard from our room. We DO NOT RECOMMEND Chai Lai Orchid. Please do thorough research because there are at least 2 other places one can go to for the elephant experience. When we returned home we met a couple who went to another place and had a better experience than us.",January 2017,Chai Lai Orchid,https://www.tripadvisor.com/Hotel_Review-g2237291-d3640765-Reviews-Chai_Lai_Orchid-Mae_Wang.html,"Mae Wang, Thailand",hotels,2.0,4.5
Good food with friendly service,"We dined here twice and the same lady who served us was very pleasant. She explained their menu to us and later told us about the Chiang Rai Flower Festival (which was nice too). Their laab/larb (Barrab style), the grilled northern sausage, Khao Soi and tom yom kong were delicious. Dishes are palatable and inexpensive. Go there to eat delectable food and meet our delightful server.",January 2017,Barrab Restaurant,https://www.tripadvisor.com/Restaurant_Review-g297920-d3845448-Reviews-Barrab_Restaurant-Chiang_Rai_Chiang_Rai_Province.html,"Chiang Rai, Thailand",restaurants,4.0,4.5
