title,text,date,place,placeURL,placeLocation,placeType,reviewScore,avgScore
Come here for steaks.,"We ordered a ribeye steak each, shoe string potatoes, creamed spinach, a salad, one blood sausage (for me to sample), a bottle of Malbec and a dessert. The salad was fresh, crisp and delicious, blood sausage was not what I expected, the shoe string potatoes were perfect in size and well fried, creamed spinach was delicious (not too creamy) and the ribeye steaks were superbly done medium. Our food and the Malbec recommended by our waiter paired well. For dessert we shared ice cream with dulce de leche, which was a great end to our meal. Despite the fact that we did not speak any Spanish and our waiter spoke very little English, the service was very good. I recommend this restaurant for Argentinian steaks. We thought the cost of our meal was reasonable.",January 2020,El Mirasol de La Recova,https://www.tripadvisor.com/Restaurant_Review-g312741-d812595-Reviews-El_Mirasol_de_La_Recova-Buenos_Aires_Capital_Federal_District.html,"Buenos Aires, Argentina",restaurants,4.0,4.5
Beautiful natural landscape,"This is the first of our tour of the Du Pont properties. It is by far the best. There was an exhibit of clothes from ""The Crown"" series there on our visit. The mansion is interesting but the gardens are well planned and there is a trolley that will drive you to parts of it. Highly recommend Winterthur.",June 2019,"Winterthur Museum, Garden & Library",https://www.tripadvisor.com/Attraction_Review-g34060-d138300-Reviews-Winterthur_Museum_Garden_Library-Winterthur_Delaware.html,"Winterthur, Delaware",attractions,4.0,4.5
Terrible service!,"My husband and I went to Bank's because it was recommended to us. His clam chowder had lots of potatoes and hardly any clams. When we asked our server about it, his reply was ""that's the way it is"". My husband ordered a white wine and that was not served until after our entrees were served by another waiter. He asked the second waiter about his white wine but the second waiter simply ignored us and walked away.
After speaking to the manager about the appalling service, she apologised but never return to see how our meal was. It was bad dining experience for us. I do not recommend this restaurant. Go to Bardea, on 620 N Market St, instead.",June 2019,Banks' Seafood Kitchen,https://www.tripadvisor.com/Restaurant_Review-g34059-d14070040-Reviews-Banks_Seafood_Kitchen-Wilmington_Delaware.html,"Wilmington, Delaware",restaurants,1.0,4.0
Fresh ramen and more.,The ribs are well seasoned and fell off the bone. Ramen was fresh and the broth tasty. The Charred Snap Peas with the kimchi was pleasantly different. Our favourite was the whole Dover Sole - cooked to perfection with just the right types of dipping sauce.,June 2019,Momofuku Noodle Bar,https://www.tripadvisor.com/Restaurant_Review-g48236-d16673280-Reviews-Momofuku_Noodle_Bar-New_City_New_York.html,"New City, New York",restaurants,4.0,4.5
"Ambiance, Tasty food and Great service","This was our first visit to this restaurant. My husband's steak was more rare than he liked. Shane, the manager, came to our table to ask how we were and my husband told him about his steak. Immediately Shane asked if he wanted a new steak and salad. He asked for his steak to be cooked a little more and new salad. That was served 5 minutes later. Our hanger steaks were well seasoned and our salads were very fresh. At different times, both Shane and Tony (our waiter) came over to inquired about our steaks. Before we asked for the bill, Shane surprised us by placing their signature dessert (salted caramel cheesecake with a dollop of vanilla ice cream) on our table. That was delicious. Service with a smile was what Tony gave us. We enjoyed our meal and will return again.",June 2019,Parker & Quinn,https://www.tripadvisor.com/Restaurant_Review-g60763-d4331649-Reviews-Parker_Quinn-New_York_City_New_York.html,"New York City, New York",restaurants,4.0,4.0
Well prepared food with good service,"The cabbage roil with sauerkraut were absolutely mouthwatering and paired well together. The sauerkraut was well cooked and seasoned. Goulash was good too. Their polenta was rich and tasty. If you like cabbage roll and sauerkraut, you need to dine here. .",May 2019,La Mama Ateneu,https://www.tripadvisor.com/Restaurant_Review-g294458-d799970-Reviews-La_Mama_Ateneu-Bucharest.html,"Bucharest, Romania",restaurants,4.0,3.5
Sanctuary for the sandhill cranes in a non-profit organisation,"It was our first time to see the sandhill cranes migration in Kearney, NE. Rowe Sanctuary is a lovely place to visit. We highly recommend that you view the sandhill cranes in the blinds here. It gave us a spectacular view of these magnificent birds. There are more volunteers than full time staff here. The gift shop has interesting items and are reasonably priced. All profit goes back to Rowe Sanctuary, which is a non-profit entity. We highly recommend a visit here and plan to return in the near future.",March 2019,Audubon Rowe Sanctuary,https://www.tripadvisor.com/Attraction_Review-g45584-d263763-Reviews-Audubon_Rowe_Sanctuary-Gibbon_Nebraska.html,"Gibbon, Nebraska",attractions,4.0,5.0
Spectacular!,"The symmetry of this vast complex with the Taj Mahal in the centre is amazing. Taj Mahal with its history is definitely a ""must see"". No sharp objects are allowed - pens, penknives, nail files, pins, etc. - into the compound. It is crowded but definitely worth a visit.",February 2019,Taj Mahal,https://www.tripadvisor.com/Attraction_Review-g297683-d317329-Reviews-Taj_Mahal-Agra_Agra_District_Uttar_Pradesh.html,"Agra, India",attractions,4.0,5.0
Majestic Greek ancient citadel,"The Acropolis with the Parthenon, the Erechtheion, and the Temple of Athena Nike is a sight to behold. These architectural marvels were constructed between 460-430 BC. Just imagine that! It was worth climbing the steps, enduring the heat and jostling with lots of people to see these stunning structures. From there you get a panoramic view of modern Athens. Wear walking shoes as the ground is uneven, sunscreen and a hat. Bring water to keep hydrated.",September 2018,Acropolis,https://www.tripadvisor.com/Attraction_Review-g189400-d198706-Reviews-Acropolis-Athens_Attica.html,"Athens, Greece",attractions,5.0,4.5
"Delicious almond cookies, ginger cookies and varieties of peanut candy","Koi Kei Bakery is famous in Macau and Hong Kong for their peanut candies. I have been a fan of their almond cookies for years. But it was on my first trip to Macau this May that I discovered their ginger cookies. They give you small samples of their cookies and candies to taste. If not for the fact that I lack space in my suitcase, I would have purchased more goodies from them. There is a big variety of cookies, candies and snacks available. Visit one of their outlets and savour these delicious snacks for yourself.",May 2018,Koi Kei Bakery- Rua S. Paulo,https://www.tripadvisor.com/Restaurant_Review-g664891-d2159412-Reviews-Koi_Kei_Bakery_Rua_S_Paulo-Macau.html,"Macau, China",restaurants,4.0,4.0
Ceviche delight,We came here at lunch for their ceviche & like it so much that we returned the next night for dinner. Their menu offered many different ceviches to choose from. Seafood was fresh and well seasoned. We enjoyed every bite.,October 2017,La Cevicheria,https://www.tripadvisor.com/Restaurant_Review-g297476-d1161396-Reviews-La_Cevicheria-Cartagena_Cartagena_District_Bolivar_Department.html,"Cartagena, Colombia",restaurants,4.0,4.0
Walking in this colourful walled city is interesting.,"Walled cities have always been of interest to my partner & I. Cartagena's walled city is easy to walk around in. The doors of many of the buildings tell stories of who their original owners were. The door knockers let one who the occupation/profession of the owner - especially it they are wealthy. There is a large bronze statue of a woman by Fernando Botero in Plaza Santa Domingo. It is said if one rubs her breast, it will bring good luck in love.",October 2017,Walled City of Cartagena,https://www.tripadvisor.com/Attraction_Review-g297476-d555214-Reviews-Walled_City_of_Cartagena-Cartagena_Cartagena_District_Bolivar_Department.html,"Cartagena, Colombia",attractions,4.0,4.5
Mondongo and fresh fish for dinner,"Here is where I tasted another traditional Colombian soup. It is mondongo, a beef tripe soup, recommended by our guide. Being raised to eat almost anything edible at least once, I am no stranger to tripe in Chinese cuisine, Vietnamese pho, Mexican soups and now in Colombia. It was delicious and very filling. My non tripe eating partner had grilled fish that was fresh and well seasoned. We both enjoyed our dinner here.",October 2017,La Olla Cartagenera,https://www.tripadvisor.com/Restaurant_Review-g297476-d1880811-Reviews-La_Olla_Cartagenera-Cartagena_Cartagena_District_Bolivar_Department.html,"Cartagena, Colombia",restaurants,4.0,4.0
Lots of walking,"I enjoy walking but when you come here, remember to wear sunscreen, sunglasses, clothes that are breathable and a hat. It is hot walking up to this fort and also around it. Bring a bottle of water to quench your thirst. You will be rewarded with a panoramic sight of Cartagena and photo opportunities.",October 2017,Castillo de San Felipe de Barajas,https://www.tripadvisor.com/Attraction_Review-g297476-d315386-Reviews-Castillo_de_San_Felipe_de_Barajas-Cartagena_Cartagena_District_Bolivar_Department.html,"Cartagena, Colombia",attractions,3.0,4.5
Come here for Ajiaco,"Ajiaco is a traditional Colombian soup that consists of 3 types of potatoes, broth (probably chicken) and guasca (herb). It is served with shredded chicken on the soup and a skewered cob of corn in it. The accompaniments are: capers, sour cream, an avocado half and rice. This is a delicious and hearty soup. If you enjoy soups, this is a MUST try.",October 2017,El mejor ajiaco del mundo,https://www.tripadvisor.com/Restaurant_Review-g294074-d4466515-Reviews-El_mejor_ajiaco_del_mundo-Bogota.html,"Bogota, Colombia",restaurants,5.0,4.5
Go see the Gold,An interesting museum that tells the history of Colombia through gold. The museum shop is worth a browse. Unfortunately we were in a tour and there was not enough time to see everything.,October 2017,Gold Museum (Museo del Oro),https://www.tripadvisor.com/Attraction_Review-g294074-d532210-Reviews-Gold_Museum_Museo_del_Oro-Bogota.html,"Bogota, Colombia",attractions,4.0,4.5
Very nice museum,Botero was personally involved in this museum that displays his works and other European artists that he collected. It is free admission and worthy of a visit.,October 2017,Museo Botero del Banco de la Republica,https://www.tripadvisor.com/Attraction_Review-g294074-d532215-Reviews-Museo_Botero_del_Banco_de_la_Republica-Bogota.html,"Bogota, Colombia",attractions,4.0,4.5
Fresh seafood on the beach,"El Bony is a favourite among the Columbians. It is right on the beach across the street from Hotel Caribe. We ate the medium size local catch that was deep fried. It came with coconut rice and fried plantains. Our whole fish were fresh, delicious and not greasy.
Although our server did not speak English and we did not speak Spanish, we managed to communicate. She was patient, friendly and always smiling. It was very pleasant experience to eat tasty food in a simple beach shack.",October 2017,Kiosco El Bony,https://www.tripadvisor.com/Restaurant_Review-g297476-d1457561-Reviews-Kiosco_El_Bony-Cartagena_Cartagena_District_Bolivar_Department.html,"Cartagena, Colombia",restaurants,5.0,4.0
A pleasant dining experience,We made reservation for only table that is on the doorway which looks out on the street. It was a different dining experience for us. Our seafood meal was absolutely delicious. Cuttlefish appetiser was fresh as was our fish main courses. Waiter gave us pumpkin seed oil to try and that was good too.,June 2017,Julija Restaurant,https://www.tripadvisor.com/Restaurant_Review-g274873-d697387-Reviews-Julija_Restaurant-Ljubljana_Upper_Carniola_Region.html,"Ljubljana, Slovenia",restaurants,4.0,4.5
Must See,The story behind the Vasa is sad and somewhat hilarious. However it enabled us in the 21st century to see what a 17th century ship looked like. I recommend joining an English tour and see the English video too; check times for these. Then walk around to see the exhibits and this beautiful ship to fully understand it.,August 2017,Vasa Museum,https://www.tripadvisor.com/Attraction_Review-g189852-d208277-Reviews-Vasa_Museum-Stockholm.html,"Stockholm, Sweden",attractions,4.0,4.5
Updated castle,We walked up there instead of taking the funicular. It looks more impressive looking up from the city centre. They have updated this castle for tourists but it is still interesting.,June 2017,The Ljubljana Castle,https://www.tripadvisor.com/Attraction_Review-g274873-d6924839-Reviews-The_Ljubljana_Castle-Ljubljana_Upper_Carniola_Region.html,"Ljubljana, Slovenia",attractions,3.0,4.0
Canal tour,"It was a relaxing ride on the boat along the river canal going under many bridges. It was part of the walking tour, which I recommend.",June 2017,River Ljubljanica Kanal,https://www.tripadvisor.com/Attraction_Review-g274873-d555572-Reviews-River_Ljubljanica_Kanal-Ljubljana_Upper_Carniola_Region.html,"Ljubljana, Slovenia",attractions,4.0,4.5
GoOpti saved us,"We were to meet with another company in the parking area of Venice airport but that company's vehicle did not show up. It was a prepaid ride that we purchased prior to our Eastern Europe trip. We showed up early and waited for 1.5 hours. We even called them 3 times but no one picked up the phone. Finally we spoke to 3 GoOpti drivers and the last one said he could drive both of us to Ljubljana for 60 euros. What choice do we have, but go with them. There were 2 passengers in the van with us and another was picked up at a bus station half an hour later. The van was clean, the ride smooth and the driver was conscientious. We were thrilled that we found a ride to Ljubljana and were the first to be dropped off. We paid the driver 60 euros in cash and he gave us a receipt. While waiting for the other company, we noticed many GoOpti vans but none from the company we bought tickets for. Definitely recommend GoOpti for ride from Venice to Ljubljana.",June 2017,GoOpti - Ljubljana,https://www.tripadvisor.com/Attraction_Review-g274873-d17826750-Reviews-GoOpti_Ljubljana-Ljubljana_Upper_Carniola_Region.html,"Ljubljana, Slovenia",attractions,5.0,4.5
Gathering place,Triple bridge is 3 connected bridges in the centre of Ljubljana for pedestrians. It connects the old medieval with the modern Ljubljana. People congregate there and it is a happening place.,June 2017,Triple Bridge (Tromostovje),https://www.tripadvisor.com/Attraction_Review-g274873-d276335-Reviews-Triple_Bridge_Tromostovje-Ljubljana_Upper_Carniola_Region.html,"Ljubljana, Slovenia",attractions,3.0,4.5
Slovenian food,We went there to eat Slovenian food. It is located in old medieval Ljubljana. We ordered different sausages because we wanted to taste the sausage that is from the area. They were average.,June 2017,Gostilna Sokol Ljubljana,https://www.tripadvisor.com/Restaurant_Review-g274873-d1190824-Reviews-Gostilna_Sokol_Ljubljana-Ljubljana_Upper_Carniola_Region.html,"Ljubljana, Slovenia",restaurants,3.0,3.5
Castle within a cave,It was interesting to see and visit this renaissance castle built at the mouth of a cave. This makes it unique. Unfortunately we were in a group tour and were not given enough time to explore more on our own.,June 2017,Predjama Castle,https://www.tripadvisor.com/Attraction_Review-g274878-d277346-Reviews-Predjama_Castle-Postojna_Inner_Carniola_Region.html,"Postojna, Slovenia",attractions,4.0,4.5
Train ride inside a cave,"Be ware that there will be many people visiting this cave. They do have it well organised that large groups go through efficiently. Temperature is kept cool, so dress in layers. First you take a train ride into the cave and then walking with informative guides. Cave is impressive. Train will take you out of the cave.",June 2017,Postojna Cave,https://www.tripadvisor.com/Attraction_Review-g274878-d277348-Reviews-Postojna_Cave-Postojna_Inner_Carniola_Region.html,"Postojna, Slovenia",attractions,4.0,4.5
Waterfalls galore,"We drove from Zagreb and spent a night in Plivice before tackling this national park the next day. Be ready to walk a lot to see the amazing waterfalls and lakes. There are 2 small caves there that we went in. They require climbing on wet steps and steep stairs. Spectacular waterfalls - some of which you walk over on bridges. Ride the ferry inside the park to take you to another lake area. We brought water and food to eat there and stayed for 6 hours. When you get away from the crowds, it is tranquil. It is also beautifully picturesque.",June 2017,Plitvice Lakes National Park,https://www.tripadvisor.com/Attraction_Review-g303827-d554038-Reviews-Plitvice_Lakes_National_Park-Plitvice_Lakes_National_Park_Central_Croatia.html,"Plitvice Lakes National Park, Croatia",attractions,5.0,4.5
Delicious fresh grilled fish and blitva,"Our grilled trouts were fresh and delicious. It was here that we were introduced to blitva - which is potatoes and mangold (swiss chard) cooked in olive oil and garlic. It was love at first bite for both of us. We drove by this restaurant and decided to give it a try and were rewarded with fresh scrumptious food that was simply cooked. If you are visit Plitvice Lakes National Park, you must come here for dinner.",June 2017,Plitvice Lakes Petar,https://www.tripadvisor.com/Restaurant_Review-g1185918-d10455088-Reviews-Plitvice_Lakes_Petar-Rastovaca_Lika_Senj_County.html,"Rastovaca, Croatia",restaurants,5.0,4.5
Waterfall and more,"Waterfall is beautiful. Amazing colours of the water in the lakes. Hues of green and blue. There will be many people here, so try to come early.",June 2017,Veliki Slap,https://www.tripadvisor.com/Attraction_Review-g303827-d552457-Reviews-Veliki_Slap-Plitvice_Lakes_National_Park_Central_Croatia.html,"Plitvice Lakes National Park, Croatia",attractions,5.0,4.5
Well-prepared Croatian food,"Instead of eating inside this small restaurant, we sat at one of the tables they had out on the alley in front of it. We wanted fish and our waiter brought out 3 fresh sea bass on a plate for us to choose, we picked the largest one and asked to have it grilled. To accompany the sea bass we ordered blitva (Croatian potatoes and mangold cooked in olive oil and garlic) and white Croatian wine. The fresh sea bass was grilled to perfection and there was garlic in olive oil on the side to eat with it. The blitva was also done just right. Bread was good too. Our waiter gave us excellent service. It was our best meal in Split. Prices were reasonable for fresh seafood that was not over cooked and blitva was tasty.",June 2017,Konoba Matejuška,https://www.tripadvisor.com/Restaurant_Review-g295370-d12327979-Reviews-Konoba_Matejuska-Split_Split_Dalmatia_County_Dalmatia.html,"Split, Croatia",restaurants,5.0,4.5
History of Venice,If possible go tour the Doge's Palace first. It will give you an good understanding to Venetian history which will make your visit to this lovely city more enjoyable.,May 2017,Doge's Palace,https://www.tripadvisor.com/Attraction_Review-g187870-d194251-Reviews-Doge_s_Palace-Venice_Veneto.html,"Venice, Italy",attractions,4.0,4.5
Delizioso!,"This is a small cosy restaurant that serves fresh, well prepared and well seasoned food. Partner had cod puree and I had octopus for our starters that were very tasty. We both had fish fillets for our main course that were cook just right. Our white wine paired nicely with our meal. Service was good and prices were reasonable for Venice.",May 2017,Osteria Enoteca San Marco,https://www.tripadvisor.com/Restaurant_Review-g187870-d1096549-Reviews-Osteria_Enoteca_San_Marco-Venice_Veneto.html,"Venice, Italy",restaurants,4.0,4.5
First-rate ice cream,"While walking along the river side, we came across CACAO and its array of ice creams. There were numerous varieties to choose from, some with interesting flavours. We had to try them. I had the chocolate raspberry and it was the best ice cream of that flavour I had ever tasted. The rich dark chocolate marries very well with the raspberry. Beware, it is addictive!",May 2017,Cacao,https://www.tripadvisor.com/Restaurant_Review-g274873-d1155842-Reviews-Cacao-Ljubljana_Upper_Carniola_Region.html,"Ljubljana, Slovenia",restaurants,4.0,4.5
Good seafood and ambiance,"Half Shell Oyster House in Biloxi is a happening place. There were at least 2 big birthday parties when we ate there. It is our second time dining in this location and although we enjoyed our first experience, this second visit was better. I had the blackened redfish with fried soft shell crab that came with a salad and one side. My partner had grilled grouper. Both fish were fresh and delicious. The soft shell crab was scrumptious and not greasy (although it was deep fried). For dessert we shared a slice of key lime pie, which was yummy and reminded us of Key West, FL. Two glasses of wine with two entrees and a dessert cost less than $100, including tip.",May 2017,Half Shell Oyster House of Biloxi,https://www.tripadvisor.com/Restaurant_Review-g43686-d2187726-Reviews-Half_Shell_Oyster_House_of_Biloxi-Biloxi_Mississippi.html,"Biloxi, Mississippi",restaurants,4.0,4.5
Locals' quarter,"We came here for the pastry shop, Patisserie Bennis, and ended up wandering around. Our taxi driver/guide took us to the butchers where he purchased some meat, and brought it to a nearby restaurant to have them cook it for his lunch. At the meat areas, we saw camel head, sheep heads, tongues, camel hoofs, etc. This quarter is a mixture of food (fruits, vegetables, olives, meats, breads), clothing (children, men, women), Argan oil products, footwear, pottery and souvenirs. This is where the locals go to shop and thus was not crowded with tourists. Quartier Habous is worth a visit.",March 2017,Quartier Habous,https://www.tripadvisor.com/Attraction_Review-g293732-d7980715-Reviews-Quartier_Habous-Casablanca_Casablanca_Settat.html,"Casablanca, Morocco",attractions,3.0,4.0
Charbroiled oysters & Shrimp creole,"It was my first time there. My partner, who has lived in New Orleans, is very familiar with creole cooking. The server first gave us the wrong plate of the charbroiled oysters appetiser - 1 dozen instead of 1/2. Once we told him his error, he than went to the next table, lifted that plate from there to hand it to us. The server was not our waiter who took our order. That began an unpleasant dining experience. My yellow fin tuna was not as fresh, but my partner's shrimp creole was unpalatable. It was smothered with tomatoes with it being the predominate taste. The shrimp was colourless & tasteless. Quality of the food did not match their high prices. Diners beware.",May 2017,Drago's Seafood Restaurant,https://www.tripadvisor.com/Restaurant_Review-g40314-d464558-Reviews-Drago_s_Seafood_Restaurant-Metairie_Louisiana.html,"Metairie, Louisiana",restaurants,2.0,4.5
Beignets. Ahhh!,"Having always eaten beignets from Cafe du Monde, which we ate for dessert after lunch, we went to Morning Call for our dinner dessert that same day. This place has nostalgic decor & is opened 24 hours. The beignets were lighter than Cafe de Monde's. Hot chocolate was delicious too. For us, Morning Call won the battle of beignets. Please go there to try them yourselves.",May 2017,Morning Call,https://www.tripadvisor.com/Restaurant_Review-g40314-d464567-Reviews-Morning_Call-Metairie_Louisiana.html,"Metairie, Louisiana",restaurants,4.0,4.5
Mind-boggling,"Jemaa el-Fnaa is the main square in Marrakech. There are numerous souks, cafes, restaurants, post office, food vendors & souvenir shops around it. Horse drawn carriages beckons tourists. For a fee water men will pose for photos. This is in the day time
At night it transforms into a people gathering/watching place. Many food stalls are set to sell an array of Moroccan food - harira, tagines, breads, grilled meats, escargots, fruit juices, olives, dried fruit & nuts. At the square are also entertainers - snake charmers, story tellers, musicians, acrobats, etc. Sights, smells and sounds are mind-boggling.",March 2017,Medina of Marrakesh,https://www.tripadvisor.com/Attraction_Review-g293734-d324126-Reviews-Medina_of_Marrakesh-Marrakech_Marrakech_Safi.html,"Marrakech, Morocco",attractions,4.0,4.0
Wish we had another day ...,"The old medina, Fez-el-Bali, is an incredible labyrinth of winding narrow alleys. A local guide is recommended. No vehicles are allowed inside the medina walls. Main mode of transportation are donkeys, mules and bicycles. One gets the feeling of going back in time. The world's oldest university is located here. We wished we had another day to venture in this UNESCO World Heritage Centre.",March 2017,Medina of Fez,https://www.tripadvisor.com/Attraction_Review-g293733-d318051-Reviews-Medina_of_Fez-Fes_Fes_Meknes.html,"Fes, Morocco",attractions,4.0,4.5
