title,text,date,place,placeURL,placeLocation,placeType,reviewScore,avgScore
Surprise,This bar and grill was recommended by the hotel we were staying out. The venue has been recently renovated so it is a very pleasant – clean and fresh. The menu offers a good range especially with the additional Greek based dishes. The food was well presented and tasty and represented value for money. The staff were very friendly and helpful. The bathrooms were spotless.,August 2020,Outback Bar & Grill,https://www.tripadvisor.com/Restaurant_Review-g255094-d7987530-Reviews-Outback_Bar_Grill-Coober_Pedy_South_Australia.html,"Coober Pedy, Australia",restaurants,4.0,4.5
Great Stopover,Booked this hotel because we wanted the unique experience of sleeping in an underground hotel and we were not disappointed. The room was every well presented with a great ensuite. The staff are very friendly and helpful making sure staying at the hotel was very pleasant. Absolutely recommend this hotel if you are looking for a different hotel experience.,August 2020,The Lookout Cave Underground Motel,https://www.tripadvisor.com/Hotel_Review-g255094-d1227400-Reviews-The_Lookout_Cave_Underground_Motel-Coober_Pedy_South_Australia.html,"Coober Pedy, Australia",hotels,5.0,4.5
City Stop Over,"A really pleasant experience. The room, as was the hotel in general, was bright well maintained and well presented. All the staff were very friendly, welcoming and helpful, well all aside one - the gentlemen who supervised the entrance. He completely failed to appreciate that one has to load suitcases into a car and therefore parking is required, simply saying you can't park here is not at all helpful especially when surrounded by city traffic. The bugger lunch special at Eve's restaurant was great and represented real value for a little money given Melbourne lunch time prices. The service was polite, efficient and friendly.",February 2020,Pullman Melbourne on Swanston,https://www.tripadvisor.com/Hotel_Review-g255100-d256812-Reviews-Pullman_Melbourne_on_Swanston-Melbourne_Victoria.html,"Melbourne, Australia",hotels,5.0,4.5
Very Practical,"Needed to be close to Westfield Bondi Junction so this was the perfect location. Friendly helpful service. The apartment, lounge, bedroom and kitchenette was ideal. The apartment was well fitted out, clean, tidy and practical. Parking is a bit of an issue but it is Sydney after all.",January 2020,Meriton Suites Bondi Junction,https://www.tripadvisor.com/Hotel_Review-g947961-d287072-Reviews-Meriton_Suites_Bondi_Junction-Bondi_Greater_Sydney_New_South_Wales.html,"Bondi, Australia",hotels,4.0,4.5
Very Disappointing,"Reads well but that’s where it stops. The room we had was tired and in desperate need of an upgrade - things like the chunky aircon unit the faded tired wood work and worst of all no shower pressure. The new areas appeared to fit with the promotional material but if you are in the older part then I think like us you will be disappointed. We are so glad this was only a short stay.
Staff very friendly but this could not compensate for the outdated tired room.",January 2020,Pacific Bay Resort,https://www.tripadvisor.com/Hotel_Review-g255059-d296725-Reviews-Pacific_Bay_Resort-Coffs_Harbour_New_South_Wales.html,"Coffs Harbour, Australia",hotels,3.0,3.5
Passing through Toowoomba,"Booked this accommodation as we were passing through. The Platinum International is well appointed and a very pleasant place to stay. Location is ideal if you are just passing through. The rooms are very comfortable, clean, modern and well appointed. The big find was the restaurant - both the service and food surpassed our expectations and we would recommend that if you are staying here that you definitely check out the restaurant.",January 2020,Platinum International,https://www.tripadvisor.com/Hotel_Review-g255340-d1164432-Reviews-Platinum_International-Toowoomba_Queensland.html,"Toowoomba, Australia",hotels,5.0,4.5
Passing Through,"Another just passing through stopover. Overall a pleasant stay. The room we had was a bit tired and in need of some renovation - particularly the carpet. That said, it was otherwise well appointed and comfortable. The big walk in shower was definitely a bonus. Staff very helpful and friendly particularly when it came to a gluten free breakfast.",January 2020,Acacia Motor Lodge,https://www.tripadvisor.com/Hotel_Review-g528941-d1533564-Reviews-Acacia_Motor_Lodge-Coonabarabran_New_South_Wales.html,"Coonabarabran, Australia",hotels,4.0,4.5
Absolutely Wonderful,"Fantastic B&B as it sets a standard other B&Bs should achieve. Meryl and Phil make you feel special. The rooms are cossy, interesting and just very pleasant to spend time in. The breakfast is in our experience unequaled and just wonderful - it makes you linger so you enjoy the whole experience. Second visit for us and yes there will be another so we can check out another room.",January 2020,Bli Bli House Riverside Retreat,https://www.tripadvisor.com/Hotel_Review-g13196465-d1903000-Reviews-Bli_Bli_House_Riverside_Retreat-Diddillibah_Sunshine_Coast_Queensland.html,"Diddillibah, Australia",hotels,5.0,5.0
Soggy chips and chewy steak,"Sorry guys, after reading the reviews we were excited about eating here but sadly were totally disappointed.. The entree - oysters Kirkpatrick were extremely disappointing as it was simply oyster swimming in Worcester sauce, in fact drowning would be a more apt descriptor. The steak which formed part of the surf and turf was dry and chewy whist the chips for both mains where cold and soggy. The black snapper and bbq prawns were actually quiet good, aside the chips, and if the other surf and turf main had matched that it would have been a much better dinning experience. The plus was the service but that could not make up for the food so we will not be back.",January 2020,Surf Club Restaurant & Bar,https://www.tripadvisor.com/Restaurant_Review-g255059-d2350827-Reviews-Surf_Club_Restaurant_Bar-Coffs_Harbour_New_South_Wales.html,"Coffs Harbour, Australia",restaurants,2.0,4.0
A delightful stay,"This is indeed a cosy place to stay. From the minute you arrive you are made to feel welcome. The house has a lovely feel to it. The fact that breakfast and dinner are part of the package that we had meant that all the big decisions were made. The dinner menu over the three days we were there changed every night, so now worries about having to choose the same thing because of a lack of choice. The menu is adaptive to gluten free requirements and the young staff are well across the issue. The host and his staff go out of their way to make sure you enjoy your dinning experience and the chief goes that step further to ensure you have a fine dinning experience. Likewise with breakfast, variety, freshness and friendly service characterised the start to the day.
This was a totally relaxing and positive experience as the host,hostess and staff go out of their way to provide an excellent service.",October 2019,Mount Pleasant Hotel,https://www.tripadvisor.com/Hotel_Review-g190743-d1863582-Reviews-Mount_Pleasant_Hotel-Sidmouth_Devon_England.html,"Sidmouth, United Kingdom",hotels,5.0,5.0
First impression,"Don’t let first impressions put you off for I nearly fell into that trap. Don’t get me wrong the room we had was very basic /plain and the bed certainly is due to be replaced. But, that said, it was clean, functional and everything worked. Now to the real plus, the friendliness of the staff. I kid you not for the three days that we stayed at the Navigator the staff were always positive, helpful with absolutely nothing being too much trouble. The atmosphere in the Inn itself is delightful as it is a local and with so many regulars dropping in it has a wonderful positive feel. The meals both breakfast and dinner were very good with the staff and the chief going that little bit further to accommodate a gluten free diet. The evening menu offers a good range of choice and is certainly not just your basic pub food but rather a significant step up. The portion size is very generous, well prepared and presented. Likewise breakfast is very enjoyable and you certainly will not go hungry if you opt for the traditional English breakfast. We absolutely enjoyed the atmosphere of being part of this local Inn and being made to fell so welcome.",October 2019,Navigator Hotel,https://www.tripadvisor.com/Hotel_Review-g504216-d587342-Reviews-Navigator_Hotel-Bognor_Regis_Arun_District_West_Sussex_England.html,"Bognor Regis, United Kingdom",hotels,4.0,4.0
What a Gem,"The level of service and the food is amazing. Adam and his staff really do provide you with a fine dinning experience. This restaurant is definitely off the beaten track but we did learn that if you are in the area they do offer a free taxi service so check this out. The menu is extremely diverse offering interesting choices which a beautifully cooked, prepared and presented. The menu is adaptive to cater for gluten intolerance which is a major plus. The gin glazed salmon entree is very delicious as was my duck main. Recommend that you book in advance.",October 2019,The Auldgirth Inn,https://www.tripadvisor.com/Hotel_Review-g1096499-d2589151-Reviews-The_Auldgirth_Inn-Auldgirth_Dumfries_Dumfries_and_Galloway_Scotland.html,"Auldgirth, United Kingdom",hotels,5.0,4.5
Pot luck,"Went here based on trip advisor and so pleased we did. We were in the market for a quick lunch but still wanted something tasty and good. We certainly were not disappointed, the service was excellent with the waitress was very happy to assist with not only menu questions but general tourist questions as well. The Drouthy
Laird has recently been refurbished so it has a fresh and bright feel to the place. The food we had, burger and a grilled haddock was really good, in fact the burger was one of the best I have had in a Scottish/English pub. Absolutely recommend the burger and the grilled haddock.",October 2019,The Drouthy Laird,https://www.tripadvisor.com/Restaurant_Review-g644366-d17625388-Reviews-The_Drouthy_Laird-Inverurie_Aberdeenshire_Scotland.html,"Inverurie, United Kingdom",restaurants,5.0,5.0
A most enjoyable lunch,A most enjoyable lunch. Great menu served by a helpful and positive staff. Dropped in looking for a pub lunch and were pleased we did. The menu is not your traditional English pub fare but there is a good variety of options to choose from and the menu does provide non-gluten options. The steaks are served on a sizzling plata so if you are hungry that is a good option. The portions are very generous so you don’t need to worry about going hungry.,October 2019,The Red Lion Inn,https://www.tripadvisor.com/Restaurant_Review-g1925511-d1082797-Reviews-The_Red_Lion_Inn-Culross_Fife_Scotland.html,"Culross, United Kingdom",restaurants,5.0,4.5
Wonderful stay,"John and Rhoda were the perfect host and hostess. Everything was as you would expect when booking a B&B, from the friendly greeting, the positive help to the great morning breakfast. The room was charming, very clean and well presented as was the rest of the guest areas. John is positive and engaging endeavouring to make sure you enjoy your stay, but that is not to say they are not a great team and they make it work so as to ensure you have a delightful stay. Did I say the breakfast were fantastic, well it was. John and Rhoda go out of there way to add a personal touch to your stay. Absolutely recommend this B&B if you are in the area. The host and hostess fully understand what it is to run a B&B and they certainly have reached an exceptional standard of presentation and service.",September 2019,Dalgreine Guest House,https://www.tripadvisor.com/Hotel_Review-g946548-d12494697-Reviews-Dalgreine_Guest_House-Blair_Atholl_Pitlochry_Perth_and_Kinross_Scotland.html,"Blair Atholl, United Kingdom",hotels,5.0,5.0
Great seafood,This was a very positive and enjoyable dining experience noting that it is slightly more expensive than most restaurants in town. They provide and cater for gluten-free and their menu is adaptive to ensure person suffering from a gluten intolerance will have an enjoyable meal and evening. Service was fantastic and nothing was too much trouble especially when it came to selecting the wine. The dress crab and lobster was most enjoyable is well worth a try. Given the popularity of this restaurant it is important to book before hand.The restaurant also has an excellent gin selection should you be so inclined.,September 2019,Wells Crab House,https://www.tripadvisor.com/Restaurant_Review-g315941-d1605260-Reviews-Wells_Crab_House-Wells_next_the_Sea_Norfolk_East_Anglia_England.html,"Wells-next-the-Sea, United Kingdom",restaurants,5.0,4.5
Most enjoyable,The pub on the corner which is very popular and rightly so because they serve a good fare. We went there for dinner and found the food and the serving staff to be excellent. Importantly the golden fleece caters for gluten-free and has an understanding of how to adapt dishes to ensure a person suffering from gluten tolerance have an enjoyable dining experience. The menu offers both seafood and non seafood options to ensure there is enough variety for you to find something that you will like. Again the big plus was the friendliness of the staff and their commitment to ensuring you had a good dining experience.,September 2019,The Golden Fleece,https://www.tripadvisor.com/Restaurant_Review-g315941-d6628870-Reviews-The_Golden_Fleece-Wells_next_the_Sea_Norfolk_East_Anglia_England.html,"Wells-next-the-Sea, United Kingdom",restaurants,5.0,4.0
Popped in,Popped in for lunch and was pleased we did so. Whilst the restaurant is not by the sea but at the top end of Staithe street it is a very pleasant walk from the port up through the village shopping area to reach the restaurant. The venue is exceptionally well presented and the staff are positive and enthusiastic. The menu options provide a good variety and this restaurant will cater for gluten intolerance adapting the dish if necessary. It is a cozy place to sit enjoy your meal and a glass of wine; play one of the games that are available and let the afternoon pass you by.,September 2019,Bang In Wells,https://www.tripadvisor.com/Restaurant_Review-g315941-d8277193-Reviews-Bang_In_Wells-Wells_next_the_Sea_Norfolk_East_Anglia_England.html,"Wells-next-the-Sea, United Kingdom",restaurants,4.0,4.5
Most enjoyable,"Great location by the quay however it means parking is an issue. The room on the third floor was great. Freshly refurbished, comfortable and with a view of the quay. The staff were exceptionally friendly and helpful, nothing was too much bother. Cosy and comfortable with a bit of old world Harbourside pub charm. Dining in in their restaurant is also a positive option. The menu caters for gluten intolerance an offers a good variety. The seafood options are well worth considering as we found the dishes to be very fresh well cooked and presented.",September 2019,Marine Hotel,https://www.tripadvisor.com/Hotel_Review-g793710-d1050244-Reviews-Marine_Hotel-Stonehaven_Aberdeenshire_Scotland.html,"Stonehaven, United Kingdom",hotels,5.0,4.0
Not what was expected!,"Alison and Andy were very friendly and responsive to requests. The location was perfect as it was just a walk down the hill into the old part of town giving you good access to restaurants and the quay.
The room was quite a surprise in terms of the decor; the sofa and chair were not particularly comfortable and in my view had moved well past their best as had the additional single bed which just didn’t seem to belong in the room.The ensuite was a built-in affair which was incredibly pokey and small. The shower was very small and for a tall person it was quite uncomfortable to have a shower. The master bed was uncomfortable as I assess the mattress had moved well past its best and certainly needs to be replaced. I am sorry but from my experience I could not in all conscience rate this as a four star guest residence. Maybe my Australian background doesn’t quite fit with what is to be expected in the UK, that said, I would certainly expect in a four star rated residence for the ensuite to be more than just a small cubicle that has been added into a room.
Another disappointing factor was the non-acceptance of credit cards as this fact was not advertised in the information about the property. As a tourist accessing cash is not necessarily always easy and / or convenient given exchange rates etc.",September 2019,Seacrest Guesthouse,https://www.tripadvisor.com/Hotel_Review-g186345-d1154947-Reviews-Seacrest_Guesthouse-Whitby_Scarborough_District_North_Yorkshire_England.html,"Whitby, United Kingdom",hotels,3.0,4.5
Very interesting,A tour through the castle is very interesting as there is much to see and read re the castles history.,September 2019,Bamburgh Beach,https://www.tripadvisor.com/Attraction_Review-g504035-d14903135-Reviews-Bamburgh_Beach-Bamburgh_Northumberland_England.html,"Bamburgh, United Kingdom",attractions,4.0,5.0
Great location to visit Bamburgh Castle,Impressed with the positive attitude of the staff and friendly atmosphere. The location is excellent for viewing the castle or just taking a walk on the beach. You do need to be careful with what room you book as the rooms on the third floor are very small. We were disappointed with our initial room so we opted to upgrade. The breakfast was very enjoyable with a good menu options also the buffet offers plenty of variety. It is however important to book a table both at the hotel and at any of the other restaurants if you don’t intend to eat at the hotel or one of the other restaurants in town. In fact I recommend you book these restaurants well in advance of your arrival..,September 2019,The Victoria Hotel,https://www.tripadvisor.com/Hotel_Review-g504035-d251675-Reviews-The_Victoria_Hotel-Bamburgh_Northumberland_England.html,"Bamburgh, United Kingdom",hotels,4.0,4.0
Disappointing,"Whilst the staff were attentive and friendly the experience here was betrayed by the food when it arrived.
The veal schnitzel was unfortunately very oily which permeated through into the chicken. The other ordered dish, a bouillabaisse had great potential as the seafood which forms the basis of this dish was very fresh but alas there was very little of it, as most of the dish was taken up with 4 large potatoes. Based on the dishes we had we would certainly not go back and therefore we struggle to recommend this inn as a good place to dine.",September 2019,The Captain's Table at the Ship Inn,https://www.tripadvisor.com/Restaurant_Review-g793710-d1422376-Reviews-The_Captain_s_Table_at_the_Ship_Inn-Stonehaven_Aberdeenshire_Scotland.html,"Stonehaven, United Kingdom",restaurants,2.0,4.0
Room selection is important,"The first room we were offered on the second floor was exceptionally basic. Yes, it was clean but that is all I can say for it. The bathroom was old and tired with the evidence of mould / damp on the walls. Thankfully we were able to obtain a room change. The second room was a vast improvement having recently been renovated and was more in keeping with the promotional material.
Critically no access and then very limited access to wifi. Many apologies about it being fix but no resolution. Wifi for international travellers is critical and in this day and age given what you pay for a room it is a service that should work.
The staff are positive and helpful and certainly make you feel welcome. The dinning experience in the restaurant was very enjoyable and a very pleasant dining experience. The menu provided good options and also catered for gluten free.",October 2019,Friars Carse Country House Hotel,https://www.tripadvisor.com/Hotel_Review-g1096499-d279714-Reviews-Friars_Carse_Country_House_Hotel-Auldgirth_Dumfries_Dumfries_and_Galloway_Scotland.html,"Auldgirth, United Kingdom",hotels,3.0,4.0
A good option,A very enjoyable dinning experience due to the friendly helpful staff and the good quality of the food; beit seafood or a steak. The scallops are in our view an absolute must. The fish of the day is also worth a try. A dish we did not try but certainly looked fantastic is the seafood platter. We would have loved to give it a try but it just looked toooo big. Suggest if you go this option arrive at the restaurant hungry. The most important thing to do re this restaurant is to book well in advance of your arrival otherwise you will struggle getting a table.,October 2019,Cuchullin Restaurant,https://www.tripadvisor.com/Restaurant_Review-g551883-d10263818-Reviews-Cuchullin_Restaurant-Portree_Isle_of_Skye_The_Hebrides_Scotland.html,"Isle of Skye, United Kingdom",restaurants,4.0,4.5
Room with a continental breakfast,"The location is just perfect if you want to be right by the harbour but it makes parking a challenge even given the availability of paid parking.
The Quay is listed as a B&B but I fear it is very different to my understanding of a B&B the the general guide of what to expect when you stay in a B&B. The room itself was very pokey and certainly did not match the picture image. General cleanliness of the place - carpets - rather surprised at the state especially as pets are allowed in the rooms. The en-suite was very small and pokey making it uncomfortable to use. I certainly did not see this as a B&B in terms of the service and that little bit extra that you expect over and above a hotel, in fact it offered less than your average hotel room in terms of room service and amenities. Given you are paying for a B&B experience you would expect something more than just a room with continental breakfast included.",September 2019,The Quay B&B,https://www.tripadvisor.com/Hotel_Review-g315941-d11909828-Reviews-The_Quay_B_B-Wells_next_the_Sea_Norfolk_East_Anglia_England.html,"Wells-next-the-Sea, United Kingdom",hotels,3.0,4.5
What a gem!,"The seafood was delightful, fresh well cooked and flavoursome. We were driving past looking for somewhere to eat so we asked a local who recommended this restaurant in a town just further on. We are so glad we took this recommendation. Location is down by the harbour- a little bit of a challenge to get to if you don’t know the area but it is worth the trouble. The staff were exceptionally friendly and very accommodating to adapt the menu to accommodate gluten intolerance. The menu provides plenty of option to choose from and it is a challenge not to over order as the servings are very generous. Absolutely recommend this restaurant if you are in the area.",September 2019,The Old Boat House,https://www.tripadvisor.com/Restaurant_Review-g1480277-d4136912-Reviews-The_Old_Boat_House-Amble_Northumberland_England.html,"Amble, United Kingdom",restaurants,5.0,4.5
Taking a longer break,"We stayed here for three days to give us time to slow down a bit. The most striking aspect of our stay was the friendliness and positive attitude of the staff. The rooms are well presented,functional and clean, but the walls are paper thin and if you are not on the top floor you certainly know what the occupants above you are up to especially if they get in late or rise early. Breakfast buffet was good although the warm dishes from the bain marie tended to be cool especially if you ate breakfast around 9 o’clock. Pool is excellent so remember to pack bathers. The restaurant does get very busy with the arrival of coaches so it is important to plan ahead and book.",October 2019,Isles of Glencoe Hotel & Leisure Centre,https://www.tripadvisor.com/Hotel_Review-g315998-d244761-Reviews-Isles_of_Glencoe_Hotel_Leisure_Centre-Ballachulish_Glencoe_Scottish_Highlands_Scotland.html,"Ballachulish, United Kingdom",hotels,4.0,4.0
What a find!!,"We went here on the off chance and must admit to being totally impressed. The young staff were friendly and very enthusiastic. The menu offered a wide range of options -certainly on pub food. The menu also has a good variety of gluten free dishes. The duck dish and the glazed pork belly with scallops were absolutely wonderful. The dishes are tasty, well presented and superbly cooked.
We enjoyed our meals so much that we booked for the following night and we were not disappointed. We would recommend you book so as to avoid disappointment. A great find and we really do recommend this restaurant if your in the area.",October 2019,The Laroch Restaurant & Bar,https://www.tripadvisor.com/Restaurant_Review-g315998-d1937780-Reviews-The_Laroch_Restaurant_Bar-Ballachulish_Glencoe_Scottish_Highlands_Scotland.html,"Ballachulish, United Kingdom",restaurants,5.0,4.5
Disappointing,Location is good being in the town centre facing the harbour but this does of course bring the inevitable parking problem. Sadly the hotel has moved well past its prime .. it’s simply tired and this is reflected everywhere. The rooms themselves are very tired and in desperate need of refurbishment. The staff are friendly and helpful. However the general atmosphere of the rooms and the hotel in general is one of being worn out; if only the room looked as fresh as the ones on the web page. If you are planning a stay in Portree is is important to precook restaurants otherwise you could find yourself with no where to eat. Would have been great if the hotel had told us this at the time we booked.,October 2019,The Royal Hotel,https://www.tripadvisor.com/Hotel_Review-g551883-d254005-Reviews-The_Royal_Hotel-Portree_Isle_of_Skye_The_Hebrides_Scotland.html,"Isle of Skye, United Kingdom",hotels,3.0,3.5
