title,text,date,place,placeURL,placeLocation,placeType,reviewScore,avgScore‘Just Brilliant’,"Gunton arms is located near Cromer, Norfolk, so you really have to plan a trip to this restaurant - but trust me it is well worth the effort. The Gunton Arms is located in the grounds of Gunton Hall. We were fortunate enough to sit right next to the large cooking fire and therefore we are able to engage in an interesting conversations with Andy aka Stuart as he prepared our meal. I have to say without hesitation the steak cooked on the open fire was by far the best I’ve had in the UK. The pork chop also cooked on the open fire, with apple sauce was equally as good . The potatoes cooked in goose fat was a brilliant accompaniment. All we can say is if you are in the area then this is a dining experience not to be missed. We are so pleased that we went out of our way to ensure that we went to The Gunton Arms, and recommend you do the same. We would also suggest that you take the precaution of making a reservation so as to ensure you are not disappointed.
Thank you Andy for a wonderful lunch and telling us your tales of your time in the land down under. A throughly wonderful dinning experience.",September 2019,The Gunton Arms,https://www.tripadvisor.com/Restaurant_Review-g499097-d2417643-Reviews-The_Gunton_Arms-Thorpe_Market_Norfolk_East_Anglia_England.html,"Thorpe Market, United Kingdom",restaurants,5.0,4.0
Pub lunch,"A great pub venue just outside the cathedral. The food was very enjoyable and once order came relatively quickly, getting the order in was a bit more of a challenge as the pub was quite busy and the wait staff appeared somewhat overwhelmed. The menu offered a good variety and certainly catered for gluten intolerance; the staff were also across this issue which is always a plus. The twice backed cheese soufflé makes a great starter. Plenty of interesting choice with the mains but the steak is always a good fall back. Sitting in the front of the pub offers a great atmosphere- as you can look out onto the lane. As this is a very busy pub recommend you book if you can so as not to be disappointed.",September 2019,Wig & Mitre,https://www.tripadvisor.com/Restaurant_Review-g186336-d720937-Reviews-Wig_Mitre-Lincoln_Lincolnshire_England.html,"Lincoln, United Kingdom",restaurants,4.0,4.0
Dropped in for lunch,"Wandered in looking for somewhere for lunch. Still suffering from jetlag after having just arrived from Australia and so really looking for some good food and somewhere to sit and relax. Andrew immediately made us feel welcome took time out to provided directions to assist us with some banking issues. So when we returned having solved those problems we sat down to an enjoyable lunch in a convivial environment with positive and friendly service. The menu is adaptive and capable of dealing with gluten intolerance and whilst not an excessive amount of choices there is enough variety to choose from to ensure that you will enjoy a positive dining experience at a reasonable price. I found the friendliness and the positive service along with the good food a sufficient inducement to bring me back again. I’m sure if you to visit Wildwood Crawley you to will have an enjoyable dining experience. Thank you Andrew for bring that personal touch, much appreciated.",September 2019,Wildwood Restaurant,https://www.tripadvisor.com/Restaurant_Review-g187051-d10678792-Reviews-Wildwood_Restaurant-Crawley_West_Sussex_England.html,"Crawley, United Kingdom",restaurants,5.0,4.5
Lunch Break in the country,"Set out from government looking for a typical little country village close by. Shere certainly fits the bill and the White Horse pub added an additional attraction. This pub figured in the movie ‘The Holiday’. The pub menu offers a range of options, not necessarily your traditional pub fare, but certainly you should be able to find something that suits. Overall the food was good but I would not say exceptional. The staff were very friendly and the service was good. If you are heading this way I would suggest to avoid disappointment that you book a table in advance as this is quite a popular little tourist spot.",September 2019,The White Horse,https://www.tripadvisor.com/Restaurant_Review-g616273-d1155834-Reviews-The_White_Horse-Shere_Guildford_Surrey_England.html,"Shere, United Kingdom",restaurants,4.0,4.0
Well worth a look,"The entrance fee is a little steep give you only have access to the chapel, part of the grounds and the bridge. However, that said, the chapel is simply amazing and in my view a must see if you are visiting Cambridge.",September 2019,King's College Chapel,https://www.tripadvisor.com/Attraction_Review-g186225-d189094-Reviews-King_s_College_Chapel-Cambridge_Cambridgeshire_England.html,"Cambridge, United Kingdom",attractions,4.0,4.5
Wonderful morning punt with Pip the punter,"We booked our punting trip with Rutherford at the last minute and certainly did not regret it. The punter, a chap by the name of Pip, made the whole experience very enjoyable. Whilst not only being very knowledgeable of the sites along the Cam river he injected his own personal touch and humour into the trip which made it very entertaining and enjoyable experience. We understand that it is not possible to book a particular punter, which is a pity, as we would recommend a trip along the cam River with young Pip.",September 2019,Rutherfords Punting Company,https://www.tripadvisor.com/Attraction_Review-g186225-d10793291-Reviews-Rutherfords_Punting_Company-Cambridge_Cambridgeshire_England.html,"Cambridge, United Kingdom",attractions,5.0,5.0
Definitely only an overnight stop,"Overall the hotel looked tired particularly the corridors and lift areas. The staff were not particularly friendly or helpful. There certainly appear to be confusion over how one should be treated if you have already paid, asking for a security deposit sent totally inappropriate. Being woken at one in the morning by a fire alarm set off because someone was smoking in the room clearly indicates that there is ineffective communication between staff and hotel guests. The hotel staff simply brushed it off as an unfortunate occurrence which doesn’t help when you have to get up again at 4:30 in the morning for an early flight. Sorry guys totally unimpressed would only use this accommodation again as a last resort.",September 2019,ibis London Gatwick Airport Hotel,https://www.tripadvisor.com/Hotel_Review-g187051-d250934-Reviews-Ibis_London_Gatwick_Airport_Hotel-Crawley_West_Sussex_England.html,"Crawley, United Kingdom",hotels,3.0,4.0
Renewing and old Acquaintance,"It has been some time since we have been to Paymasters and we are so pleased we opted to go back. The food and service was simply the best – friendly, inviting and in terms of the food great. The menu offers a great choice and caters for gluten free without compromise on taste and flavours, which is a great plus. The pan-fried scallops with a romesco sauce were exceptional and we really do recommend you tried this entrée if scallops are your thing. As for mains we both opted for the Duck and Lychee curry – and what a great choice. Again a dish well worth checking out.",July 2019,Paymasters,https://www.tripadvisor.com/Restaurant_Review-g255325-d781863-Reviews-Paymasters-Newcastle_Greater_Newcastle_New_South_Wales.html,"Newcastle, Australia",restaurants,5.0,4.5
Overnight stop,Great place for an overnight stop. The staff were very friendly and helpful. The room is practical and tasteful. But the big win was the restaurant 579 Olive street - what a surprise. The food and service was excellent. If you are in Albury and looking for a great place to dine with interesting dishes then I recommend you check 579 out. The menu also caters for gluten free so that is a real bonus.,July 2019,Mercure Albury,https://www.tripadvisor.com/Hotel_Review-g255314-d255419-Reviews-Mercure_Albury-Albury_New_South_Wales.html,"Albury, Australia",hotels,4.0,4.5
Passing through,"Booked this motel based on the reviews it had received and we were so glad that we did. The Motel is modern, bright, clean and fresh and is well suited for that one night stopover or even longer. The rooms are well appointed and have everything you will need in terms of making that cup of coffee, storing food items in the bar fridge etc. The location is ideal - next-door to the Services Club where you are guaranteed to find something you will like to eat. We were so impressed with the overall quality of this motel that we booked it for our return trip and we certainly will have no hesitation in staying there again. It will in fact be our first preference. Positive friendly service with a personal touch goes a long way to making you feel welcome.",April 2019,Cowra Services Club Motel,https://www.tripadvisor.com/Hotel_Review-g261613-d8450105-Reviews-Cowra_Services_Club_Motel-Cowra_New_South_Wales.html,"Cowra, Australia",hotels,5.0,5.0
Fantastic romantic getaway spot,"Bli Bli House is an ideal venue for that romantic or quiet getaway. It's location is such that there are things to see and do or you can just spend time in the well appointed cosy room and just chillax. The breakfast is absolutely wonderful, there is absolutely no shortage of options, everything is fresh and beautifully presented. The cooked breakfast is a delight and if you are staying a few days we recommend you work your way through all of the options provided. Phil and Merryl can not do enough, in a very quiet and unobtrusive way, to ensure your stay is just fanatic.",April 2019,Bli Bli House Riverside Retreat,https://www.tripadvisor.com/Hotel_Review-g13196465-d1903000-Reviews-Bli_Bli_House_Riverside_Retreat-Diddillibah_Sunshine_Coast_Queensland.html,"Diddillibah, Australia",hotels,5.0,5.0
Return visit after many years,"A most enjoyable and positive dinning experience. It has been many years since we have eaten here and we are pleased to say - it was just as good as we remembered it. Food choice and quality is excellent catering also for a gluten free diet. The service is sometime a little slow but always positive, friendly and very helpful; nothing is too much trouble. We can certainly recommend the burger if you are stopping for lunch.",February 2019,Silk's Brasserie,https://www.tripadvisor.com/Restaurant_Review-g261620-d728318-Reviews-Silk_s_Brasserie-Leura_Blue_Mountains_New_South_Wales.html,"Leura, Australia",restaurants,5.0,4.5
Disappointing Dinning experience,A very disappointing dinning experience as both the food and service was average but the prices were certainly not. It has been sometime since we have dined here and our experiences in the past have been excellent that is why we specifically booked so that our friends could enjoy what we thought was a great place to dine on the harbour; sadly this was not the case.,February 2019,Sydney Cove Oyster Bar,https://www.tripadvisor.com/Restaurant_Review-g255060-d757408-Reviews-Sydney_Cove_Oyster_Bar-Sydney_New_South_Wales.html,"Sydney, Australia",restaurants,2.0,4.5
Country pub - with a difference,What a surprise ..... Evening dinner with the Mike Watson horse riding group. All-in-all a most enjoyable experience and certainly not what you expect when you walk through the door. The food and service were very good. We recommend dropping in and trying this local pub we think you will be pleasantly surprised.,March 2018,Kevington Hotel,https://www.tripadvisor.com/Restaurant_Review-g2690981-d2689269-Reviews-Kevington_Hotel-Kevington_Victoria.html,"Kevington, Australia",restaurants,4.0,4.5
Overnight stop over,A most pleasant surprise. Needed one nights accommodation as we passed through Bairnsdale and this was a great option. Obviously being reasonably new the rooms were well presented but it was pleasing to note they were also well prepared. The rooms were well appointed and give the washing machine facilities you could stay longer. TV option however very limited. Staff were very friendly and helpful. A most enjoyable stop over.,January 2019,Bairnsdale Motel,https://www.tripadvisor.com/Hotel_Review-g255345-d1231296-Reviews-Bairnsdale_Motel-Bairnsdale_Gippsland_Victoria.html,"Bairnsdale, Australia",hotels,5.0,4.5
Quick bite to eat,"On the road and so we were just passing through Inverlock, looking for a place to have lunch. We stopped and asked a local for a recommendation on a place to get a good lunch - value for money. He recommended both of the local pubs so we opted for The Inlet and we were not disappointed. The hotel catered for gluten free which was a huge plus especially as the steak sandwich was also available as a gluten free dish. Service and friendliness of the staff was also a plus given that we hit this place at the height of the tourist season. Well worth a stop in our view - enjoy.",January 2019,Inlet Hotel,https://www.tripadvisor.com/Restaurant_Review-g552187-d4780116-Reviews-Inlet_Hotel-Inverloch_Gippsland_Victoria.html,"Inverloch, Australia",restaurants,4.0,4.0
QUICK STOP OVER,"Everything about this hotel was great except for the white noice coming from the elevator which completely ruined the experience. We had Room 108b which backs onto the elevator shaft so all night you could hear either hear the elevator or the electric fans atop the elevator humming. Of course we didn’t realize this until we turned the tv off and then it was too late to complain.
We book through hotels.com rather than direct and therefore can’t help feel we got the least desirable room in the hotel. We were so put off by this experience that we did not rebook for the return trip. All I can suggest if you are booking this hotel make sure you ask that your room is located away from the elevators.",December 2018,The Esplanade Resort & Spa,https://www.tripadvisor.com/Hotel_Review-g255354-d966144-Reviews-The_Esplanade_Resort_Spa-Lakes_Entrance_Gippsland_Victoria.html,"Lakes Entrance, Australia",hotels,3.0,3.5
Long lunch,"The restaurant is located on the Syntagma Square - an ideal location to sit and watch the day go by particularly after spending a morning see the sights. The staff are very friendly and will endeavour to accommodate dietary requirements such as a gluten intolerance. There is a good variety of dishes so plenty to choose from. The fact that they serve a house wine makes the dinning experience even a bigger plus - the wine is actually very enjoyable and well worth trying. As a great place to eat, drink, relax and watch the world go by.",September 2018,Mentor Bar & Grill,https://www.tripadvisor.com/Restaurant_Review-g319780-d12098538-Reviews-Mentor_Bar_Grill-Nafplio_Argolis_Region_Peloponnese.html,"Nafplio, Greece",restaurants,4.0,4.0
Great lunch time stop over,Stopped in for lunch and pleased we did. The staff are very helpful and friendly offering polite and prompt service. They are very happy to cater for dietary requirements such as gluten free and were possible will adjust the dish to accommodate a gluten free diet. The burgers are great and all at a reasonable price.,August 2018,Del Mar,https://www.tripadvisor.com/Restaurant_Review-g1137879-d8760044-Reviews-Del_Mar-Porto_Rafti_East_Attica_Region_Attica.html,"Porto Rafti, Greece",restaurants,4.0,4.5
Not what I expected - Sofitel,"Reception very disappointing as a club member no priority system in operation contrary to the stated benefit to be offered to members.
Service in the lounge is incredibly disorganized and incredibly slow.
Aside the reception area, the lounge and restaurant which are bright and fresh the hallways and rooms are tired, especially the hallway carpets. Not what I expected to find at a Sofitel. On the positive side the reception staff are very polite and keen to help. Location is obviously a positive if you have an early flight out.",September 2018,Sofitel Athens Airport,https://www.tripadvisor.com/Hotel_Review-g562627-d285733-Reviews-Sofitel_Athens_Airport-Spata_East_Attica_Region_Attica.html,"Spata, Greece",hotels,3.0,4.5
Eat with the locals,"This is definitely a locals traverna - and if you are into sea food then you are assured of a very enjoyable dinning experience. We were there the evening of a rather large local family get together but this did not impact on the quality and friendliness of the service. The food is great and the serves are very very generous - try the mini serves of mussels and you will see - it surpasses most restaurants normal serves. As with all things sea food it can get expensive very quickly, but the prices here were in keeping with what was being served, obviously the more exotic the more expensive as per any restaurant but in my opinion still cheaper than most.
So if you are down checking out Poseidon’s temple and you are into sea food you might want to give this traverna a go.",August 2018,Theodoros & Eleni Fish Tavern,https://www.tripadvisor.com/Restaurant_Review-g12294876-d10962079-Reviews-Theodoros_Eleni_Fish_Tavern-Legrena_East_Attica_Region_Attica.html,"Legrena, Greece",restaurants,4.0,4.0
What a pleasant surprise!,"Cafe Zeus is at the other end of town, that is, you have to drive passed it to get to the entrance to the archaelogical of Olympia, but I can assure you it’s worth going back. Why?
The food and choices are great and the service is very very good. The staff completely understand the issues relating to gluten intolerance and will if possible alter dishes to ensure it is gluten free. Alex, who just happen to be a Greek Australian, went the extra nine yards to ensure everything we selected was gluten free so as to ensure we had a great lunch experience. I can personally recommend the Caesar salad as a good lunch option.
Don’t be put off by the fact that is not near the entrance to the attraction do some backtracking for I’m sure you will have an enjoyable lunch.",August 2018,Zeys Restaurant - cafe,https://www.tripadvisor.com/Restaurant_Review-g189487-d7755253-Reviews-Zeys_Restaurant_cafe-Olympia_Elis_Region_West_Greece.html,"Olympia, Greece",restaurants,5.0,5.0
“Very Basic hotel accommodation”,"The big plus for this hotel is the friendliness of the staff and their willingness to help.

The room was very basic which is fine if it bright and cheerful as opposed to tired. The bathroom however was another issue - very small and poky and I mean poky with no external ventilation or an exhaust fan. In Greece with an average summer temperature above 30 degrees C and the toilet issues - no flushing of toilet paper an exhaust fan / external ventilation in my view is a must. The underground parkinging is a real challenge if you have a medium size car and in reality is a very neglected basement area not what one would consider really set out to accommodate parking. Overall a very basic hotel room in an aging hotel complex.",August 2018,Hotel Cronos,https://www.tripadvisor.com/Hotel_Review-g670148-d2441609-Reviews-Hotel_Cronos-Arta_Arta_Region_Epirus.html,"Arta, Greece",hotels,3.0,3.5
“Lovely location but the hotel needs to lift its game”,"Location - The hotel is ideally placed if you want to access the Temple of Poseidon.

The rooms whilst recently renovated just looked like a quick make over. The front door and entrance for example to the room was a steal door with marine ply steps! The bathroom was very impractical particular in terms of using the shower - height restriction meant for a tall person it was almost impossible.The bathroom had no exhaust fan - given the heat and the fact that you can't flush paper - not a good combination. Everywhere in the room there were things that had not be finished. The grounds were uncared for as were the paths, noticeable the weeds growing over the paths.",September 2018,Poseidon Beach Villas,https://www.tripadvisor.com/Hotel_Review-g562628-d12723630-Reviews-Poseidon_Beach_Villas-Sounio_East_Attica_Region_Attica.html,"Sounio, Greece",hotels,3.0,4.0
Taking a break in Greece,"A very enjoyable three day stop over.
Looking for a relaxing stopover in this northern part of Greece, located south of Thessaloniki, then this resort is in my view a great option. The resort is well appointed but you can read all that from the resorts own site. What is impressive is the friendliness of the staff, the relaxed atmosphere and the attentive service. The buffet breakfast and dinners are a positive dining experience and the oppose to what you expect when told dinner and breakfast are a buffet. You will not be disappointed with the quality, variety and the presentation of the food, not to mention the taste.. The rooms are well appointed and extremely comfortable.
A great way to relax in an very enjoyable resort.",August 2018,Possidi Holidays Resort & Suites Hotel,https://www.tripadvisor.com/Hotel_Review-g667130-d249149-Reviews-Possidi_Holidays_Resort_Suites_Hotel-Possidi_Kassandra_Halkidiki_Region_Central_Macedon.html,"Possidi, Greece",hotels,5.0,4.5
Long Haul,A most enjoyable experience flying with the very friendly and helpful staff of Singapore airlines. The level of service friendliness and attention to ensuring the flight was as enjoyable as possible is to be commended. The staff made the flight - the inflight meals were excellent and the overall comfort level was very good.,September 2018,Singapore Airlines,https://www.tripadvisor.com/Airline_Review-d8729151-Reviews-Singapore-Airlines,World,flights,4.0,4.5
Going a little local.,"The menu offers a great variety so you will not be short on choices BUT don't order too much as the servings are very generous. The seafood is delightful and in most instances is fresh, you do need to check however. The house wine is a real steal and we can only recommend it - don't waste your money - go the house wine. The staff are an absolute delight, positive and very helpful, they will in fact advise you that you are more than likely ordering too much. Can you believe that!! All-in-all a delightful place to dine with a good balance of traditional style cooking with a more contemporary style leading to great food and a positive local dining experience. Great value for money.",September 2018,Alaloum,https://www.tripadvisor.com/Restaurant_Review-g319780-d2055780-Reviews-Alaloum-Nafplio_Argolis_Region_Peloponnese.html,"Nafplio, Greece",restaurants,4.0,4.0
An enjoyable place to relax,"Situated right on the Syntagma square this cafe offers a delightful dinning experience. The menu offers plenty of variety and the staff go out of their way to accommodate dietary requirements, particular the requirement for the food to be gluten free. Yes, it is a little more expensive but then you are paying a bit extra because of the cafes location - don't let that put you off as it is very pleasant to sit there in the evening watching the activities playing out in the square whilst you enjoy good food, great service and a glass or two of wine.",September 2018,Xenon Cafe,https://www.tripadvisor.com/Restaurant_Review-g319780-d3773751-Reviews-Xenon_Cafe-Nafplio_Argolis_Region_Peloponnese.html,"Nafplio, Greece",restaurants,5.0,4.5
What a delight!,"The inn is located in the Syntagma Square, so you are there right in the heart of the old town of Nafplio. We found this inn to be a delight and we certain enjoyed our six day stay. The room was charming - well appointed and very comfortable. Given the duration of our stay we were very fortunate to have the room with the large balcony, room 206 (I think). If you are there for a long stay then I recommend you request this room, as sitting on the balcony in the evening overlooking the square is indeed very enjoyable and relaxing. The room was as detailed in the advertisement and was very comfortable. The friendliness and positive commitment on the part of the staff to make sure you enjoyed your stay was refreshing and a very positive aspect of our stay. The breakfast served at the Zenon Cafe (just downstairs) was excellent. Again the staff went out of their way to provide great service especially when dealing with special dietary requirements. We ate a number of our evening meals at the cafe not only because of it close proximity to our room but because of the outlook over the square and the overall quality of the food and service made it such an enjoyable experience. Being located in the old part of Nafplio also brings with it a certain charm - especially seeing the children playing each evening in the square.",September 2018,Xenon Inn,https://www.tripadvisor.com/Hotel_Review-g319780-d1833144-Reviews-Xenon_Inn-Nafplio_Argolis_Region_Peloponnese.html,"Nafplio, Greece",hotels,5.0,4.5
