title,text,date,place,placeURL,placeLocation,placeType,reviewScore,avgScoreViews over the city,"Tower is situated on top of a hill, quite a steep climb during a hot and humid sunny day. Considered that the entry price for the top terrace and glass box was to steep for non residents so settled for the lower view platform which offers good views over the city and the Petronas towers. Beware that the open platform closes during rainy periods and no refunds are offered.",September 2017,Menara Kuala Lumpur,https://www.tripadvisor.com/Attraction_Review-g298570-d454880-Reviews-Menara_Kuala_Lumpur-Kuala_Lumpur_Wilayah_Persekutuan.html,"Kuala Lumpur, Malaysia",attractions,3.0,4.0
Interesting museum,Definetly worth a visit. Ecolains in detail the history of the city and you get a voucher worth of 5rmb to buy something from the souvenier shop where they have some nice handmade items. Snap a photo of the KL sign above and do not miss the city model show. The scale model of the city is quite impressive.,September 2017,Kuala Lumpur City Gallery,https://www.tripadvisor.com/Attraction_Review-g298570-d2373838-Reviews-Kuala_Lumpur_City_Gallery-Kuala_Lumpur_Wilayah_Persekutuan.html,"Kuala Lumpur, Malaysia",attractions,5.0,4.0
Not recommended,Not recommended unless you are a collector of cheap chinese items most of which are brand knockoffs.,September 2017,Chinatown,https://www.tripadvisor.com/Attraction_Review-g298570-d447384-Reviews-Chinatown-Kuala_Lumpur_Wilayah_Persekutuan.html,"Kuala Lumpur, Malaysia",attractions,2.0,3.5
Incredible views,"Worth to see the views of the skyline. Best tome is during sunset times, the clouds and the setting sun give a dramatic image. Definetly recommend. The glass is high quality, no issues in taking pictures.",September 2017,Singapore Flyer,https://www.tripadvisor.com/Attraction_Review-g294265-d678639-Reviews-Singapore_Flyer-Singapore.html,"Singapore, Singapore",attractions,5.0,4.5
Interesting,"The msoque is beautiful and so is the neighbourhood around it. Its worth a visit. Shoes need to be left outside, robes are provided if you have shorts or other revealing clothing. Inside is very clean, however you cant visit the prayer hall. Lots of information about Islam is provided in the entrance hall.",September 2017,Sultan Mosque,https://www.tripadvisor.com/Attraction_Review-g294265-d317468-Reviews-Sultan_Mosque-Singapore.html,"Singapore, Singapore",attractions,4.0,4.0
Train to Sintra,Very clen and organised train station. Its the best location to take the train to Sintra. Trains are frequent. The architecture is nice both inside and outside.,March 2017,Rossio Train Station,https://www.tripadvisor.com/Attraction_Review-g189158-d4053333-Reviews-Rossio_Train_Station-Lisbon_Lisbon_District_Central_Portugal.html,"Lisbon, Portugal",attractions,5.0,4.5
Nice square,It is a nice square where one can relax or admire the architecture surrounding it. Nice views over the city aswell.,March 2017,Rossio Square,https://www.tripadvisor.com/Attraction_Review-g189158-d195644-Reviews-Rossio_Square-Lisbon_Lisbon_District_Central_Portugal.html,"Lisbon, Portugal",attractions,5.0,4.0
