title,text,date,place,placeURL,placeLocation,placeType,reviewScore,avgScore
Visit the skyview bar instead of eating at Al Muntaha,"The bar is one end of the Muntaha restaurant. Since the food was absolutely S**** at Muntaha, would suggest you are better off coming to the bar and enjoying a drink!",January 2017,Skyview Bar & Restaurant,https://www.tripadvisor.com/Restaurant_Review-g295424-d3926250-Reviews-Skyview_Bar_Restaurant-Dubai_Emirate_of_Dubai.html,"Dubai, United Arab Emirates",restaurants,5.0,4.5
Just the experience!,"The hotel is flamboyant with gold everywhere! but what else would you expect from a hotel that claims to be the most luxurious hotel in the world (also claim to have a 7 star rating, which isn't certified if something such as 7 star actually exists). You can request a rolls royce pickup from the airport. The rooms are spacious interesting (ask for sea view) with Hermes toiletries and gold everywhere!",October 2016,Burj Al Arab,https://www.tripadvisor.com/Attraction_Review-g295424-d324445-Reviews-Burj_Al_Arab-Dubai_Emirate_of_Dubai.html,"Dubai, United Arab Emirates",attractions,5.0,4.5
Shut down for very good reasons !,"The Dubai marina yacht club has shut down for very good reasons! The club wasn't membership only, was ridden down and not maintained at all! Happy to see that they took a decision to close it down and make into a building which would be of more use!",September 2016,Dubai Marina Yacht Club,https://www.tripadvisor.com/Attraction_Review-g295424-d4559422-Reviews-Dubai_Marina_Yacht_Club-Dubai_Emirate_of_Dubai.html,"Dubai, United Arab Emirates",attractions,1.0,4.5
Possibly one of the best Thai restaurants in Dubai!,"Although there is limited seating with a view and the restaurant is never able to assure you of a good table, but if you do end up getting a table outside on the terrace with a view, it's definitely worth it! Food isn't a 10/10 (would chose Pai Thai or Mekong) but the overall experience does make up for it!",March 2017,Thiptara,https://www.tripadvisor.com/Restaurant_Review-g295424-d3926429-Reviews-Thiptara-Dubai_Emirate_of_Dubai.html,"Dubai, United Arab Emirates",restaurants,5.0,4.5
"Great location, friendly staff!","We booked the 1 bedroom apartment for a two nights! The apartment was overlooking the pool and sea! The staff is brilliant to say the least! The property has two pools, a pool bar and a view to die for! Definitely better than the typical Ibiza hotels! For 310 euros per night, the price was a bit steep compared to the quality! It's a 15 minute walk from Ushuaia and the main bars street, some food options around but no beach!",August 2016,Aparthotel Playasol Jabeque Soul,https://www.tripadvisor.com/Hotel_Review-g664638-d237035-Reviews-Aparthotel_Playasol_Jabeque_Soul-Ibiza_Town_Ibiza_Balearic_Islands.html,"Ibiza, Spain",hotels,4.0,4.0
Off the beaten path gem!,It's nestled in the mountains! About 45 mins away from the center by car and 1 hour by bus! A must do for nature lovers! Beautiful views!,August 2016,Abadia de Montserrat,https://www.tripadvisor.com/Attraction_Review-g187501-d191040-Reviews-Abadia_de_Montserrat-Montserrat_Catalonia.html,"Montserrat, Spain",attractions,5.0,4.5
Amazing!,"We stayed 1 night before traveling to Ibiza and a week immediately after! The large terrace apartment on the 6th floor was a bad experience; no views from the terrace, elevator wasn't working and had the wall mounted air conditioners which weren't working! Upon our return, everything changed when we got the 3rd floor two bedroom apartment; beautifully furnished, all necessary bathroom and kitchen equipment available, centrally air conditioned and working well, elevator was working by then! Staff is brilliant on both occasions!

Note: keys collection from another location which is 15 mins away before 6pm. Washing machine is poor quality. Pictures only of the 3rd floor apartment below!",August 2016,Mila Apartments,https://www.tripadvisor.com/Hotel_Review-g187497-d7065631-Reviews-Mila_Apartments-Barcelona_Catalonia.html,"Barcelona, Spain",hotels,5.0,4.0
Good location and clean rooms!,Great location close to the main shopping street. Friendly staff and overall well equipped but basic rooms! Had to change my room because the safe was not working and there wasn't any hot water in the bathroom but it was arranged with a smile and did not leave negative taste at all! Would definitely stay again!,January 2016,NH Collection Frankfurt City,https://www.tripadvisor.com/Hotel_Review-g187337-d280630-Reviews-NH_Collection_Frankfurt_City-Frankfurt_Hesse.html,"Frankfurt, Germany",hotels,4.0,4.5
Great Service and good food!,"As a collector of Hard Rock café memorabilia from around the world, I usually end up at a hard rock cafe whereever i go! The prague one is definitely not as nice as some of the others but beats the quality of food and service from most others i have been to! Service was excellent, friendly staff and great food!",May 2016,Hard Rock Cafe,https://www.tripadvisor.com/Restaurant_Review-g274707-d1516182-Reviews-Hard_Rock_Cafe-Prague_Bohemia.html,"Prague, Czech Republic",restaurants,4.0,4.0
"Excellent location, cleanliness & service!","We had booked citadines Holborn as part of a group of 70 guests in may. We were not given a single reason to complain about! First and foremost, everyone from the front desk to the housekeeping was brilliant! Ronan and the team are doing a doing a great job towards building customer loyalty and they really know what matters towards ensuring that guests continue to come back! The location is excellent (just a few mins walk from the tube station), lots of dining and bars options around! will definitely be back!",May 2016,Citadines Holborn-Covent Garden London,https://www.tripadvisor.com/Hotel_Review-g186338-d192043-Reviews-Citadines_Holborn_Covent_Garden_London-London_England.html,"London, United Kingdom",hotels,5.0,4.0
One word.. Amazing,"Excellent location, clean, amazing staff, within walking distance of all attractions. Couldn't have chosen a better location! Gave unbiased Advise or currency exchange, tours to take, taxi services and the tour of their bunker was the highlight of my trip! Como restaurant has great breakfast and dinner.. Room service was also quick!",May 2016,Jalta Boutique Hotel,https://www.tripadvisor.com/Hotel_Review-g274707-d275250-Reviews-Jalta_Boutique_Hotel-Prague_Bohemia.html,"Prague, Czech Republic",hotels,5.0,4.5
Poor service and blood stained sheets!,"I stayed at Crowne Plaza Jeddah as a business traveller for one night only (20th / 21st Oct 2014). Although, the check in was hassle free, the check-in staff had to be possibly the worst in i have come across; Rude, sarcastic and discourteous! Initially denied late check-out but given only when I questioned on the late checkout allowance for IHG members (again with some comment and laughter exchanged with his colleague)..

I move up to my room at about 11:30pm, order room service (told 35mins) and walk in for a quick shower... after 45 mins, i call them to check on my food and again i get a response on the lines of: ""it has only been 33 minutes i have the time printed here .. you go and check again what time you ordered"" .. the food arrives in another 10 mins which is absolutely cold, the fries are soggy and my drink is not there.. desperately wanting to sleep for the night, i take a couple of bites and lift the duvet to get into bed with another surprise ... BLOOD STAINS ON THE SHEETS! no one has bothered to change the sheets and basically just ""fixed"" them. I would have assumed that after the whole episode of people contracting various diseases when travelling to Jeddah (post Hajj season), a chain associated with IHG would have atleast been careful about basic hygiene and cleanliness! I request the sheets to be changed, fortunately, the change was quick and apologetic .. While checking out the next day, i mentioned (to the same person who checked me in) that the food was cold and there were blood stains on the sheets and he laughs again and tells his colleague something in again before apologizing to me..

To me it seemed like due to the lack of options in the Area, the hotel has adopted careless nonchalant attitude where there is no respect for guests, no concept of health concerns and zero understanding of customer service! Would definitely recommend looking elsewhere incase anyone plans to travel to Jeddah!

Oh, and IHG rejected my post because apparently the blood stain pics are not much of a concern for them!",October 2014,Crowne Plaza Jeddah,https://www.tripadvisor.com/Hotel_Review-g295419-d299181-Reviews-Crowne_Plaza_Jeddah-Jeddah_Makkah_Province.html,"Jeddah, Saudi Arabia",hotels,1.0,4.5
Park plaza. Great location and service with a smile overshadows the small sized yet clean rooms,"The hotel is very centrally located (just about 200 ft from the BTS Asoka station). Although the rooms are small, however the positive attitude of the staff, the helpfulness and not accepting satisfactory as their standard brings out the true definition of the Asian hospitality that we hear of! (in particular mr Ko at the front desk). Close to nana square, soi cowboy as well as some of the more premium clubs such as bed supper club, the state tower, etc! Breakfast was awful but who cares when you have soo many great places around the area!",October 2012,Park Plaza Sukhumvit Bangkok,https://www.tripadvisor.com/Hotel_Review-g293916-d939455-Reviews-Park_Plaza_Sukhumvit_Bangkok-Bangkok.html,"Bangkok, Thailand",hotels,4.0,4.5
One word! Fabulous.,"Beautiful hotel with the most accommodating staff I have ever come across! 'no' is just not in their dictionary! Truly speaks of the amazing Asian hospitality that we hear so much about! The rooms were beautiful, the bed was very comfortable and had a bathroom to die for! the breakfast is not to be missed as it is truly extravagant! The pool is small however the private beach is just a few steps away (have to be there at sunset time)! The Thai restaurant has some seriously great food too! On the downside, cabs to and from the hotel are a problem (usually 800 - 900) baht just one way to patong beach / bangla street! Best option is to book the cabbie for a return trip with a 4 hr wait! They usually agree for 1600 baht and guarantee your return to the hotel! (yes, cabbies from town usually refuse a one way trip to this side of town at night)!",October 2012,Renaissance Phuket Resort & Spa,https://www.tripadvisor.com/Hotel_Review-g1223683-d1634352-Reviews-Renaissance_Phuket_Resort_Spa-Mai_Khao_Thalang_District_Phuket.html,"Phuket, Thailand",hotels,5.0,4.5
