title,text,date,place,placeURL,placeLocation,placeType,reviewScore,avgScore
"Should be right on top of your bucket list, or very near the top!","I will not attempt to describe the most important cultural site in the whole western world! Nothing that I write will do justice to this treasure of human civilisation. I will just give two small bits of advice: Firstly go to this place with a guide or join a highly regarded conducted tour. I was on a group tour, and we had a wonderful guide. He gave us an enormous amount of information, and regaled us with numerous anecdotes. You may go only once to this place in your life, don't try to save money by not using a guide! My second bit of advice: it is positively dangerous to go here with inappropriate footwear. The ground is very uneven, and there is a bit of climbing (and descending! coming down is more dangerous than going up!) I saw two people slip and fall. We went on a bright sunny day, so everything was dry. On a wet day, it would be dangerous even with good shoes. So take care!",April 2019,Acropolis,https://www.tripadvisor.com/Attraction_Review-g189400-d198706-Reviews-Acropolis-Athens_Attica.html,"Athens, Greece",attractions,5.0,4.5
Heaven for history buffs! Should be near the top of your bucket list.,"Unmissable, if you go to Greece! The most important ancient site to see, in the whole of the Peloponnese. Some would even say, the most important in all of Greece. We were on a conducted bus tour, for our 50th class reunion, and our guide budgeted just two hours for this magnificent site. I think our guide was mindful of the fact that all of us (25 couples) were well over 70, and not too fit, that is why he did not allocate more time here. I was very disappointed. We could get just a cursory look at all the attractions. I will go again, and spend a day here. This site and its museum is worth at least four to six hours, if not more. Plenty of details available in travel books, for you to do it entirely on your own, but it may help to have a guide to explain the site (the museum needs no guide, you can do it easily on your own!) Just two small tips: Firstly, see the museum before you see the site. You will appreciate the site better, and it makes it easier for you to imagine what the various buildings were like, in ancient times. Secondly, wear GOOD walking shoes. Even though the place is not hilly and uneven like Mycenae and Mystras, there is a lot of walking.",April 2019,Archaeological Site of Olympia,https://www.tripadvisor.com/Attraction_Review-g189487-d243256-Reviews-Archaeological_Site_of_Olympia-Olympia_Elis_Region_West_Greece.html,"Olympia, Greece",attractions,5.0,4.5
Not all that exciting. You could give it a miss and spend the time saved in Mycenae.,"I wasn't all that impressed with Mystras. It is not an ancient Greek site, it is basically a Byzantine site. The last place to hold out against the conquering Ottomans. Quite a few churches, and other associated buildings with a religious flavour. Our guide explained it all to us, but as we were coming straight from seeing Mycenae and the Treasury of Atreus, this site did not interest us as much. Now, don't get me wrong: there is more to actually see here, as the place is much newer (the oldest buildings here are just 800 years old, whereas the oldest stuff in Mycenae were 3300 years old!) But, if you like your history, there is plenty to see. Our guide regaled us with stories of how the Franks grabbed this place, then the Byzantines grabbed it back, and then fought off the Ottomans for many years before finally succumbing, how it declined under Ottoman rule, etc..etc... All very exciting for history buffs, but not for people disinterested in Byzantine and Ottoman history. There is even more climbing over rough ground than in Mycenae. See this place if you are keen, otherwise skip it. Spend the time saved in Mycenae.",April 2019,Mystras,https://www.tripadvisor.com/Attraction_Review-g189489-d320200-Reviews-Mystras-Sparta_Sparta_Municipality_Laconia_Region_Peloponnese.html,"Sparta, Greece",attractions,3.0,4.5
Paradise for history buffs!,"The ""Citadel"" is really the ruins, well over 3000 years old, of the ancient city of Mycenae, glorified by Homer in the ""Illiad"" and the ""Odessey"". Homer himself lived nearly 3000 years ago, and most people thought of all that as pure myth, till the German archaeologist Schliemann excavated the site in the 1870's. The rest, as they say is history. This is a huge site, and it proved that Homer was not just spinning yarns. It is NOT something that would excite someone with no appreciation of history. It is not all that photogenic. You could get a reasonably good idea of the place if you have a decent travel guide. But, if you want a detailed explanation, a local guide is needed. We had a local guide and he gave a fascinating description. Very impressive.
The ""Treasury of Atreus"" is at a completely different site, nearby. This is even older, dating back to 1300 BC. An amazing structure, it is also reputed to be Agamemnon's Tomb. Who was this dude? Well, look it up in Wikipedia, he was one of big shots in the Illiad. Too complicated to explain here! (there is even some doubt about whether Agamemnon even existed, but let that not deter you from seeing this place). It is a strange structure, shaped somewhat like a beehive. Truly amazing, perhaps the single most amazing thing I saw in the Peloponnese. As you stand inside the chamber, you marvel that all this is over 3300 years old !!!! You definitely don't need a guide here, just go and enter the massive chamber.
If you have taken the trouble to go all the way to the Peloponnese, please don't miss these two sites!!",April 2019,Citadel and Treasury of Atreus,https://www.tripadvisor.com/Attraction_Review-g189486-d243267-Reviews-Citadel_and_Treasury_of_Atreus-Mycenae_Argolis_Region_Peloponnese.html,"Mycenae, Greece",attractions,5.0,4.5
Well worth seeing! Perhaps the best sight in Ephesus.,"My wife and I were on a conducted tour of Ephesus from our hotel in Kusadasi. Our guide had made it clear to us that our tour included a ticket for seeing this attraction, (it is an extra ticket over and above the entrance fee for getting into the main Ephesus site). But, surprisingly, only about half the group were game enough to enter this ""added"" attraction. Even my wife chickened out. Why? Because there is a fair bit of climbing stairs. What is this attraction? These are recently excavated (and beautifully restored) residences from 2000 years ago. The residences are along a hillside, and they are adjoining one another. Some are even connected. What grand apartments! What decorations! Beautiful floors! A photo buff's paradise. Unfortunately, we were on a tight schedule, we had much more to see in Ephesus, and as half the group did not join us, our guide rushed us through the exhibit. This is easily the best thing to see in Ephesus. Truly amazing. I strongly recommend it. A guide would greatly help, as it is difficult to understand the layout of the rooms in the various houses (they are properly called ""apartments"" !!!) . Also, a guide can explain the various decorations on the walls.",April 2019,Ephesus Terrace Houses,https://www.tripadvisor.com/Attraction_Review-g293976-d294528-Reviews-Ephesus_Terrace_Houses-Selcuk_Izmir_Province_Turkish_Aegean_Coast.html,"Selcuk, Turkey",attractions,5.0,5.0
"Unmissable, if you visit Corfu !!","This is actually a palace, built by Empress Elizabeth (Sisi) of the Austro-Hungarian Empire, in the early 1890's. Sisi used it as her summer palace. Not the biggest palace I have seen, but perhaps one of the most delightful to explore, and wander around. Photos are allowed. And the place is a photo buff's delight. Plenty of rooms, staircases, paintings, curios, old photos, statues, gardens, etc..etc...to photograph. This palace is so damn INTERESTING, as compared to many larger and stuffier palaces I have seen. The rooms, the furniture, the curios, and especially the gardens. You get fantastic views from the gardens. A guide would be helpful, but you can manage without a guide. (audio guides are available). We were on a conducted tour, so we had a guide to explain things to us. If possible, try and get the brochure relating to this place from the hotel or from the tourist office, and read it thoroughly BEFORE you visit the palace. You will better appreciate what you see. Don't miss the statue of Sisi at the entrance, and the two great statues of Achilles in the gardens. This palace was easily the highlight of my visit to Corfu.",April 2019,Achilleion Museum,https://www.tripadvisor.com/Attraction_Review-g1188103-d523820-Reviews-Achilleion_Museum-Gastouri_Corfu_Ionian_Islands.html,"Corfu, Greece",attractions,5.0,4.5
A must for history buffs!,"I would have given this place an ""excellent"", but I am restricting it to a ""very good"", because my claustrophobia, and my asthma, detracted a bit from my enjoyment of the place. Some of the passages are barely half a metre wide. Others are so low that you have to bend almost double, which is very bad for asthmatics like me. If you don't have these issues, you ought to enjoy this place. The guide (we were on a conducted tour) had a lot of details of the history of the place, how people lived underground, how they defended themselves, etc...etc.... True paradise for history buffs. And, if you are not bothered by claustrophobia or asthma, you can get some really good photographs. There are much bigger underground cities to see in Cappadocia. This is one of the smaller ones. We were taken here, because of the lack of time. Next time, I will try my luck with one of the other underground cities. I hope I can get over the claustrophobia by then!",April 2019,Ozkonak Underground City,https://www.tripadvisor.com/Attraction_Review-g297986-d3535159-Reviews-Ozkonak_Underground_City-Nevsehir_Nevsehir_Province.html,"Nevsehir, Turkey",attractions,4.0,4.5
"Great place to have a quick meal, while in the Sultanahmet area","We had lunch here, twice. It is exceptionally well located, very near Aya Sofya and the Blue Mosque. Excellent place to have lunch while sightseeing in the area. We discovered it by accident, it was next to our local agent (Efendi Travel) in Istanbul. Very delicious food, reasonably priced. Strongly recommended.",April 2019,Albura Kathisma,https://www.tripadvisor.com/Restaurant_Review-g293974-d1811748-Reviews-Albura_Kathisma-Istanbul.html,"Istanbul, Turkey",restaurants,5.0,4.5
Good place to have a nice meal,"Sadly, we were only one day in Thessaloniki. I would have loved to go again to this place. Great food. Great atmosphere. We were a large group of nearly 50 (this was our 50th class reunion, and we were traveling around Greece), but they managed to accomodate us well, and all of us had a good time. Strongly recommended.",April 2019,Panellinion,https://www.tripadvisor.com/Restaurant_Review-g189473-d806148-Reviews-Panellinion-Thessaloniki_Thessaloniki_Region_Central_Macedonia.html,"Thessaloniki, Greece",restaurants,5.0,4.0
A wonderful airline. I would strongly recommend it.,"Very pleasant flight! New plane, which was also very clean. Seats reasonably comfortable. Check-in was very smooth, cabin staff were very friendly. There was a light snack. No complaints whatsoever. I would strongly recommend this airline. (We had one more flight with Turkish, from Istanbul to Athens, two days later. We had the same experience: nice plane and very good cabin staff. On this flight there was a fairly substantial meal).",April 2019,Turkish Airlines,https://www.tripadvisor.com/Airline_Review-d8729174-Reviews-Turkish-Airlines,World,flights,5.0,4.0
Great airline!,"I had never heard of this airline before going to Turkey! Well, I was very impressed. Excellent plane (very new, very clean, reasonably comfortable seats), wonderful cabin staff. Plane was on time, flight was smooth and pleasant. I could not ask for more. My only complaint: the check-in at Kayseri was quite chaotic. No proper lines for queuing, check-in staff were harried and few in number. Perhaps this had nothing to do with the airline, it may be the airport's fault! All in all, a great experience. I would gladly fly again with them. (I kept their in-flight mag as a souvenir, on going through it I find that Pegasus has a very extensive domestic network in Turkey and quite a few international routes.)",April 2019,Pegasus Airlines,https://www.tripadvisor.com/Airline_Review-d8728979-Reviews-Pegasus-Airlines,World,flights,5.0,3.0
What a sight !!!!!,"We were a large group (a 50th class reunion, 25 couples) and we were doing a bus tour around Greece. After a couple of days in Athens, we drove to Nafplion on the Peloponnese. We crossed over the Corinth Canal, to enter the Peloponnese. We stopped here for about an hour. I wish we had more time! What a magnificent sight! A triumph of modern engineering! The steep sides are one of the most photogenic structures I have ever seen! We stood on the bridge, took many many photos and video clips. If you go, you must try and get a video of a big ship passing through the canal. We were unlucky, no really large ship passed, but quite a few small ones. Most of our group had never heard about this thing. I had heard about it, and seen pictures, but it did not prepare me for the actual sight! And it was quite a sight! Something that was conceived over 2500 years ago, but realised only in the 19th century, by the independent Greek state. The canal is cut through rock, and is just 6km long, but what is amazing is the near vertical sides, rising 300 feet from the water. We saw the canal en route to the Peloponnese, but it is also worth a day trip from Athens, entirely on its own. Just hire a taxi and come. You do not need a guide just to see the canal! If you do come this far from Athens, you might spend an hour or two in the historic city of Corinth, which is nearby. And yes, St. Paul wrote his letters to the inhabitants of this city (letters to the Corinthians) two thousand years ago. If you go to see the canal, do not miss the monument to the Hungarian engineers who played a part in its construction. This monument is on the mainland, just near the terminus of the bridge.",April 2019,Corinth Canal,https://www.tripadvisor.com/Attraction_Review-g1188932-d2454053-Reviews-Corinth_Canal-Isthmia_Loutraki_Corinthia_Region_Peloponnese.html,"Isthmia, Greece",attractions,5.0,4.5
One of the highlights of my trip to Turkey. Paradise for history buffs!,"I was lucky to see Ephesus twice, in the space of two weeks. The first time was in mid April, on a tour of Turkey with my wife, when we stayed at Kusadasi and went on a conducted tour, a day trip, that included Mary's house. The second time was in late April, when we had a shore excursion to Ephesus as part of a cruise around the eastern Mediterranean aboard the MV Celestyal Olympia. Note: both were conducted tours, and though both the guides were good, I feel someone with an interest in history might better off without a guide. What you need is a bit of background knowledge of the place, and a good travel guide book for maps of the site. (most recent editions of travel guides have excellent colour maps and pictures). On both occasions we entered by the upper gate (there is an information centre here, for those doing the trip on their own). We then walked downhill to the lower gate. All tour groups do it this way: enter through the upper gate, walk downhill, while their transport goes to the lower gate to meet them. Very convenient. But, if you are on your own, I don't see any reason why you have to follow this pattern. You can wander around the complex on your own, in any fashion. Ephesus has been excavated for well over a hundred years, and it is the best ancient Greco-Roman city in existence: yet nearly three-quarters of it is yet to be dug up! One can only marvel at what more will be revealed! Don't miss the following highlights: the odeon, the latrines, the huge theatre (where St. Paul preached to the locals), the terraced houses, the footprint leading to the brothel, the harbour road, the agora, temple of Hadrian, and most famous of all, the totally unmissable Library of Celsus. History buffs ought to read up about all this. Even if you are not a history buff, you will find the place utterly fascinating (the guides know enough to keep you entertained with anecdotes and details of the various objects of interest. ) On one of my visits, it rained briefly and the whole place got very slippery !! There is a lot of walking over very uneven ground: wear good walking shoes. Very difficult to manage a stroller due to uneven ground.
Try and go on a nice sunny day, when it is not too hot! It will be a memorable experience.",April 2019,Ancient City of Ephesus,https://www.tripadvisor.com/Attraction_Review-g293976-d548950-Reviews-Ancient_City_of_Ephesus-Selcuk_Izmir_Province_Turkish_Aegean_Coast.html,"Selcuk, Turkey",attractions,5.0,5.0
