title,text,date,place,placeURL,placeLocation,placeType,reviewScore,avgScore
Excellent way to travel between Helsinki and Tallinn,"We took the Tallink Star, for a day trip to Tallinn from Helsinki. Booked online, the previous day, with the help of the staff at our Helsinki hotel. We took the first ferry in the morning, I think it left Helsinki around 7am. We took the breakfast option, on the advice of our hotel front desk staff. Two advantages: lovely food, and comfortable seats in the front of the ship, with good views of Helsinki as we depart, and of Tallinn as we arrive. Smooth, comfortable journey. Returned around 6pm or so (it was just a day trip to Tallinn) Absolutely no problems whatsoever, I would strongly recommend this method of travel between Helsinki and Tallinn. The terminal is well connected by tram services to other parts of Helsinki. In Tallinn, it is only a fifteen minute walk to the walled city centre. Take your passports! After all, you are going to a different country!",September 2019,Helsinki to Tallinn Independent Round-Trip Ferry Ticket,https://www.tripadvisor.com/AttractionProductReview-g189934-d12580460-Helsinki_to_Tallinn_Independent_Round_Trip_Ferry_Ticket-Helsinki_Uusimaa.html,"Helsinki, Finland",activities,5.0,4.0
An amazing service. The best way to travel between Helsinki and St. Petersburg!,"I had gone from St. Petersburg to Helsinki by the Allegro in October 2018, when I visited Finland, at the end of a trip to Russia. I loved it. Then, in September 2019, my wife and I went on a trip to Russia, and we spent a week in Helsinki, prior. We took the same train in the reverse direction, i.e. from Helsinki to St. Petersburg.
Now, whereas in 2018 I traveled first class, in 2019 my wife and I went in second class (I think the names given are ""executive"" class and ""economy"" class). It is less than one-third the price, and the seats are slightly narrower (2 by 2 in economy, whereas first class was 1 by 2). Also, in economy there was no lunch served, whereas there was lunch in first class. But, there is plenty of space for luggage in economy, and the seats are quite comfortable, so there is no need waste money paying three times the fare!!
As I said in my 2018 review, I simply cannot imagine why anyone would want to fly between these two cities !! The ride was super smooth, and the journey took about three and a half hours. Best thing, it is city centre to city centre. So if you factor in the time taken to travel airport to city at both ends, AND the requirement to go early to the departure airport for security and other formalities, I am sure train is much less time consuming!
Perhaps the best thing about going by train between the two cities, is that all official formalities (checking of passports, customs, etc...) are done on the train, while it is rolling along, by officials from Russia and Finland. You don't have to get off. You don't even have to get up from your seat! Now, that's service. Compare that with treatment at an airport, where you have wait in a queue, and stand all the time! As I said earlier, I will repeat: I cannot imagine why ANYONE would fly between these two cities! A wonderful service. With free wi-fi !!",September 2019,Allegro Train,https://www.tripadvisor.com/Attraction_Review-g189934-d8823016-Reviews-Allegro_Train-Helsinki_Uusimaa.html,"Helsinki, Finland",attractions,5.0,4.5
"My second stay here, and it was as good as the first, if not better!","I was in Helsinki for four days in October 2019, on my own. I stayed here, in a studio apartment. Later, in September, on my second visit to Helsinki, with my wife, I decided to stay here again. It was wonderful. We had apartment number 152. Actually, this is a two bedroom apartment, my wife's brother and his wife were supposed to join us, they had to cancel at the last moment. So, my wife and I had the whole place to ourselves. A bit too much space, but what the hell, it was divine! I am reproducing much of what I gave in my earlier review, with a few additions:

1. Exceptionally well located, within walking distance of the main railway station. We caught the airport train, and just walked the 1km to the hotel. We left the same way, we walked to the station to catch the train to St. Petersburg.
2. The apartment had everything: a small but fully equipped kitchen where you can cook all your meals, two reasonably sized bedrooms, comfortable beds, perfect security and a common use laundry in the basement to wash your clothes. A small balcony outside the central lounge area. In addition, there was a sauna!
3. The building is very near several tram and bus lines, and it is a very quiet neighbourhood.
4. There is a small supermarket about six or seven minutes away, where you can shop for any of your needs.
5. Most important of all: wonderfully cheerful and cooperative staff. One of the staff members helped us to book our day trip to Tallinn in Estonia, it was a great help!

Note: It is not dirt cheap, but then Finland is a very rich country, Helsinki is an expensive city, and you get what you pay for! I would strongly recommend this place. Having stayed here twice, I am utterly convinced this is a fabulous place to stay.

Oh, one more thing: because it was a repeat stay, they gave me a very nice discount!",September 2019,Hellsten Helsinki Parliament,https://www.tripadvisor.com/Hotel_Review-g189934-d508154-Reviews-Hellsten_Helsinki_Parliament-Helsinki_Uusimaa.html,"Helsinki, Finland",hotels,5.0,4.0
Ought to be of great interest for history buffs!,"This wonderful church is close to the Morosini Fountain (lion fountain). Worth a visit, especially for history buffs. Titus, also known as Titus the Apostle, lived in the first century and was a Cretan of noble birth. He was given his title probably because he was an associate of St. Paul. What we see today is not the original church, but the third or even the fourth incarnation of the original at this site, which was built in AD961, when the Byzantines re-conquered Crete from the Arabs. Then, when the Venetians conquered Crete, the building became a Catholic church. Later, under the Ottomans, it became a mosque !!! Finally, when Crete became an integral part of Greece after WW1, it reverted to being a Greek Orthodox church. Over the years, it suffered fire (totally destroyed), an earthquake (again totally destroyed), and was modified in many ways by its various owners. The most valuable relic here, for hundreds of years, was the skull of St. Titus. This precious relic was sent to Venice for safe-keeping during the Ottoman rule. It was brought back here in 1966.

Even if you have no interest whatsoever in its history, the church itself is really beautiful inside, though not so impressive from outside. Really worth a visit. If you go, don't forget to grab a leaflet in English, describing in great detail the history of the church, and of St. Titus.",May 2019,Agios Titos Church,https://www.tripadvisor.com/Attraction_Review-g189417-d4888429-Reviews-Agios_Titos_Church-Heraklion_Crete.html,"Crete, Greece",attractions,4.0,4.5
"Great landmark, right in the heart of Heraklion! One for the photo buffs.","We had a free hour in Heraklion, and I spent nearly half my precious time at this fountain, photographing it from every possible angle, walking around it, etc... It is located in the middle of a small square, which is probably the geographic centre of the city. Great for photo buffs! Built by the Venetians during the time they ruled Crete, named after its builder Francesco Morosini. It is surrounded by several restaurants. Wonderful location for people watching. It is also called the ""lion"" fountain, as it has lions at the centre.",May 2019,Morosini Fountain (Lion's Fountain),https://www.tripadvisor.com/Attraction_Review-g189417-d669297-Reviews-Morosini_Fountain_Lion_s_Fountain-Heraklion_Crete.html,"Crete, Greece",attractions,4.0,4.0
"Much of it is in ruins, there is just a hint of Minoan glory!","We were on a cruise with MV ""Celestyal Olympia"", and we reached Heraklion early one morning. The tour of Heraklion and the Palace of Knossos was a free ""included"" tour. The palace was a bit of a disappointment. One can just get a hint of the glory of the Minoan Civilisation. Much of it is in ruins. Fortunately for us, we had a wonderful guide, who was both knowledgeable and very very enthusiastic. You DEFINITELY need a guide to see this place. Don't bother to come here and just wander around among the ruins! You will not understand anything just wandering around. Because it is all in ruins, you need to use your imagination, though the guide will have pictures of what the buildings may have looked like. Lots of walking, lots of climbing up and down over very uneven ground. Wear good walking shoes. And if it is a sunny day, wear a hat! After seeing this place you will develop a deep respect for the Minoans, you will also wonder that they build all this over 3500 years ago!",May 2019,The Palace of Knossos,https://www.tripadvisor.com/Attraction_Review-g13124727-d195896-Reviews-The_Palace_of_Knossos-Knosos_Crete.html,"Crete, Greece",attractions,4.0,4.0
Amazing walled city! One for the history buffs.,"This is actually a walled city, entirely within the so called ""New Town"". About 700 metres by 500 metres. The double wall (which you cannot climb!) has a deep moat. No water, but beautiful gardens in the moat. You could descend to the moat and wander the gardens. But, if you are pressed for time, don't bother with the moat, stick to wandering the streets of the Old Town. There are different sections of the Old Town, which are utterly different from each other. The Knights Quarter is where the Knights Hospitaller lived (they ruled the island for hundreds of years). The famous Street of the Knights is here (see my separate review). Then there is the Jewish Quarter, most of whose residents were taken away by the Nazis in the war (and probably killed). Then there is the Turkish Quarter, with narrow cobblestoned streets, souvenir shops, eating places, etc.. All in all, a wonderful place, where you can easily spend half a day, if not more!",May 2019,Old Town of Rhodes,https://www.tripadvisor.com/Attraction_Review-g635613-d14775172-Reviews-Old_Town_of_Rhodes-Rhodes_Town_Rhodes_Dodecanese_South_Aegean.html,"Rhodes, Greece",attractions,5.0,4.5
One for history buffs !!!,"We had a great guide, he was in no hurry, he slowly walked us down this magnificent piece of history! The Knights Hospitaller ruled Rhodes for hundreds of years, this was their main drag. A lovely cobblestoned street with really beautiful medieval buildings on either side. Our guide told us that the whole place had fallen into disrepair after the Knights were driven out, but the Italians lovingly restored the ancient buildings to their past glory, when they ruled Rhodes. You can see how old the buildings are, many have dates engraved onto them. The knights came from different countries of Europe, the buildings were devoted to different language groups: French, German, Italian, English, etc..etc... This is paradise for history buffs. One of the main sights in the Old Town.",May 2019,Street of the Knights,https://www.tripadvisor.com/Attraction_Review-g635613-d11797224-Reviews-Street_of_the_Knights-Rhodes_Town_Rhodes_Dodecanese_South_Aegean.html,"Rhodes, Greece",attractions,4.0,4.5
"Great for photos, and also for history buffs","We were on a cruise (Celestyal Olympia), and the ship reached Rhodes early morning, and stayed here till evening. Unfortunately, it was a public holiday, so we could not get our full day free tour, but a reduced version of the city tour was available for sale! (not cheap, 45 Euros, but then nothing is cheap on a cruise!). The coach stopped at the harbour for about half an hour, to let us take photos, etc...I liked this place so much, I took the trouble to come back here from the pier in the afternoon. I spent over an hour here. It is worth it! Three things to see in the harbour area:

(a) The harbour itself! There is a story that one of the wonders of the ancient world, the Colossus of Rhodes (a huge statue of Apollo) stood at the harbour, feet on either side of the entrance. There are two highly photogenic pillars at the spot, marking where his feet stood. Ships are supposed to have passed between Apollo's feet to enter the harbour. The guide (spoilsport!) told us that it is all a myth, the huge statue was somewhere inside, that it was nowhere near the harbour. You decide!

(b) The Greek Orthodox church at the harbour. A really beautiful church! During the time the Italians ruled Rhodes, this was a Roman Catholic church, but reverted to the Greek Orthodox faith when Rhodes reverted to Greek rule.

(c) The broad road that runs along the harbour has many beautiful Italian style buildings, highly photogenic. If I remember right, the one nearest to the church was the headquarters of the Italian Fascist party during the war. Our guide said that Mussolini drove down this road, on some ceremonial occasion.

If you are tired with all the walking, you can sit down at the harbour and do some serious people watching. There are plenty of stalls selling snacks and drinks.",May 2019,Mandraki Harbour,https://www.tripadvisor.com/Attraction_Review-g635613-d8099471-Reviews-Mandraki_Harbour-Rhodes_Town_Rhodes_Dodecanese_South_Aegean.html,"Rhodes, Greece",attractions,4.0,4.5
"Unmissable, if you visit Patmos !! Combine this with a visit to the cave.","My wife and I were very happy that our ship, the MV Celestyal Olympia, visited Patmos, on a cruise around the Greek Islands. As practising Catholics, we looked forward to seeing the cave where St. John wrote the Book of Revelation. We took an optional tour (paid tour). The tour took us first to the cave, then to this magnificent monastery on top of the hill. While the cave had a lot religious significance, this monastery was a real sightseeing gem. Wonderful location, great views, and plenty of history. (it is 1000 years old, whereas St. John lived in the cave, in exile, over 1900 years ago). There is a fantastic little museum, where you can see some very interesting church treasures, including the document signed by the Byzantine Emperor Alexis in 1088, establishing this monastery. As we had taken a paid tour, we had an excellent guide, who gave us an enormous amount of information. She also pointed out the best places to get photos. The views are stunning. One caution: your transport cannot take you right up to the entrance, it will need to park a fair way below. So, there is some climbing involved. If it is rainy, the cobblestones will be slippery and dangerous. Not a place to take a stroller!",May 2019,Monastery of St. John,https://www.tripadvisor.com/Attraction_Review-g189447-d207187-Reviews-Monastery_of_St_John-Patmos_Dodecanese_South_Aegean.html,"Pátmos, Greece",attractions,5.0,4.5
"Great for believers, but not for tourists.","As a practising Catholic, this was one of the sights my wife and I eagerly looked forward to seeing, on our cruise around the Greek Islands. We took an optional tour (paid tour) from our ship MV Celestyal Olympia. Not cheap, but really worth it. Please take the paid tour, like we did, if you are on any similar ""islands cruise"". Ships stop at Patmos only for about four hours, it is nearly impossible to see this place and monastery further up the hill in such a short time, if you rely on public transport. Also, it helps to have a guide. As we had taken a paid tour, we had an excellent guide, who gave us an enormous amount of information. She also pointed out the best places to get photos. The views are stunning. As for the cave itself, it is somewhat underwhelming for non-believers, and for those who don't appreciate history. It is really something for practising Christians, not for sightseeing tourists. St. John the Divine lived in this cave for several years, in exile, and wrote the Book of Revelation, more than 1900 years ago! There are a few steep steps to go down into the cave (and to climb up when you leave the cave!). We went in May, and yet there were so many tourists, it was a real crush on the steps. Single file up and down. I shudder to think how unbearably crowded this place will be in high season, in July/August. I would love to go again to Patmos and stay there for a couple of days, and see this place without the crowds, and spend some time contemplating St. John the Divine. Perhaps in winter. It would be colder, but the crowds would not be there!",May 2019,Cave of Apocalypse,https://www.tripadvisor.com/Attraction_Review-g189447-d207185-Reviews-Cave_of_Apocalypse-Patmos_Dodecanese_South_Aegean.html,"Pátmos, Greece",attractions,5.0,4.0
A fantastic sight for history buffs. And for photo buffs! Well worth going out of the way to see it.,"I had done a lot of research before going to Greece, but I never realised this is such an amazing place. I suppose it is not well known because firstly it is in a remote location, and the guide books I consulted did not give elaborate descriptions. We were on a long drive from Meteora to Thessaloniki (a conducted tour by bus) and there were groans and moans when the bus stopped at Vergina. Everyone was tired and a bit irritated. But, all that totally vanished when we saw this magnificent museum. To a man (and woman!) we were tremendously impressed. This is called ""Royal"" for a simple reason: it holds the tomb of Phillip of Macedon, father of Alexander the Great, and another tomb which is reputed to be that of Alexander's son. There is some doubt about whether the latter is really the place where Alexander's son is buried, our guide gave us both sides of the story. But, the piece de resistance is Phillip's tomb, and the various artefacts relating to it in the museum. Several very large and very beautiful gold objects. Phillip was buried with all these things, along with his most recent wife. She agreed (or was forced!) to die and join him in the after-life. Fortunately grave looters did not get to this grave, (and the one purporting to be Alexander's son's) before they were properly excavated. A truly amazing museum, and really worth seeing. One of the highlights of my three week trip to Greece! (by the way, photos were allowed everywhere, except in the actual tombs).",April 2019,Museum of the Royal Tombs of Aigai (Vergina),https://www.tripadvisor.com/Attraction_Review-g1082258-d2459889-Reviews-Museum_of_the_Royal_Tombs_of_Aigai_Vergina-Vergina_Imathia_Region_Central_Macedo.html,"Vergina, Greece",attractions,5.0,5.0
Simply unmissable !!,"We had a guide, and he said many people see the Acropolis but fail to see the Museum. What a pity. The museum is truly amazing. A fantastic modern building, with numerous exhibits. There is good signage, so you could perhaps manage without a guide, but we were short of time, (we had just about an hour and a half in this magnificent place!), so our guide was invaluable. He took us to the important exhibits, and explained everything. The best thing about having a guide is that he can give you a ""helicopter"" view, and perspective, otherwise you are reduced to reading signboards and trying to orient yourself. Don't miss the ruins near the entrance. These were excavated fairly recently. Then there are the original Carytids (only five, one is in London!). The ones you see next to the Parthenon are imitations! Finally, the Parthenon Gallery on the top floor, is simply stunning. It is a virtual replica of the Parthenon itself. The whole museum is worth at least three or four hours.",April 2019,Skip the Line: Athens New Acropolis Museum Ticket,https://www.tripadvisor.com/AttractionProductReview-g189400-d12835132-Skip_the_Line_Athens_New_Acropolis_Museum_Ticket-Athens_Attica.html,"Athens, Greece",activities,5.0,4.5
Good place for a meal.,"We were on a ""food"" tour of Istanbul, and this was the ""included"" lunch. It was chosen by our guide. A reasonably good choice. Plus points: food was delicious, and there was a wide choice on the menu. Staff were friendly and helpful. The place was very clean. The only real negative: it was quite cramped (we went upstairs, downstairs was even more cramped). I would strongly recommend this place for a meal, if you don't mind the slightly cramped surroundings!",April 2019,Kadikoy Saray Muhallebicisi,https://www.tripadvisor.com/Restaurant_Review-g293974-d3336480-Reviews-Kadikoy_Saray_Muhallebicisi-Istanbul.html,"Istanbul, Turkey",restaurants,4.0,4.0
Great food. Wonderful staff. Superb location. Strongly recommended!,"We were in Kusadasi for three nights. On the second day, my wife and I went here for dinner (it was very near our hotel). We liked the place so much, we went again for dinner the next day. This is a fairly large restaurant, very very clean and well furnished. Superb location, on the waterfront. I suggest you try and get a table facing the sea. Excellent food, with a very wide choice of items. Staff were cheerful and friendly. Reasonably fast service. A great experience, in every respect. I would strongly recommend this place for a meal.",April 2019,Komsu Cafe & Restaurant,https://www.tripadvisor.com/Restaurant_Review-g297972-d14102565-Reviews-Komsu_Cafe_Restaurant-Kusadasi_Turkish_Aegean_Coast.html,"Kusadasi, Turkey",restaurants,5.0,4.5
Good food. Very pleasant and cooperative staff.,"A fairly large restaurant, bright and airy. Very clean. We were on a whole day tour, seeing places in and around Goreme. We were brought here for lunch (lunch was included in the tour). It was a set menu, Turkish food. Delicious. Staff were very very friendly. I would definitely recommend this place.",April 2019,Kapadokya Urfa Sofrasi,https://www.tripadvisor.com/Restaurant_Review-g297981-d3651566-Reviews-Kapadokya_Urfa_Sofrasi-Avanos_Cappadocia.html,"Avanos, Turkey",restaurants,4.0,3.0
A great experience.,"I would recommend every tourist in Goreme visit Ali and Mustafa in their shop, even if they have no plans whatsoever to buy something! (You may finally end up buying, because they are such good salesmen, but that is not the point I am trying to make!). It was a pleasure to be entertained by them, and to be educated in the various types of carpets. It was like visiting a museum. All the time, my wife and I were given cup after cup of apple tea. Ali speaks perfect English, because he has lived several years in the US. We did buy some carpets, but the whole experience was something out of this world. Shopping here was such a pleasure. Ali and Mustafa are in business to sell carpets, but more than anything else, they seemed to get more pleasure in simply talking to us and entertaining us. Long may they do so!",April 2019,Sultan Carpet,https://www.tripadvisor.com/Attraction_Review-g297983-d3507763-Reviews-Sultan_Carpet-Goreme_Cappadocia.html,"Goreme, Turkey",attractions,5.0,5.0
Great place for a quick bite!,"A large local restaurant, serving Turkish food. Our hotel was very near, and we just dropped in for a meal soon after checking in. Both my wife and I are not the adventurous types when it comes to food. So, because we liked the place, we came here again for a light dinner. We also took a packed lunch, the next day, to eat on the long bus journey to Cappadocia. The staff here were fantastic, they did not know much English (and my Turkish was very basic), but they helped us order food, and they treated us like honoured guests. We were the only foreigners in the establishment, on all three occasions we went there. If ever I go to Ankara again, I will seek out this place. A wonderful experience. They were so nice to us!!",April 2019,Haci Bayram et Lokantasi,https://www.tripadvisor.com/Restaurant_Review-g298656-d20368726-Reviews-Haci_Bayram_et_Lokantasi-Ankara.html,"Ankara, Turkey",restaurants,4.0,4.0
Efficient tour company,"Our agent in Istanbul (Efendi Travel), booked two full-day tours with this company, for my wife and myself, while we were in Goreme. We had the same guide on both days, Mr. Mustafa Sahin. He was great. We loved his wry humour, his enthusiasm and his depth of knowledge. On both days, the group size was small, around ten. Small enough for us to make friends with everyone, as we were together for about six to seven hours, each day. We got lunch on both days. Transport was comfortable (minibus). I would strongly recommend this company. to take you around, when you visit Cappadocia.",April 2019,HtR Tours,https://www.tripadvisor.com/Attraction_Review-g297989-d2510421-Reviews-HtR_Tours-Urgup_Cappadocia.html,"Urgup, Turkey",attractions,5.0,5.0
"Good food, pleasant and cooperative staff. Well located restaurant, near the water-front.","We were a large group, 25 couples, celebrating our 50th reunion, on a bus tour around Greece. We had dinner at this restaurant. It is big, so they had no trouble accomodating our group. Food was good, no complaints. Staff were pleasant, and made us feel quite welcome. I would recommend this restaurant.",April 2019,Avli,https://www.tripadvisor.com/Restaurant_Review-g662629-d2241886-Reviews-Avli-Corfu_Town_Corfu_Ionian_Islands.html,"Corfu, Greece",restaurants,4.0,4.5
"Great little restaurant, a bit off the beaten track, but worth going here for a relaxed meal","We were a large group, 25 couples, on a bus tour around Greece, celebrating our 50th class reunion. Somehow the restaurant accommodated us, along with a few of their regular customers. Our local guide took us here, we would never have found it. It is in the old town, hidden among a maze of narrow streets. It is a bit off the beaten track. But it is worth seeking out. We had a wonderful evening. Great food. Great atmosphere. If ever I go to Corfu again, I will seek this place out and go there. Strongly recommended.",April 2019,Pergola Restaurant Taverna,https://www.tripadvisor.com/Restaurant_Review-g662629-d4722474-Reviews-Pergola_Restaurant_Taverna-Corfu_Town_Corfu_Ionian_Islands.html,"Corfu, Greece",restaurants,5.0,4.0
