title,text,date,place,placeURL,placeLocation,placeType,reviewScore,avgScore
Great Hostel with Incredible Views,"Fantastic hostel that offer travelers an incredible value for money option. The hostel has several room options, I was staying in a private room with other two friends. The hostel counts with a bar and a wooden deck and outdoor tables that offer spectacular views of the surroundings. Located a 5-minute walk from downtown. The team that works there is incredible - super friendly and helpful. Upon booking you will receive an email from them with a document highlighting all the best tours in the area (book fast as many of them have limited availability) - bear in mind many of the tours may be somewhat expensive compared to the room rate you are paying.",January 2019,America del Sur Hostel,https://www.tripadvisor.com/Hotel_Review-g312851-d798617-Reviews-America_del_Sur_Hostel-El_Calafate_Province_of_Santa_Cruz_Patagonia.html,"El Calafate, Argentina",hotels,5.0,4.5
Short Boat Trip,"Take one of the many boat trip options, this can also be a short 2.5-hour trip. The lighthouse is one of the several stops you can do.",January 2019,Ushuaia Bay,https://www.tripadvisor.com/Attraction_Review-g312855-d317606-Reviews-Ushuaia_Bay-Ushuaia_Province_of_Tierra_del_Fuego_Patagonia.html,"Ushuaia, Argentina",attractions,4.0,4.5
Great Full Day Visit,"You cannot miss a visit to Parque Nacional Tierra del Fuego - the best way to see it is by car (you can rent one for a day) so you can drive to your favourite spot to see first and take you own time to walk around the several trails. Do not forget your camera and make sure to dress well as weather is unpredictable; it can be rainy, windy, sunny and cloudy in less than 45 minutes.",January 2019,Parque Nacional Tierra del Fuego,https://www.tripadvisor.com/Attraction_Review-g312855-d1972397-Reviews-Parque_Nacional_Tierra_del_Fuego-Ushuaia_Province_of_Tierra_del_Fuego_Patagonia.html,"Ushuaia, Argentina",attractions,4.0,4.5
Nice for a Boat Trip,"The Beagle Channel cannot be missed, although you can see if from wherever you are in the city take one of the many boat tours. Make sure to cover properly, even during the summer time as it is always windy and the weather is unpredictable.",January 2019,Canal Beagle,https://www.tripadvisor.com/Attraction_Review-g312855-d313940-Reviews-Canal_Beagle-Ushuaia_Province_of_Tierra_del_Fuego_Patagonia.html,"Ushuaia, Argentina",attractions,4.0,4.5
Great Option at Fantastic Price,La Posta is conveniently located very close to the airport and the city centre. It offers great rooms (we were in one of the apartments that accommodate easily up to 4 guests) with private bathroom and small kitchenette. The staff is very friendly and ready to help. Breakfast is included and is very good. Rooms are comfy and offer all necessities.,January 2019,La Posta Hostel,https://www.tripadvisor.com/Hotel_Review-g312855-d1065470-Reviews-La_Posta_Hostel-Ushuaia_Province_of_Tierra_del_Fuego_Patagonia.html,"Ushuaia, Argentina",hotels,5.0,4.5
The Trendiest Neighborhood,"Palermo is by far the trendiest neighborhood in Buenos Aires, which offers a great selection of restaurants, bars and the best places to enjoy the nightlife (just remember, the nightlight in BsAs start very, very late).",January 2019,Palermo,https://www.tripadvisor.com/Attraction_Review-g312741-d622890-Reviews-Palermo-Buenos_Aires_Capital_Federal_District.html,"Buenos Aires, Argentina",attractions,5.0,4.5
Great Promenade and Restaurants,"Puerto Madero is one of the newest areas in the city, offers a beautiful promenade where you can walk and choose from one of the many restaurants bars - during a sunny day opt to see outdoors.",January 2019,Puerto Madero,https://www.tripadvisor.com/Attraction_Review-g312741-d311777-Reviews-Puerto_Madero-Buenos_Aires_Capital_Federal_District.html,"Buenos Aires, Argentina",attractions,5.0,4.5
The Most Exclusive Area in the City,Recoleta is definitely the nicest and chicest area in the capital; even though you are not staying here spend some of your time walking around to observe the magnificent architecture.,January 2019,Recoleta,https://www.tripadvisor.com/Attraction_Review-g312741-d311775-Reviews-Recoleta-Buenos_Aires_Capital_Federal_District.html,"Buenos Aires, Argentina",attractions,5.0,4.5
The Best Hostel I've Been to... Your Best Choice in Buenos Aires,"Selina Palermo Soho is by far the best hostel I've been too. This place is new, it's been open for a month and is located in one of the trendiest areas in Buenos Aires, where you can find lots of bars, restaurants, clubs at a walking distance. Selina has a chic, trendy vibe with nice and comfortable rooms. The employees are so great, friendly and ready to help. Did I mention they have the most amazing rooftop where you can enjoy the beautiful sunsets in BsAs, with a DJ playing great music and bartenders preparing nice drinks - is the perfect spot to socialize and end your day.",January 2019,Selina Palermo,https://www.tripadvisor.com/Hotel_Review-g312741-d15811698-Reviews-Selina_Palermo-Buenos_Aires_Capital_Federal_District.html,"Buenos Aires, Argentina",hotels,5.0,4.0
A New Delightful Dining Experience,"We visited the newly Latino 8 one day after it opened its doors. We are normally somewhat conscious in visiting recently open places, however Latino 8 did not disappoint. The menu was very well thought and with several specialities from several countries; from Mexico to Brazil, Argentina and Peru. It all looked mouthwatering. The cocktail menu was great too - very well presented and tasty drinks. The food was very well presented and it was good. Service was ok (again they were opened for barely 24 hours) so they did a very good job and we are confident it will only get better.
Prices are fair considering its location. Worth the visit.",September 2018,Latino 8,https://www.tripadvisor.com/Restaurant_Review-g152516-d15213073-Reviews-Latino_8-San_Jose_del_Cabo_Los_Cabos_Baja_California.html,"San Jose del Cabo, Mexico",restaurants,5.0,5.0
Great Breakfast Option,"I came across this amazing place while walking through Downtown San Jose del Cabo, I was brought in by the delightful smell of fresh baked bread:

The French Riviera has the best croissants and pain au chocolat in town.

My breakfast was great and the service was impeccable.

When going to San Jose you can’t miss out on this amazing experience!",August 2018,French Riviera,https://www.tripadvisor.com/Restaurant_Review-g152516-d1201965-Reviews-French_Riviera-San_Jose_del_Cabo_Los_Cabos_Baja_California.html,"San Jose del Cabo, Mexico",restaurants,5.0,4.0
Worst Experience Ever,"Try a different option. My flight got cancelled and we were not even informed ahead of time - we noticed on the screens in the terminal at time of boarding time that the flight was cancelled. The customers service agents were the worst; to get rid off of me I was sent to Krakow in order to fly back to Zurich; when I was in Poland I realized I was on stand-by on the following flight. Not to mentioned that due to this cancelation I lost my flight from Zurich to Mexico, which resulted in changes over 1,000USD.",June 2018,SAS,https://www.tripadvisor.com/Airline_Review-d8729142-Reviews-SAS,World,flights,1.0,3.5
Literally The Best Sushi in Los Cabos,"I know that opinions are all personal, but believe me - this is by far the best sushi place in Los Cabos. When you first get there and see the place from outside, most people would not notice the place nor tend to get there - but never judge a book for its cover. The restaurant is small and cozy. Attentive and friendly efficient service. The sushi, sashimi and all the other specialties are delicious, best sea food quality and there is no other place in the area that has such great Japanese food. When it cannot get any better, the price is not at all elevated. You won't be disappointed.",June 2018,The Fish Sushi,https://www.tripadvisor.com/Restaurant_Review-g152515-d1747765-Reviews-The_Fish_Sushi-Cabo_San_Lucas_Los_Cabos_Baja_California.html,"Cabo San Lucas, Mexico",restaurants,5.0,4.5
Italian food for American Tourists,"I've eaten at many authentic Italian restaurants and this is not one of them. The food is ok but not great. The portions are huge, it couldn't be more obvious they cater to American tourists. The service is average, although the people are very nice.
The dessert (tiramisú) was disappointing, I was told was the best option they had - had half a tea spoon of it and left it there.",June 2018,Salvatore G's Italian Restaurant,https://www.tripadvisor.com/Restaurant_Review-g152515-d1027342-Reviews-Salvatore_G_s_Italian_Restaurant-Cabo_San_Lucas_Los_Cabos_Baja_California.html,"Cabo San Lucas, Mexico",restaurants,2.0,4.5
Great Sushi at Great Price,"Great sushi options - either if you eat at the small restaurant or do take away. Staff is nice and friendly, sushi chef very efficient. The sushi is delicious, very well presented and fresh.",June 2018,Maguro Sushi,https://www.tripadvisor.com/Restaurant_Review-g152515-d5111514-Reviews-Maguro_Sushi-Cabo_San_Lucas_Los_Cabos_Baja_California.html,"Cabo San Lucas, Mexico",restaurants,5.0,4.5
As Perfect as a Dream,"One&Only The Palm is by far the best resort in Dubai and with the most unique location you can possibly imagine. The resort is so beautiful and from the moment you arrive you may think you are dreaming. If you are seeking for privacy this is the place for you, the resort has boutique feel and even when is full you don't get to see many people. The culinary offerings are beyond expectations - our favourite was 101; overlooking the private marina and Dubai skyline. The service is flawless and the staff very friendly and always ready to anticipate your needs. The main pool is beautiful and if you like extra privacy there are cabanas available.",March 2018,One&Only The Palm,https://www.tripadvisor.com/Hotel_Review-g295424-d1905654-Reviews-One_Only_The_Palm-Dubai_Emirate_of_Dubai.html,"Dubai, United Arab Emirates",hotels,5.0,5.0
Beautiful Hotel & Perfect Location,"As many of you, reading this now, I decided to come to the Beverly Wilshire hotel because of the movie Pretty Woman. The hotel is beautifully appointed, elegant and set perhaps in the best location in Beverly Hills. The rooms are spacious and with beautiful views - I could see the Hollywood sign from my room. The staff is friendly and very professional - they all made us feel special. We really enjoyed breakfast at Blvd and loved the complimentary car service - perfect if you go shopping at the endless options of boutiques around the hotel. Would definitely consider coming back.",January 2018,Beverly Wilshire Beverly Hills (A Four Seasons Hotel),https://www.tripadvisor.com/Hotel_Review-g32070-d125138-Reviews-Beverly_Wilshire_Beverly_Hills_A_Four_Seasons_Hotel-Beverly_Hills_California.html,"Beverly Hills, California",hotels,5.0,4.5
By Far the Best Bakery,"Chaumont is by far the best bakery I ever visited; it has a perfect location, with fantastic options to eat there or to go. The chocolate or almond croissants are to die for - better than any I've tried in France. Look no further, it cannot get any better than Chaumont.",January 2018,Chaumont Bakery and Cafe,https://www.tripadvisor.com/Restaurant_Review-g32070-d3863635-Reviews-Chaumont_Bakery_and_Cafe-Beverly_Hills_California.html,"Beverly Hills, California",restaurants,5.0,4.5
Stunning Hotel,"The Waldorf Astoria is such an incredible hotel. It speaks luxury from the moment you enter the drive way and step into the lobby. The front desk staff is fantastic; lovely, professional and extremely helpful. The rooms are spacious, elegantly appointed, the bathrooms are wonderful (very important for me). When you think it doesn't get any better, wait you try the restaurants - overseen by Jean-Georges. The rooftop is breath-taking; it was my favourite spot in the hotel, which offers the best views of the City of Angels.",January 2018,Waldorf Astoria Beverly Hills,https://www.tripadvisor.com/Hotel_Review-g32070-d11707873-Reviews-Waldorf_Astoria_Beverly_Hills-Beverly_Hills_California.html,"Beverly Hills, California",hotels,5.0,4.5
Chic Restaurant with Excellent Food,"The restaurant is chic and very well designed, with several intimate spaces if you are looking for a more private seating area. The bar is beautiful and you can opt to have dinner there too. The food was delicious and very well presented, the cocktails options were fantastic too, although somewhat expensive. It is a really good option of fine dining Cantonese cuisine.",March 2018,Hakkasan Dubai,https://www.tripadvisor.com/Restaurant_Review-g295424-d2417528-Reviews-Hakkasan_Dubai-Dubai_Emirate_of_Dubai.html,"Dubai, United Arab Emirates",restaurants,4.0,4.5
The Best Aquapark in the UAE,"Aquaventure at Atlantis The Palm is by far the best aquapark in the UAE (and that I have ever been too). There are many many rides to keep you and your friends entertained the whole day, many food outlets with great food and many areas to relax as well - either by the pools or at the beach. An unforgettable day.",March 2018,Atlantis Aquaventure Waterpark,https://www.tripadvisor.com/Attraction_Review-g295424-d1200463-Reviews-Atlantis_Aquaventure_Waterpark-Dubai_Emirate_of_Dubai.html,"Dubai, United Arab Emirates",attractions,5.0,4.5
Beautiful Gardens - worth a short visit,"Got to know about the Dubai Miracle Gardens because of Instagram pictures posted on several accounts. Despite its location, the Gardens are very well maintained and very nice to talk a nice walk away from the city. Plenty of pictures opportunities. Try to go during the week days to avoid having too many people there.",March 2018,Dubai Miracle Garden,https://www.tripadvisor.com/Attraction_Review-g295424-d3916661-Reviews-Dubai_Miracle_Garden-Dubai_Emirate_of_Dubai.html,"Dubai, United Arab Emirates",attractions,4.0,4.5
Great Breakfast Option in JBR The Walk,"As the name suggests, Eggspectation is a great option for breakfast in JBR The Walk. The atmosphere is nice and casual, if the weather permits sit outdoors. The food is good and the service is fast. Food portions are big for the price you pay. I have never seen so many eggs options for breakfast - love it!",March 2018,Eggspectation,https://www.tripadvisor.com/Restaurant_Review-g295424-d6776411-Reviews-Eggspectation-Dubai_Emirate_of_Dubai.html,"Dubai, United Arab Emirates",restaurants,4.0,4.5
Idyllic Getaway from Dubai,"It's always nice to escape from Dubai and Fairmont Fujairah is the perfect getaway. The resort is very nice, the rooms are nice, spacious and very well appointed with beautiful views. We really enjoyed our time by the pool, where we were looked after by attentive staff. The food was great in all the restaurants, the spa was the true highlight of the resort. Next time we are in Dubai we will make sure to escape to this beautiful resort.",March 2018,Fairmont Fujairah Beach Resort,https://www.tripadvisor.com/Hotel_Review-g1028283-d11979404-Reviews-Fairmont_Fujairah_Beach_Resort-Dibba_Al_Fujairah_Emirate_of_Fujairah.html,"Dibba Al Fujairah, United Arab Emirates",hotels,5.0,4.5
Great Option close to the Airport,"Ibis Budget is a really good option if you need to stay overnight at Zurich Airport. The hotel covers all the basic needs at a very affordable price. Rooms are quite and the bed is comfortable. The hotel does not have a shuttle service, nevertheless there is a tram stop right in front of the hotel and the journey to the airport is less than 5 minutes. Very convenient.",June 2018,ibis budget Zurich Airport,https://www.tripadvisor.com/Hotel_Review-g227102-d7296153-Reviews-Ibis_budget_Zurich_Airport-Opfikon_Zurich.html,"Opfikon, Switzerland",hotels,4.0,3.5
Ibis is Always a Good Option,"Relatively close to the airport (10-15 minute drive), ibis is good option for an overnight stay prior catching your flight. The hotel offers affordable rooms that satisfy all the basic needs, with quiet rooms and comfortable beds. The staff is friendly and helpful.
The only downside is the airport shuttle, although complimentary, only runs twice every hour.",June 2018,ibis Zurich Messe Airport,https://www.tripadvisor.com/Hotel_Review-g188113-d230881-Reviews-Ibis_Zurich_Messe_Airport-Zurich.html,"Zurich, Switzerland",hotels,4.0,3.5
Excellent options a few steps from the City Centre,"Grand Hotel has probably the best location just a few steps from the City Centre. The hotel is beautiful, is like stepping back in time - making you feel like royalty. The staff is extremely friendly and very helpful. The rooms are spacious and very well appointed. We really enjoyed our stay and we would definitely love to go back.",March 2018,Grand Hotel,https://www.tripadvisor.com/Hotel_Review-g274772-d276782-Reviews-Grand_Hotel-Krakow_Lesser_Poland_Province_Southern_Poland.html,"Krakow, Poland",hotels,5.0,4.0
It cannot be missed,If you've watched the movie you know you have to visit Oskar Schindler's factory. The museum is designed in a very original and interesting way. Purchase your ticket online so you avoid to queue for too long.,March 2018,"Muzeum Krakowa, oddział Fabryka Emalia Oskara Schindlera",https://www.tripadvisor.com/Attraction_Review-g274772-d647063-Reviews-Muzeum_Krakowa_oddzial_Fabryka_Emalia_Oskara_Schindlera-Krakow_Lesser_Poland_Provi.html,"Krakow, Poland",attractions,5.0,4.5
Stunning,"The main plaza is stunning. Very charming, with several restaurants, cafes, carrosses for nice city tours. The whole area is pedestrian, the market is very nice. We loved it.",March 2018,Krakow's Rynek Glowny Central Square,https://www.tripadvisor.com/Attraction_Review-g274772-d276740-Reviews-Krakow_s_Rynek_Glowny_Central_Square-Krakow_Lesser_Poland_Province_Southern_Poland.html,"Krakow, Poland",attractions,5.0,4.5
By far the Best Breakfast in Town,"Truly the best breakfast in town. The cafe is nice and charming, and you can smell the bread from the other side of the plaza. Once you enter go downstairs, you get to seat where the bread is baked. Sometimes the waiting time can be long but it is definitely worth waiting. We went back everyday during our short stay in Krakow.",March 2018,Bistro Charlotte,https://www.tripadvisor.com/Restaurant_Review-g274772-d3585143-Reviews-Bistro_Charlotte-Krakow_Lesser_Poland_Province_Southern_Poland.html,"Krakow, Poland",restaurants,5.0,4.0
Ski-out resort with Breath-Taking Views,Great resort with ski-out access to the beautiful slopes of Valle Nevado. The location couldn't not get any better. The rooms are spacious and with breath-taking views of the Andes. The staff is very friendly and the hotel offers an all-inclusive plan (including ski pass and rental). Can't wait to go back.,August 2017,Puerta del Sol Hotel,https://www.tripadvisor.com/Hotel_Review-g488180-d625842-Reviews-Puerta_del_Sol_Hotel-Valle_Nevado_Santiago_Metropolitan_Region.html,"Valle Nevado, Chile",hotels,4.0,3.5
Best Tuna Tartar in Town,"A casual dining option that offers a great selection of seafood, tacos and much more. They menu offers excellent food options, but the best dish - which is a must try - is the tuna tartar with avocado and mango. It won't disappoint.",April 2018,La Marea,https://www.tripadvisor.com/Restaurant_Review-g152516-d9565209-Reviews-La_Marea-San_Jose_del_Cabo_Los_Cabos_Baja_California.html,"San Jose del Cabo, Mexico",restaurants,5.0,4.5
Don't miss out on an iconic Toronto picture.,"The reason why I decided to visit this place, despite getting my iconic Toronto sign picture and the cityhall, was because I saw this building in the movie Resident Evil II starring Mila Jovovic.",October 2017,Toronto City Hall,https://www.tripadvisor.com/Attraction_Review-g155019-d184942-Reviews-Toronto_City_Hall-Toronto_Ontario.html,"Toronto, Canada",attractions,5.0,4.0
Stunning building,"Get a sense of the old Canada, right in the middle of modern Downtown. In my opinion is one of the nicest building in that area.",October 2017,Old City Hall,https://www.tripadvisor.com/Attraction_Review-g155019-d186819-Reviews-Old_City_Hall-Toronto_Ontario.html,"Toronto, Canada",attractions,5.0,4.0
The most beautiful street in the city,"This is something you really do not have to miss out. Get ready with comfortable shoes to walk and admire the beautiful bohemian buildings, nice shops, trendy restaurants, bars and nightlife. Very picturesque.",October 2017,Queen Street,https://www.tripadvisor.com/Attraction_Review-g155019-d155505-Reviews-Queen_Street-Toronto_Ontario.html,"Toronto, Canada",attractions,5.0,4.5
A FLAWLESS Experience,"Not trying to exaggerate, but Rosewood Mayakoba was the best resort experience I have ever had. It could not have get any better, not even if I've dreamed about it.
I could write a novel praising how fantastic the resort is, but with limit my review in the major highlights to make it easier for you to read.

The arrival experience is something truly unique. Do not want to give any spoilers, but it's magical.

The rooms are wonderful, nicely and elegantly appointed, spacious, private pool and a daybed on the roof. Extremely private and peaceful. You can have a golf cart picking you up but I preferred to ask for a bike and tour the beautiful property at my own pace.

All the restaurants have delicious food, very well presented (I ended up taking pictures of pretty much all dishes). Excellent service. Punta Bonita was my favourite for lunch - I was surprised with an order of churros (without cinnamon, due to my intolerance - a true wow factor). I will have to go back as I didn't get to experience 'Aqui me Quedo'.

The beach is stunning. The sand seems flour. The amenities and service were outstanding.

Breakfast at Casa del Lago was great - really loved the buffet set up and the a la carte options.

The spa was one of the largest I've ever seen. The wet areas were a true blessing, you can make use of them even though you do not have a scheduled treatment. The fitness centre (which is open 24/7) is great, there are fantastic group fitness classes. Giovanni the personal trainer is a true superstar, I had the best TRX training.

Rosewood Mayakoba is the best resort you can possibly find in the Riviera Maya.",September 2017,Rosewood Mayakoba,https://www.tripadvisor.com/Hotel_Review-g150812-d754465-Reviews-Rosewood_Mayakoba-Playa_del_Carmen_Yucatan_Peninsula.html,"Playa del Carmen, Mexico",hotels,5.0,5.0
"Great location, impressive views, fantastic value for money.","The hotel has a great location with easy access to the city's main tourist attractions and a 5-minute walk from Warszawa Centralna railway station. The rooms are very nice, elegant and quiet with beautiful views of the city. The fitness centre and the pool were fantastic, located on the top floor. The staff is very nice and friendly. It's a great value for money.",March 2018,InterContinental Warszawa,https://www.tripadvisor.com/Hotel_Review-g274856-d284134-Reviews-InterContinental_Warszawa-Warsaw_Mazovia_Province_Central_Poland.html,"Warsaw, Poland",hotels,5.0,4.5
"Must visit, do not miss out!","It is a tour you cannot missed - the only way not to repeat the same mistakes from the past is to learn from it. There are guided tours in all languages. Bring comfortable shoes as you will walk a lot during the tour of both camps Auschwitz-Birkenau.
Bear in mind to be respectful when visiting the camp.",March 2018,Krakow and Auschwitz Small Group Tour from Warsaw with Lunch,https://www.tripadvisor.com/AttractionProductReview-g274856-d11472652-Krakow_and_Auschwitz_Small_Group_Tour_from_Warsaw_with_Lunch-Warsaw_Mazovia_Provin.html,"Warsaw, Poland",activities,5.0,4.5
Beautiful and picturesque,"You have to take a walk in the beautiful and picturesque old town. Although it has been completely reconstructed after WWII, it feels as it could have been the original. The buildings, the walls are great to visit. Explore the little streets and discover small restaurants and cafes.",March 2018,Old Town,https://www.tripadvisor.com/Attraction_Review-g274856-d284330-Reviews-Old_Town-Warsaw_Mazovia_Province_Central_Poland.html,"Warsaw, Poland",attractions,5.0,4.5
Visit Castle Square prior to get to the Old Town,Before adventuring into the little streets that will take you to the old town plaza start your walk right on Castle Square. Visit the castle if you have enough time.,March 2018,Castle Square (Plac Zamkowy),https://www.tripadvisor.com/Attraction_Review-g274856-d274987-Reviews-Castle_Square_Plac_Zamkowy-Warsaw_Mazovia_Province_Central_Poland.html,"Warsaw, Poland",attractions,5.0,4.5
"Perfect Getaway - Breathtaking, Elegant and Quiet","Together with my girlfriend we were among the first guests to stay at this new resort in Los Cabos. We were impressed - the resort is very elegant, quiet and with impressive views of the bay. Our room had breath-taking views of the sea and the pools (there are like 6 different pools!); they are spacious and comfortable. We really enjoyed the restaurants; great food and very good and warm service. We will definitely come back!",June 2018,Montage Los Cabos,https://www.tripadvisor.com/Hotel_Review-g152515-d13294609-Reviews-Montage_Los_Cabos-Cabo_San_Lucas_Los_Cabos_Baja_California.html,"Cabo San Lucas, Mexico",hotels,5.0,5.0
