title,text,date,place,placeURL,placeLocation,placeType,reviewScore,avgScore
GREAT EXAMPLE OF ARABIC AND EGYPTIAN CULTURE,"Entering Petra's valey you feel like being part of a Hollywood movie. The scenery, the colours and the pourity of materials create a calmness inside your soul. But allof these are ruined by the torture of the animals, the vomiting stink and the constant fear of being througn down by the rushing shouting Arabs going up and down the narrow paths.",October 2019,Petra,https://www.tripadvisor.com/Attraction_Review-g318895-d319461-Reviews-Petra-Petra_Wadi_Musa_Ma_an_Governorate.html,"Petra - Wadi Musa, Jordan",attractions,4.0,5.0
Nice surprice,"We heard about this ice place from locals, so we where a little bit in doubt, because most of the places in Kalymnos were average. But the place is very nicely decorated and the cocktails delicius. The service needs to show little more cheered up.",August 2019,Azul Kalymnos,https://www.tripadvisor.com/Restaurant_Review-g189439-d6975960-Reviews-Azul_Kalymnos-Kalymnos_Dodecanese_South_Aegean.html,"Kalymnos, Greece",restaurants,5.0,4.5
Goddess's Athina Temple,"Thιs temple is the crown of a civilization, was the symbol tried to conquered by many. An architecture marvel of the ancient people. Worth to read about the details of the design and the construction to have a complete eperience when you visit.",July 2019,Parthenon,https://www.tripadvisor.com/Attraction_Review-g189400-d198711-Reviews-Parthenon-Athens_Attica.html,"Athens, Greece",attractions,5.0,4.5
The history unveiled,All around and on top of these rocks are the elements of the base of the western civilization. These small castle creates houge emotions as you enter its gates through the marble columns (the propylea). Worth the walk and the heat of an Athenian day.,July 2019,Acropolis,https://www.tripadvisor.com/Attraction_Review-g189400-d198706-Reviews-Acropolis-Athens_Attica.html,"Athens, Greece",attractions,5.0,4.5
ARCHITECTURE AT ITS FINEST,"I visited the place at night hours. I could not imagine a better presentation of the ancient civilisations existed in the area. During the tour, the continuous visual contact with the Acropolis creates a spiritual filling.",May 2019,Acropolis Museum,https://www.tripadvisor.com/Attraction_Review-g189400-d735521-Reviews-Acropolis_Museum-Athens_Attica.html,"Athens, Greece",attractions,5.0,4.5
Calmness in the center of Athens,The historical architecture blends with the modern renovation. We stayed in first floor and the room had a very spacious and bright feeling. We went everywhere by foot. The spot is like leaving in the neighborhood of the old town. The bells of the metropolitan church were not a problem for us beacause there are a lot of bars with tasty cocktails around! The rooftop bar-restaurant is a hot spot and we had to book a day before.,February 2019,The Zillers Boutique Hotel,https://www.tripadvisor.com/Hotel_Review-g189400-d553893-Reviews-The_Zillers_Boutique_Hotel-Athens_Attica.html,"Athens, Greece",hotels,5.0,4.5
