title,text,date,place,placeURL,placeLocation,placeType,reviewScore,avgScore
Cameo Earrings,"We stopped at Apa 1848 while on an excursion to Pompeii. We were able to see them making cameos and they explained the process. It is very delicate work.
There was no pressure to buy anything, but I couldn't resist since I had been wanting some cameo earrings. There are a variety of items in different price ranges so they can be affordable.
I have really enjoyed wearing my earrings since I returned and have received many compliments. Jewelry is always a good souvenir because each time I wear it, it brings back fond memories of our vacation!",August 2019,Apa 1848,https://www.tripadvisor.com/Attraction_Review-g1063524-d12653838-Reviews-Apa_1848-Torre_Del_Greco_Province_of_Naples_Campania.html,"Torre Del Greco, Italy",attractions,5.0,4.5
A Highlight of Our Trip!,"We visited Pompeii on a cruise ship excursion. Although it was listed as strenuous, we are in our 70's and found it very doable.
I found the area fascinating. It is hard to imagine that they had running water and sewers in 79 AD.
It is poignant to see the preserved body and other artifacts from an advanced society.
Be sure to have a guide because the complex is huge and they know which areas are best. Plus he explained about interesting things we would not even have noticed on our own.
In my opinion, Pompeii is not to be missed!",August 2019,Pompeii Archaeological Park,https://www.tripadvisor.com/Attraction_Review-g187786-d195477-Reviews-Pompeii_Archaeological_Park-Pompeii_Province_of_Naples_Campania.html,"Pompeii, Italy",attractions,5.0,4.5
Unbelievable Views!,"We visited Santorini and Fira on a cruise. We took a ship excursion which took us by bus up to Fira rather than by cable car. The views are stunning!
It is hard to describe how beautiful it is to look off the side of the mountain, where everything is perched, down into the caldera.
We spent our day wandering around the shopping area and enjoying the little sidewalk cafes. (Yum - gelato!) It was a very relaxing day.
We bought some jewelry made of orichalcum and lava stone from the artist- Emmanouelo in a little shop in the Fabrika. Meeting the artist, makes it a very special sourvenir.
We really enjoyed our day in Santorini and Fira.",August 2019,Three Bells of Fira,https://www.tripadvisor.com/Attraction_Review-g482942-d12900632-Reviews-Three_Bells_of_Fira-Fira_Santorini_Cyclades_South_Aegean.html,"Santorini, Greece",attractions,5.0,4.5
Relaxing Cruise Stop,"We visited Messina while on a Mediterranean Cruise. We decided to spend the day relaxing so we took a short walk from the ship to the Cathedral Square (Piazza Duomo).
There is a fountain and a 180 foot bell tower with the famous astronomical clock.
We enjoyed shopping in the little shops and with street vendors in the square. Don't forget to buy some lemoncello! There was even entertainment in the square!
We enjoyed our relaxing day!",August 2019,Duomo di Messina,https://www.tripadvisor.com/Attraction_Review-g187889-d195176-Reviews-Duomo_di_Messina-Messina_Province_of_Messina_Sicily.html,"Sicily, Italy",attractions,4.0,4.5
Well Organized and Informative Tour,"We took the ""Half-Day Bus Tour in Athens, Acropolis and Acropolis Museum Tour"" with Athens Tours Greece. The price included a guide, all entry tickets and transportation from our city center hotel and back.
Everything was well organized and happened on schedule.
We started with a tour around the city to see the Panathenaic Stadium, Hadrian's Arch, and Constitution Square among other things. Then we went to the Acropolis Museum.
The Museum is beautiful. Very clean, bright and modern. Our excellent guide explained all the things we were seeing. The Museum has a great view of the Acropolis. I loved the glass floor exposing excavations below.
We then walked up the Acropolis. This is not an easy climb but doable. We are in our 70's and made it to the top. The view of the City of Athens in breathtaking. The Parthenon (a temple to the Goddess Athena) and the Porch of the Maidens are a page from the history books.
We were very pleased we had booked a tour with Athens Tours Greece and would definitely utilize them again.",August 2019,Highlights of Athens Half-Day Tour with Transfers,https://www.tripadvisor.com/AttractionProductReview-g189400-d13548937-Highlights_of_Athens_Half_Day_Tour_with_Transfers-Athens_Attica.html,"Athens, Greece",activities,5.0,5.0
A Beautiful Museum,"The Acropolis Museum is beautiful with a modernistic design. It is bright with lots of natural light and wonderful displays.
As you enter the museum, you walk over a glass floor allowing you to view an excavation of artifacts below. There is a great view of the Acropolis from the museum.
The displays are artifacts from the temples on the Acropolis. A guide is very beneficial to explain the history of what you are seeing.
This museum is well worth seeing. Don't miss it!",August 2019,Acropolis Museum,https://www.tripadvisor.com/Attraction_Review-g189400-d735521-Reviews-Acropolis_Museum-Athens_Attica.html,"Athens, Greece",attractions,5.0,4.5
A Page From The History Books,"I loved Europe because I finally saw all the things I only studied about in books. The Acropolis is a perfect example of this. The Parthenon (the temple to the goddess Athena) on top of the Acropolis towers over the city and is visible from many locations including our hotel.
Nothing compares to actually climbing up and seeing it up close. A bonus is the spectacular view of Athens. It is not an easy climb especially in August. But we are over 70 and did it!
Don't wait until you are our age to experience this wonder of the world!",August 2019,Acropolis,https://www.tripadvisor.com/Attraction_Review-g189400-d198706-Reviews-Acropolis-Athens_Attica.html,"Athens, Greece",attractions,5.0,4.5
Nice Newer Hotel,"We stayed for the first time at the Quality Inn and Suites in Sioux Falls. We chose it because of its proximity to I-90.
The appearance is nice and the staff is welcoming.
Our room was spacious with a seating area and in very good condition. The breakfast buffet offered a good variety of items.
We took advantage of the pool and hot tub area.
We will stay here again when we need a room in this part of town.",September 2019,Quality Inn And Suites,https://www.tripadvisor.com/Hotel_Review-g54805-d582292-Reviews-Quality_Inn_And_Suites-Sioux_Falls_South_Dakota.html,"Sioux Falls, South Dakota",hotels,4.0,4.5
Beautiful Hotel But Expensive Food,"We stayed at the InterContinental Athenaeum during our stay in Athens.
It is a very beauiful hotel with professional service. However, be prepared - food is very expensive.
We ate several meals in the Cafe Vienna. Service was excellent. Bread was served in a cute little bread box. We ate club sandwiches, chicken and rice soup etc. We drank the regular water. A club sandwich was about 20 Euro each. The soup was 12. One time we had two small bottled cokes and it was 15 Euro.
The breakfast buffet was included with our room. It was extensive with fresh fruit and meats but if it is not included with your room, the price is 38 Euro per person.
Our room was nice although our view was of an abandoned building. While we had free WiFi, we couldn't find any free TV. According to the screen, there was a charge so we didn't go further.
We enjoyed the tropical atmosphere of the outdoor swimming pool. A dip felt really refreshing after climbing the Acropolis.
While we enjoyed our stay, if we return to Athens, we will probably choose a different hotel.",September 2019,InterContinental Athenaeum,https://www.tripadvisor.com/Hotel_Review-g189400-d233052-Reviews-InterContinental_Athenaeum-Athens_Attica.html,"Athens, Greece",hotels,4.0,4.0
Nice Rooms but Confusing Layout and No Indoor Pool,"We spent two nights at the Crowne Plaza as part of a reunion event. Check-in was fine until I tried to find the elevator. I asked the desk clerk and she said turn and go down the hall. I couldn't figure out which hallway to turn into. Then I came to the elevators for the meeting rooms which did not go up to my floor. I asked three times before I finally found the elevator. A map and more signage would certainly help this situation.
Our room was nice and we had no complaints. We were disappointed there was no indoor pool or hot tub. The outdoor pool looked nice but we did not have nice weather. Considering how many months Illinois is cold, this doesn't seem like a very wise choice.
The meeting room and food were very good for our dinner and dance.
Breakfast was included with our room. Note this is not always the case. The breakfast buffet was very good with fresh fruits, scrambled eggs, bacon, etc. and we even had a waitier who brought us coffee and juice.
I expected more from a Crowne Plaza. We would probably not choose to stay here again unless it was for a meeting.",September 2019,Crowne Plaza Hotel Chicago - Northbrook,https://www.tripadvisor.com/Hotel_Review-g36464-d87923-Reviews-Crowne_Plaza_Hotel_Chicago_Northbrook-Northbrook_Illinois.html,"Northbrook, Illinois",hotels,3.0,4.0
Reunion Visit,"We visited Hackney's on Lake as part of a High School Reunion. We were in a small meeting room. We were served hors d'oervres which were delicious. I particularly remember the little quesadillas.
After the snacks, we weren't very hungry so instead of ordering a meal, we ordered the blooming onion. It was not very good.
We would return if we are in the area again.",September 2019,Hackney's On Lake,https://www.tripadvisor.com/Restaurant_Review-g36052-d509908-Reviews-Hackney_s_On_Lake-Glenview_Illinois.html,"Glenview, Illinois",restaurants,4.0,4.0
Irish Comfort Food,"We ate at the Dublin Bay Irish Pub while visiting a friend in Ames. It was a beautiful fall evening so we ate on the patio.
We started with Strawberry Lemonade Sangria.Then there is no better comfort food than a deliciious Shepherd's Pie. Don't pass up the yummy Bailey's Pie for dessert. It was big enough to share. Attached is part of the menu with some of the other options available.
We will definitely return when we are in the area.",September 2019,Dublin Bay Irish Pub & Grill,https://www.tripadvisor.com/Restaurant_Review-g29355-d415023-Reviews-Dublin_Bay_Irish_Pub_Grill-Ames_Iowa.html,"Ames, Iowa",restaurants,4.0,4.5
Nice New Hotel But No Hot Tub,"We stayed at the Comfort Inn ISU while traveling through Iowa. We were surprised to find it was a brand new hotel. Everything sparkled!
Check-in was fast and friendly. Our room was huge. I had inadvertently booked an accessible room and I think that is why it was so large. The bathroom was almost as big as some motel rooms. I was surprised it had a bathtub since it appeared to be a handicapped room with a lot of grab bars.
I assumed all Comfort Inns had hot tubs so we were disappointed after a long day of driving to find they didn't have one.
Breakfast was very good and included delicious homemade cinnamon rolls. Definitely a plus! Karina, the breakfast staff person, was very friendly, and we enjoyed visiting with her.
We were very pleased with our stay with the exception of no hot tub!",September 2019,Comfort Inn & Suites near ISU Campus,https://www.tripadvisor.com/Hotel_Review-g29355-d15810940-Reviews-Comfort_Inn_Suites_near_ISU_Campus-Ames_Iowa.html,"Ames, Iowa",hotels,4.0,4.5
Inexpensive Eats,"We were staying at the Athenaeum Intercontinental Hotel and the Grill House was recommended to us.
It is situated behind the hotel and a little hard to find but worth it.
We sat in a pleasant outdoor eating area. I had a huge gyro. Prices were very reasonable. Two meals with soda pop were about 25 euro.",August 2019,Grill House Vassilis,https://www.tripadvisor.com/Restaurant_Review-g189400-d3574655-Reviews-Grill_House_Vassilis-Athens_Attica.html,"Athens, Greece",restaurants,4.0,4.5
Nice Neighborhood Bar & Grill,"We have driven by the NorthStar Grill & Pub several times & finally decided to stop.
The décor is typical bar & grill. Our waitress was very nice.
They have very reasonable lunch specials. I had the shrimp wrap with chips for $7.25 and it was very good.
We will return.",August 2019,Northstar Grill & Pub,https://www.tripadvisor.com/Restaurant_Review-g54805-d15650711-Reviews-Northstar_Grill_Pub-Sioux_Falls_South_Dakota.html,"Sioux Falls, South Dakota",restaurants,4.0,4.0
Breathtaking Views,"We visited Kotor on a cruise ship. The views going into the bay are just breathtaking.
We took a ship excursion which was ""lunch in a local home."" It exceeded our expectations. We first took a tour of the local market filled with fresh fruit and vegetables.

Our very talented and gracious hostess, Vlasta Mandic, welcomed us into her charming home. She entertained us by playing the piano and demonstrated making gnocchi. We had a lovely lunch of antipasto, gnocchi with beef and gravy, and a creamy layered dessert. It was completed with locally made wines.

After our lunch, we walked around the charming old town area of Kotor.
We travel to many places but we would like to return to Kotor.",September 2018,Bay of Kotor,https://www.tripadvisor.com/Attraction_Review-g295381-d3368773-Reviews-Bay_of_Kotor-Kotor_Kotor_Municipality.html,"Kotor, Montenegro",attractions,5.0,5.0
Very Enjoyable Lunch,"We always enjoy a stop in Keystone. We love walking around looking at the gift shops.
We stopped at the Ruby House Restaurant for lunch. It has a fun old west atmosphere. Service was fast and friendly.
We really enjoyed our chicken fried chicken with mashed potatoes and gravy. We shared an unusual berry (I can't remember the name) ice cream. Only $1.99 and it was delicious. We thought the prices were very reasonable for a tourist area.
We will be back!",May 2019,Ruby House Restaurant,https://www.tripadvisor.com/Restaurant_Review-g60908-d639379-Reviews-Ruby_House_Restaurant-Keystone_South_Dakota.html,"Keystone, South Dakota",restaurants,5.0,4.0
I WANT TO DO IT AGAIN!,"We were in the Black Hills and wanted to do something new. So we went on a helicopter ride with Black Hills Aerial Adventures.

They have three different locations and we left from Keystone. The staff was very friendly and efficiently took care of everyone. They even offered to take our picture at the end of the tour.

I was concerned it might be scary or I might get airsick. Even though I was in the front seat with a glass window to the floor, I wasn't. I thoroughly enjoyed seeing Keystone, Mt. Rushmore and Horse Thief Lake from a different perspective.

We felt the cost was reasonable at $105 per person in comparison to other rides we have priced. They have different tours with different prices.

Next time - The Badlands!",May 2019,Black Hills Aerial Adventures,https://www.tripadvisor.com/Attraction_Review-g60865-d1547651-Reviews-Black_Hills_Aerial_Adventures-Custer_South_Dakota.html,"Custer, South Dakota",attractions,5.0,5.0
SERVICE WITH A SMILE,"Obviously we love Secrets Aura in Cozumel. We look forward to seeing the wonderful staff every year. Many of them we have known for the eleven years that we have been visiting. Thanks Nelly Bass for your first-rate service. It is always a joy to see Fernando Yam’s huge smile “welcoming us home”. The “other” concierge express Fernando is always sociable too. Milly Oss our Preferred Pool Concierge brightened our days. Jesus is an outstanding bartender.

We stayed in Ocean Front Preferred suite – 914. Our room was perfect (except for no towel animals) including plenty of hot water and cold air conditioning. The convenience and view of an Ocean Front room can’t be beat.

We love the leisurely dining in the unlimited, no reservation specialty restaurants. We really missed breakfast at Oceana because it did not open until 8:30 this year. We are early risers so we ate at the buffet (which opens at 7:00) every morning except once when we simply had to have the Eggs Benedict and waffles with chocolate mousse.
We discovered the lunch menu had also changed considerably at Oceana. Most dishes were a seafood mixture. I need to know exactly what seafood it is so we avoided those dishes. Also the ribs (my favorite) were no longer on the menu however they are available at times in the Buffet and on the room service menu. Antonio provided exceptional service at Oceana.

We ate most breakfasts and lunches at the Market Café Buffet. Margarito, a superb waiter, made sure I had all the ribs I wanted. The very personable Yuritza will brighten your day as she seats you. Marcos always provides tremendous service. We also enjoyed great service by Adrian and Erick.

At dinner in Oceana, Capitan Luis does a fantastic job. One evening he found us some ice cream when we just wanted a little snack. Unfortunately my favorite dishes - crab cakes and coconut shrimp were no longer available. I ordered the Surf and Turf which was supposed to be coconut shrimp but it wasn’t. I never saw the flaming Mayan Coffee this year. I know it takes quite a bit of the waiter’s time but it is the special touches that makes a vacation memorable.

At Bordeaux, we love the French onion soup and filet mignon. We really miss the special dishes made at the table like the melted cheese and flaming Bananas Foster. A highlight of our week was the private dinner at La Cava (the wine cellar next to Bordeaux.) Our private waiter was Capitan Extraordinaire Joseph. Joseph is a true asset to Secrets Aura.

In the evening, Market Café now becomes a steakhouse. The steak was excellent and came with a choice of toppings such as mushrooms or peppers and service by Jose Antonio was delightful. This is a great idea!

We ate at Windows in order to have Angel as our fabulous waiter even though the food was not our favorite.

We discovered quite by accident that Coco Café has ice cream. So if you are looking for some, now you know!

We never tire of returning home to Secrets Aura. We treasure the relaxing atmosphere and the beautiful setting, but mainly the staff who have become friends.

¡Hasta el próximo año!
Pamela & Roger",April 2019,Secrets Aura Cozumel,https://www.tripadvisor.com/Hotel_Review-g150809-d939910-Reviews-Secrets_Aura_Cozumel-Cozumel_Yucatan_Peninsula.html,"Cozumel, Mexico",hotels,4.0,4.0
Great for Early / Late Flights!,"We recently stayed at the AeroStay Motel connected to the Sioux Falls Airport. We were very pleased with our nice well maintained room overlooking the runway. We enjoyed watching the planes but thankfully we couldn’t hear them.
We were really glad we were staying there because we had a 6:00 a.m. flight and the return flight arrived at 11:30 p.m. Add the snow and ice that occurred while we were gone and we were even happier with the decision.
To get to the airport, you wheel your luggage through the lobby door into the airport. No need to go outside. It’s a short distance and very easy. There were also a couple of restaurants (Marlins and Subway) outside of security for meals if you don’t want to drive somewhere.
They also have a park and fly package that saves you a little on the long term parking. If you are gone longer than the seven days, you just pay the airport directly for the additional days.
Be aware that the hotel is quite bare bones. The room does not have a bathtub, refrigerator, closet or safe. There is no swimming pool, hot tub or included breakfast.
Be sure to ask for a receipt at checkout. There was a discrepancy between the confirmation and the amount we were being charged. The hotel did remedy the situation.
We will definitely stay here again when flying out of Sioux Falls.",April 2019,AeroStay Hotel,https://www.tripadvisor.com/Hotel_Review-g54805-d7949575-Reviews-AeroStay_Hotel-Sioux_Falls_South_Dakota.html,"Sioux Falls, South Dakota",hotels,4.0,4.5
They Thought of Everything!,"From the moment we entered the Comfort Inn & Suites, we were impressed. The lobby is very attractive and we were greeted by the very friendly desk clerk. Check-In was quick and she described all the hotel amenities and even recommended a restaurant for dinner. (Which was close and very good.) We have never received a slip of paper before with all the details such as the hours for the pool and breakfast plus the free breakfast menu.

We were offered snacks and our name was on the board because of our status with Choice hotels. Besides the welcome cookies and ice water (with lemon), we were surprised they offered chicken noodle soup in the lobby.

Our room was large with a room divider and a sofa and comfy chair. Everything was very up to date. There was a microwave, refrigerator & coffee pot. We enjoyed the large shower with a modern glass door. We also took advantage of the pool area and hot tub. Nowhere did I notice any maintenance issues.

The Free Breakfast was excellent. My favorites were the waffles with strawberries and whipped cream and the biscuits and gravy. There were also scrambled eggs and sausage plus a variety of healthy options.

Also a first for us, was receiving a ""thank you for your stay"" letter. Since we were using points and our night was free, there was no bill but they reiterated that we didn't need to do anything but turn our keys in.

A very nice touch! They really did think of everything.",March 2019,Comfort Inn & Suites,https://www.tripadvisor.com/Hotel_Review-g54805-d6107115-Reviews-Comfort_Inn_Suites-Sioux_Falls_South_Dakota.html,"Sioux Falls, South Dakota",hotels,5.0,4.5
More Than A Bar & Grill,"We ate at Krav'n upon the recommendation of our hotel clerk. We were a little skeptical about a Bar & Grill but were pleasantly surprised with the variety offered on their menu.

It was a tough decision but we chose the Prime Rib Sandwiches. I had the potato salad as a side. The Prime Rib was sliced thin but was very good. It was about $11.99. Then we splurged and had Fried Ice Cream. It was delicious and was accompanied by churros. It was $6.00 and there was plenty to share.

We received excellent service from Terrell. He was very friendly and helpful. He checked back often and filled our water glasses several times.

We will definitely return. Next time I am trying the coconut shrimp.",March 2019,kRav'N Bar & Grill,https://www.tripadvisor.com/Restaurant_Review-g54805-d2044908-Reviews-KRav_N_Bar_Grill-Sioux_Falls_South_Dakota.html,"Sioux Falls, South Dakota",restaurants,5.0,4.0
Good Food but Noisy!,"We ate with friends at Marina 84. Although we tried to sit in the quietest part of the restaurant, it was very difficult to hear and visit.
We had a variety of dishes including coconut shrimp, fajitas, and sliders and everyone enjoyed them.",November 2018,Marina 84 Fort Lauderdale,https://www.tripadvisor.com/Restaurant_Review-g34227-d6868047-Reviews-Marina_84_Fort_Lauderdale-Fort_Lauderdale_Broward_County_Florida.html,"Fort Lauderdale, Florida",restaurants,4.0,4.0
Lot of Stores!,"We stopped at Port Zante on a cruise ship. It had far more stores than most islands we visit. We enjoyed walking around and picking up a few souvenirs. Everyone was friendly and helpful and not pushy.

There was a little craft market near the museum. Although some stores advertised free WIFI, we were never able to get a good connection.",November 2018,Port Zante,https://www.tripadvisor.com/Attraction_Review-g147375-d11729208-Reviews-Port_Zante-Basseterre_St_Kitts_St_Kitts_and_Nevis.html,St. Kitts,attractions,4.0,3.5
Great Free WIFI & Smoothies!,"While traveling on a cruise ship, we were looking for free WIFI and came across this Starbucks. The waitress was very friendly and helpful, the strawberry lemonade smoothie was delicious, and the WIFI worked great! It was the only time on our trip that the WIFI was strong enough to download our emails.

When you walk in, you might think there is no seating but don't worry, there is lots more out of sight.",November 2018,Starbucks,https://www.tripadvisor.com/Restaurant_Review-g147320-d10063422-Reviews-Starbucks-San_Juan_Puerto_Rico.html,Puerto Rico,restaurants,5.0,4.0
Nice Clean Beach and Shopping Area,"We enjoyed the Grand Turk Cruise Center. It is very clean and appealing. There are nice little shops and free WIFI. Right off the pier is a beach for swimming with free chairs and umbrellas.

We felt very welcome and enjoyed our time here.",November 2018,Grand Turk Cruise Center,https://www.tripadvisor.com/Attraction_Review-g147397-d2422682-Reviews-Grand_Turk_Cruise_Center-Cockburn_Town_Grand_Turk_Turks_and_Caicos.html,Grand Turk,attractions,4.0,4.0
Free Chairs & Umbrellas,"We decided on a beach day in Grand Turk and how nice to have Sunray beach right off the pier complete with free chairs and umbrellas! The chairs with green umbrellas to the left as you are facing the beach are free. The blue clam shells to the right are also free.

To get to the beach, you walk through the shopping area and then turn right or left.

We had read to avoid the crowds to go right. However we found the surge quite strong as we tried to enter the water especially as we were trying to navigate over the rocks. We were wearing water shoes which I think are a must.

It looked like it was better on the other side since we saw a lot of people standing in the water. The ship may have blocked some of the surge.

Our free chairs were quite saggy and worn out but I guess you can't complain about free!",January 2018,SunRay Beach,https://www.tripadvisor.com/Attraction_Review-g147396-d150106-Reviews-SunRay_Beach-Grand_Turk_Turks_and_Caicos.html,Grand Turk,attractions,4.0,4.5
Free WIFI,"When cruising, free WIFI is always appreciated! We weren't able to download our emails but we were able to access the internet and Facebook so we could still see our messages.

To show your appreciation, don't forget to stop in a buy a smoothie!",November 2018,Froots,https://www.tripadvisor.com/Restaurant_Review-g147397-d6728713-Reviews-Froots-Cockburn_Town_Grand_Turk_Turks_and_Caicos.html,Grand Turk,restaurants,4.0,4.0
