title,text,date,place,placeURL,placeLocation,placeType,reviewScore,avgScore
Lots of Beautiful Ceilings,"We had of course heard of the Sistine Chapel ceiling but we had no idea about the long beautiful ceiling in the Vatican Museums.

It is difficult to explain the sheer volume of great works of art including sculptures, huge intricate tapestries lining the walls and paintings that are everywhere you look.

Of course the Museums are very busy so be sure to book a Skip the Line tour with a guide who can lead you to the things that are ""must sees"".

At times you may feel like you are experiencing art overload but this is truly not to be missed!",September 2018,Vatican Museums,https://www.tripadvisor.com/Attraction_Review-g187793-d191000-Reviews-Vatican_Museums-Vatican_City_Lazio.html,"Vatican City, Italy",attractions,5.0,4.5
Mysterious,"We saw this while passing through the courtyard but strangely our guide did not even mention it. I found it fascinating. It is unlike anything we have seen before. The inside moves around.

I have since read about it on the internet and there is a lot of symbolism about the fractured state of our world.",September 2018,Sphere within a Sphere,https://www.tripadvisor.com/Attraction_Review-g187793-d7134502-Reviews-Sphere_within_a_Sphere-Vatican_City_Lazio.html,"Vatican City, Italy",attractions,5.0,4.0
Unbelievable artwork!,"We have heard about the Sistine Chapel our whole lives. What an experience to actually be there! It is incredible to imagine how difficult it must have been to create.

Be aware that it will be packed (literally shoulder to shoulder) with tourists. Be sure to book your tour in advance with Skip the Line tickets and a guide to explain everything. Also don't plan to visit on Sunday because it is not open for tours. Pictures are not allowed.

Still a Must See!",September 2018,Sistine Chapel,https://www.tripadvisor.com/Attraction_Review-g187793-d190130-Reviews-Sistine_Chapel-Vatican_City_Lazio.html,"Vatican City, Italy",attractions,5.0,4.5
A Piece of History,"We have seen St. Peter's Square numerous times on TV so it is exciting to see it in person. It is huge and the number of chairs set up is unbelievable.

You feel like you are immersed in history to stand in this historic site.",September 2018,St. Peter's Square,https://www.tripadvisor.com/Attraction_Review-g187793-d191109-Reviews-St_Peter_s_Square-Vatican_City_Lazio.html,"Vatican City, Italy",attractions,5.0,4.5
Awe Inspiring!,"As you stand in front of La Pieta, it is hard to believe you are actually seeing such a beautiful sculpture by Michelangelo. It has always just been something we read about. The sculpture of Mary and Jesus is so poignant.

Be sure you don't miss it when you visit St. Peter's Basillica!",September 2018,La Pieta,https://www.tripadvisor.com/Attraction_Review-g187793-d195265-Reviews-La_Pieta-Vatican_City_Lazio.html,"Vatican City, Italy",attractions,5.0,5.0
Stunning Church,"We visited St. Peter's Basilica as part of a Vatican tour. Be sure to use a guide so you can gain a full understanding of what you are seeing and to skip the long lines!

The interior of the Basilica is just stunning. It is filled with paintings, sculptures, sarcophagi, gold, and history!

Don't miss La Pieta. You don't have to be Catholic to appreciate the works of art.",September 2018,St. Peter's Basilica,https://www.tripadvisor.com/Attraction_Review-g187793-d631111-Reviews-St_Peter_s_Basilica-Vatican_City_Lazio.html,"Vatican City, Italy",attractions,5.0,5.0
Beautiful Church,"The Cattedrale di San Lorenzo has a beautiful exterior with a large rose window and arches.The interior carries on the arch theme. The altar has beautiful stained glass windows.
The Church is conveniently located on the square and worth a visit.",August 2018,Cattedrale di San Lorenzo - Duomo di Genova,https://www.tripadvisor.com/Attraction_Review-g187823-d243377-Reviews-Cattedrale_di_San_Lorenzo_Duomo_di_Genova-Genoa_Italian_Riviera_Liguria.html,"Genoa, Italy",attractions,5.0,4.5
Wonderful Art Work!,"We really enjoyed our tour of the Palazzo Rosso. How wonderful to see such great works of art and in an old mansion. As You climb all the stairs (because of the high ceilings), you realize you have really stepped back in time.",August 2018,Musei di Strada Nuova - Palazzo Rosso,https://www.tripadvisor.com/Attraction_Review-g187823-d7230671-Reviews-Musei_di_Strada_Nuova_Palazzo_Rosso-Genoa_Italian_Riviera_Liguria.html,"Genoa, Italy",attractions,5.0,4.5
WOW! JUST WOW!,"I can only describe our experience at the Basilica of the Sagrada Familia as amazing. You will be saying Wow too!

The Basilica is unlike any other church you will ever see. Everywhere you look is something different. Up close you see all the carvings. It is very helpful to have a guide to explain the stories of the numerous sculptures.

Do not miss the inside. It is one of kind also. We booked our tour before arriving and I was very glad we did. We were on a cruise and other people arriving when we did were unable to get tickets for the day of arrival or the next day.

The Sagrada Familia is the one thing to be sure not to miss on your trip to Barcelona.",August 2018,Basilica of the Sagrada Familia,https://www.tripadvisor.com/Attraction_Review-g187497-d190166-Reviews-Basilica_of_the_Sagrada_Familia-Barcelona_Catalonia.html,"Barcelona, Spain",attractions,5.0,4.5
Not Much of a View if it is Foggy,"Our tour was early in the morning and it was very foggy. So we missed seeing the view. Later in the morning it started to clear off so that would probably be a better time. At least we didn't have a wait to get on the cable car.

The ride is very short which is a good thing because we were packed in like sardines!",August 2018,Gibraltar Cable Car,https://www.tripadvisor.com/Attraction_Review-g187510-d4308557-Reviews-Gibraltar_Cable_Car-Gibraltar.html,Gibraltar,attractions,4.0,4.0
Great Historical Site!,"The Great Siege Tunnels are very interesting and have great historical value. It is very beneficial to have a guide.

Be aware that if you have mobility issues, it is a very steep and sometimes slippery descent and a very steep climb back up. If you are physically able to do it, it is worth the trip!",August 2018,The Great Siege Tunnels,https://www.tripadvisor.com/Attraction_Review-g187510-d546154-Reviews-The_Great_Siege_Tunnels-Gibraltar.html,Gibraltar,attractions,5.0,4.5
Interesting Historical Site!,"We started our tour of the Rock of Gibraltar by taking the Cable Car. Unfortunately it was very foggy so our view was non-existent. We saw the famous monkeys but we were not as thrilled with them as some people after we saw one jump on a ladies back. We gave them lots of room after that.

We toured the Great Siege tunnels. They are amazing and it is difficult to imagine how they were able to excavate more than 30 miles of tunnels. Not to mention what it must have been like to have to live in them.

Be aware this tour involves a lot of strenous walking. We walked around the area of the snack bar/gift shop and it had a lot of stairs. Then our bus left us off at the bottom of a steep hill we had to climb. Then in the tunnels it is a steep walk down and a very steep walk back up. We are older and we were able to do it but it was not easy. There was a lady with a cane on our tour and she made it too.

Definitely worth a visit!",August 2018,The Rock of Gibraltar,https://www.tripadvisor.com/Attraction_Review-g187510-d232389-Reviews-The_Rock_of_Gibraltar-Gibraltar.html,Gibraltar,attractions,5.0,4.5
More Beautiful Than We Expected!,"Of course, we had seen pictures of the Torre di Pisa but they don't really show how beautiful it is. All the individual columns and decorative elements in marble are really spectacular. It is so interesting to see how far it has sunk into the ground. Our guide told us about repairs that have been done in order to preserve it.

If you plan to climb the tower, be sure to allow plenty of time, The line was very long.

We also enjoyed shopping in the little shops surrounding the tower. We bought leather goods, a decorative mask, and a shawl at what we felt were very good prices.

Some people say the tower is not worth the time to visit, but we were very glad we did.",August 2018,Leaning Tower of Pisa,https://www.tripadvisor.com/Attraction_Review-g187899-d195452-Reviews-Leaning_Tower_of_Pisa-Pisa_Province_of_Pisa_Tuscany.html,"Pisa, Italy",attractions,5.0,4.5
Great Italian Pizza!,"While we were at the Monument to Vittorio Emanuele II in the Piazza Venezia, we wanted to eat a late lunch. We saw their display of pizzas beside the front door.

A very friendly waiter explained some of the choices. He got a table for us outside so we could enjoy the beautiful day and the view of the Monument.

We ordered a pizza with prosciutto, mushrooms, basil, boiled eggs,and black olives. It was very good and about 10 Euros.

A very enjoyable meal!",September 2018,Antico caffe castellino,https://www.tripadvisor.com/Restaurant_Review-g187791-d2336190-Reviews-Antico_caffe_castellino-Rome_Lazio.html,"Rome, Italy",restaurants,4.0,4.0
We Think it is Beautiful!,"Yes, Yes we know that the Romans consider the Monument to Vittorio Emanuele II a terrible eye sore but we thought it was very impressive and beautiful!

We were near the monument several times as we walked and drove around Rome. We had to stop and look every time. There is so much detail. It also includes the Tomb of the Unknown Soldier. You realize how big it is when you can hardly see the honor guard they are so tiny.

We did not go inside. We will do that next time!",September 2018,Monumento a Vittorio Emanuele II,https://www.tripadvisor.com/Attraction_Review-g187791-d190985-Reviews-Monumento_a_Vittorio_Emanuele_II-Rome_Lazio.html,"Rome, Italy",attractions,5.0,4.5
Toss Your Coin in the Fountain!,"Trevi Fountain is as beautiful as we imagined from seeing it featured in the movie Three Coins in a Fountain.

Be prepared for hoards of people. But be sure to take time to study the various sculptures throughout. They are truly impressive.

Don't forget to Toss Your Coin!",September 2018,Trevi Fountain,https://www.tripadvisor.com/Attraction_Review-g187791-d190131-Reviews-Trevi_Fountain-Rome_Lazio.html,"Rome, Italy",attractions,5.0,4.5
Miss the Crowds Here!,"We were walking around the area of our hotel and came across the Baths of Diocletian. It happened to be the 1st Sunday of the month so admission was free. It was the first place we visited in Rome where there were no crowds.
It is beautiful and relaxing walking around the facility. There are many sculptures and sarcophagi that you can see up close. I wanted to take the huge bathtub home.
We really enjoyed our time here and I don't think we even saw it all.",September 2018,National Roman Museum - The Baths of Diocletian,https://www.tripadvisor.com/Attraction_Review-g187791-d12230876-Reviews-National_Roman_Museum_The_Baths_of_Diocletian-Rome_Lazio.html,"Rome, Italy",attractions,5.0,4.5
Impressive!,"We took a Princess excursion to Avignon. We spent time inside the historic city and saw the Palais des Papes. It is a truly impressive sight.

We did not go inside but enjoyed looking at the detail on the ouside. I really felt like I was in France with the cobblestone streets and narrow alleys. We had a snack at the sidewalk café in the square in front of the Palace allowing us lots of time to study the detail.

There are lots of little shops in the area for shopping also. This was one of the most relaxing days on our vacation.",August 2018,Palais des Papes,https://www.tripadvisor.com/Attraction_Review-g187212-d197784-Reviews-Palais_des_Papes-Avignon_Vaucluse_Provence_Alpes_Cote_d_Azur.html,"Avignon, France",attractions,5.0,4.5
A Bucket List Item Completed,"We visited the Pont du Gard aqueduct on a Princess Excursion. We have been fascinated by aqueducts since studying them in school so we were excited about the opportunity to see one close up.
Our guide gave us a lot of background on aqueducts which was very helpful. It is one of the highest and best preserved aqueducts. It is awesome to stand at the base and look up and marvel at how they were able to get those huge stones so high up. Not to mention being able to construct a bridge that has survived for 2000 years. We enjoyed walking across to see every detail.
Our excursion was a long one but we felt it was well worth it.",August 2018,Pont du Gard,https://www.tripadvisor.com/Attraction_Review-g651718-d197785-Reviews-Pont_du_Gard-Vers_Pont_du_Gard_Gard_Occitanie.html,"Vers-Pont-du-Gard, France",attractions,5.0,4.0
Great Gelato!,"While walking around Rome, we stopped into Don Nino for some Gelato. The décor is so cute. The display cases are full of all kinds of goodies.
I had the lemon gelato and it was the best I had in Rome. They even put a cookie on top. The generous serving was 3.50 Euro which we felt was reasonable.
If I am in Rome again, I will be looking for Don Nino!",October 2017,Don Nino,https://www.tripadvisor.com/Restaurant_Review-g187791-d7208819-Reviews-Don_Nino-Rome_Lazio.html,"Rome, Italy",restaurants,5.0,3.5
Cute Little Restaurant,"While wandering down Las Ramblas, we decided to stop in to Tapas 125 for dinner.
It is a cute restaurant. We loved the décor.
We had La Paella with Chicken and tapas and the ribs. Both were very good but a little expensive. Our total bill with soft drinks was 34 Euro.",August 2018,Tapas 125,https://www.tripadvisor.com/Restaurant_Review-g187497-d12997670-Reviews-Tapas_125-Barcelona_Catalonia.html,"Barcelona, Spain",restaurants,4.0,2.5
Ice Cream Stop,"We were waiting for our tour in front of the Olivia Plaza Hotel, and saw a little shop - the Farggi Cafe. We bought a couple dishes and sat at a nice little sidewalk seating area. It was a very pleasant break on a beautiful day in Barcelona.",August 2018,Farggi,https://www.tripadvisor.com/Restaurant_Review-g187497-d6784475-Reviews-Farggi-Barcelona_Catalonia.html,"Barcelona, Spain",restaurants,4.0,3.5
Great Pre-Cruise Hotel,"We booked the Hotel Hesperia Presidente through Princess Cruise Lines as part of our cruise package. Although our flight arrived at 9:00 a.m., we were able to check into our room when we arrived on our Princess transfer. After flying all night, that was wonderful!

We had contacted the concierge at the hotel prior to our arrival about arranging a tour to La Sagrada Familia Church. They replied promptly and booked it for us. Although there was a little confusion at check-in since the concierge was no longer there, it was soon sorted out and confirmed. We were very glad we had done that because people who waited to book with Princess were unable to get tickets.

Our room was very nice and modern. We were on the 14th floor with amazing views. We walked around the area and did some sightseeing and felt very safe.

An excellent breakfast buffet was included with our room. It had a wide variety of choices and the best croissants ever!

We hope to return to Barcelona and stay here again.",August 2018,Hesperia Barcelona Presidente,https://www.tripadvisor.com/Hotel_Review-g187497-d228563-Reviews-Hesperia_Barcelona_Presidente-Barcelona_Catalonia.html,"Barcelona, Spain",hotels,5.0,4.0
Great Historical Site,"We walked to the Pantheon from Trevi Fountain. It was a nice self guided tour. We were surprised to find it hiding at the end of a narrow alley. There is a nice plaza in front of it with a fountain.
If you are doing this without a guide, be sure to research ahead of time so you know what you are seeing. Church was being held while we were there so we could only peek inside.",October 2017,Pantheon,https://www.tripadvisor.com/Attraction_Review-g187791-d197714-Reviews-Pantheon-Rome_Lazio.html,"Rome, Italy",attractions,4.0,4.5
Our Favorite Tour,"The Colosseum is definitely a site not to be missed in Rome. We were fortunate to tour it at night. The lights make it so beautiful and the atmosphere is serene and eerie.
Because we went at night, there was only one other tour group so it was like we were the only ones there. After all the crowds at other attractions, we thoroughly enjoyed the quiet.
It was easy to stand there and imagine what it must have been like at the time of the gladiators. Because the floor that covered the tunnels is gone, you can see how intricately built it was.
Don't miss the Colosseum.",October 2017,Colosseum,https://www.tripadvisor.com/Attraction_Review-g187791-d192285-Reviews-Colosseum-Rome_Lazio.html,"Rome, Italy",attractions,5.0,4.5
Fabulous Tour,"We took the Colosseum and Ancient Rome Tour by night. It was fabulous. We first walked around Palatine Hill and the Forums. By then night had fallen and we entered the Colosseum.

It is difficult to express the feeling as we entered. It was dark and quiet - almost eerie. There was only one other tour group so we felt like we were the only people there.

Our guide Paolo was excellent as he described the different parts of the structure.

If you want to get away from the crowds, definitely do this tour. You will never forget the experience.",October 2017,Colosseum by Night Tour with Access to Arena Floor & Roman Forum,https://www.tripadvisor.com/AttractionProductReview-g187791-d11465342-Colosseum_by_Night_Tour_with_Access_to_Arena_Floor_Roman_Forum-Rome_Lazio.html,"Rome, Italy",activities,5.0,4.5
"Great Staff, Great Rooms, Great Location","We stayed at the Best Western Premier Hotel Royal Santina during a recent stay in Rome. We booked through Princess Cruises as part of our cruise package. We were very pleased when we arrived late morning and our room was ready.
It is centrally located and near Termini Station. Walk to the nearby Diocletian Bath Museum for a very relaxed and uncrowded experience.
Our room was very modern and beautiful. I particularly liked the lights around the refrigerator and closet. You can even choose your own color. We really appreciated the free WIFI and there was even a phone in the room for free calling but we didn't use that.
We had contacted the hotel before arrival about scheduling a tour to the Vatican. They replied promptly and made reservations for us.
The front desk staff especially Iolanda was very helpful. We had asked her where to meet our tour and when they didn't arrive exactly on time, she noticed and called to verify. She always greeted us and asked about our day.
An excellent breakfast with a large variety of choices was included with our room. Water was available and sometimes snacks at the bar which we really appreciated after a long day of touring. However sometimes it was not restocked in a timely fashion.
One evening we were going to have a drink at the bar but no one was around. The next evening there was a young lady who was also the waitress for the restaurant. We waited 10-15 minutes for the drinks we had ordered.
We really enjoyed our stay in Rome and at the Royal Santina and hope to return someday.",September 2018,Best Western Premier Hotel Royal Santina,https://www.tripadvisor.com/Hotel_Review-g187791-d233408-Reviews-Best_Western_Premier_Hotel_Royal_Santina-Rome_Lazio.html,"Rome, Italy",hotels,5.0,4.0
Convenient Location,"We have stayed at the Quality Inn & Suites in Rapid City twice recently. We have been very happy with our stays. It was hot and I really appreciated the ice water in the lobby. Another pleasant surprise was complimentary water and granola bars in the room.
The 1st stay was during the summer and they were unable to give me a room with an elevator. The last time we were given a free upgrade to a suite with elevator access. If steps are a problem for you, be sure to arrange ahead of time for a room with an elevator.
We saw no maintenace issues. The pool area was nice. The breakfast had a very nice variety of choices.
The hotel is close to both Rushmore Crossing and the Rushmore Mall. An abundant choice of restaurants are also nearby.
We will definitely return.",September 2018,Quality Inn & Suites,https://www.tripadvisor.com/Hotel_Review-g54774-d97714-Reviews-Quality_Inn_Suites-Rapid_City_South_Dakota.html,"Rapid City, South Dakota",hotels,4.0,4.5
Good Lunch,"Our family ate at the Overtime Steakhouse and Sports Bar for lunch. It is rather dark and dingy like a bar but the kids with us did not seem out of place. and in fact they have a children's menu.
There were 8 of us and our waitress handled our orders and food with efficiency. We ate mostly French Dip and Prime Rib Sandwiches. Our food came out quickly and piping hot. My Prime Rib Sandwich was very thinly sliced but there was lots of very flavorful meat. The prices seemed fair. The Prime Rib Sandwich was $10.99 and the French Dip about $8.99.
We enjoyed out meal and will return to try some of the other interesting menu items.",August 2018,OverTime Steakhouse & Sports Bar,https://www.tripadvisor.com/Restaurant_Review-g54718-d7176544-Reviews-OverTime_Steakhouse_Sports_Bar-Mitchell_South_Dakota.html,"Mitchell, South Dakota",restaurants,4.0,4.0
Cute Woodsy Decor,"We enjoyed our first trip to Mackenzie River. The décor is cute imitating the woods. I especially enjoyed the trees and the river scene.
Our waitress, Michaela was excellent. When I asked for recommendations, she was very helpful. I was concerned about how spicy the spicy chicken sandwich was. She offered to have it prepared without the Cajun seasoning. The pineapple salsa was yummy and the bacon completed it. The French Fries were a little too salty for my taste.
I don't normally review the restroom but it really bothered me that I could see fingerprints all over the walls of the stall. I don't know whether it is the type of finish or it is not being cleaned regularly. It is an issue that I believe should be addressed.
We enjoyed our meal and will return to try some of the other delicious looking options.",July 2018,"MacKenzie River Pizza, Grill & Pub",https://www.tripadvisor.com/Restaurant_Review-g54774-d12178007-Reviews-MacKenzie_River_Pizza_Grill_Pub-Rapid_City_South_Dakota.html,"Rapid City, South Dakota",restaurants,4.0,4.0
Delicious Chicken & Waffles,"We tried Slim Chickens for the first time. The atmosphere is typical fast food restaurant. I was surprised the only choices in chicken were the chicken tenders and wings. I chose the waffles and chicken, a new combination to me.

My chicken was crispy and moist. I really enjoyed the unusual blend of flavors. We will return.",July 2018,Slim Chickens,https://www.tripadvisor.com/Restaurant_Review-g54805-d14793497-Reviews-Slim_Chickens-Sioux_Falls_South_Dakota.html,"Sioux Falls, South Dakota",restaurants,4.0,4.5
Try the Ultimate Chicken Alfredo,"I ate at Fazoli's for the first time. It is a fast food version of Italian so very reasonably priced.

tried the Ultimate Chicken Alfredo. It was delicious. I loved the addition of broccoli, bacon and mushrooms to a traditional dish. The meal also came with breadsticks. The breadsticks were a little heavy on garlic but otherwise very good.

You order at the counter and they bring the food to your table. They also bus the tables. A young man took my dirty dishes before I even left which I appreciated.

Come hungry because it is a lot of food. I think it could be split. I will be back.",July 2018,Fazoli's,https://www.tripadvisor.com/Restaurant_Review-g54805-d12729906-Reviews-Fazoli_s-Sioux_Falls_South_Dakota.html,"Sioux Falls, South Dakota",restaurants,4.0,3.5
