title,text,date,place,placeURL,placeLocation,placeType,reviewScore,avgScore
A Tired Old Lady,"The Internet WiFi in our unit was dreadful - and a limit of 200MB per day is miserly. In the modern age, many of us run businesses that are Internet-dependent, so poor WiFi and ridiculously small caps are a deal-breaker. I also felt the resort is looking tired - corridor carpeting, paint, etc. And two great big rusty air conditioner units on our balcony - a real eyesore! That's why, I'm afraid, I would find it difficult to recommend The Peninsula to others.

On the upside, to be fair, the view is spectacular, the unit was spotless and well equipped. Our bedroom, however, had a window which opened out onto the corridor. Despite a louvre blind that had to closed at night, which made for quite an airless sleep.

I'd go there again if I had to, but I know that I have found much better in the same area of Sea Point for the same price.",December 2015,The Peninsula All-Suite Hotel,https://www.tripadvisor.com/Hotel_Review-g312659-d304619-Reviews-The_Peninsula_All_Suite_Hotel-Cape_Town_Central_Western_Cape.html,"Cape Town Central, South Africa",hotels,2.0,4.5
A Coimbra Highlight!,"On a wet Sunday night in early May, Coimbra is not the best place in the world to be. But imagine our surprise to find this small restaurant not only open, but also delivering a brilliant fado show, a very warm welcome from the staff and great food. Determined to try the local fare, my wife opted for Chanfana (goat) and I had Naco de Porco (roasted cheek of pork) - preceded by some local chourizo - all absolutely excellent. Washed down by a good bottle of red wine - Sao Domingo, from the Bairrada region, €9.50 - our whole bill came to just €43.95. I don't know that I'd go back to Coimbra, but if I ever do, this will be the first place I'll visit.",May 2015,A Cozinha da Maria,https://www.tripadvisor.com/Restaurant_Review-g189143-d3222311-Reviews-A_Cozinha_da_Maria-Coimbra_Coimbra_District_Central_Portugal.html,"Coimbra, Portugal",restaurants,5.0,4.5
Breathtaking Library,"This was very definitely the highlight of a short stop-over in Coimbra. Built by King Joao (hence 'Joanina') to display his wealth, it is an exquisite example of art, architecture and craftsmanship fused into one. Believe it or not, the library even has a resident flock of bats, which are kept there to eat the insects that prey on the ancient tomes. Quite remarkable.",May 2015,Biblioteca Joanina,https://www.tripadvisor.com/Attraction_Review-g189143-d6761156-Reviews-Biblioteca_Joanina-Coimbra_Coimbra_District_Central_Portugal.html,"Coimbra, Portugal",attractions,5.0,4.5
Great Value,"This hotel is small, but very clean and the staff are extremely helpful and friendly. It's five minutes away from one of Lisbon's principle parks, and we are able to walk right down into the centre of the city and the Baixa area. Coming back the other way (uphill), there's a Metro stop close by. It's also right beside the Gulbenkian Museum. Breakfast is standard for a European hotel, as are room sizes, including the bathroom. The key question: would we return? The answer is definitely yes.",May 2015,Hotel Principe Lisboa,https://www.tripadvisor.com/Hotel_Review-g189158-d206381-Reviews-Hotel_Principe_Lisboa-Lisbon_Lisbon_District_Central_Portugal.html,"Lisbon, Portugal",hotels,4.0,4.5
Unimpressive,"Despite the fact that we were allowed to check in early, and despite the fact that the receptionist was helpful and knowledgeable, I'd give the Oslo a skip if I ever returned to Coimbra. Our room stank of cigarette smoke, despite the fact that we had asked for a non-smoker, and it was extremely noisy, overlooking the main street. Breakfast was adequate, but the young waitress clearing tables appeared to have a major attitude problem. No, not one to go back to.",May 2015,Hotel Oslo Coimbra,https://www.tripadvisor.com/Hotel_Review-g189143-d254150-Reviews-Hotel_Oslo_Coimbra-Coimbra_Coimbra_District_Central_Portugal.html,"Coimbra, Portugal",hotels,2.0,4.0
"Great location, good choice.","The Hotel Aveiro Palace could not be more central, located at the junction of two main canals and the end of Aveiro's main street. Our room was spotless, the bathroom more than adequate and breakfast was the standard European style. It helps that it's an old building - a real palace, I assume - that has been very tastefully refurbished inside. The staff front-of-house appeared a little bored, compared with some we have encountered on this trip, but that wouldn't stop us from returning.",May 2015,Hotel Aveiro Palace,https://www.tripadvisor.com/Hotel_Review-g189140-d2258039-Reviews-Hotel_Aveiro_Palace-Aveiro_Aveiro_District_Northern_Portugal.html,"Aveiro, Portugal",hotels,5.0,4.0
Fabulous local pork!,"This small, new venture specialises in roast suckling pig, a regional delicacy. We had ours with chips and one in a delicious Portuguese roll. Absolutely first class and great value delivered by a young man (the owner?) who spoke excellent English. No hesitation - if you enjoy pork, don't miss this one.",May 2015,Tasquinha Do Leitao,https://www.tripadvisor.com/Restaurant_Review-g189140-d8015685-Reviews-Tasquinha_Do_Leitao-Aveiro_Aveiro_District_Northern_Portugal.html,"Aveiro, Portugal",restaurants,5.0,4.0
A Delight in Porto,"Within easy walking distance of all the major attractions in Porto, this hotel has been very tastefully put together. Its lines are clean with an emphasis on simplicity of both architecture and decor. And talking of clean - it was absolutely spotless. Staff on the front desk were helpful, and the basement restaurant, where breakfast is served, is airy and light. The food itself plentiful, delicious, and there was a good selection. (Maybe they should skip trying scrambled eggs, though - very watery and tasteless.) It also has excellent wi-fi and parking is available, although we didn't use it, so I can't comment on the cost. Would we go back? In a flash!",May 2015,Eurostars Das Artes Hotel,https://www.tripadvisor.com/Hotel_Review-g189180-d581093-Reviews-Eurostars_Das_Artes_Hotel-Porto_Porto_District_Northern_Portugal.html,"Porto, Portugal",hotels,5.0,4.0
Seafood and white beans - a winner!,"We arrived on a busy night, without a booking, but the Maitre d' made a plan and gave us a six-seater table to ourselves in a small upstairs section. He warned us that the Feijoada (shellfish with white beans stew) was made from scratch and would take a while, which was accurate. Almost an hour, in fact. But it was well worth the wait. He also recommended a very good, mid-range bottle of wine. When the stew arrived, although advertised as",May 2015,Postigo do Carvão,https://www.tripadvisor.com/Restaurant_Review-g189180-d1998474-Reviews-Postigo_do_Carvao-Porto_Porto_District_Northern_Portugal.html,"Porto, Portugal",restaurants,5.0,4.5
"Great location, stunning room, awful food","Quinta de la Rosa is perfectly situated, overlooking the Douro River, about two kilometres outside the picturesque village of Pinhao. Our room was a delight, with a small lounge downstairs, double bedroom upstairs (bed a touch on the small side, perhaps?) and a very spacious bathroom. The welcome from young Anna was perfect - and so far we're in five star territory.

Then came dinner.

At 25 euros per head, including wine & port, we were expecting something out of the ordinary. It was not to be. Some sad chunks of melon dotted with five tiny pieces of local ham were paired with a very so-so rosé. Then came a truly awful overcooked chicken breast, with watery green beans and mashed potatoes. The accompanying Douro red wine was OK. Finally, some kind of stodgy chocolate tart topped with what appeared to be artificial cream and a very poor port.

We had also tried the Quinta's white port apéritif before dinner, under the oddly-named Tonnix label. It would probably have been better used to wash the car windscreen. Very nasty.

So by all means stay at Quinta de la Rosa - it's a breathtaking venue. Just avoid their food and drink.",May 2015,Quinta de la Rosa,https://www.tripadvisor.com/Hotel_Review-g580264-d679216-Reviews-Quinta_de_la_Rosa-Pinhao_Vila_Real_District_Northern_Portugal.html,"Pinhao, Portugal",hotels,2.0,4.5
The World's Noisiest Hotel?,"When I booked at Queen's Hotel, I asked for their quietest room. Running a half marathon the following morning, I needed to get to sleep early and leave early. They said they would oblige. Well, Room 214 was what I was allocated - very clean, with a comfortable bed, but outside my window and across a parking lot was an air-conditioning pipe the size of a jumbo jet. It switched itself on and off every ten or fifteen minutes, right through the night. Add to the mix what sounded like packs of feral teenagers howling at each other well into the small hours and a string of passing motor-bikes...let's just say I didn't get much sleep at all. It's a pity - the hotel itself is a period piece of note, although the bathroom was quite cramped and I had to sit sideways on the loo. If I run the same race next year, I will book somewhere else.",February 2015,Queens Hotel,https://www.tripadvisor.com/Hotel_Review-g312667-d611570-Reviews-Queens_Hotel-Oudtshoorn_Western_Cape.html,"Oudtshoorn, South Africa",hotels,2.0,4.0
Very Mixed Feelings,"We’ve just spent 10 days at Le Maritim - my wife and me, my one adult son and his fiancée, my other adult son and his girlfriend. The purpose: an advance celebration of my 60th birthday.

Would I return and would I recommend the hotel?

I have to say that the more I think about it, the less convinced I am that the answer to either question would be yes.

Let’s start off with the positives: Le Maritim, part of a family-owned German group, is well-priced compared to the competition. It’s situated in a wind-free corner of the north-western part of the island. The capital, Port Louis, is about 10kms south, and the nasty tourist trap, Grand Baie, about 15kms north. On the beach, however, you’re unaware of either. It sits on the mouth of the Citron River - walk up the estuary on the Maritim side and you arrive at the ruins of Balaclava, an old sugar estate set up by one of the original owners in the 19th Century. These are used for functions, but you can also walk through and around them during the day and at night.

In fact, one of Le Maritim’s strong points is the extensive grounds, including a small golf course. You can, run walk or saunter to your heart’s delight.

The beach is also extensive, with the obligatory sun loungers, palm-thatched shades, white sand and safe swimming area.

We were on a Half Board package - breakfast and dinner included but pay for your own booze. We’ve been to Mauritius five or six times over the years and that’s the way we do it: Mauritius has punishing import taxes on liquor, so you stock up at the airport duty free, buy your mixes at the local café (what South Africans call a corner store) and carry on. There’s always a mountain of food at breakfast, so who needs lunch anyway?

Also included - snorkelling twice a day, water-ski-ing between 10.00-12.00 and 14.00-16.00, glass-bottomed boat (also used for snorkelling), kayaking and pedalo. (I think dinghies and/or hobie cats were also available free if you know how to sail one - we’re not sailors, so double check, if that’s your thing.) The golf course is free - if you have your own clubs and balls. Archery - with some very decrepit gear - also free.

So far, so good.

We arrived quite late, were warmly greeted on check-in, and then informed that the restaurant would be closing in 15 minutes and that men are not allowed in wearing shorts. No exceptions - not even for late arrivals. Which meant both of my sons had to race to their rooms, shower, change into long pants and then arrive for the last five minutes of the buffet, once again dripping with sweat.

Surely a more appropriate response would have been to waive the rule - “just this evening, sir, because you’ve just arrived - but tomorrow evening, please adhere to our dress code.” (You may or may not agree with the long-pants-for-men-in-the-evening-rule, but it’s pretty standard in Mauritius and we were well aware of it…but on arrival, with 15 minutes to go before closing?)

We had asked for three rooms side by side, which we got, and in the quietest part of the hotel, which we did not. No sooner had we shovelled some food into us and retreated to our rooms than the thump-thump-thump of the sega dancing demonstration from the hotel’s poolside dance floor came crashing in. Close the doors, crank up the air conditioner and the noise was somewhat blocked out. However, a couple of nights later, one of my sons was kept awake into the wee small hours by a door beneath their room opening and closing. Yes, they were above the kitchens, and someone was preparing something. The next morning, they asked to be moved and were refused - “Sorry, the hotel is running at 96% occupancy - nothing else is available.”

Again, in fairness, most evenings we needed doors closed and air con running - it’s very hot and humid at this time of year - but even so, the various noises kept my wife awake for several nights and my son on another. Not good enough.

The rooms themselves are fine - small balcony, big enough for four chairs, and with a great sea view. Beds very comfortable and everything very clean. The bathrooms are adequate - maybe on the small side for a South African, but quite large when compared with some hotel bathrooms I’ve encountered in Europe. Lots of dry towels whenever you need, too. The girls complained that there was no conditioner with the shampoo - I don’t have so much hair these days, so can’t really comment.

One serious problem - at random moments during a shower, the water would suddenly become scaldingly hot. And I mean scalding - dangerously hot. We complained, but nothing happened.

The main restaurant is large, (as is the hotel, by the way: 450 guests when we were there) and at the breakfast buffet, there is as much as you can eat of almost everything. One exception is smoked marlin, a Mauritian delicacy. It appeared twice during our stay, as opposed to daily in previous trips to other hotels. One son, who has worked at the Two Oceans Aquarium in Cape Town, says that marlin is now scarce because it’s been fished out over the years for people like me who want to eat it for breakfast. If that’s true, mea culpa. When there was no smoked marlin, the hotel provided smoked salmon. No real complaint on that score.

The evening meal was a different scenario, however. Again it’s a giant buffet - but why was every meat dish, including chicken, overcooked? Pork, lamb, beef (including a desperate Beef Wellington), all cooked to a dull, dry greyness, every night. Awful. The Mauritian/Indian/Creole food was often a much better bet. I’d find it very hard to recommend this, I’m afraid.

Maybe the chefs prepare the food this way for their target market: we saw a large number of middle-aged and elderly German, French and British visitors - could this be the way they like their food back home? (My late father, from the north-east of England, could take a beautiful piece of fillet steak and reduce it to something small and black, like a charred matchbox. He claimed to like it that way…)

One very big positive, albeit an expensive one: Le Maritim’s spa - my wife treated herself and the other girls to a session in the spa and said it was truly wonderful. Not much more expensive than the same sort of thing in South Africa, she added.

So what was the key problem?

Le Maritim’s style is that what I’ve described above forms “the basics”. But if you want anything else, you reach into your pocket and pay more.

The best piece of beach is roped off - you can go there, but you have to book your slot, and pay. There are several other restaurants at the hotel - all more expensive than the main restaurant. Want to hire a bike? You can, a very clapped out old mountain bike for a 4km ride to the café - pick up some mixers - cycle back - 30 minutes - “Sorry, sir, that’s 300 rupees…” Have a scuba demo - yes, five metres up the main pool and back - “If you want any more, it’s 2,400 rupees.” Taxi to Port Louis? “Certainly, sir - 1 600 rupees for four people” Additional bottle of water? “By all means, sir - 100 rupees, please.”

I was left with the distinct impression that Le Maritim is a well-oiled machine designed to extract as much extra cash from its visitors as possible, once the poor victims are trapped there. Trapped is also a word I use deliberately - we had been told that the nearest bus stop was 1km from the hotel, but in fact it was 4kms on a fairly unpleasant, narrow road.

Again, in fairness, we opted for one of the fancy restaurants - the beachside La Marée - to celebrate my birthday and the experience was largely outstanding. Two of us had a smoked marlin salad to start and needed a microscope to find the marlin. We also had to send back seared tuna - the hopelessly overcooked problem again - but the staff re-appeared in moments with the fish properly cooked. And a delightful little birthday cake was presented to me at the end of the evening. This was an evening at a restaurant I would certainly recommend. Not cheap, but not a great deal more than a similar restaurant in Johannesburg or Cape Town.

One final issue - a message informing us that our return flight the following day to Johannesburg had been delayed by four hours reached the hotel just after 15.30. At 18.45, when I left my room to go to supper, the message had not been delivered, so I only saw it after supper, when I returned to the room at around 22.00. Which was far too late to start attempting to make alternative arrangements. Net result - missed ongoing connections in Johannesburg for four of our party, re-booking fees and a night in a Johannesburg hotel for me and my wife. Significant flight delays are - in my view - urgent messages and should be treated as such.

Would I recommend Le Maritim to you? Yes, provided you understand the way the hotel works and are prepared to deal with the constant attempts at up-selling, as well as the overcooked food.

Would I go back? No, I think I’d try somewhere else.",November 2014,Maritim Resort & Spa Mauritius,https://www.tripadvisor.com/Hotel_Review-g488101-d305559-Reviews-Maritim_Resort_Spa_Mauritius-Balaclava.html,Mauritius,hotels,3.0,4.5
The Noise!,"I'm writing this at 1.40 a.m. with noise from the Montecasino resort, of which this hotel is a part, pounding through the floor and walls. That's in addition to the road noise from just outside my room. It's a pity because the room itself is quite pleasant - basic, but clean and comfortable. Sorry - but an absolute basic for any hotel room anywhere in the world is that a guest should be able to sleep undisturbed.",August 2014,Southern Sun Montecasino,https://www.tripadvisor.com/Hotel_Review-g1819668-d1769981-Reviews-Southern_Sun_Montecasino-Fourways_Sandton_Greater_Johannesburg_Gauteng.html,"Fourways, South Africa",hotels,1.0,4.5
An excellent hotel,"This is one of Johannesburg's better hotels, ideally sited right beside the upmarket Hyde Park shopping centre. It's comfortable, well-equipped, has an excellent gym, very friendly staff and plenty of parking.",June 2014,Southern Sun Hyde Park Sandton,https://www.tripadvisor.com/Hotel_Review-g312586-d1742330-Reviews-Southern_Sun_Hyde_Park_Sandton-Sandton_Greater_Johannesburg_Gauteng.html,"Sandton, South Africa",hotels,4.0,4.5
Avoid Yindees - rip offs here.,"A first visit, looking for a moderately priced dinner for five of us. We'd heard good things about Yindees and the menu looked reasonable. However, it quickly became apparent that this might not be the case, with a heavily over-priced wine list. We settled on a Durbanville Hills Shiraz at R185 - at least 50% higher than I would expect. This wine retails at around R45, so draw your own conclusions. My wife and I both had variations on a mixed seafood curry - good flavours but we needed forensic investigators to find the seafood. If I'd wanted vegetarian, that's what I would have ordered. However, the final straw came with the bill, reflecting a 10% service charge - labelled tips - already added in in very tiny letters, a total, and then, beneath that space for GRATUITIES another TOTAL. Each of the two last had hand-written letter 'R's beside them, to draw my attention. In other words, the staff were hoping that I would not notice the first 10% and then add 10% more.

I told the waiter that I did not like it when a restaurant tried to cheat me - whereupon I was fed all sorts of nonsense about this being ""something only the manager could do"" and ""they had never seen it before"". We paid and left - the waiters turned their backs and didn't even offer to hold the door open for us.

Needless to say, we will not be back under any circumstances.",April 2014,Yindee's,https://www.tripadvisor.com/Restaurant_Review-g1722390-d1961979-Reviews-Yindee_s-Cape_Town_Western_Cape.html,"Cape Town, South Africa",restaurants,1.0,4.0
Excellent value and a new menu,"Five members of our family visited this branch of the very popular pizza chain for a light, early supper. Three big gourmet salads and two half-and-half pizzas later, accompanied by two bottles of shiraz and one bottle of chardonnay, a couple of bottles of mineral water, a tip - and all for exactly R1,000. Very good value in my book. The salads were substantial, plenty of fresh leaves and other ingredients. I had a half-and-half Morituri and Nacho Libre - delicious. (So much for the 'light' bit in my super!) The half and half concept is, as far as I understand it, new to Col'Cacchio - as are a number of other variations, including labelling of what type of food/meal might be appropriate to which kind of diet. Two of our number are following the currently faddish Banting Diet - even that's there - and there was a very delicious gluten-free pasta for my wife, who is gluten intolerant.

One slight gripe - this is one of those buildings where sound seems to echo off the walls and ceilings - as it filled up, it became harder and harder to follow the conversation around our own table.",April 2014,Col'Cacchio Foreshore,https://www.tripadvisor.com/Restaurant_Review-g312659-d812816-Reviews-Col_Cacchio_Foreshore-Cape_Town_Central_Western_Cape.html,"Cape Town Central, South Africa",restaurants,4.0,4.5
Not so bonny at Bonnievale River Lodge,"My wife and I had booked the Farm House and adjacent West Suite at Bonnievale River Lodge for a weekend catch-up with two old friends. At first, everything seemed fine - very picturesque, adjacent to a large camp-site which, in turn, gives on to the Breede River. But as the weekend wore on, one missed detail after another let the experience down. Dog poop right outside our door - not picked up; rooms not serviced; a dishwasher that didn't work properly; bathroom windows without curtains; the tiniest of wall-mounted TVs in the main room; and finally, no hot water on the second morning. There's building underway and the kitchen door was sealed up with a mixture of grubby towels, bits of old rag and paper, to prevent the dust getting in. Not very alluring. We were also amazed at the fact that by Saturday morning, the campsite was absolutely bursting at the seams - forget any idea of a gentle stroll down to the river - it was a sea of tents. And many, many, many insects - more of the irritating kind, rather than biting - but if you decide to go, take a good repellent.

On the upside, the staff (the few that we saw) were friendly and the camp-site, despite the large number of people present, was quiet.

Not one to revisit, I'm afraid.",February 2014,Bonnievale River Lodge,https://www.tripadvisor.com/Hotel_Review-g2100817-d2643845-Reviews-Bonnievale_River_Lodge-Bonnievale_Overberg_District_Western_Cape.html,"Bonnievale, South Africa",hotels,2.0,4.0
Be Chairful Of This Hotel!,"In most respects, this hotel is excellent. Beds are comfy, bathrooms are spotless, there's a good work surface with several different power points, even inputs for AV. But. But. But. The single chair provided is an instrument of medieval torture. Often, I need to work for two or three hours in my room - with this chair, more than 15 minutes became difficult. It's cheap, nasty, hard. Nor was there anything else in which to sit back and relax. Thus, my options were either stand or lie on the bed. Not great and - frankly - not what I would have expected from a hotel of this calibre. The other limiting factor is that the wing of the hotel in which I stayed overlooks the rooftop of the adjoining (and very good) shopping centre. Open the window for fresh air and you have the roar of the centre's air conditioners and the exhaust fans of its restaurants. Noisy and smelly. A major plus, however, is a very good gym with a great view over Johannesburg's northern suburbs.",November 2012,Southern Sun Hyde Park Sandton,https://www.tripadvisor.com/Hotel_Review-g312586-d1742330-Reviews-Southern_Sun_Hyde_Park_Sandton-Sandton_Greater_Johannesburg_Gauteng.html,"Sandton, South Africa",hotels,3.0,4.5
"A brilliant concept, well executed and a pleasure to stay in.","Close to the iconic Erasmus bridge, an old Customs House has been converted into a wonderful hotel. It blends old and new and is run by the most helpful and attentive staff. Highly recommended.",June 2011,Suite Hotel Pincoffs,https://www.tripadvisor.com/Hotel_Review-g188632-d1058441-Reviews-Suite_Hotel_Pincoffs-Rotterdam_South_Holland_Province.html,"Rotterdam, The Netherlands",hotels,5.0,5.0
