title,text,date,place,placeURL,placeLocation,placeType,reviewScore,avgScore
A first-rate option for visitors to Athens,"Across the space of a fortnight’s holiday, we’ve been in and out of the Athenian Callirhoe four times, each time for a night or two. It’s absolutely efficient, comfortable and with a helpful, smiling, English-speaking staff.

If you’re heading for the Acropolis, its superb Museum, or the Plaka area – all of which are tourist ‘Big Ticks’, this hotel couldn’t be better placed. It is on a main road, which does make it noisy – on a couple of occasions, we had to close the door or window and fire up the air-conditioner. It’s also directly across the road from a large Greek Orthodox Church, whose bells sound irregularly in the early mornings – but that’s part of Athens’ charm.

The rooms are on the small side and perhaps in need an upgrade, but on each occasion, spotlessly clean. Tea, coffee and a kettle are provided in each room, and there is Wi-fi, the quality of which seems to vary from room to room.

Breakfast is standard Greek hotel fare, with a mixture of eggs, bacon, mushrooms, all the way to dolmades, bougatsa and the absolutely obligatory thick Greek yoghurt and honey. I’ve had better coffee but I’ve also had much worse and there is a selection of teas and infusions for those who prefer that option.

The only small downside: this is an hotel that appears to be consistently used by large tour groups of elderly Americans. Personally, I’m not fond of Americans in large numbers, especially when the sole topic of their conversation at breakfast appears to be their varied and alarming medical conditions! In fairness, though, they were smiling, courteous and – like the coffee – I’ve had a lot worse!

Would I stay at the Athenian Callirhoe again, despite the coffee and the transatlantic cousins? Without a doubt.",October 2019,The Athenian Callirhoe Exclusive Hotel,https://www.tripadvisor.com/Hotel_Review-g189400-d286943-Reviews-The_Athenian_Callirhoe_Exclusive_Hotel-Athens_Attica.html,"Athens, Greece",hotels,4.0,4.0
"Good, but....","The Argo is a typical Naxian boutique hotel – small, comfortably appointed, close enough to the beach and with a sea view in some rooms. Helpful, courteous staff, and our room was modern, well-appointed and enjoyed a reasonably-sized balcony with a distant sea view. (Our son and daughter-in-law reported that their non-sea view room needed a refresh – but I didn’t see that for myself…)

Breakfast is standard Greek hotel fare – delicious and encouraging me to eat too much!

Two major gripes, though: first, the internet in our room was almost non-existent. Down at reception, it was quick enough, but who wants to pad around a hotel’s public spaces in pyjamas while trying to pick up email or send pictures to family via email? I also developed an acute problem with my business back home, which needed fast internet access for a very short while – again, off to reception to solve the problem. It’s my view that any modern hotel that does not offer fast, reliable internet in-room needs a health warning.

Second, come sleep time, when we turned the lights off, a small night light came on in one of the ordinary light fittings. Brilliant, perhaps, if you have small children or are scared of the dark. Awful if you want full black-out. The problem was solved by removing the key tag from its socket (which is needed to activate the lights and air-conditioning) – but that also turns off all the power sockets – not much use if you’re charging camera batteries or cell phones or tablets, etc. Net result: on with an airline ‘sleep mask’, which I find very uncomfortable.

On balance, if I was offered the chance to come back here, I’d think twice about it because of these problems.

I can’t comment on price/value for money as this was part of a package bought for us from an Athens travel agent.",October 2019,Argo Boutique Hotel,https://www.tripadvisor.com/Hotel_Review-g580192-d506473-Reviews-Argo_Boutique_Hotel-Naxos_Town_Naxos_Cyclades_South_Aegean.html,"Naxos, Greece",hotels,3.0,4.0
Terrific value & delicious food,"Set about three or four streets back from the beach, this restaurant has a very large open-air patio, ringed by a small wall, which makes it ideal for watching the passing show, but also for corralling little people. There is also an enclosed patio for those evenings when the wind blows or the night air gets chilly.

We had been warned that the portion size for main courses was big, so we skipped starters. The warnings were accurate: baby goat with lemon, baby goat kleftiko, pork in tomato sauce and stuffed tomatoes were all plenty for all but the most gargantuan appetitites. Both baby goat dishes and the stuffed tomatoes were delicious, with the kid meat slow cooked and falling off the bone. Perhaps the chef could have dialled back on the green pepper in the kleftiko? The pork was also slow cooked in a delicious spicy tomato sauce but, unfortunately, was too dry.

The house white wine was poor – supposedly dry, but with a musty, sweet aftertaste, so we switched to red – a bottle of Diamantopetra – a mix of syrah and a local grape, mandilari, from the Diamantakis Winery in Crete. At €22.00, it was excellent value and the flavour – intense syrah but very different from a typical Rhone-style wine – accompanied the food well.

The final bill, for four people, including tip and wine was €87.00 which, I thought, was very good value.

To Helleniko is not on Chora’s main harbour but don’t let that put you off – it’s well worth a visit.",October 2019,To Elliniko,https://www.tripadvisor.com/Restaurant_Review-g580192-d1579829-Reviews-To_Elliniko-Naxos_Town_Naxos_Cyclades_South_Aegean.html,"Naxos, Greece",restaurants,5.0,4.5
Skip this one,"Recommended to us by our hotel, Ammos bills itself as a ‘Seafood and more…’ restaurant. On reflection, perhaps that should be changed to ‘Seafood and less…’?

Maybe it was because it was a Sunday night, but everything was flat, stale and with a couple of exceptions, simply unappetising. What was billed as a white taramasalata was suspiciously pink and lacking in flavour. The salads which accompanied the grilled squid and stuffed aubergines were as old as my great aunt and even the bread for the table was stale.

One exception – the grilled octopus, which was very tasty indeed when hot, but became rubbery and hard to chew as it cooled down. A portion of three small red mullet also started well, but it became obvious after a couple of mouth-fulls that they had been deep-fried in the same very old oil that has been used for the chips, which were awful. The stuffed squid was filled almost entirely with diced green pepper, which overwhelmed the dish.

The house white wine was drinkable – nothing more – and the entire experience, including tip, cost €110.00, which was, in my opinion and compared to what we have had at other restaurants in Chora, quite expensive.

Give this one a miss, unless it’s the only restaurant open on the harbour front and you’re extremely hungry.",October 2019,Ammos Seafood and More,https://www.tripadvisor.com/Restaurant_Review-g580192-d11744509-Reviews-Ammos_Seafood_and_More-Naxos_Town_Naxos_Cyclades_South_Aegean.html,"Naxos, Greece",restaurants,1.0,4.0
From the site to the Museum - a must!,"Once you've done the archaeological site itself, please pay a visit to the Museum. It's clean, cool and simple - easy to follow, with exhibits that are well labelled in Greek, English and (I think) French. Truly magnificent materials - and then, right at the end - the 5-star exhibit - the Charioteer. What an extraordinary, priceless artefact - it alone was worth the trip to Delphi. Brilliant!",October 2019,Delphi Archaeological Museum,https://www.tripadvisor.com/Attraction_Review-g189408-d199057-Reviews-Delphi_Archaeological_Museum-Delphi_Phocis_Region_Central_Greece.html,"Delphi, Greece",attractions,5.0,4.5
Amazing experience,"The day before we visited Delphi, I had been bored stupid at Ancient Olympia - just another collection of rocks, lumped in a field, to this untutored eye. I was preparing for more of the same at Delphi - and I could not have been more wrong! Perhaps it's the astonishingly beautiful setting? Perhaps it's ascending the Sacred Way? Perhaps it's the fact that the dreadful crowds from the tour coaches and cruise ships have been thinned out by the gradients? But I loved every moment at Delphi. I can quite see why the Oracle chose this spot. It's everything that an ancient Greek site should be.",October 2019,Delphi,https://www.tripadvisor.com/Attraction_Review-g189408-d523823-Reviews-Delphi-Delphi_Phocis_Region_Central_Greece.html,"Delphi, Greece",attractions,5.0,5.0
A very solid choice - but awful coffee.,"Kastalia Boutique Hotel is on Delphi's main street, within easy walking distance to both the archaeological site and museum. The front of house staff were smiling, pleasant, efficient and our room was quite acceptable. If I'm less than 100% enthusiastic, the room was, in truth, slightly awkward: it looked great when we entered, it was pretty clean, but didn't quite have enough room for both my wife and my suitcases. A small balcony with a view over the valley down to the sea was a bonus, just beside the hotel's much bigger terrace, which has superb views.
Breakfast was typical of what we have come to expect in Greece - bacon, mushrooms, eggs, and a host of sweet pastries and breads - and one very big negative: the coffee was truly awful. An old-fashioned filter ""percolator"" system, which allows a glass jug of coffee to stand on a hot plate for hours, unless quickly emptied. The coffee becomes bitter immediately and a hotel of this class ought to know better.
I can't comment on the price/value for money aspect as this was part of a package bought via a travel agent in Athens.
Would I go back? Yes, but only when the owners confirm that they have upgraded their coffee machine!",October 2019,Kastalia Boutique Hotel,https://www.tripadvisor.com/Hotel_Review-g189408-d1475703-Reviews-Kastalia_Boutique_Hotel-Delphi_Phocis_Region_Central_Greece.html,"Delphi, Greece",hotels,4.0,4.5
Something of a puzzle,"The Arty Grand is supposedly a 5-star hotel. It's comfortable, the room we had for one night was spacious, with a view over the very large swimming pool. Yet the large bathroom - very large, in fact - did not have a shower. Yes, a jacuzzi tub with a hand-shower - but nowhere to attach the hand shower above knee height. My choice: either run a full, deep bath - very wasteful of water - or squat in the tub like a two-year old and hope not to wet the entire bathroom, waving the hand shower around.
Also - and this is my absolute worst - no kettle in the room for tea/coffee. Surely this is a staple of the modern hotel, five-star or otherwise?
An excellent breakfast, friendly staff, plenty of parking and good wi-fi.
I can't comment on price/value for money, as this was part of a package bought from a travel agent in Athens. I doubt that t would have been cheap - hence my gripes, especially about tea/coffee and a kettle.",October 2019,Arty Grand Hotel,https://www.tripadvisor.com/Hotel_Review-g189487-d2329454-Reviews-Arty_Grand_Hotel-Olympia_Elis_Region_West_Greece.html,"Olympia, Greece",hotels,3.0,4.0
Forget the Acropolis...,"After battling extraordinary crowds to get up the Acropolis - crowds that were, in my opinion, very badly marshalled, even dangerously so - to come down to the airy elegance of the Acropolis Museum was a joy. The design and layout, which mirrors the Acropolis itself, is such a stroke of simple genius. Photographs without flash are permitted in most sections and we were lucky enough to have the services of a good guide, herself a professional archaeologist. Absolutely terrific! (And the strawberry cheesecake in the cafeteria would be fit for the Goddess Athena herself!) If you do one thing in Athens, this must be it.",October 2019,Acropolis Museum,https://www.tripadvisor.com/Attraction_Review-g189400-d735521-Reviews-Acropolis_Museum-Athens_Attica.html,"Athens, Greece",attractions,5.0,4.5
The worst I have ever endured,"Yes, the Acropolis is a must-visit for any first-timer to Greece like me. And yes, I knew that it would be busy, even though we had scheduled our trip for mid-October, to avoid the tourist hordes of high summer. But nothing prepared me for the crowds on the way up - and this after a 45-minute wait for our guide to get tickets. Such was the throng and so poorly marshalled by a single official that I believe it's a matter of time before someone has a serious accident. Dreadful, dreadful, dreadful.",October 2019,Acropolis,https://www.tripadvisor.com/Attraction_Review-g189400-d198706-Reviews-Acropolis-Athens_Attica.html,"Athens, Greece",attractions,1.0,4.5
Charming and friendly in walled village,"The Byzantino Boutique Hotel is not really hotel - more a collection of utterly charming rooms scattered throughout Monemvasia. Our rook a two-minute walk from the hotel's reception, with a friendly porter to carry our bags across the town's cobbled stones. The room itself was enormous, although the bathroom was cramped. Wi-fi worked well and breakfast took place in another small part of the complex, overlooking the town square. Delicious, by the way! I can't recommend a trip to Monemvasia too highly and if you do go, be sure to try the Byzantino. One point: I can't comment on price/value for money as this was part of a package put together for me by an Athens travel agent. I suspect that it might not be cheap, so you may need to do your homework.",October 2019,Byzantino Boutique Hotel,https://www.tripadvisor.com/Hotel_Review-g285708-d278875-Reviews-Byzantino_Boutique_Hotel-Monemvasia_Monemvasia_Municipality_Laconia_Region_Peloponnese.html,"Monemvasia, Greece",hotels,5.0,4.5
"The best food, the best value.","Voltes is a meze restaurant with a terrific atmosphere and brilliant food. In fact, as I write this, we're half-way through a fortnight touring in Greece and its food is easily the best we have eaten thus far. Its wine list limited is limited to a house white, rosé or red - we drank the white which was delicious and light. Imagine our surprise when the bill for three people, including 1.5 litres of wine, came to just €43.00. From me and my wife, Voltes gets a 'Highly Recommended' rating.",October 2019,Voltes,https://www.tripadvisor.com/Restaurant_Review-g285708-d8275186-Reviews-Voltes-Monemvasia_Monemvasia_Municipality_Laconia_Region_Peloponnese.html,"Monemvasia, Greece",restaurants,5.0,4.5
Most disappointing!,"We visited this restaurant about 12 months ago and had a very enjoyable experience, with excellent food. What a difference a year makes!

On arrival today, we were handed menus but the waiter immediately informed is that half the things on it were off. The substitutions didn't sound too appetising: ""Canelloni."" ""Yes, with what?"" ""No, cannelloni. It's Italian and vegetarian."" ""Right....""

My wife and I both ordered Vichyssoise, which, when it arrived, was delicious. But it was garnished with a blob of cold cheese (panacotta?) and tiny onion rings, which were stale - awful. Then my wife had a second starter, mussels, well enough cooked, but in a very sweet sauce, which simply didn't work. I ordered tuna, which came grilled the way I like it, but on a bed of saffron tomato - a thick melange of very powerfully flavoured red gloop, which completely overwhelmed the delicate texture and taste of the fish. I ended up scraping the tuna off its red bed - nasty.

Someone in the Franschhoek Kitchen is trying too hard to tweak or modernise classic dishes whilst not paying enough attention to both detail and balance of flavours.

We accompanied all of this with the Holden Manz Chenin Blanc 2018 - a well-built wine which worked well, despite the food. This is a wine estate which makes excellent wine - especially their reds.

Total bill, including tip, ZAR750.00, which for Franschooek, one of South Africa's more expensive villages, was about what we expected. But not for food of this poor quality.",September 2019,Franschhoek Kitchen,https://www.tripadvisor.com/Restaurant_Review-g469391-d1977173-Reviews-Franschhoek_Kitchen-Franschhoek_Western_Cape.html,"Franschhoek, South Africa",restaurants,2.0,4.5
Consistent and excellent,"We first visited this small restaurant in 2006 and loved it then. Thirteen years later, I'm delighted to report that its standard is as good as ever, with same team running front of house and the kitchen! We started with a celebratory glass each of champagne - not cheap at €9.00 per glass, but delicious nonetheless - and opened with snails for me and free asparagus for my wife. The snails - escargots - came in a small glass, served in a delicious sauce verde - the asparagus were impeccable. Then duck breast for my wife and cassoulet for me. The duck was superb and the cassoulet the best I have eaten in many years. Be warned - it's a big portion...and my wife couldn't finish her duck, which was passed over to me. No room, therefore, for cheese or dessert. All of this accompanied by a modest Cotes du Rhone and our bill came to €112.00. Not cheap, but for a special occasion - worth every penny!",May 2019,Bistrot de L'Oulette,https://www.tripadvisor.com/Restaurant_Review-g187147-d695171-Reviews-Bistrot_de_L_Oulette-Paris_Ile_de_France.html,"Paris, France",restaurants,5.0,4.5
"Very friendly, very well priced.","Like so many cafés of its kind, Cafe Factory Republique is not much to look at from the outside. But that's more than made up for in the effusive welcome - in English, if you need - of M. le Patron. Add to that a menu that is basic - a plat du jour, salads, a half-baguette sandwich - but made from extremely fresh produce and very keenly priced. You won't be disappointed. My wife and daughter-in-law both had salads - ample portions, delicious - my son and I both had a sandwich filled with a local terrine. More than ample and just €5.00 for each sandwich. A couple of glasses of house wine for the ladies, a beer for my son and an espresso for me (the driver!) and we were well set for the afternoon. Arles itself is delightful and if we ever return, we'll start with another visit to Café Factory Republique!",May 2019,Cafe Factory Republique,https://www.tripadvisor.com/Restaurant_Review-g187211-d8519354-Reviews-Cafe_Factory_Republique-Arles_Bouches_du_Rhone_Provence_Alpes_Cote_d_Azur.html,"Arles, France",restaurants,5.0,4.5
Out of a Story-book,"We spent two nights in this hotel, which dates back to the 14th Century. Beautifully restored, our huge bedroom overlooked the gardens and River Tarn, and the circular bathroom was situated in one of the castle's turrets. Luxurious towels, soaps and so on, a massive king-sized bed, a delightful bar for pre- or post-dinner drinks - what more could we have wished for? Add in the River itself and a trail through the grounds of about 1.5kms along its wooded banks - spectacular. Very friendly staff, including a top-notch maitre d'hotel. Plenty of parking and reasonable, if not spectacular, Internet. I repeat the question: what more could we have asked for?

The answer, I'm afraid to say, is a restaurant with a rather more varied menu. The Chateau is quite far from anywhere - which is good - but that means you are confined to eating in their restaurant. The first night we enjoyed the food very much, but it's quite expensive and we would have preferred a little more variety on the second night. Buy your wine - even in the bar - by the bottle rather than by the glass, which cost us 8 euros each.

I would add that the cheese board is superb, so perhaps I'm quibbling. Recommend it? For sure. But next time, maybe one night only, not two.",May 2019,Chateau de la Caze,https://www.tripadvisor.com/Hotel_Review-g196609-d239299-Reviews-Chateau_de_la_Caze-Sainte_Enimie_Gorges_du_Tarn_Causses_Lozere_Occitanie.html,"Sainte-Enimie, France",hotels,4.0,4.5
"Top quality wine, friendly staff","Domaine de Beaurenard is one of more than 300 wine producers in the Chateauneuf du Pape region, but it's one of just five that makes wine that is both organic and bio-dynamic. As part of our tasting, we were allowed to roam the cellars and when we emerged, were given a most knowledgeable, yet friendly, lecture to accompany the wine. Absolutely recommended.",May 2019,Domaine de Beaurenard,https://www.tripadvisor.com/Attraction_Review-g187215-d8588760-Reviews-Domaine_de_Beaurenard-Chateauneuf_du_Pape_Vaucluse_Provence_Alpes_Cote_d_Azur.html,"Chateauneuf-du-Pape, France",attractions,5.0,4.5
Get some help!,"I have long extolled the virtues of French, family-run restaurants, in which Maman-et-Papa run the entire establishment, with perhaps a single young helper, comparing them to places of similar size in my native South Africa. There, dozens of staff seem to spend enormous amounts of time lounging around, chatting to each other and generally doing nothing to improve the service. However, on Monday night (20.05.19) at Cheminee Royale in Bordeaux, my theory was sorely tested.

The restaurant was almost full when we arrived, and shortly after, began turning people away. A couple – Maman-et-Papa? – was running front of house, with a single helper and it immediately became clear that they were not coping with the crowd. We waited and waited and waited to be noticed and finally were given some bread. It’s a strange, help-yourself arrangement to get wine: survey a good array of bottles marked with prices on shelves in two big cabinets, but having picked a modest Bordeaux Superieure, we battled to attract M. le Patron’s attention to draw the cork.

The restaurant has a reasonable `a la carte selection and, in the evening, offers two prix fixe menus – we opted for the €19.90 version, starting with a mixed mussels and prawns starter, one grilled tuna steak and one poached salmon, followed by a crème brulee and a panacotta.

“Sorry, no more tuna,” we were told a few minutes later.
“OK, make it two salmon, then.”
“Sorry, no more salmon,” came the reply. “We could do you some grilled trout instead?”

We had now been in Cheminee Royale for more than an hour, with nothing but the bread and wine.

When the mussels-prawns combo eventually arrived, it was clear that the mussels had been cooked in a nuclear reactor. Totally dried out and dessicated, they were inedible. The prawns were better, although the liquid in which both were swimming had a very suspicious smell. Not one to mop up with the bread.

The grilled trout turned out to be delicious, served with a very moist, well flavoured pyramid of rice. The crème brulee and panacotta were both equally good.

But by the time the bill was paid, we had been at the restaurant for more than two and a half hours. Way, way too long and definitely long enough to deter us from returning.",May 2019,Restaurant Cheminee Royale,https://www.tripadvisor.com/Restaurant_Review-g187079-d1322703-Reviews-Restaurant_Cheminee_Royale-Bordeaux_Gironde_Nouvelle_Aquitaine.html,"Bordeaux, France",restaurants,2.0,3.5
The worst hotel room I have ever stayed in.,"Room 402 at this hotel is the worst I have ever stayed in. It is certainly the only one which has caused me injury. On the fourth floor, it’s under quite flat eaves, which made manoeuvring around the spacious double bed extremely hazardous. Midway through our first night of three I got up to go to the bathroom, fully aware of the perilous route ahead of me. To no avail – I still managed to crack my head on a window join. Blood flowing down your face at three a.m. does not endear you to a hotel. Over the next three days, no matter how hard we tried not to, both my wife and I had bumped our heads repeatedly.

Once in bed though, the sheets were spotlessly clean.

Tiny bathroom, sure, but I was not impressed by the black algae along the line of the pipes. It’s tough to clean, once established, but a toothbrush and a strong grout cleaner ought to do the trick.

Free tea and coffee was provided in the room, but only using ridiculous, tiny, disposable, plastic cups. On our third night, the cups had not been renewed, so we were reduced to sharing an early morning cup of tea from the single remaining one.

Room 402 abuts the hotel’s breakfast room and I can tell you the breakfast staff starts working at around 05:30. That’s because I could clearly hear doors opening and closing amidst preparations for the repast.

Did I mention that Room 402 overlooks Bordeaux’s main pedestrian thoroughfare? It seems they party hard in this beautifully restored city. Our first night in town was a Saturday and we could hear still youngsters howling up and down as dawn broke. Sunday night was not a great deal better, although by Monday, our final night, they seemed to have run out of steam.

Returning for a moment to breakfast. The room itself was not dissimilar to our own 402 – crippled by low eaves. But the food itself was plentiful, fresh and tasty. It won’t be enough to bring us back, though. At least not if Room 402 is the only one on offer.

Note: there are three rooms on the top floor of this hotel: 401, 402, 403 – I’m guessing that all would have the same problem with the roof. But rooms on lower floors might be perfectly acceptable. Check before you book, if you decide to risk it.",May 2019,Coeur de City Hotel Bordeaux Clemenceau by HappyCulture,https://www.tripadvisor.com/Hotel_Review-g187079-d293524-Reviews-Coeur_de_City_Hotel_Bordeaux_Clemenceau_by_HappyCulture-Bordeaux_Gironde_Nouvelle_Aquit.html,"Bordeaux, France",hotels,1.0,3.5
