title,text,date,place,placeURL,placeLocation,placeType,reviewScore,avgScore
Oppiestoep at Klein Parys,"Oppiestoep is the restaurant at Klein Parys, and my wife and I dropped by for a late breakfast. Well, late it certainly was, because it took them 40 minutes to prepare Eggs Benedict for her and a Banting breakfast (fried eggs, bacon, mushrooms, beef sausage and cheese) for me. My wife had asked for her eggs to be cooked 'medium' but one was still runny and my mushrooms and sausage were smothered in a most unappetising brown baste or sauce. My bacon was also overcooked. Our accompanying cappuccinos were way too milky and the foam rather thin and nasty. Suffice it to say we cannot recommend this restaurant and we will not be back.",April 2018,Klein Parys Vineyards,https://www.tripadvisor.com/Attraction_Review-g312668-d6733829-Reviews-Klein_Parys_Vineyards-Paarl_Western_Cape.html,"Paarl, South Africa",attractions,1.0,2.5
A Gem in Pretoria,"This is the third time I have stayed at the Menlyn Boutique Hotel. It's always clean, the staff are attentive and it's very handily placed for my Pretoria client. The rooms are large, well-appointed and comfortable and have delightfully fast Wi-Fi. My only complaint is that the black-out is not up to scratch, so ask reception for a face-mask. Oh...did I mention tasty complementary snacks on arrival, a couple more actually in the room and a Nespresso coffee machine? I'll be back, as someone once said.",February 2018,Menlyn Boutique Hotel,https://www.tripadvisor.com/Hotel_Review-g312583-d2420423-Reviews-Menlyn_Boutique_Hotel-Pretoria_Gauteng.html,"Pretoria, South Africa",hotels,5.0,4.5
Forget God's Window - visit Kings Walden instead.,"Well, that was the opinion of both my wife and myself, and we've been to both now. The view from the terrace is just spectacular and to be able to enjoy it with a glass of something chilled in hand is even better. Our room was a delight: plenty of space, a comfortable bed, spotlessly clean and with an enormous, separate bathroom. Then came dinner - not quite at Michelin levels, but certainly with aspirations in that direction and reasonably priced. It's an add-on extra, and I suppose you could trek the 15kms or so back into town if you wanted a burger or KFC, but if that's your fancy, then maybe Kings Walden might not be the right venue for you. Breakfast certainly is included and it was equally tasty and large.

There is complimentary wi-fi but it was not very good - I carry my own and used that instead. Not a deal-breaker, though.

One small caveat - the property is not fenced, and although it has a night watchman, we were rather alarmed when le patron Billy banged on our door quite late after supper to say that ""someone had been spotted wandering around the parked vehicles"" and could we come and remove anything of value from our car? Given that we were heading up to Kruger National Park for two weeks in the bush, that meant unshipping quite a lot of kit. Not ideal, I'm afraid, but at least the intruder was spotted before any damage could be done.

Would we return? In a flash, provided management could assure us that parking is now more secure.",November 2017,Kings Walden Garden Manor,https://www.tripadvisor.com/Hotel_Review-g469386-d1778651-Reviews-Kings_Walden_Garden_Manor-Tzaneen_Limpopo_Province.html,"Tzaneen, South Africa",hotels,4.0,4.5
Heaven in the Hemel-en-Aarde,"For non-Afrikaans speakers, Hemel-en-Aarde means ""Heaven on Earth"" and High Season Farm is simply a heavenly place to stay. The views are spectacular, the cottage, Pine Tree, very well equipped, spacious and superbly clean, and the farm itself a delight, with a couple of brilliant walks, good birds and even - yes, folks, this is a farm - real-life Nguni cattle. I have to say that it was very cold - we were there in mid-winter, so what did we expect? - but each bedroom has a wall-mounted heater, excellent covers and we were very toasty. I can imagine that this location in summer is simply spectacular.",July 2017,High Season Farm,https://www.tripadvisor.com/Hotel_Review-g312663-d3248002-Reviews-High_Season_Farm-Hermanus_Overstrand_Overberg_District_Western_Cape.html,"Hermanus, South Africa",hotels,5.0,4.5
"Best Guided Walk in Berlin - and many other places, too.","Over the past couple of weeks, my wife and I have done a number of guided walks in several European capitals, some as part of a group and some with a personal guide (Budapest, Vienna, Prague). Holger Raschke, founder of Berlins Taiga, was easily the best of the bunch.

Why?

First, we picked him to talk to us about life in the former German Democratic Republic (East Germany) and to guide us and walk us through East Berlin - the Red Metropolis, as he aptly calls it. It's a 4-hour tour, which may sound a lot, but there's a pit stop around half-way, and a couple of bus and train rides, which provide a brief rest.

Holger's knowledge is not only encyclopaedic, but personal: he grew up in Potsdam, in the former East Berlin and can talk from memory about things like receiving gift parcels from relatives in the West. Where was he on the night the Wall came down? What were his parents doing? It's a very different perspective from the run-of-the-mill young tour guides used by the big companies who are quite often Brits or Americans or Aussies and who simply quote from history books, with lots of ""Hello, darling,
nudge-nudge, wink-wink"" asides thrown in.

Second, Holger is personable and engaging - he made sure that my wife, 70, was comfortable at all times. She has an interest in architecture and Holger took us along Karl Marx Allee, formerly Stalin Allee, which is a living text book of the development of residential building styles in East Berlin. Immensely interesting.

Third, by his own admission, he grew up with many East German youngsters who looked upon their young Russian chums as natural friends. He maintains those friends to this day and is more than able to offer a perspective that is not one normally seen through western eyes. Don't misunderstand me - this is not a propaganda trip: far from it, it's nuanced, thoughtful and highly informative and really did enable us to gain a different perspective of life behind the Berlin Wall and in East Germany.

Exactly what we were looking for.

Along the way we also visited several places that ordinary tours don't bother with but which are spectacular, culminating in the Russian War Memorial at Treptower Park. Truly remarkable and I was humbled to have visited.

Thanks, Holger - a most excellent morning in Berlin.",May 2017,Berlins Taiga,https://www.tripadvisor.com/Attraction_Review-g187330-d12258362-Reviews-Berlins_Taiga-Potsdam_Brandenburg.html,"Potsdam, Germany",attractions,5.0,5.0
High point of our Budapest visit,"Three days in Budapest: what to see, what to do? I left the hours of daylight to my wife, but thought, ""Let me treat myself to a guided photo tour..."" I don't shoot of lot of cityscapes or buildings, and certainly not at night (I live in South Africa and my main subjects are birds and larger fauna) so let me see what I can learn.

Miklos delivered big time - he knows his city and his subject, and even though he's a Canon shooter, he was more than able to offer me advice on settings for my Fujis.

But what made this tour special was that a) he offered a local Food Tour first and b) he allowed my wife to come along for the photography tour - at no extra charge. He was solicitous at all times, making her feel extremely comfortable, answering all her questions - a perfect host. Even if you are the 'passenger', non-paying, you'll get a very different view of Budapest from the 'ordinary' daytime tours.

I also learnt a great deal about early evening and night photography, for which, Miklos, many thanks.",May 2017,Photo Tours in Hungary by Miklós Mayer,https://www.tripadvisor.com/Attraction_Review-g274887-d8820680-Reviews-Photo_Tours_in_Hungary_by_Miklos_Mayer-Budapest_Central_Hungary.html,"Budapest, Hungary",attractions,5.0,5.0
"Almost there, but needs some work.","Situated just inside the walls of Marrakech's old Medina, this riad has some very pleasant touches and one or two others that could do with some attention.

First, on the upside, it was generally very clean, classically airy, has a delightful roof-top terrace, some helpful, if a little self-effacing, staff and is very well placed for access to Marrakech's famous Djmaa al Fnaa square, and all its evening food stalls, if that's your thing.

Breakfast seems to be the standard Moroccan fare: fresh orange juice, yoghurt, and various breads and pastries, accompanied by jam, honey and coffee. I must add that after 10 days of this in various venues across the country, I began to long for my wife's home-made muesli- if I return, I'll bring my own supply.

Our room was decorated in faux-Arabian nights style - amusing for a few minutes at first, but irritating for the rest, with a bed sunken into a concrete plinth - ideal for a strained ankle or worse in the middle of the night. The door into the small but adequate bathroom was also Moorish in style with two sharp wood carvings sticking out at head night. Sway slightly left or right as you pass through and you risk a severely bruised cheek-bone or worse. No armchair of any sort, just a few cushions on the floor, and - most irritating of all - nothing on which to place two quite large hard-shelled suitcases. Except the concrete plinth at the end of the bed, but then, if you don' close the suitcases and move them elsewhere, something else to fall over as you try to navigate to the bathroom in the middle of the night.

One final gripe. The riad's two main courtyards both had rain covers in place when we stayed there. I'd not seen this variety before, but it's a big, see-through cover and rain water gathers in the centre. Give it enough and the cover will obviously break. So it needs a drain and a hole in the cover's centre drops what is, in effect, a flexible, mobile gutter downpipe, to take water away. But it's a fall of three stories, so this is a long, transparent pipe that dominates the courtyard. And in both courtyards, the downpipe, made of the same transparent plastic as the main cover, is dirty. Very dirty. The net effect reminded me of nothing so much as the cord that runs down the back of a crustacean, and which we remove before cooking and eating. What George, Matt and Gary on ""Masterchef Australia"" call ""the poo-chute"". I fully understand the need for this device, but just as you clean the scum-line in a swimming pool, it needs to be kept as clean as possible. Otherwise...well, it's too prawn-like for comfort!

Would I recommend Riad Aladdin? Yes, despite the negatives, we enjoyed our time there.",November 2016,Riad Aladdin,https://www.tripadvisor.com/Hotel_Review-g293734-d1181276-Reviews-Riad_Aladdin-Marrakech_Marrakech_Safi.html,"Marrakech, Morocco",hotels,3.0,4.5
Crushed by Tourists,"We visited three medinas during our November 2016 trip to Marrakech: Chefchaouen, Fez and Marrakech. Of the three, Marrakech's was the most unpleasant by a long chalk. It is clogged with tourists, the various stalls all seem to sell the same tourist tat, and unlike the other two, cars go up and down its main streets and, more alarmingly, mopeds and motorbikes zoom up and down its narrow alleys at pace.

The main square is the much-vaunted Djmaa el Fnaa, which certainly comes alive after dark when the food stalls set up. This is a interesting, if not altogether, pleasant experience. As you look from stall to stall to try and assess what's on offer, you are besieged by touts, crying the excellence of their particular employer. One stall in particular - at the end of the row and whose number I regret I did not note - sold only fish. Fried, calamari, etc., and it was truly excellent. Another - No.21 - informed us that ""mother"" was doing the cooking, and she lived up to her billing: fried aubergine, chips, long thin kebabs and kefta - lamb meatballs - again, excellent. But on our third and last night, we fell between two stools - a stall that seemed to offer a bit of everything. It was dreadful - so you need to fight off the touts and try to look around you.

I should add that we declined to go back for a fourth night and went instead to the Kosybar, in the Place des Ferblantiers, near our riad. Kosybar is licensed and serves a reasonable seafood pizza and expensive drinks - we shared a bottle of Cuvée du President red, at 190 dirhams, and although it tasted well enough, it still gave me a 3am hangover.

I cannot see any reason to recommend the Marrakech Medina - unless it's just to use as a base for excursions elsewhere with some cheap food thrown in. I might add that Marrakech itself is much, much bigger and looks very much more interesting.",November 2016,Medina of Marrakesh,https://www.tripadvisor.com/Attraction_Review-g293734-d324126-Reviews-Medina_of_Marrakesh-Marrakech_Marrakech_Safi.html,"Marrakech, Morocco",attractions,2.0,4.0
On the one hand and on the other.,"This is a tale in two parts. The first is that the hotel is situated just outside the very main part of old Chefchaouen, so it’s remarkably convenient for heading straight into tourist central, the medina. It’s very clean, and has plenty of authentic Moroccan touches. In fact, it’s very pretty and has a superb view over the famous blue town. A helpful porter carried our suitcases up to the third floor - no lift (elevator to our American readers).

A very comfortable king-sized bed awaited us and a small fridge with two small bottles of water. The bathroom has a very, very small washbasin, western-style lavatory and large shower, which worked very well on our first evening. Clean towels, soap, shampoo, etc.

But there is another side to this establishment.

Most importantly, for those who value a good night’s sleep, it’s noisy. A Japanese tour group were here for our first night and we shared every moment of their experiences - at least, those of the folk in the room beside us and the room on the floor below. As they battled with the locks on the door and regaled their friends below about their problem; as they dragged furniture around, and then put it back just before their early departure the next morning; as they left luggage outside their door and reminded the same friends on the floor below to do the same. Even the sound of their micturition at three in the morning. (Well, we all do, don’t we - at least those of us with some grey in our beards? But we shouldn’t have to listen to each other as it happens.) The toilet flushing, then water running as hands were washed. And I’m sure they heard us doing mush the same.

I couldn't help noting that the same Japanese tour group seemed to have been offered a rather better class of breakfast than we were - but we did have plenty of delicious local pastries, breads, tapenade, jams and honey, while they also were given what looked like cold ham and eggs. Be warned - the coffee in the urn is dreadful.

And our hot water refused to work. So no early morning shower before breakfast, although it was eventually fixed and we were able to clean up before meeting our guide for a walk around the town at nine.

I should also add that we stayed two nights, and on the second night, the Moroccan couple in the same room next door were very quiet and at our second breakfast, we were also offered eggs - fried, boiled, etc.

I also suspect that our room - No. 8 on the top floor - is just too close to the main plumbing for a quiet stay.

On balance, would I recommend Dar Echaouen? Without seeing the alternatives, that’s a tough one, but given that it has light, a certain amount of space and is away from the hustle and bustle of the medina, very probably.",November 2016,Dar Echchaouen,https://www.tripadvisor.com/Hotel_Review-g304013-d952618-Reviews-Dar_Echchaouen-Chefchaouen_Tanger_Tetouan_Al_Hoceima.html,"Chefchaouen, Morocco",hotels,3.0,4.5
Tourist Central,"Chefchaouen is delightful from afar - the famous blue city. (Well, it looks more like a big village to me, but I'm open to correction.) Get closer, drop down into the medina and it quickly becomes apparent that you have arrived in what I call a 'tourist chute' - whichever end you approach from, you're on a path along which the various vendors view you as a mobile cash dispenser.

We stayed over the Moroccan Independence Day long weekend in mid-November, so most of our fellow tourists were from places like Rabat, Tangier, etc., and they were being fleeced just as hard as we were.

The central square - Place Outa el Hammam - is noisy, full of screeching kids and liberally smeared with excrement from the plague of feral cats. If you visit, be very careful where you put your feet and your bag. The restaurants all serve identical food, bar Morisco, which does a terrific goat, prune, honey and almond tagine. Try Cafe Restaurant Sofia just behind the square instead.

The Kasbah is a complete waste of time and money - happily the entrance fee was included in our overall price, otherwise I'd've been bleak. It's a modern restoration - as is much of the town - and as soulless as a Disney theme park. No, in fact, I've been to Disneyland in Paris and that had quite a lot of verve, which could pass for soul.

With hindsight, I'd probably give Chefchaouen and the Place Outa el Hammam and the Kasbah a miss altogether next time. One positive - most locals we encountered, despite trying to sell us tourist tat, were unfailingly polite, charming and helpful - that's been our experience so far throughout nearly all of Morocco.",November 2016,Place Outa el Hammam & Kasbah,https://www.tripadvisor.com/Attraction_Review-g304013-d7222032-Reviews-Place_Outa_el_Hammam_Kasbah-Chefchaouen_Tanger_Tetouan_Al_Hoceima.html,"Chefchaouen, Morocco",attractions,2.0,4.0
Very easy to like!,"A modern, mid- to up-market hotel, situated in central Casablanca. Very comfortable and super clean with king-sized bed, exceptionally large bathroom, plenty of writing/computer space, free wi-fi and good 2-pin power points. We arrived early and thought we had booked an early check-in but that turned out to be incorrect. No matter - we went for an early walk around central Casablanca and the helpful staff had a room prepared for us by 10.00. One sour note - beware the breakfast charge. Our early arrival the previous day meant that we had used up our paid-for breakfast, so on our departure day, breakfast had to be paid for: 300 dirham - outrageously expensive! Yes, we ought to have checked before we sat down and didn’t and were stung accordingly. You have been warned but that would not stop us from returning.",November 2016,Hotel Kenzi Basma,https://www.tripadvisor.com/Hotel_Review-g293732-d304343-Reviews-Hotel_Kenzi_Basma-Casablanca_Casablanca_Settat.html,"Casablanca, Morocco",hotels,5.0,3.5
Better alternatives,"Situated in the main square of the old part of town, directly opposite the old recently-restored castle, Morisco had been recommended to us by our tour operator. This part of Chefchaoeun is a mega-tourist trap (much like the entire town, in truth) and it provided a good meal, but only so far. I had a goat tagine, with prunes, almonds and honey - super sweet and delicious. My wife had a beef tagine with prunes and sesame - somewhat ho-hum. Prices are reasonable but I would be hard-pressed to recommend it - there are better alternatives.",November 2016,Restaurant Morisco,https://www.tripadvisor.com/Restaurant_Review-g304013-d4060272-Reviews-Restaurant_Morisco-Chefchaouen_Tanger_Tetouan_Al_Hoceima.html,"Chefchaouen, Morocco",restaurants,3.0,4.0
Don't think twice - eat here.,"This is a gem and it delivered the first Moroccan meal of our trip that really lived up to expectation. It is situated just behind the main square in the old part of town and when we arrived looked a little empty and almost about to close. Far from it. The owner welcomed us (he speaks good English) and almost as soon as we had sat down a number of other parties arrived and were soon tucking in to the excellent food. I had a kofta tagine - tiny balls of ground veal meat in a tomato-based sauced with a fried egg in the middle; my wife had a basic beef couscous - also delicious. Portions not stupidly big - just enough, in fact - and should we have stayed another night in this town this is the only place to which we would have returned. For the two dishes plus a 1.5l bottle of water and a tip - 100 dirham. Highly recommended.",November 2016,Cafe Restaurant Sofia,https://www.tripadvisor.com/Restaurant_Review-g304013-d7067670-Reviews-Cafe_Restaurant_Sofia-Chefchaouen_Tanger_Tetouan_Al_Hoceima.html,"Chefchaouen, Morocco",restaurants,5.0,4.5
Tourist trap par excellence,"From afar and from the guide books, Chefchaouen looks like a pearl: a blue-washed village draped onto the side of a pair of hills, from which it gets its name. As we approached, I was reminded of Cassis or parts of Provence. But then we were dropped into the main part of the old town, the Medina, a not terribly difficult labyrinth of alleyways that consist of small shops designed to fleece tourists of their dirhams. I felt that every pair of eyes was viewing me as just another walking cash dispenser. The tourist offerings all appeared to be the same and over-priced. We had asked to stay here for two nights, not just one, and to be frank, even one night would have been more than enough. Were it not for the fact that it's quite a long way from anywhere, Chefchaouen could be seen and done in a single afternoon. I should add that just about everyone we met outside of the main square was unfailingly polite and helpful - that makes up for a great deal.",November 2016,Chefchaouen Medina,https://www.tripadvisor.com/Attraction_Review-g304013-d1751665-Reviews-Chefchaouen_Medina-Chefchaouen_Tanger_Tetouan_Al_Hoceima.html,"Chefchaouen, Morocco",attractions,3.0,4.5
Could this be South Africa's best guest house?,"This was our second time at Prince Albert Country Stay and we enjoyed it as much as the first. There is a rustic charm to the property and its rooms, but unlike so many others which have the words ""rustic"" and ""charm"" attached, here everything works, is clean, spacious and extremely comfortable. Nothing seems to be too much trouble for Colleen, who even woke up at 5 a.m. to serve us coffee and rusks ahead of a local half-marathon which we were about to run. Her team includes husband William, who makes a mean breakfast with delicious fresh free-range farm eggs, local fruit, yoghurt and butter. The rest of the staff are well-trained, courteous and smiling. It might be in the middle of the Klein Karoo, but the free wi-fi in each room also works a treat. I'm trying very hard indeed to think of something I disliked, or which irritated me...hmmm, I'll have to get back to you on that one! Talking of getting back - we're definitely planning a return in the not-too-distant future.",October 2016,Prince Albert Country Stay,https://www.tripadvisor.com/Hotel_Review-g469393-d7018521-Reviews-Prince_Albert_Country_Stay-Prince_Albert_Prince_Albert_Municipality_Western_Cape.html,"Prince Albert, South Africa",hotels,5.0,5.0
OK Hotel - but unlikely to return.,"I have stayed at this hotel many times over the years - never for more than a single night, always en route from somewhere in the north to somewhere in the south. Its main attractions - large, clean rooms, big, comfortable double beds and - most important - a good, local steakhouse attached to the hotel. However, on our arrival last Friday night, we discovered that the steakhouse had moved elsewhere. The hotel's own dinner menu is limited, its kitchen is poor, so we were forced to go to a nearby mall to find food. Not ideal after a long day on the road. Net result? Friends have recommended what they say is a very good guest house just south of Bloemfontein, which does an excellent evening meal. We'll try that next time.",August 2016,Southern Sun Bloemfontein,https://www.tripadvisor.com/Hotel_Review-g312564-d299206-Reviews-Southern_Sun_Bloemfontein-Bloemfontein_Free_State.html,"Bloemfontein, South Africa",hotels,2.0,4.0
First-rate bird walk!,"Themba's brief: take four interested-but-amateur South African bird-watchers on a general, introductory walk around St. Lucia. In three hours, he hit the mark in a big way. Everyone afterwards was saying how knowledgeable he was and how impressed they were with his bird calls. Highly recommended and his rates are very reasonable. If we had more time, we would certainly go out with him again. Next time - for sure! Thank you, Themba.",July 2016,Themba's Birding and Ecotours,https://www.tripadvisor.com/Attraction_Review-g312636-d1484769-Reviews-Themba_s_Birding_and_Ecotours-St_Lucia_KwaZulu_Natal.html,"St Lucia, South Africa",attractions,5.0,5.0
A budget beauty!,"Burgers, pizzas, cold beer and situated right by the estuary - excellent value, too. We'll be heading back there in a couple of days, which is all you need to know.",July 2016,St Lucia Ski Boat Club,https://www.tripadvisor.com/Restaurant_Review-g312636-d3360535-Reviews-St_Lucia_Ski_Boat_Club-St_Lucia_KwaZulu_Natal.html,"St Lucia, South Africa",restaurants,5.0,4.0
