title,text,date,place,placeURL,placeLocation,placeType,reviewScore,avgScore
Highly recommended,"I had the pleasure to visit this great restaurant in April. The atmosphere is very nice and welcoming. Pricing was very reasonable also.
We will definitely be back when next in Athens",April 2019,Frankie,https://www.tripadvisor.com/Restaurant_Review-g189400-d13282632-Reviews-Frankie-Athens_Attica.html,"Athens, Greece",restaurants,5.0,4.5
You Must Visit,"Extremely interesting historical site. The buildings and history are amazing
You can't visit Athens without going to see it.
April was the perfect time to go as it was still cool and not to many people.",April 2019,Acropolis,https://www.tripadvisor.com/Attraction_Review-g189400-d198706-Reviews-Acropolis-Athens_Attica.html,"Athens, Greece",attractions,5.0,4.5
BEST IN ATHENS,"This tour was the highlight of our trip!
This tour was recommended to us by our friends who were visiting Athens last year. It was amazing.
Food was amazing and a lot more than we expected. The crew was extremely friendly! The boat itself was very nice as well.
The tour ended with an atmosphere drinks, fruits. I would highly recommend to anyone visiting.",April 2019,"Unique Sailing Experience from Athens to Agistri, Moni, and Aegina",https://www.tripadvisor.com/AttractionProductReview-g189403-d13504995-Unique_Sailing_Experience_from_Athens_to_Agistri_Moni_and_Aegina-Piraeus_Piraeus_R.html,"Piraeus, Greece",activities,5.0,4.5
