title,text,date,place,placeURL,placeLocation,placeType,reviewScore,avgScore
Inconsistent customer service,"I am giving the 3 stars review because while flight itself was short and unremarkable, but the customer service surrounding was not good. First, make sure you read a small print of your tickets. They charge extra fee, if you do not come with the downloaded online check-in. We were having trouble getting check in online, so the customer service gave us a break. However, here where inconsistency were: on the flight Athens-Santorini we got free baggage check in. On the flight back (with the same bags) we were told that we had to pay for the checked in baggage and could not take them with us. While we were standing on the security line (which was very chaotic) I noticed people with bags, which were the same size as ours and even bigger and heavier. They all got in and got they bags taken for check in for free while we boarding. It gave me impression that check in might be a subject to the agent's mood (the guy who was doing our check in on the Santorini-Athens flight was unpleasant to everyone in that line).",September 2019,Volotea,https://www.tripadvisor.com/Airline_Review-d10533097-Reviews-Volotea,World,flights,3.0,3.0
Drinks on the sunset,"Had drinks with the sunset in this place. The drinks were pretty good (I had sangria) and the view was great. Waiters are nice and the owner, Nick, was pretty chatty. Nice atmosphere. A great stop to make.",September 2019,Nektar Lounge,https://www.tripadvisor.com/Restaurant_Review-g482942-d14142451-Reviews-Nektar_Lounge-Fira_Santorini_Cyclades_South_Aegean.html,"Santorini, Greece",restaurants,4.0,5.0
Great way to spend a day,"This tour honestly exceeded expectations. All of us on our small group shared that notion (the group was only 6 people). You can check the stops on the tour description they give on this website. Unlike other tours I've been to, this one was quite well paced and relaxing. We met our guide Nicholas at the Thira bus station, he already had a sign with our names on it. He was most gracious host and created fun atmosphere. He seemed as a person who is genially proud of this place and strove to share it with us. He also was super helpful picking angles for photos and offered to take pictures. The only thing I wished for is that he had a microphone, because with roads being quite rocky, sometimes there are a lot of rattle and it is hard to hear what guide was saying. Regardless, it was great time. Highly recommend. And thank you Nicholas!",September 2019,Santorini Highlights Tour with Wine Tasting from Fira (small group up to 10),https://www.tripadvisor.com/AttractionProductReview-g189433-d12472010-Santorini_Highlights_Tour_with_Wine_Tasting_from_Fira_small_group_up_to_10-Santori.html,"Santorini, Greece",activities,5.0,5.0
"Adorable, comfortable and affordable","We stayed there for only three nights and I wish it was more. Location is super convenient: in a two min walk from the beach and restaurants and shops; a bus to the Thira is across the street. The hotel also has a pool and bar, where you can get drinks and food. I had breakfast there: Greek yogurt with fruits and it was very good. They provide free towels for the beach too. The building itself is super cute. Rooms
were clean and comfy. I think all of them have balconies. Things I was not prepared for were: roosters early in morning and local dogs, who made quite a noise as well. So, if you are a light sleeper, get yourself ear plugs. The airport is close enough too and sometimes you can hear them pass by, but this is true for the entire village of Kamari. Staff at the hotel is beyond friendly and helpful. Very lovely people.",September 2019,Hotel Matina,https://www.tripadvisor.com/Hotel_Review-g658914-d234322-Reviews-Hotel_Matina-Kamari_Santorini_Cyclades_South_Aegean.html,"Santorini, Greece",hotels,4.0,4.5
"Great views, average tour",The temple and surroundings are breathtaking. The tour itself is average at best. The information that was provided was mostly basic (with the exception of history of the temple). I would treat this tour as a form of transportation to the temple and back.,September 2019,Cape Sounion and Temple of Poseidon Half-Day Trip from Athens,https://www.tripadvisor.com/AttractionProductReview-g189400-d11448503-Cape_Sounion_and_Temple_of_Poseidon_Half_Day_Trip_from_Athens-Athens_Attica.html,"Athens, Greece",activities,3.0,4.0
Never cease to amaze,"This was my time here and I could not wait to get there. It is a magnificent creation that withstood thousands of years. If you are traveling at the end of the tourist season, you do not need to worry about major crowds (they still be there, but not as much). If you are traveling during hot time of the year, then get there earlier. We got a guide who was soliciting clients at the gate and paid 30 euros for entry and tour (entry itself is 20 euro). The tour was uneven in a quality: the guide was not taking us up to the temple itself, but she talked about history of Athens and building of the temple. However, in my opinion it went on too long. Enjoy the grounds and roam around. Pro tip: find out when the cruise ships come into town: on those days the lines are hours long.",September 2019,Acropolis,https://www.tripadvisor.com/Attraction_Review-g189400-d198706-Reviews-Acropolis-Athens_Attica.html,"Athens, Greece",attractions,5.0,4.5
Beautiful,"The estate is located a bit far away from the main action, however it totally worth the drive. A copy of a British architecture with a Czech flare. It was quiet and not overrun by tourists. Check out the yard and gardens.",November 2018,Hluboka Nad Vltavou Castle,https://www.tripadvisor.com/Attraction_Review-g676771-d277833-Reviews-Hluboka_Nad_Vltavou_Castle-Hluboka_nad_Vltavou_South_Bohemian_Region_Bohemia.html,"Hluboka nad Vltavou, Czech Republic",attractions,5.0,4.5
A nice place to take a break while sightseeing,"It is located in what seems to be a newer part of the city. It looks unassuming from outside, but it is really good. Inside you can pick from several restaurants. I had arctic char from Skal and it was delicious. Washed it down with some Icelandic ale. Perfect lunch. Place provides you with a welcoming break from busy day of sightseeing.",May 2019,Hlemmur Matholl,https://www.tripadvisor.com/Restaurant_Review-g189970-d17624403-Reviews-Hlemmur_Matholl-Reykjavik_Capital_Region.html,"Reykjavik, Iceland",restaurants,4.0,4.5
You got to be nature fanatic,"It is a tiny island in the bay. You got to take a little boat to get there (5 min ride). The island itself has almost nothing on it, except a several small houses, which were a part of a farm once upon a time. There is nothing to do. You got to be nature fanatic or photo enthusiast to truly enjoy it. It is not worth the time.",May 2019,Videy Island,https://www.tripadvisor.com/Attraction_Review-g189970-d1526196-Reviews-Videy_Island-Reykjavik_Capital_Region.html,"Reykjavik, Iceland",attractions,2.0,4.5
Great food with a personal touch,"Had a fish and chips dinner there: fresh and delicious! The place is tiny, but totally worth the visit. It would be great for either lunch or light dinner. The staff was super friendly (which seems to be a trend in Iceland). Prices are quite affordable.",May 2019,101 Reykjavik Street Food,https://www.tripadvisor.com/Restaurant_Review-g189970-d16720175-Reviews-101_Reykjavik_Street_Food-Reykjavik_Capital_Region.html,"Reykjavik, Iceland",restaurants,4.0,5.0
My first try of Icelandic food,"Visited it on the first day in Reykjavik. They served plates of samples of typical Icelandic dishes. I got to admit I had mixed experience: some I really enjoyed and some not so much. However, if you are food-adventurous you should try it. Location is great (across the Halgrimskirja).",May 2019,Cafe Loki,https://www.tripadvisor.com/Restaurant_Review-g189970-d1960952-Reviews-Cafe_Loki-Reykjavik_Capital_Region.html,"Reykjavik, Iceland",restaurants,3.0,4.5
A great place to have breakfast,"We had breakfast in this place twice (our hotel was nearby): friendly staff, delicious food, cute decor, and reasonable prices. What else do you need? Tea was good and my friend loved the coffee. They also make croissants on the premises and they was wonderful!",May 2019,Cafe Babalu,https://www.tripadvisor.com/Restaurant_Review-g189970-d2208354-Reviews-Cafe_Babalu-Reykjavik_Capital_Region.html,"Reykjavik, Iceland",restaurants,4.0,4.5
Simple and small,"The exhibit is tiny. It might be a good place to visit with kids, as it is small enough for them to handle and contains enough information for them to process about early Icelandic history.",May 2019,The Settlement Exhibition,https://www.tripadvisor.com/Attraction_Review-g189970-d2414517-Reviews-The_Settlement_Exhibition-Reykjavik_Capital_Region.html,"Reykjavik, Iceland",attractions,3.0,4.5
Learn about Icelandic history here,"The open air museum is a collection of houses that were native to Iceland. They have costumed guides telling you about life in Iceland for the past 300 years. The houses actually from the different time periods, so visitors can see the progression. t is a bit tricky to get to without a car, however, not impossible. Got there on a city bus.",May 2019,Arbaer Open Air Museum,https://www.tripadvisor.com/Attraction_Review-g189970-d245994-Reviews-Arbaer_Open_Air_Museum-Reykjavik_Capital_Region.html,"Reykjavik, Iceland",attractions,4.0,4.5
"Great, great and great","I never thought I will find great crepe place in Iceland. However, Eldur is awesome. Out of 4 days my friend and I spent in the city, we went 3 times. Crepes were delicious! That is all that needs to be said.",May 2019,Eldur and Is,https://www.tripadvisor.com/Restaurant_Review-g189970-d2660477-Reviews-Eldur_and_Is-Reykjavik_Capital_Region.html,"Reykjavik, Iceland",restaurants,5.0,4.5
Great photo op,This church is a major symbol of the city. Can't say you visited Reykjavik without taking a picture with it. Inside it is pretty austere. Be mindful that it is a functioning church and there are hours when it is closed for tourists.,May 2019,Hallgrimskirkja,https://www.tripadvisor.com/Attraction_Review-g189970-d245998-Reviews-Hallgrimskirkja-Reykjavik_Capital_Region.html,"Reykjavik, Iceland",attractions,4.0,4.5
A nice walk by the water,"It was a bit disappointing as I sort of expected more. However, the weather was nice, sun was shining bright and it was a nice walk to take from Harpa further down by the shore.",May 2019,Sculpture and Shore Walk,https://www.tripadvisor.com/Attraction_Review-g189970-d12286720-Reviews-Sculpture_and_Shore_Walk-Reykjavik_Capital_Region.html,"Reykjavik, Iceland",attractions,3.0,4.5
One of the main places to visit in Reykjavik,"It is a lovely place to visit on a rainy day. Most of it's exhibits are dedicated to different species and areas native to Iceland. This could be fun for kids (especially the ice cave). The show in the Planetarium was amazing! If you are not interested in the exhibit dedicated to the nature, you can buy a ticket to Planetarium only. They show two short films about auroras. It worth the time and money. Afterwards, make your way to the observation deck (you will see entire city) and top it off with the visit to the rotating restaurant on the top. We had dinner and drinks there while enjoying the view. Food was awesome and quite affordable. Tip: there is a free shuttle to the museum from the Harpa.",May 2019,Perlan,https://www.tripadvisor.com/Attraction_Review-g189970-d246003-Reviews-Perlan-Reykjavik_Capital_Region.html,"Reykjavik, Iceland",attractions,4.0,4.5
Adorable,"Visited it during the cherry blossoms week. However, even without the cherry blossoms the garden is beautiful. It's location is sort unassuming, but once inside you will see the carefully planned garden, with paths, little hidden temple, bridges, statues and ponds. Requires a small entry fee.",March 2019,Koishikawa Korakuen Garden,https://www.tripadvisor.com/Attraction_Review-g1066442-d480636-Reviews-Koishikawa_Korakuen_Garden-Bunkyo_Tokyo_Tokyo_Prefecture_Kanto.html,"Bunkyo, Japan",attractions,5.0,4.5
A war museum with a purpose,"This is a meticulously gathered war memorabilia collection that serves one purpose: to present certain point of view. The place is full of artifacts, photos, diagrams, facts. And while I am always interested in learning how different cultures/countries see the worlds events that many others were involved, this exhibit seemed to lacking some self-awareness. It skillfully avoided ""bumpy"" parts of the Japan's military history. Unless, you are an absolute fan of military histories (regardless of how they presented) this museum does not worth the admission price.",March 2019,Yushukan,https://www.tripadvisor.com/Attraction_Review-g1066443-d9974357-Reviews-Yushukan-Chiyoda_Tokyo_Tokyo_Prefecture_Kanto.html,"Chiyoda, Japan",attractions,2.0,4.0
A bustling and beautiful,"I visited this place during the Cherry Blossoms week and it was fantastic. The large yard of the shrine is full of cherry trees, which created added an extra beauty factor to the shrine. The complex is located in a middle of a bustling neighborhood, so you will hit a few marks that day just by visiting this shrine. There were also different activities going on in the yard. I am not sure if it was because of the Golden week or it is a normal occurrence for the temple, but it worth checking out. I saw a tea ceremony performed for the viewers in the yard. You will need to pay money to sit close, but I saw it just by standing nearby. The entry is free. But there are a couple attractions you will have to pay money to enter. I would skip the Yushukan Museum, unless you are a military history fan.",March 2019,Yasukuni Shrine,https://www.tripadvisor.com/Attraction_Review-g1066443-d555799-Reviews-Yasukuni_Shrine-Chiyoda_Tokyo_Tokyo_Prefecture_Kanto.html,"Chiyoda, Japan",attractions,4.0,4.0
a decent way to spend a day,"Booked a tour via this website. The reviews seemed to be good and overall tour met the expectations. It started a bit chaotic. First, my confirmation email said that pick up was BY the hotel. It did not mention that you actually have to go INTO hotel, find their counter and register. They put workers in the main area of the hotel lobby to direct travelers to the counter. The scene was chaotic, people were confused on what to do, and workers were running around trying to direct everyone to the correct place and rushing those whose tours were about to leave through the registration counters. It takes some time to get to the second pick up point, so I would recommend to stock up on snacks and water (they allow that on the bus). Our guide was super nice and attentive, but suffered the affliction of many tour guides: talking a lot about where Tokyoties shop, go to restaurants, etc. and not presenting enough history. She gave us some details about each of our stops, but I wish tour would include more in depth narration about history, significance and tradition represented in each place. Macha tea prep ceremony and temples were great and lunch that they provided was very tasty. I thought that the last stop at Enoshima was kind of unnecessary: we were there during the later part of the day, and since it was March, it was really cold on the seaside. Moreover, this place would require at least 2-2.5 hours to explore re and we only had an hour. So, this stop would make more sense during warmer time of the year. I'd rather we spent more time on the previous stops or someplace else than on Enoshima. We also end up sitting in traffic and got back about 1.5 hour later. Overall, I thought it was worth the money I spent, because they took me to places I would not go by myself.",March 2019,Kamakura Walking Tour,https://www.tripadvisor.com/AttractionProductReview-g1066457-d11446626-Kamakura_Walking_Tour-Shinjuku_Tokyo_Tokyo_Prefecture_Kanto.html,"Shinjuku, Japan",activities,3.0,4.5
"Interesting, but something is missing","As a museum fanatic I make a point of visiting at least one museum in every city I go. Edo-Tokyo museum presents history of the city in a logical historical progression. It has all the trimmings of the museum dedicated to any city: models of palaces, recreated city dwellings, etc. The sequence goes down the history and covers daily life, arts, science, politics and religion. Nonetheless, it feels some something is constantly missing. Major plus it is pretty kid friendly, there are things for kids to do and touch. It is a good place to spend time on a bad weather day. But if you are not a museum geek, you might want to skip it.",March 2019,Edo-Tokyo Museum,https://www.tripadvisor.com/Attraction_Review-g1066459-d315478-Reviews-Edo_Tokyo_Museum-Sumida_Tokyo_Tokyo_Prefecture_Kanto.html,"Sumida, Japan",attractions,3.0,4.5
A great option for a budget traveler,"I booked this hotel on a recommendation from someone and I would like to pass it on further. It is a chain hotel and is great for a budget conscious traveler. My single room was tiny, but squeaky clean and comfortable. I loved the fact that I could operate the entire room from my bed (all the light switches are on the headboard, plus usb port, two wall jacks and environment control). Room also had a fridge and tea pot. Amenities included trouser press on the floor, microwave and vending machine (I did not use them though). Hotel does not have a restaurant, but it is located on the street full of restaurants and diners, as well as multiple markets (Lawson, 7-eleven and Family Mart), which work 24 hours and are great places to purchase drinks, snacks and some food items. Also, there is take out place by the entrance to the hotel. Hotel is conveniently located within 5-7 min walk from a subway station, which include several lines, making it easy to get to other parts of the city. There are two more APA hotels located in the vicinity: Iidabashi Ekimae (across from one of subway entrances) and Tokyo-Kudanshita (further away from the subway). I assumed that standards of service applies to all three of them. There are a lot of places one can actually walk to from the hotel.",March 2019,APA Hotel Iidabashi-Eki Minami,https://www.tripadvisor.com/Hotel_Review-g1066443-d12856445-Reviews-APA_Hotel_Iidabashi_Eki_Minami-Chiyoda_Tokyo_Tokyo_Prefecture_Kanto.html,"Chiyoda, Japan",hotels,5.0,3.5
Tea party at the train station,"The restaurant is located inside shopping area of a train station and close by Keisei station (Skyliner for Narita airport). So, if you would like it could be a perfect ending of your Tokyo trip. I got there during the lunch rush, but despite hostess telling me that there were 6 parties before me, I did not wait for long. Restaurant shares a tight space with the Afternoon tea company shop, so you can totally shop while you wait. The staff was extremely pleasant, they made sure I got to the cash register faster because it was my time to be seated. I had a salad with chicken, which was to die for, freshly baked scones with cream and jam, and tea. They also have a pretty comprehensive dessert menu and I saw patrons ordering various delicious looking stuff. The prices are reasonable. If you in that area, it is definitely worth a stop.",March 2019,Afternoon Tea Tea Room Shibuya Mark City,https://www.tripadvisor.com/Restaurant_Review-g1066456-d1679291-Reviews-Afternoon_Tea_Tea_Room_Shibuya_Mark_City-Shibuya_Tokyo_Tokyo_Prefecture_Kanto.html,"Shibuya, Japan",restaurants,4.0,3.5
Fans only,"The restaurant is located alongside a small amusement park in Tokyo Dome city, and is full of families. So, prepare to wait in line for some time. My wait time was almost 40 min, when I walk in about 2/3 of the tables were empty. They serve food very fast though. I had a dish which included salad, roast beef, fish and bunch of sides. I am not sure what they were, but everything was delicious. For dessert, it was a cheesecake in a mug and cafe latte with moomin design. They also had a bread station. Food was wonderful, but the main thing is moomin and unless you are a big fan, you can find equally delicious food in other places in Tokyo. Afterwards, make sure you browse a little shop for a souvenir (or two). It is also good for those travelers with younger children.",March 2019,Moomin House Cafe Tokyo Sky Tree Town Solamachi,https://www.tripadvisor.com/Restaurant_Review-g14134337-d3369081-Reviews-Moomin_House_Cafe_Tokyo_Sky_Tree_Town_Solamachi-Oshiage_Sumida_Tokyo_Tokyo_Pref.html,"Oshiage, Japan",restaurants,4.0,4.0
Samurai 101,"This museum is small, but it presents a solid digest of a samurai history-culture for the tourists. They run English speaking guided tours for free. Otherwise, you can explore it on your own. They also have a presentation, which includes ""ninja"" and ""samurai"" showing off some moves with an option of taking pictures with them post-show. It might be fun for the kids. Bonus: it is in a middle of busy restaurant-bars district.",March 2019,Samurai Museum,https://www.tripadvisor.com/Attraction_Review-g14133667-d8652405-Reviews-Samurai_Museum-Kabukicho_Shinjuku_Tokyo_Tokyo_Prefecture_Kanto.html,"Kabukicho, Japan",attractions,4.0,4.5
Best time to visit is during cherry blossoms,"I really liked the park because I came specifically during the cherry blossoms time. Park houses a great amount of different types of cherry trees and others as well. It was a great place to mingle with locals as well, as crowds of people came in for the viewing. People were picnicking under the cherry trees and atmosphere was festive. However, without cherry blossoms, park is quite average. If you do not have much time in Tokyo, visiting it would check off several things on your sightseeing list, including different types of landscaping, emperor's old house, tea house and souvenir shopping. Also, a great place to visit for botanical gardens devotees.",March 2019,Shinjuku Gyoen National Garden,https://www.tripadvisor.com/Attraction_Review-g1066457-d479258-Reviews-Shinjuku_Gyoen_National_Garden-Shinjuku_Tokyo_Tokyo_Prefecture_Kanto.html,"Shinjuku, Japan",attractions,3.0,4.5
Hits all the checks,"This hotel gives everything one needs when traveling to Venice on a vacation. A spectacular building with great view -check; nice, clean rooms with interesting views-check; a pleasant staff-check; a good location (close to S. Marco and other landmarks) -check. They also offer a quite decent breakfast (different meats, cheese, fruits, yogurts, bread and cakes, juices, coffee and tea). If your booking does not include breakfast it is 8 euros per person and you get more for your money than in some other places in Venice. For example, we had a brioche and coffee breakfast for 5 euros elsewhere. One major con: it is 4 large flights of stairs to go to the reception and rooms. So, it might be difficult for people with mobility and or heart issues or little kids. A couple of helpful hint: when looking for hotel ask for Campo S. Maria Formosa. It is easier to locate on the map than the street Ruga Giuffa (hotel address), the entrance is on the side. If you take a water ferry from an airport get off F. te. Nove A. From there it is 15-20 min walk to the hotel (with less bridges). Overall, it was a very pleasant stay. I even liked the fact that they give old fashion keys for the room!",August 2018,Residenza Ca Malipiero,https://www.tripadvisor.com/Hotel_Review-g187870-d233913-Reviews-Residenza_Ca_Malipiero-Venice_Veneto.html,"Venice, Italy",hotels,4.0,4.0
When in Venice,The ride on the Grand Canal is a must. You will get to see the grandeur of the city. If you can get a spot either in the middle on the small deck or in front for the best views. The back is also ok. The ferries seem to be less crowded earlier in the morning.,August 2018,Canal Grande,https://www.tripadvisor.com/Attraction_Review-g187870-d191172-Reviews-Canal_Grande-Venice_Veneto.html,"Venice, Italy",attractions,5.0,4.5
The show of wealth and power of the republic,"If you only have one day in Venice, this is one of three things you must do there (other two are Basilica and Grand Canal ride). Designed to showcase the power and wealth of the republic to it's citizens and guests, the Doge palace manages to impress by both it's intricate decor and logical and functional construction. Everything for the Doge apartments to the Senate room. Don't miss the view of the Grand Canal out of the windows. Downside: the long line you will have to bear in order to enter. However, it is totally worth it.",August 2018,Doge's Palace,https://www.tripadvisor.com/Attraction_Review-g187870-d194251-Reviews-Doge_s_Palace-Venice_Veneto.html,"Venice, Italy",attractions,5.0,4.5
The heart of Venice,"This is the heart of Venice and must be seen. It is beautiful and frustrating at the same time because it is over run by people, vendors and pigeons.",August 2018,Piazza San Marco,https://www.tripadvisor.com/Attraction_Review-g187870-d191175-Reviews-Piazza_San_Marco-Venice_Veneto.html,"Venice, Italy",attractions,4.0,4.5
Cross that bridge,It is most famous of all Venice bridges for a reason. Offers a nice photo op of itself as well as a great view of the canal. As all places in Venice is very busy with people.,August 2018,Ponte di Rialto,https://www.tripadvisor.com/Attraction_Review-g187870-d194252-Reviews-Ponte_di_Rialto-Venice_Veneto.html,"Venice, Italy",attractions,4.0,4.0
Fantastic creation,"Basilica S.Marco is as fantastic as they come. Rich, colorful and designed to impress churchgoers it offers all the splendors of architectural and interior designs. Take at least half an hour wondering the church. Take a look at the details. Marvel. A few notes: make sure your knees and shoulders are covered; check backpacks across the street and if you can buy ""skip the line"" ticket (online only) for 2 euros.",August 2018,Basilica di San Marco,https://www.tripadvisor.com/Attraction_Review-g187870-d191226-Reviews-Basilica_di_San_Marco-Venice_Veneto.html,"Venice, Italy",attractions,5.0,4.5
