title,text,date,place,placeURL,placeLocation,placeType,reviewScore,avgScore
Panaghia Gorgoepikoos: A Temple of All Ages,"Next to the Metropolitan Cathedral, at Metropoleos Sq., is the elegant, small church of Panaghia Gorgoepikoos (the one quick to hear), aka Aghios Eleftherios, built in the 13th c. over an ancient temple dedicated to the goddess Eileithyia. The church was entirely constructed with the ruins of ancient temples and votive offerings, to which time has given a wonderful patina. The walls of the church are made of large, ancient Greek, Roman and early Byzantine marble blocks and relief plaques, without bricks.",March 2017,Little Metropolis,https://www.tripadvisor.com/Attraction_Review-g189400-d524618-Reviews-Little_Metropolis-Athens_Attica.html,"Athens, Greece",attractions,4.0,4.0
Hadrian's Arch marks the boundary between the ancient and the Roman parts of Athens,"On the road from the Acropolis to the Temple of Olympian Zeus, a two-story triumphal arch of white marble was erected in 131-132 A.D., in honor of Roman Emperor Hadrian, a benefactor of the city of Athens, marking the boundary between the old city of Athens and the new city constructed mostly during his rule and bearing his name.",March 2017,Arch of Hadrian (Pili tou Adrianou),https://www.tripadvisor.com/Attraction_Review-g189400-d242820-Reviews-Arch_of_Hadrian_Pili_tou_Adrianou-Athens_Attica.html,"Athens, Greece",attractions,4.0,4.0
Monastiraki Old Market of Athens,"Monastiraki, (little monastery) has narrow streets and small buildings. Here is the flea market neighborhood in the old quarters of the city of Athens and one of the principal shopping districts in Athens. On the outdoor stands of street vendors, or the small shops on the central roads, the area is home to several clothing boutiques, souvenir shops, and specialty stores, and is a major tourist attraction for bargain shopping since you can find anything, such as shoes and leather sandals, traditional clothes or hip garments, used or new furniture, old books and maps, antiques and curiosities.",March 2017,Monastiraki,https://www.tripadvisor.com/Attraction_Review-g189400-d265865-Reviews-Monastiraki-Athens_Attica.html,"Athens, Greece",attractions,4.0,4.0
The magnificent Temple of Olympian Zeus in Athens,"The most magnificent monument in Athens, other than the Acropolis complex of sites, is the Temple of the Olympian Zeus. In 1312 AD, in a grand ceremony, Roman Emperor Hadrian inaugurated the temple, the construction of which had begun in the 6th century BC. The gigantic temple of the Corinthian order was twice the size of the Parthenon and its interior housed a splendid statue of Zeus.",February 2017,Temple of Olympian Zeus,https://www.tripadvisor.com/Attraction_Review-g189400-d242844-Reviews-Temple_of_Olympian_Zeus-Athens_Attica.html,"Athens, Greece",attractions,5.0,4.0
An old-fashioned bar in a historic neighborhood,"Within the historic Acropolis-Makriyanni neighborhood, you may find this small old-fashioned bistro-bar for a drink or two and an optional wonderful dinner to go along.",November 2016,Duende,https://www.tripadvisor.com/Restaurant_Review-g189400-d2654642-Reviews-Duende-Athens_Attica.html,"Athens, Greece",restaurants,4.0,4.0
An excellent take-away grill,"This is a small take-away grill, serving Constantinople-style high-quality affordable street food like kebab and souvlaki on Dionyssiou Areopagitou, the most magnificent pedestrian street near the Acropolis.",February 2017,Mikro Politiko,https://www.tripadvisor.com/Restaurant_Review-g189400-d10713120-Reviews-Mikro_Politiko-Athens_Attica.html,"Athens, Greece",restaurants,5.0,4.5
The Temple of Hephaestus once thought to be of Thesseus,"This impressive temple within the Athenian Agora site is almost intact and presents a perfect example of a doric peripheral hexastyle building of the most glorious era of ancient Athens. It is rising on a plateau with three steps. The length of the temple is 31 m. (104 ft.) by 13 m. (45 1/2"") and its height is 10 m. (34 ft.). From a distance it looks larger than it actually is, with its curves and inclination of the columns towards the center and with a splendid patina of the weather-stained white marble from the quarries of Mt. Penteli.",February 2017,Temple of Hephaestus,https://www.tripadvisor.com/Attraction_Review-g189400-d1064133-Reviews-Temple_of_Hephaestus-Athens_Attica.html,"Athens, Greece",attractions,5.0,4.5
"Syntagma Square, the Center of Athens","Syntagma Square is not an attraction itself, it is however where the Greek Parliament building is, the Tomb of the Unknown Soldier, guarded by the Evzones traditional guards, the high-end central Hotel Row, as well as the one end of Ermou Street, the busiest commercial street in Athens. This is where all political rallies start from or end, and this is the city center from which distances to Athens are measured from!",January 2017,Plateia Syntagmatos,https://www.tripadvisor.com/Attraction_Review-g189400-d245992-Reviews-Plateia_Syntagmatos-Athens_Attica.html,"Athens, Greece",attractions,4.0,4.0
