title,text,date,place,placeURL,placeLocation,placeType,reviewScore,avgScore
Boy Scout trail hike up to Observatory,"We weren't sure how to get up to the Observatory since amber signs indicated that the parking lot was full. We did find a parking spot along Vista del Valle drive and it turns out we were right by the Boy Scout Trail head which leads up to the Observatory. The hike is a short, but somewhat steep 0.6 mile (we're senior citizens). There are views of the city and the Hollywood sign. The Observatory itself is educational... but it was crowded on the weekend. The cafe was horrible -- served ice-box cold hot dogs and the person behind the counter would neither heat the hot dog nor offered an exchange for a warm hot dog. Literally left a bad taste in our mouths.",January 2020,Griffith Park,https://www.tripadvisor.com/Attraction_Review-g32655-d129312-Reviews-Griffith_Park-Los_Angeles_California.html,"Los Angeles, California",attractions,5.0,4.5
Satisfying bun in a bowl,"Saigon Dish offers satisfying dishes. One of us ordered #18 Yellow egg noodle soup with shrimp, pork and shrim wontons; and the other ordered #28 - Bun Tom Cha Gio Thit Nuong with grilled shrimp, grilled pork, and egg noodle salad. Prices are very reasonable and service is fast.",January 2020,Saigon Dish,https://www.tripadvisor.com/Restaurant_Review-g32612-d3652621-Reviews-Saigon_Dish-Lawndale_California.html,"Lawndale, California",restaurants,5.0,4.5
Smoking in hotel; crowded breakfast,"Really wanted to like this hotel but when we arrived, we could smell marijuana smoke emanating from a room by the 4th floor elevator. We're not anti-pot but when the hotel is supposed to be non-smoking, we don't expect the heavy smell of cigarette, cigar or pot smoke. We reported the smoke to the front desk -- they seemed aware of the issue. More smoke wafting out of the room on the 2nd day/night.
Breakfast was a zoo. The hotel does forewarn guests about busy times during breakfast service. Many trays and coffee pots needed replenishing. No English muffins - just plain white/wheat bread; bagels; and some pastries/muffins. First day had chicken fried steak with biscuits and gravy and reconstituted scrambled eggs. Second day offering was turkey and pork sausages, and scrambled eggs. Also available were make-your-own waffles, oatmeal, and cereals (fruit loops, honey nut cheerios, raisin bran).
There is a $15 per night parking fee. LAX is about 5 miles north.",January 2020,Homewood Suites by Hilton Los Angeles Redondo Beach,https://www.tripadvisor.com/Hotel_Review-g32954-d11830039-Reviews-Homewood_Suites_by_Hilton_Los_Angeles_Redondo_Beach-Redondo_Beach_California.html,"Redondo Beach, California",hotels,3.0,4.0
Wonderful museum,"We had seen the segment on CBS Sunday morning about the PostSecret exhibit and it did not disappoint. Reading people's secret letters was fascinating amd emgrossing. The museum had other worthwhile exhibits particularly the ones on cannibals, race, and beer!.",August 2019,Museum of Us,https://www.tripadvisor.com/Attraction_Review-g60750-d126988-Reviews-Museum_of_Us-San_Diego_California.html,"San Diego, California",attractions,5.0,3.5
"Short overnight stay, close to I-210 freeway","We arrived in the evening and left early in the morning before the breakfast service. Since we were unable to take advantage of the comp breakfast offered to Diamond members, we were given drink vouchers which was a nice touch. The hotel seemed a little dated, but we slept well (Room 1018) and access back to the freeway was easy. We would stay here again if we are in the area.",July 2019,DoubleTree by Hilton Hotel Monrovia - Pasadena Area,https://www.tripadvisor.com/Hotel_Review-g32729-d78310-Reviews-DoubleTree_by_Hilton_Hotel_Monrovia_Pasadena_Area-Monrovia_California.html,"Monrovia, California",hotels,4.0,4.0
Inexpensive Indian food,"This is definitely a ""quick vegetarian meal"" cafe where food is served with paper plates, bowls, cups, and disposable forks/spoons. Don't expect anything fancy...but the food is tasty and plentiful. We had samosas, pakoras, dahl makhni, chana masala.",December 2019,Valshnu Express Cafe,https://www.tripadvisor.com/Restaurant_Review-g33212-d5112996-Reviews-Valshnu_Express_Cafe-Vallejo_California.html,"Vallejo, California",restaurants,4.0,4.5
Decent when red meat craving hits,"We generally don't eat red meat, but when the craving hits, Black Angus suffices. We remember the ""bottomless salad"" bowls days from decades ago when the chain restaurant first opened. The restaurant continues to give ice cold forks with the salad -- wish they would have forks at room temp; it's the plate that should be cold, not the forks. The prime rib and steaks are adequate; one shouldn't expect Ruth Chris / Morton's quality. We don't care for the underbaked cookie dessert. Take advantage of coupon specials. The Vallejo Black Angus is not open for lunch; dinner only.",November 2019,Black Angus Steakhouse - Vallejo,https://www.tripadvisor.com/Restaurant_Review-g33212-d1371099-Reviews-Black_Angus_Steakhouse_Vallejo-Vallejo_California.html,"Vallejo, California",restaurants,3.0,3.5
Downhill from previous stay,"We stayed at the Hilton Santa Clara back in 2017 and had a satisfactory experience so we expected the same level of service when we returned in 2019. We are Diamond members and used the digital check-in feature for Room 733 but when we arrived at the hotel, they said the room wasn't available and put us in Room 714. The room hadn't been well cleaned -- many live and dead gnats on the window sill and some stuck on the wall by the bed. From our previous stay, we knew the Exec Lounge would be not as good as other Exec lounges in terms of snack offerings, but we hadn't anticipated that the coffee machine would be out of service. We had the breakfast buffet in the restaurant but that was awful -- the bowl of cheese was rancid. The server didn't believe us until we told him to smell the bowl and sample the cheese. This hotel could stand some major improvements in housekeeping service and food quality.",July 2019,Hilton Santa Clara,https://www.tripadvisor.com/Hotel_Review-g33046-d224358-Reviews-Hilton_Santa_Clara-Santa_Clara_California.html,"Santa Clara, California",hotels,3.0,4.0
Convenient location,"As Diamond members, we got Room 1533 on the 15th floor facing the river. The room was comfortable enough. Shutters restaurant for breakfast felt claustrophobic. Fee for parking - best to book a room with parking included to get about a $5 per night discount. Hotel is located close to downtown region so restaurants are within walking distance. Wasn't the best, but certainly not the worst Doubletree we've stayed at.",June 2019,DoubleTree by Hilton Hotel Spokane City Center,https://www.tripadvisor.com/Hotel_Review-g58759-d111020-Reviews-DoubleTree_by_Hilton_Hotel_Spokane_City_Center-Spokane_Washington.html,"Spokane, Washington",hotels,4.0,4.0
Odd layout; dark ambience; service lacking,"We were en route to San Diego but wanted to visit a friend who lives in Santa Clarita; hence, one night at this Hilton Garden Inn. The layout is not typical Hilton Garden Inn; it's almost as though Hilton took over an old hotel and turned it into a Hilton Garden Inn. The location of our room (280) required walking down a long hall on ground level to take an elevator different from main elevator. When we got to our room, we wanted to put our food which required refrigeration in the mini-fridge; however, we couldn't because the fridge hadn't been cleaned out. We called housekeeping to remove the items. Not a good first impression. As Diamond members, our breakfast was comp but I think we have had better and more appealing breakfasts at other Hilton Hampton Inns and Garden Inns. The hotel felt old, tired, and worn. The dining area is dark with an old appearance. Breakfast staff seemed slow in helping guests. Place would benefit from lighting improvements. Can't say we would consider staying here again.",July 2019,Hilton Garden Inn Valencia Six Flags,https://www.tripadvisor.com/Hotel_Review-g33047-d77905-Reviews-Hilton_Garden_Inn_Valencia_Six_Flags-Santa_Clarita_California.html,"Santa Clarita, California",hotels,3.0,4.0
Suites on 5,"As Diamond Hilton Honors members, our room was upgraded to one in the ""Suites on 5"" section of the hotel. The Suites, intended for extended residential stays, is in an annexed part of the hotel and requires card key access. The room (886) was equipped with a kitchenette in the living area and a separate bedroom. Very quiet and well-appointed furnishings. The housekeeping staff during our 4-night stay were superb. Our only complaint with the hotel was the breakfast dining area which we reported to management and for which we received a prompt response. Overall a very good hotel in a terrific location.",October 2019,Doubletree by Hilton Philadelphia Center City,https://www.tripadvisor.com/Hotel_Review-g60795-d102480-Reviews-Doubletree_by_Hilton_Philadelphia_Center_City-Philadelphia_Pennsylvania.html,"Philadelphia, Pennsylvania",hotels,4.0,4.0
Allow 2-2.5 hours to view very fine art,"There is a lot to see in this museum. It begins at the foot of the grand stairs leading up to the museum entrance where the Rocky statue is. Then get ready to climb the steep staircase. The first floor is currently closed for renovations and will re-open in 2020. We spent quite a bit of time in the European Art and Modern and Contemporary Art galleries. There's a wing for American Art, European Medieval to Early Renaissance art, and some Asian art.",October 2019,Philadelphia Museum of Art,https://www.tripadvisor.com/Attraction_Review-g60795-d10800264-Reviews-Philadelphia_Museum_of_Art-Philadelphia_Pennsylvania.html,"Philadelphia, Pennsylvania",attractions,5.0,4.5
"Informative, interactive museum","We believe this museum is a very fine museum, better seen when one has more energy to appreciate all the details. This was our last stop of a very full day and we were low on energy, foot-weary, and hungry. That said, the exhibits were very well done and informative. The layout of the museum was well-curated and the lighting gave an intimate feel. Next time we visit this museum, we'll do it in the morning. We know we skipped reading a good amount of the historical material because we were tired. We plan to return here and give it its due time.",October 2019,Museum of the American Revolution,https://www.tripadvisor.com/Attraction_Review-g60795-d12163505-Reviews-Museum_of_the_American_Revolution-Philadelphia_Pennsylvania.html,"Philadelphia, Pennsylvania",attractions,4.0,4.5
Reserve time entry tickets in advance,"This is a must-see attraction which requires a timed entry ticket which should be reserved way in advance, especially during holidays, spring break, and summer. We went in October and could not get tickets for our first-choice date, so we re-juggled our planned itinerary around the date for which we could get tickets to Independence Hall. It seems to us the first place to visit in Philadelphia is Independence Hall for people interested in American history. (If you're an art aficionado, then the Barnes would be the first stop in Philly.) The park ranger provided an informative overview and history of Independence Hall, after which we were allowed to roam and explore the Independence Square buildings. To get or pick-up reserved tickets, go to the modern Independence Visitor Center which across the street from the entrance to Independence Hall.",October 2019,Independence Hall,https://www.tripadvisor.com/Attraction_Review-g60795-d104739-Reviews-Independence_Hall-Philadelphia_Pennsylvania.html,"Philadelphia, Pennsylvania",attractions,5.0,4.5
Okay museum with room to grow,"Some exhibits were very well done, especially the Feature Exhibition Gallery, Documents Gallery (American Treasures), and interactive Constitution exhibit while others seemed a bit hokey or wanting. The Signers' Hall has life-size bronze statues. The Road to Freedom theatrical performance was okay.",October 2019,National Constitution Center,https://www.tripadvisor.com/Attraction_Review-g60795-d278726-Reviews-National_Constitution_Center-Philadelphia_Pennsylvania.html,"Philadelphia, Pennsylvania",attractions,4.0,4.5
Fun snorkeling excursions,"We booked with PWF a few years ago a snorkeling excursion to Lanai and enjoyed ourselves so much that we got a membership and booked two excursions this time: one to Lanai for the snorkeling, and the other to Honolua. Unfortunately, there were strong currents in Honolua thereby precluding the captain from anchoring there. Customers could ask for a refund or board the boat and let the captain take us to other sites. Glad we chose to board the boat. We snorkeled near Mala Wharf where we saw a white tip reef shark, turtles, tangs and parrotfish. Then we headed towards Olowalu Reef where we saw some spectacular marine life, including lots of turtles. Both excursions included lunch and beverages. Fabulous adventures.",November 2019,Pacific Whale Foundation - PacWhale Eco-Adventures,https://www.tripadvisor.com/Attraction_Review-g60639-d10317823-Reviews-Pacific_Whale_Foundation_PacWhale_Eco_Adventures-Wailuku_Maui_Hawaii.html,"Maui, Hawaii",attractions,5.0,4.5
The tour was worthwhile,"I can't even remember how we found out about the Ocean Vodka distillery tours other than I had noted the tour in our planned itinerary before we left the mainland. We're sure glad we did the tour - it was $15 per person and included a 45-minute tour of the distillery and grounds, vodka/gin tastings, and a beautiful shot glass. The coconut rum was lovely, and the vodkas were nice, but the biggest and most pleasant surprise was the delightful refreshing ginger gin which turned out to be a disappointment because the gin is currently only sold at the distillery. :-( We were hoping it would be available at liquor stores on the mainland... hope Ocean manufactures the gin for commercial sale soon!",November 2019,Ocean Vodka Organic Farm and Distillery,https://www.tripadvisor.com/Attraction_Review-g60633-d4259183-Reviews-Ocean_Vodka_Organic_Farm_and_Distillery-Kula_Maui_Hawaii.html,"Maui, Hawaii",attractions,5.0,4.5
Upcountry cafe,"Kula Bistro is a convenient place for breakfast when exploring Kula country. We remember this place when we were in Maui a few years ago and had a ""short"" stack (it really wasn't 'short!"" -- it was huge!) before going to Haleakula for a hike. This year, we ate here before going to the Ocean Distillery and Ali'i Lavender Farm. We ordered crab cake benedict (which was okay -- too much breading), and mahi mahi benedict (excellent) along with coffee and cappuccino. Tab was $44.",November 2019,Kula Bistro,https://www.tripadvisor.com/Restaurant_Review-g60633-d2693277-Reviews-Kula_Bistro-Kula_Maui_Hawaii.html,"Maui, Hawaii",restaurants,4.0,4.5
Good breakfast options,"From street level, walk down the stairs to the Down The Hatch restaurant. Place and pay for your order at the counter by the stairs and then look for a table. The restaurant offers vegetarian and non-vegetarian fare. Both of us ordered ""bennies"" - spinach-avocado benedict and seared ahi benedict with a side of bacon. Food was very good and tasty. Look for Maui coupon books (e.g., This Week Maui, Spotlight on Maui) for a coupon to Down the Hatch (Buy one, get second at 50%).",November 2019,Down the Hatch Maui,https://www.tripadvisor.com/Restaurant_Review-g60634-d8650129-Reviews-Down_the_Hatch_Maui-Lahaina_Maui_Hawaii.html,"Maui, Hawaii",restaurants,5.0,4.5
What a kick! Totally delightful adult shave ice!,"We had lunch at Down the Hatch and on the receipt, it said we could get a 15% discount on a Breakwall Shave Ice. We delighted in the Pina Colada made with coconut ice cream, rum, pina colada flavoring and shaved coconut, and Mai Tai with mac nut ice cream, and light and dark rums. YUM!!! Recommend going during Happy Hour which begins at 2:00 pm for extra savings.",November 2019,Breakwall Shave Ice Co.,https://www.tripadvisor.com/Restaurant_Review-g60634-d2587544-Reviews-Breakwall_Shave_Ice_Co-Lahaina_Maui_Hawaii.html,"Maui, Hawaii",restaurants,5.0,4.5
Decent Light lunch,"Decent food for lunch. We shared an Upcountry Arugula Salad and 4-piece fish and chips plate. Because we arrived slightly after the restaurant opened for lunch, we were fortunate to be seated by the water's edge.",November 2019,Lahaina Fish Co.,https://www.tripadvisor.com/Restaurant_Review-g60634-d404460-Reviews-Lahaina_Fish_Co-Lahaina_Maui_Hawaii.html,"Maui, Hawaii",restaurants,4.0,4.0
Food's great but service was inconsistent,"We went to Three's Bar and Grill three times during our 10-day stay in Kihei: first time for Happy Hour dinner which was so delicious that we wanted to check out breakfast, and then the last time for dinner. We sampled the Brussel sprouts, Kahlua pig quesadilla, fish taco, flatbread salad, spicy tuna roll, nachos, kale salad, and for breakfast, the ahi benedict and breakfast sandwich. All the dishes were excellent except for the flatbread Mediterranean salad. For our second dinner, we opted for the kale salad. What prevents us from giving 5 stars is the inconsistent service which seemed to decline with each successive meal. On the third time, we waited nearly 25 minutes for the server to take our order. Our server spent quite a bit of time behind the bar talking to workers and serving drinks to bar customers.We timed her from when she said ""I'll be with you in a moment"" to when she returned to our table. Meanwhile, we witnessed customers who were seated after us being waited on by their servers. A shout-out to our first server, Max, who was fabulous -- especially since it was a busy Friday evening. The hostess/greeter was also excellent.",November 2019,Three's Bar and Grill,https://www.tripadvisor.com/Restaurant_Review-g60632-d1675288-Reviews-Three_s_Bar_and_Grill-Kihei_Maui_Hawaii.html,"Maui, Hawaii",restaurants,4.0,4.0
Under new management,"We were in Maui in November and ate here on our first night. We learned the woman who ran the restaurant (since our last visit 3 years ago) had retired about a year or two ago. The menu appears to be the same. We shared the special Hawaiian Opakapaka steamed with broccoli, green onions, and ginger, and a large seafood pho soup. On a second visit, we had the clay pot rice and crispy chicken. Both meals were above average.",November 2019,Vietnamese Cuisine,https://www.tripadvisor.com/Restaurant_Review-g60632-d510871-Reviews-Vietnamese_Cuisine-Kihei_Maui_Hawaii.html,"Maui, Hawaii",restaurants,4.0,4.0
Went three times in 10 days,"We enjoyed Nutcharee's so much that we went three times during our 10-day stay in Kihei. The first time we had papaya salad and cashew chicken, both of which were excellent, and a disappointing green curry fish. The green curry was much too thick for our taste. (In Thailand, green curry is more soup-like.) Nonetheless, we wanted to try other dishes. On our second visit, we ordered the ""to-die-for"" crispy fish, pad gra prao (seafood), and cashew chicken. We prefer not to visit a restaurant more than twice on any given trip; however, the second night's meal was so memorable and so tasty that on our last night on Maui, we went back a third time, this time ordering our favorite dishes: papaya salad, crispy fish, and cashew chicken. Really happy to have found this place!",November 2019,Nutcharee's Authentic Thai Food,https://www.tripadvisor.com/Restaurant_Review-g60632-d9558263-Reviews-Nutcharee_s_Authentic_Thai_Food-Kihei_Maui_Hawaii.html,"Maui, Hawaii",restaurants,4.0,4.5
Do the treasure hunt!,"This was a whim-of-the-moment visit to the Ali'i Kula Lavender Farm. We're so glad we were in no hurry so we got to do the treasure hunt (a completed form with 12 different stamps) which yielded a delectable prize and to enjoy lavender tea, scones, and lilikoi jelly and syrup. The farm is very peaceful and fragrant. The farm sells lavender products including shea butter gardener's salve, hand creams, soaps, apparel, and the like. We bought several tins of the gardener's salve. Be forewarned that parking is on a rather steep hill. Recommend getting to farm in the morning as it closes at 3:45 pm. Before arriving at the farm, get a free copy of Upcountry Maui magazine and look for a $3 discount coupon which covers the entrance fee, not the guided tour portion. The treasure hunt gets you around the farm without the guided tour, although, the guide provides additional information. Surprisingly, we ended up spending 2 hours on the farm; we could have limited our time there to one hour if we didn't enjoy the scones and shop.",November 2019,Ali'i Kula Lavender Farm,https://www.tripadvisor.com/Attraction_Review-g60633-d1459873-Reviews-Ali_i_Kula_Lavender_Farm-Kula_Maui_Hawaii.html,"Maui, Hawaii",attractions,5.0,4.0
Taco Tuesday at Fred's!,"We love eating at Fred's on Taco Tuesdays. Be sure to arrive early (no later than 5-5:30 pm) otherwise anticipate a long wait (up to an hour) for a table. Our favorite tacos are the Baja Fish, Mahi Mahi, and Ahi Tuna. Other taco fillings include carne asada, carnitas, chicken and shrimp. No napkins on Taco Tuesday, just a practical roll of paper towels.",November 2019,Freds Mexican Cafe - Kihei,https://www.tripadvisor.com/Restaurant_Review-g60632-d1461904-Reviews-Freds_Mexican_Cafe_Kihei-Kihei_Maui_Hawaii.html,"Maui, Hawaii",restaurants,4.0,4.0
Hearty breakfast,"Moose McGillycuddy's is one of our go-to breakfast spots whenever we're in Kihei. Breakfasts are hearty with generous portions. We like the corned beef hash, huevos rancheros, the basic (eggs, potatoes, bacon/sausage, bread), and any one of the omelets (especially the spinach omelet). The short stack is huge! May order with mac nuts, banana, fruit. Check out ""This Week"" for coupons. Reasonably priced for Maui.",November 2019,Moose McGillycuddy's,https://www.tripadvisor.com/Restaurant_Review-g60632-d1157103-Reviews-Moose_McGillycuddy_s-Kihei_Maui_Hawaii.html,"Maui, Hawaii",restaurants,4.0,4.0
Great beach - life guard on duty,"Whenever we're in Maui, we prefer to stay in Kihei at a hotel directly across from Kam Beach 1. Snorkeling is very good in the mornings when the water is calm. Unfortunately, this year in early November, there were tiger shark sightings which forced the closure of the beach for a couple of days -- apparently there were dead/dying fish from a damaged fishing net. When the beach finally opened, it had to be closed again, this time due to strong rip currents. Good thing there are lifeguards on the Kam 1-3 beaches.",November 2019,Kamaole Beach Park I,https://www.tripadvisor.com/Attraction_Review-g60632-d7191674-Reviews-Kamaole_Beach_Park_I-Kihei_Maui_Hawaii.html,"Maui, Hawaii",attractions,5.0,4.5
Ideal hotel across the street from Kam1 beach,"This is the third time we've stayed at Maui Coast Hotel. Hotel provides Gilchrist & Soames bath products; and the junior suite (625) is equipped with mini-fridge, microwave, coffee/tea maker, and bar sink along with tub/shower. The hotel does not have rooms which offer a full ocean view; the best one can get is a ""partial"" (obscured) view although the rooms have balconies. The daily resort fee includes free use of washer/dryer (detergent can be purchased), parking, newspaper, wi-fi. King bed was comfortable. The best aspects of the Maui Coast hotel is location: directly across the street from Kam I, around the corner from the best fish food truck, and within close proximity to many restaurants and shops. ABC is less than a block away. Pool is small and towels are provided.",November 2019,Maui Coast Hotel,https://www.tripadvisor.com/Hotel_Review-g60632-d111818-Reviews-Maui_Coast_Hotel-Kihei_Maui_Hawaii.html,"Maui, Hawaii",hotels,4.0,4.5
Beginning to show its age; construction next door,"The Hampton Inn-Missoula is one of our go-to hotels whenever we are in town because it has the advantage of being in close proximity to the freeway on-ramps and about 3 miles from the Missoula Airport. The staff are friendly and hospitable. This year, we were in Room 416 which overlooked current construction in the adjacent lot. This Hampton is beginning to show its age and could benefit from some improvements.",June 2019,Hampton Inn Missoula,https://www.tripadvisor.com/Hotel_Review-g45277-d97375-Reviews-Hampton_Inn_Missoula-Missoula_Montana.html,"Missoula, Montana",hotels,4.0,4.5
An architectural marvel with terrific views,Book online for free timed entry tickets two weeks in advance of planned arrival. There is a small elevator to accommodate those who are physically unable to climb steps. Great views of the Hudson River.,October 2019,The Vessel,https://www.tripadvisor.com/Attraction_Review-g60763-d16875019-Reviews-The_Vessel-New_York_City_New_York.html,"New York City, New York",attractions,5.0,4.5
Make reservations for a delicious sushi feast,"We were visiting a young friend who is studying in NY. When asked where he would like to have dinner, he suggested Sushi Yasaka. We had miso soup, sushi deluxe, sashimi deluxe, appetizer tempura, soft shell crab roll, hot sake, and red bean ice cream. Food was very fresh and delicious. Bill came to about $115 before tip. Worth every cent. Be sure to make reservations.",June 2019,Sushi Yasaka,https://www.tripadvisor.com/Restaurant_Review-g60763-d2401811-Reviews-Sushi_Yasaka-New_York_City_New_York.html,"New York City, New York",restaurants,5.0,4.5
