title,text,date,place,placeURL,placeLocation,placeType,reviewScore,avgScore
Excellent Take-out Japanese fusion lunch,"We had a gift certificate which we used to enjoy an excellent take-out lunch: Iyasare kakiage tempura, suzuki yaki and sashimi mori. Portions were plentiful, enough for two lunches for the two of us. We would definitely order the same thing the next time. We know that if we had eaten the tempura, it would have been over-the-top excellent but by the time we got the dish home, it had lost some of the crispiness. The sashimi mori had a wonderful collection, but our most favorite plate was the grilled suzuki yaki (grilled sea bass). A wonderful treat in the time of Covid!!! Highly recommended. A big shout-out to Dan for helping us with our order.",February 2021,Iyasare,https://www.tripadvisor.com/Restaurant_Review-g32066-d5601764-Reviews-Iyasare-Berkeley_California.html,"Berkeley, California",restaurants,5.0,4.5
The Bad and the Good,"Overall we liked this place; however, there were a couple of incidents that were problematic. On our 2nd night, neither of our card keys wouldn't unlock the front door. It's a good thing we were returning to the condo before 11:00 pm when the front desk closes for the night. The cards had to be re-keyed. The second incident was on Day 3 . At check-in, we were told our condo would be cleaned on Day 3; however, no one showed up. A housekeeping attendant had come to deliver the extra blanket we requested and when we inquired about when our room would be cleaned, she had to check with the front office. Apparently the front desk forgot to notify housekeeping. We went out for an early dinner and when we got back, the trash was emptied, towels and amenities replaced. What we liked about the condo was the spaciousness, the kitchen set-up (coffee, dish detergent, sponge provided), and the washer/dryer. We were in Building 20 which is a long walk to the parking structure (and even longer walk to the front desk). We would recommend that housekeeping wash the kitchen floor which was dirty. At check-in, we were offered a discount card IF we attended a ""session"" which we knew to be a time-share presentation - we declined - and Holua was not pushy which we appreciated.",March 2020,Holua Resort at The Mauna Loa Village,https://www.tripadvisor.com/Hotel_Review-g60872-d254754-Reviews-Holua_Resort_at_The_Mauna_Loa_Village-Kailua_Kona_Island_of_Hawaii_Hawaii.html,"Island of Hawaii, Hawaii",hotels,4.0,4.5
Decent combo pizza,"We had a hankering for pizza and came upon this restaurant while shopping for groceries. We shared a 14"" combination pizza with thin crust and a glass of merlot. Pizza was palatable. Total bill was $30.",March 2020,Bianellis Gourmet Pizza & Pasta,https://www.tripadvisor.com/Restaurant_Review-g60872-d494217-Reviews-Bianellis_Gourmet_Pizza_Pasta-Kailua_Kona_Island_of_Hawaii_Hawaii.html,"Island of Hawaii, Hawaii",restaurants,4.0,4.0
"We ate here for breakfast, lunch and dinner","We ate here three times over a period of five days. Prices are a little high but food was delicious. The first time was for breakfast: one of us had the scumptious Ono Benedict and the other had the tasty homemade corned beef hash. Including two cups of coffee and tax, the bill was $40. We wished we could have returned for another breakfast because the menu was appealing.
The second time we came was for dinner. We shared a Caesar salad and red wine sangria. One of us ordered the Macadamian Mahi and the other the Hawaiian Ginger Ono. Both main dishes were satisfying. Bill totaled $89.
On our last full day in Kona, we lunch on Fish N Chips and the exceptional fish combo with battered fried mahi, calamari rings, and prawns. The tab was $39.",March 2020,Fish Hopper Seafood and Steaks,https://www.tripadvisor.com/Restaurant_Review-g60872-d645698-Reviews-Fish_Hopper_Seafood_and_Steaks-Kailua_Kona_Island_of_Hawaii_Hawaii.html,"Island of Hawaii, Hawaii",restaurants,5.0,4.5
Decent Mexican food,"We had driven to Waikoloa from Hilo in the morning and after having checked in, we were hungry, but we also wanted to explore the grounds. We ended up at the Boat Landing Cantina, an open air cafe by the Ocean Tower terminus of the tram. We shared Mahi tacos (2 on a plate for $22) and Taco Salad ($16) for lunch Food was decent and fresh, but perhaps on the pricey side.",March 2020,Boat Landing Cantina,https://www.tripadvisor.com/Restaurant_Review-g60608-d2523551-Reviews-Boat_Landing_Cantina-Waikoloa_Kohala_Coast_Island_of_Hawaii_Hawaii.html,"Island of Hawaii, Hawaii",restaurants,4.0,3.5
Dined here twice,"Both nights' dinners pleased us, but we were especially delighted by the first night's meal. We ordered the special fish dish with purple sweet potato, ginger monchong with sushi rice cake, tower of Maui onion rings, and a Moana Mule. Tab came to $144 including tax. The second night we shared a Caesar salad and the Seafood Tower for 2 (lobster, tiger prawns, Pacific oysters, and king crab leg). Bill including tax was $118. Be sure to make reservations with the concierge. The earliest seating we could get both nights was 6:30 pm. The first night we sat outside and got to experience a beautiful sunset. On the second night, the wind was so gusty that guests had to eat indoors.",March 2020,Kamuela Provision Company,https://www.tripadvisor.com/Restaurant_Review-g60608-d502507-Reviews-Kamuela_Provision_Company-Waikoloa_Kohala_Coast_Island_of_Hawaii_Hawaii.html,"Island of Hawaii, Hawaii",restaurants,4.0,4.0
Mid-afternoon snack,We enjoyed a mid-afternoon snack of delicious Mahi Tacos along with a mai tai. The food menu is simple with basic pub-type dishes. There are several large screen tvs offering sports channels. Good place to relax after a day in the sun.,March 2020,Kona Tap Room,https://www.tripadvisor.com/Restaurant_Review-g60608-d13806993-Reviews-Kona_Tap_Room-Waikoloa_Kohala_Coast_Island_of_Hawaii_Hawaii.html,"Island of Hawaii, Hawaii",restaurants,4.0,3.5
"Shout-out to Kelli, front desk reception","We are multi-year Diamond HH members and having stayed at many of Hilton's hotels around the world, we expect a certain level of quality and service. We were on the Big Island at the start of the month, before the onset of Covid-19 in Hawaii. On this particular trip to the Big Island, we experienced the worst and best of the Hilton brand. Our stay in Hilo was disappointing and below Hilton standards. The night before we arrived at Waikoloa we tried to do a digital check-in but none of the offered rooms matched the Makai Ocean Front with lanai king bed room we had booked months ago. We called the Hilton Waikoloa and asked why we were offered a resort view (parking lot view) room instead of the ocean front room with lanai that we had reserved. The reservations desk clerk on the other end of the line advised us to talk to the manager upon our arrival at the Hilton Waikoloa. When we got to the registration desk, we were feeling rather tense and stressed and braced for another disappointment -- but Kelli calmly listened to our story, checked the registration, and gave us keys to Room 6304 which was a king bed room with ocean front view and lanai... exactly what we had reserved. It was Kelli, with her beautiful and warm smile, her serene and calming voice, her very helpful suggestions which enhanced our stay; and her genuine aloha spirit, that set the pace and tone for a most wonderful respite at Hilton's Waikola Village. Our biggest regret was that we had only booked a two-night stay; we wished we had added another night or two before moving on to Kailua-Kona. (We began in Hilo, stayed in Waikoloa, and then finished our trip in Kailua-Kona.)
Our room was equipped with iron and ironing board; robes; slippers; comp water bottles; spacious closet; full dresser; mini-fridge, Keurig coffee/tea maker, DVD player, and Kohala Spa coco-mango bath products.
We understand why guests don't want/need to leave the premises: the resort is self-contained. We loved the salt water lagoon which is ideal for snorkeling with plenty of large green turtles, tropical fish, and even a conger eel; access to the lagoon is via a sandy beach. Next to the lagoon is where guests can play, for a price, with dolphins. There are several pools and tennis court which we did not use. One can get lots of steps simply by walking and meandering throughout the resort. In the breezeways which connect all three towers are displays of museum-quality works of art, paintings, and objets d'art. There is a tram and boat which can transport guests from one tower to another but we chose to walk. As part of the resort fees, one can get ukulele, hula, and lei-making lessons; we opted to attend the ukulele lesson which was fun. The resort fees also include a complimentary photo. (Book 24 hrs in advance and allow about 30-45 minutes for the photo shoot.) If staying at the Makai Lagoon tower, the self-parking lot is close by; if staying at the Palace or Ocean Towers, then one might opt for valet parking. Breakfast is offered at the Big Island Breakfast hall. One can order a la carte or opt for either the continental or hot buffet. The continental breakfast ($28) is extensive and impressive with plenty of breads and pastries, exotic fruits, cereals, yogurts, parfaits, hot oatmeal, Chinese congee, and Japanese miso soup with all the fixings (e.g., tofu, daikon, pickles, kimchee, parsley, green onions). We did not opt for the ""hot"" buffet ($40) because there was way more than we could ever eat in one sitting: waffle station, omelet bar, pancakes, French toast, hot trays filled with meats, and other delights. We plan to return! Mahalo, Kelli, for your outstanding service and warm and hospitable welcome!",March 2020,Hilton Waikoloa Village,https://www.tripadvisor.com/Hotel_Review-g60608-d89980-Reviews-Hilton_Waikoloa_Village-Waikoloa_Kohala_Coast_Island_of_Hawaii_Hawaii.html,"Island of Hawaii, Hawaii",hotels,5.0,4.0
Smelly room; horrible breakfast; unhappy staff,"We stayed at the Grand Naniloa and then at Hilton's Waikoloa. It was like night and day, worst to best. We hated our experience at the Grand Naniloa. At the Grand Naniloa, Ashlynn, the unfriendly and unhelpful desk clerk, did not acknowledge us as Diamond members, did not offer us water, did not give us our comp breakfast coupons. We ended up speaking to Sierra, another desk clerk, who graciously provided us with the comp water and breakfast coupons. Overall, it seemed the staff were not a friendly, happy group; dour seems an appropriate description; lacked the aloha spirit. We were assigned Room 328. The bathroom smelled like a combination of urine and mold. We used our carry-on Lysol spray in an attempt to mask the smell but were unsuccessful. We only travel with carry-on luggage (we never check luggage) so we were surprised by the severely limited storage space: no place to store luggage; a tiny closet (even small by European standards) and 2 small under-the-desk drawers; no dresser; no iron/ironing board. Breakfast at the hotel's Hula Hula restaurant was beyond dreadful and definitely not up to Hilton standards. The ""cold"" breakfast cost $16 for breads, cold cereals (no granola), yogurt, oranges, apples, a limit of 2 slices of papaya; a choice of passo-guava and orange juice; no apple or tomato juice; no peanut butter, no bananas . For $22, one can get the ""hot"" breakfast which is the never-changing oatmeal, scrambled eggs, bacon, Portuguese sausage slices, steamed rice, and breakfast potatoes. One can order off the menu instead of the buffet but we recommend leaving the hotel and finding a nearby breakfast restaurant. Parking is included in the $30 resort fee: one can choose between valet parking or self-parking in the lots across the street from the hotel. We've been Diamond members for years -- this is the most disappointing Hilton-chain hotel we've been to.",March 2020,Grand Naniloa Hotel Hilo - a DoubleTree by Hilton,https://www.tripadvisor.com/Hotel_Review-g60583-d113096-Reviews-Grand_Naniloa_Hotel_Hilo_a_DoubleTree_by_Hilton-Hilo_Island_of_Hawaii_Hawaii.html,"Island of Hawaii, Hawaii",hotels,1.0,3.5
Counter-clockwise is easier on this 4-mile hike,"Start early in the day, if only because parking is extremely limited at the Kilauea Iki Overlook. There are two ways to hike: clockwise, the more difficult direction which begins with an unpaved path, or counterclockwise, the easier direction which begins with going down steps. The descent to the crater floor is 400 feet... the ascent back to the parking area via the counterclockwise direction involves hiking switchbacks which is easier than climbing uneven, high, and steep steps if one has taken the clockwise direction. If in relatively decent shape, allow approximately 2 to 2.5 hours. Elevation/altitude is about 4,000 feet. The interpretative map/guide is available for $2 at the park headquarters and is worthwhile. Pack a hat/cap, sunglasses, plenty of water and insect repellent.",March 2020,Kilauea Iki Trail,https://www.tripadvisor.com/Attraction_Review-g143034-d131308-Reviews-Kilauea_Iki_Trail-Hawaii_Volcanoes_National_Park_Island_of_Hawaii_Hawaii.html,"Island of Hawaii, Hawaii",attractions,5.0,5.0
Local color - off the beaten path,Our Hawaiian friends took us here to experience some of the local color. It's a weekly (Wednesday nights) farmers market / arts and crafts fair/food court along with Hawaiian music and dance. It's off the beaten path and probably not high on the priority list of must-see/must-do for the average tourist.,March 2020,Uncle Robert's Awa Bar and Farmers Market,https://www.tripadvisor.com/Attraction_Review-g3383516-d2646769-Reviews-Uncle_Robert_s_Awa_Bar_and_Farmers_Market-Kaimu_Island_of_Hawaii_Hawaii.html,"Island of Hawaii, Hawaii",attractions,3.0,4.5
Best place to buy Mauna Loa products,"As others have pointed out, the farm/factory is not a ""tour"" although one can peer through the window to see the factory. This location is primarily a store/gift shop where you can get free tastings and the best prices on Mauna Loa products. We didn't believe the other reviewers about the prices being cheaper than Costco, WalMart, ABC and other stores, but it's true! We never knew there are 11 flavors of mac nuts; we have only seen a few of them heretofore: unsalted, lightly salted, Kona coffee, honey roasted, honey sriracha, mango chipotle, Maui onion and garlic, milk chocolate, milk chocolate coconut, milk chocolate toffee, and dark chocolate. The store offers other products as well including souvenirs, postcards, coffee, tea, jewelry, mugs, t-shirts, etc. Additionally, the store has a small cafe that serves reasonably priced food (e.g., hot dog) and ice cream. There were a lot of tour buses so it can get crowded. It's a fun place to go on a rainy day.",March 2020,Mauna Loa Macadamia Nut Farm and Factory,https://www.tripadvisor.com/Attraction_Review-g60583-d12253325-Reviews-Mauna_Loa_Macadamia_Nut_Farm_and_Factory-Hilo_Island_of_Hawaii_Hawaii.html,"Island of Hawaii, Hawaii",attractions,3.0,3.5
Homecooking,"Great restaurant. Generous portions. Have loved this restaurant ever since we first ate here over 30 years ago. As soon as our plane landed and we got our rental car, we headed to Teshima's for lunch. We had shrimp tempura as an appetizer and then ordered two pupu trays for lunch. Teshima's tempura is to die for... the batter is very light and crispy and not greasy. The pupu tray also came with bbq beef and sashimi. Yum! We like to eat here at least twice whenever we're in town.",March 2020,Teshima's,https://www.tripadvisor.com/Restaurant_Review-g60591-d519157-Reviews-Teshima_s-Kealakekua_Island_of_Hawaii_Hawaii.html,"Island of Hawaii, Hawaii",restaurants,5.0,4.5
Even Hilton's Hampton Inns serve a better breakfast,"We're Diamond Hilton members so we were given vouchers for the continental breakfast with the option to pay $6 per person to ""upgrade"" to the Aloha buffet. We took the upgrade option the first day but decided it wasn't worth the price. We would advise guests to eschew the buffet and either order off the menu or go to a nearby restaurant. We could not believe how sparse and meager the breakfast offerings were. Even Hilton's budget chain, Hampton Inns, offers a free breakfast that's much better than the breakfast at this Hilo hotel. The ""cold continental breakfast"" included an assortment of breads (white and wheat bread, bagels, English muffins, croissants, orange and blueberry muffins, Danish; cottage cheese; fruits (limit of 2 thin slices of papaya slices, pineapple, thawed honeydew melon, apples, oranges); cereals (Frosted Flakes, Raisin Bran, Special K, Rice Krispies); juice (orange and passo-guava); and yogurt. Not to be seen anywhere in the buffet area were peanut butter, bananas, granola, waffle iron (staples offered at other Hilton chains); some other Double Tree hotels include cold cuts and cheese... but not the Hilo Double Tree. Oatmeal is considered part of the hot buffet! Cost for the cold buffet was $16 per person! For an additional $6, one can upgrade to the hot buffet which included oatmeal, scrambled eggs, Portuguese sausage and bacon, breakfast potatoes, steamed white rice, and French toast. Poor and unappetizing value.",March 2020,Hula Hulas,https://www.tripadvisor.com/Restaurant_Review-g60583-d13126875-Reviews-Hula_Hulas-Hilo_Island_of_Hawaii_Hawaii.html,"Island of Hawaii, Hawaii",restaurants,1.0,3.5
Satisfying late afternoon meal,"We had spent the day hiking at Volcanoes National Park and returned to Hilo ravenous. We arrived for the HBC Afternoon Menu (in between lunch and dinner). We ordered a California Twist Sushi roll with tempura-style soft-shell crab as an appetizer, and two orders of fish and chips. The fish of the day was swordfish and surprisingly, the fish N chips were moist. Along with the Cock N Bull Ginger Beer, the tab came to $64.93 including tax for the two of us.
Good thing we arrived before the start of the dinner hour because there was already a line of people waiting to be seated for dinner. Highly recommended.",March 2020,Hilo Bay Cafe,https://www.tripadvisor.com/Restaurant_Review-g60583-d539482-Reviews-Hilo_Bay_Cafe-Hilo_Island_of_Hawaii_Hawaii.html,"Island of Hawaii, Hawaii",restaurants,5.0,4.5
"Very good food, but slow, inattentive service","We had lunch at the open-air Pineapples restaurant. We shared Fish and Chips and Seared Scallops, along with an Ola Cider glass (Dragonfruit and Lychee). The fish of the day was Mahi Mahi and we ordered the fish n chips furikoke style ($0.75 surcharge) and requested Sweet Potato Fries ($1 surcharge). The menu was enticing and the food was excellent and reasonably priced. Too bad service was slow and inattentive. The tab came to $ 37.96 including tax.",March 2020,Pineapple's Island Fresh Cuisine,https://www.tripadvisor.com/Restaurant_Review-g60583-d3730946-Reviews-Pineapple_s_Island_Fresh_Cuisine-Hilo_Island_of_Hawaii_Hawaii.html,"Island of Hawaii, Hawaii",restaurants,4.0,4.5
Good food; odd service,"We were a party of 7 with reservations at noon. Five of us had arrived at 11:45 am and the hostess said she would seat us as soon as the remaining two arrived which they did about 5 minutes later.... to which the hostess said she wouldn't seat us until the stated reservation at noon -- in spite of the fact that it was a weekday, the restaurant was not at all crowded, and 6 other people had already been seated. We probably would have been seated earlier if we did not have reservations! We all thought this was odd. Food was decent enough - 4 out of 5 stars -- nothing really stellar. We ordered two crab dip appetizers; steak sandwich; 2 seafood louie salad; 2 mahi mahi stuffed with crab; 1 steelhead salmon; 1 cod and chips; iced tea; lemonade; Sprite; and 1 burnt cream. Total bill for the 7 of us was $282 including tax.",February 2020,Skates on The Bay,https://www.tripadvisor.com/Restaurant_Review-g32066-d377656-Reviews-Skates_on_The_Bay-Berkeley_California.html,"Berkeley, California",restaurants,4.0,4.0
Excellent pizza; salad dressing too vinegary,"We were two couples who lunched at the new location on 2nd and Mercedes, which is more spacious than the old location. One couple shared the Greek salad and Butcher Shop Pizza; and the other couple ordered the House salad and Favorite Pizza (sausage and crimini mushrooms). We loved our pizzas; however, we found the salad dressings way too acidic - wasn't sure if there was any olive oil. Also, on the House salad, the candied pecans were missing so we asked for some. There was a long line formed before the restaurant opened at 11 am on Sunday. By the time we finished lunch, there were still people waiting to get in. Highly recommended restaurant. Very reasonable prices - total tab was $70 including tax for the four of us.",February 2020,The Goat and Vine,https://www.tripadvisor.com/Restaurant_Review-g33165-d7929033-Reviews-The_Goat_and_Vine-Temecula_California.html,"Temecula, California",restaurants,4.0,4.5
Excellent pasta,"We lunched at Belottis and shared a ""small"" antipasto which was more than ample for the three of us. We also shared three different pastas: Agnolotti di Lidia stuffed with beef, pork, sausage, spinach and escarole; Casoncelli pasta stuffed with beef, pork, prosciutto and sage; and Tagliatelle al cinghali (narrow pasta with wild boar). All the dishes were excellent and flavorful but the favorite was the Agnolotti di Lidia. One of us ordered a glass of Grecante Arnaldo Capral. Total tab including tax was $83.",December 2019,Belotti Ristorante E Bottega,https://www.tripadvisor.com/Restaurant_Review-g32810-d10067472-Reviews-Belotti_Ristorante_E_Bottega-Oakland_California.html,"Oakland, California",restaurants,5.0,4.5
Very good Mexican / seafood restaurant,"We spent the late morning in Atwater to see the Castle Air Museum, then drove to nearby Merced to pick up maps at the California Welcome Center (which was closed on a non-holiday Monday!). Since there was no cafeteria at the Air Museum, we were hungry and noticed Lupians restaurant across the street from the Welcome Center. We entered the restaurant around 2:15 pm and ordered chicken enchiladas and chile verde. Both of us like spicy food so, while the plates were tasty, we requested fresh chopped jalapenos and hot sauce. The dishes were filling such that we didn't need/want dinner. Total bill including tax was $31. Service was excellent. Highly recommend.",February 2020,Lupians Restaurant,https://www.tripadvisor.com/Restaurant_Review-g32706-d20139076-Reviews-Lupians_Restaurant-Merced_Merced_County_California.html,"Merced, California",restaurants,5.0,5.0
Very good - request map before starting walk,"From the road, the open-air museum does not look like much; however, once one enters the field, it's quite impressive. Be sure to get the map (it may cost $1) which allows you to identify each aircraft. We used our pedometer and the walk involved about 2,500-2,750 steps (about 1-1.5 mile looped path). Neither of us knows much about military aircraft nonetheless we found this attraction interesting. There is an indoor museum as well. We thought we would be able to see the museum in an hour, but we ended up spending two hours at the site. There is no cafeteria but vending machines are available.",February 2020,Castle Air Museum,https://www.tripadvisor.com/Attraction_Review-g29117-d679789-Reviews-Castle_Air_Museum-Atwater_Merced_County_California.html,"Atwater, California",attractions,4.0,4.5
Excellent Hampton Inn but not close to anything,"No quibbles with this Hampton Inn other than it's not close to anything. Nearest shopping area with restaurants is 2 miles south. This hotel has the usual high standards one expects of Hampton Inns in terms of room, bed quality, appearance, cleanliness. Hampton Inns rotate breakfast offerings and on this visit we had scrambled eggs and bacon. Hotel was unusually crowded (sold out) due to the World Ag Expo.",February 2020,Hampton Inn & Suites Madera,https://www.tripadvisor.com/Hotel_Review-g32673-d816729-Reviews-Hampton_Inn_Suites_Madera-Madera_California.html,"Madera, California",hotels,4.0,4.5
Very good customized pizzas,"We like this ""new concept"" pizza where you choose the crust, sauces, cheeses, and toppings. We've been here a few times now and we gravitate towards the thin crust with a combination of marinara and pesto sauces, double helping of spinach, mozzarella and gorgonzola cheeses, sausage and/or pepperoni, and depending on our mood, the addition of mushrooms, olives, artichokes and red onions. The restaurant offers ""standard"" pizzas such as cheese, margheritas, meat pizzas, but we much prefer to add more vegetables. Doesn't matter what toppings one wants, the price is the same. We experimented with toppings and decided that sometimes, less is better; too many ingredients obscure the flavors.",February 2020,MOD Pizza,https://www.tripadvisor.com/Restaurant_Review-g33212-d13808715-Reviews-MOD_Pizza-Vallejo_California.html,"Vallejo, California",restaurants,4.0,4.0
Pepitos Canyon Crest location,"This was our first time at the Canyon Crest location. We met friends for dinner on Margarita Monday where the restaurant offers a 2-for-1 on margaritas. Food was very good and we were able to get separate checks. We ordered two margaritas (one regular blended and one mango blended), chili verde, and two chicken enchiladas. Bill was a reasonable $45 for two (including the discount on margaritas).",January 2020,Pepitos,https://www.tripadvisor.com/Restaurant_Review-g32978-d3335049-Reviews-Pepitos-Riverside_California.html,"Riverside, California",restaurants,4.0,4.0
