title,text,date,place,placeURL,placeLocation,placeType,reviewScore,avgScore
Our go-to place whenever we're in NYC,"After a long cross-country flight, we like to have our first night's dinner in NYC at An'Nam where we'll order Pho to rehydrate and replenish our electrolytes. Our favorite dish on the menu is the steamed fish with vegetables prepared Chinese style with hot oil, soy sauce, and julienne ginger. For appetizers we typically order fried calamari and spider sushi roll. We consider this an Asian fusion restaurant with Vietnamese, Chinese, and Japanese offerings. We love this place (has nice ambience and full bar) and it's perfect for pre- and post-theater.",September 2019,Annam,https://www.tripadvisor.com/Restaurant_Review-g60763-d10027946-Reviews-An_nam-New_York_City_New_York.html,"New York City, New York",restaurants,5.0,4.5
meh,We were hoping to find a good Mexican restaurant in Visalia. We didn't succeed with Alejandra's. We ordered crab enchiladas which we did not like along with a carnitas platter which was average.,June 2019,Alejandra's Mexican Restaurant,https://www.tripadvisor.com/Restaurant_Review-g33230-d4256316-Reviews-Alejandra_s_Mexican_Restaurant-Visalia_California.html,"Visalia, California",restaurants,3.0,4.0
"Good meal, seems overpriced","We were in town for a family event and decided to have dinner at an old-time favorite restaurant. The two of us shared an ala carte salad, one of us had the salmon and the other had the halibut with one ginger beer. The tab was about $110 without tip. Tabs like this are common in the SF Bay Area, Los Angeles, NYC or any large metropolitan area, but it's still a shocker in small town Visalia. Food was decent, however.",June 2019,Vintage Press,https://www.tripadvisor.com/Restaurant_Review-g33230-d468647-Reviews-Vintage_Press-Visalia_California.html,"Visalia, California",restaurants,4.0,4.5
Decent food and service,"We were in town in late October for dinner. Shared the market salad and each of us had the grilled whole branzino. The meal was good, though a bit pricey for Visalia.",October 2019,Jack and Charlie's,https://www.tripadvisor.com/Restaurant_Review-g33230-d2701935-Reviews-Jack_and_Charlie_s-Visalia_California.html,"Visalia, California",restaurants,4.0,4.0
Tasty Ethiopian food,We were in San Jose for a conference and ate at Zeni's. We shared a vegetarian combo and a meat combo with a side salad and spiced Ethiopian tea. The platters were quite filling and delicious with ample injera to scoop up the dishes. Prices were quite reasonable - we spent just over $40 for the two of us.,July 2019,Zeni Ethiopian Restaurant,https://www.tripadvisor.com/Restaurant_Review-g33020-d799524-Reviews-Zeni_Ethiopian_Restaurant-San_Jose_California.html,"San Jose, California",restaurants,4.0,4.5
Casual seafood restaurant,This is the kind of restaurant where you go up to the counter to order your meal. The fish is very fresh and expertly prepared. The aspect I don't like is having to find a table after putting in one's order. Sometimes one has to share a table so one should be prepared to forego privacy and converse with strangers.,July 2019,El Pescador Fish Market,https://www.tripadvisor.com/Restaurant_Review-g32578-d1088743-Reviews-El_Pescador_Fish_Market-La_Jolla_San_Diego_California.html,"La Jolla, California",restaurants,4.0,4.5
Family reunion and long wait in spite of reservations,"We were a party of 50 people in town for a family reunion. The reunion coordinator had reserved dinner at 6:30 pm but we weren't seated until 7:15 pm. We were all very hungry, especially the young kids, so lots of crying and crankiness. On the positive side, the restaurant allowed each family to get separate checks. Natalie was our server and she was fantastic in dealing with the huge clan. The chicken tostada and chili verde plate that we ordered was better than average. Normally would have given 4 stars but deducted a star for the extra-long wait to be seated in spite of having reservations.",July 2019,Cafe Coyote,https://www.tripadvisor.com/Restaurant_Review-g60750-d568355-Reviews-Cafe_Coyote-San_Diego_California.html,"San Diego, California",restaurants,3.0,4.0
Nice hotel with terrific front desk staff,"We were in town for a family reunion. Although we were there at check-in, the room wasn't yet ready. The staff went out of their way to make us comfortable while we sat in the lobby. As Diamond members, we got comp water and snacks. The bedroom suite was equipped with a king bed and a separate living area with sofa bed. The bed was comfortable and it was nice to have a TV in the bedroom and living area since our nephew was with us. Given that this was a weekend and the hotel was at full capacity, the breakfast area was somewhat chaotic with not enough seating area. Overall, our stay was pleasant because of the staff.",July 2019,Homewood Suites by Hilton San Diego Mission Valley / Zoo,https://www.tripadvisor.com/Hotel_Review-g60750-d9719161-Reviews-Homewood_Suites_by_Hilton_San_Diego_Mission_Valley_Zoo-San_Diego_California.html,"San Diego, California",hotels,4.0,4.5
Tomato Keftedes!,"We had just finished a tour of Oia and before heading back to the cruise liner, we wanted to sample one of Santorini's most famous dishes, tomato keftedes made with tomatoes, feta cheese, and onions. We walked along Nomikou checking out restaurant menus and finally came upon Apsithia which offer the fried fritters made with Santorini tomatoes. Yum!!! The restaurant has a gorgeous view of the caldera. We were happy customers.",September 2019,Apsithia Restaurant,https://www.tripadvisor.com/Restaurant_Review-g482941-d12505910-Reviews-Apsithia_Restaurant-Oia_Santorini_Cyclades_South_Aegean.html,"Santorini, Greece",restaurants,5.0,4.0
Good made-to-order pizza,"My friend and I have been here twice and we were happy with our made-to-order pizzas. I ordered a pizza with thin crust, a combination of pesto and tomato sauces, double helpings of spinach, gorgonzola, mozzarella, sausage, mushrooms, and onions. My vegetarian friend loves the cauliflower crust with vegetables and cheese.",October 2019,"Pieology Pizzeria, Moreno Valley",https://www.tripadvisor.com/Restaurant_Review-g32743-d17442618-Reviews-Pieology_Pizzeria_Moreno_Valley-Moreno_Valley_California.html,"Moreno Valley, California",restaurants,4.0,4.5
Ho-hum,Wanted to try a new restaurant that sells salad and ordered the Mediterranean salad with chicken. Nothing special - I didn't finish the salad because it was boring and tasteless.,April 2019,Freshii,https://www.tripadvisor.com/Restaurant_Review-g32978-d12978552-Reviews-Freshii-Riverside_California.html,"Riverside, California",restaurants,3.0,3.5
Tourist restaurant,"This restaurant was recommended by our tour guide. Since this was a tourist cafe, we knew not to have high expectations and thus, we were not disappointed with the fried calamari, saganaki (shrimp in tomato sauce) and Greek salad. The place was busy so service was on the slow side.",September 2019,Niko's Taverna,https://www.tripadvisor.com/Restaurant_Review-g662620-d1507969-Reviews-Niko_s_Taverna-Mykonos_Town_Mykonos_Cyclades_South_Aegean.html,"Mykonos, Greece",restaurants,3.0,3.5
So glad we went to Delos,"Back in 1971, Mykonos was already known as a party island. Forty-eight years later, it's still a party island, only more crowded and more expensive. We knew we would get off the cruise ship, disembark in Mykonos, and then immediately board another boat that would take us to nearby Delos for an archaeological tour. After we got back to Mykonos, we meandered the narrow alleys, had a late lunch, and took photos by the windmills.",September 2019,Little Venice,https://www.tripadvisor.com/Attraction_Review-g662620-d519760-Reviews-Little_Venice-Mykonos_Town_Mykonos_Cyclades_South_Aegean.html,"Mykonos, Greece",attractions,3.0,4.5
One of Europe's oldest cities,"Hubby and I are split about how to rank Knossos. He liked the Bronze-Age Minoan city while I wasn't as inspired given that we saw many other archaeological ruins on our 3-week Greek tour. The site is undergoing major restoration. The site lacks information plaques making it challenging to ascertain the structure one is viewing and its purpose. The most obvious structure, however, is the Palace with its vibrant frescoes. A guide, human or brochure, would be useful when visiting this site.",September 2019,Knossos Archaeological Site,https://www.tripadvisor.com/Attraction_Review-g189417-d1635165-Reviews-Knossos_Archaeological_Site-Heraklion_Crete.html,"Crete, Greece",attractions,3.0,4.0
Oh yeah! Best way to escape the crowds!,"I had been here 48 years ago, before there was electricity on the Greek islands, before the construction of the funicular, before the inundation of cruise ships and crowds. Was horrified to see that we had to wait over an hour to board the funicular to Fira and saddened by how overrun the island was of tourists. Fortunately, hubby and I wanted to hike the 8+-mile trail from Fira to Oia and avoid the crowds. Because we were on a cruise ship, we could not get an early start. Our tender did not get to the port until way after 9:30 am and by the time we reached the start of the trail in Fira, it was past 11:00 am -- already too late and too warm for optimal hiking conditions -- but we persevered because we knew it was either now or never. It took us about 4 hours of hiking (we're senior citizens) before we found the bus stop in Oia. This was one of our top three highlights of our Greek adventure. The trail was not crowded once we got past Imerovigli. Wear sturdy walking shoes (paved, unpaved, rocky, cobblestoned paths), pack plenty of water, wear sunscreen and hat with wide rims.",September 2019,Hiking Trail Fira - Oia,https://www.tripadvisor.com/Attraction_Review-g189433-d2368798-Reviews-Hiking_Trail_Fira_Oia-Santorini_Cyclades_South_Aegean.html,"Santorini, Greece",attractions,5.0,5.0
Interesting museum if you have the time,"We were on an organized tour of the island which included a visit to this museum. It is a nicely curated and informative museum, especially given its compact size. One gets a glimpse of the geologic origins of Milos; the sociological, economic, and technological aspects of mining; and the various minerals which can be found on Milos.",September 2019,Milos Mining Museum,https://www.tripadvisor.com/Attraction_Review-g635606-d605981-Reviews-Milos_Mining_Museum-Adamas_Milos_Cyclades_South_Aegean.html,"Milos, Greece",attractions,4.0,4.5
Spectacularly gorgeous,"On our tour of Milos, we stopped at Sarakiniko Beach. The area is spectacularly scenic with the stark, white stone contrasted against a deep blue sea and sun-lit blue sky. Swimmers and sunbathers abound, as well as hikers.",September 2019,Sarakiniko Beach,https://www.tripadvisor.com/Attraction_Review-g494953-d2171292-Reviews-Sarakiniko_Beach-Milos_Cyclades_South_Aegean.html,"Milos, Greece",attractions,5.0,4.5
Worth the time and effort,"We were on a cruise ship and opted to go on the Delos tour rather than hang out in Mykonos (been there, done that decades ago). Good choice. The island is now uninhabited and requires taking a ferry from Mykonos to Delos. Once we disembarked, we met up with a tour guide who was quite informative. One got a sense of how bustling a place Delos was. Time permitting, it's worth a quick trip to the museum before boarding the boat back to Mykonos. Time on Delos was time well-spent.",September 2019,Archaeological Site of Delos,https://www.tripadvisor.com/Attraction_Review-g202339-d4297568-Reviews-Archaeological_Site_of_Delos-Delos_Cyclades_South_Aegean.html,"Delos, Greece",attractions,5.0,4.5
Interesting Meteora monastery,"Varlaam is the second largest of the 6 surviving monasteries. This monastery shows how the monks were able to ascend and descend using nets and ropes. There is a 16th century oak barrel which stored water as well as a small museum housing painted icons. Seven monks still live in the monastery. No photos allowed and one must wear modest clothes - no shorts, no sleeveless shirts.",September 2019,Varlaam Monastery,https://www.tripadvisor.com/Attraction_Review-g315843-d243301-Reviews-Varlaam_Monastery-Kalambaka_Trikala_Region_Thessaly.html,"Kalambaka, Greece",attractions,4.0,4.5
Nunnery,Roussanou is one of 6 surviving monasteries out of the original 24. Today the venue is a nunnery. No photos are allowed but we were able to see the chapel and the gardens. There is a small shop selling Catholic items.,September 2019,Roussanou Monastery,https://www.tripadvisor.com/Attraction_Review-g315843-d243299-Reviews-Roussanou_Monastery-Kalambaka_Trikala_Region_Thessaly.html,"Kalambaka, Greece",attractions,5.0,4.5
Tour group hotel,"This hotel was the least favorite of our tour group hotels... but thankfully, we didn't spend much time in our room since our group arrived before dinner and we checked out early morning after breakfast. It's an average hotel with nothing special to distinguish itself. Dinner and breakfast were adequate.",September 2019,Amalia Hotel Kalambaka,https://www.tripadvisor.com/Hotel_Review-g315843-d285983-Reviews-Amalia_Hotel_Kalambaka-Kalambaka_Trikala_Region_Thessaly.html,"Kalambaka, Greece",hotels,3.0,4.0
Decent hotel for tour group,We were part of a tour group that stayed in this hotel. The hotel was modern and the hallways stark. Decent room. The breakfast and dinner buffets were adequate and filling. Service by front desk staff was very good and responsive.,September 2019,Amalia Hotel Delphi,https://www.tripadvisor.com/Hotel_Review-g189408-d253645-Reviews-Amalia_Hotel_Delphi-Delphi_Phocis_Region_Central_Greece.html,"Delphi, Greece",hotels,4.0,4.0
Good compact museum,"Highlights of this museum include bronze works, the Sphinx of Naxos, kouros statues, pediments and friezes from the Temple of Apollo, and the bronze Charioteer of Delphi.",September 2019,Delphi Archaeological Museum,https://www.tripadvisor.com/Attraction_Review-g189408-d199057-Reviews-Delphi_Archaeological_Museum-Delphi_Phocis_Region_Central_Greece.html,"Delphi, Greece",attractions,4.0,4.5
Spiritual,"We weren't prepared for the spirituality and energy we derived from visiting legendary Delphi. It is an amazing and fascinating archeological site. As you make your way up the Sacred Way, you'll walk past the Roman Forum. It's easy to miss the small cone-shaped Omphalos, between the Treasuries and the Treasury of the Athenians, which marks the center of the world. Continue walking and you'll reach the imposing Temple of Apollo. Look upwards towards the hills and you'll see people climbing towards the theater. If you are able-bodied, it's worth climbing to the theater; and, if you are fortunate, you'll get an inexplicable surge of energy which will take you beyond the theater to the Stadium. All the hiking from the entrance to the top where the stadium is and back down can be done within 2 hours. Wear sturdy walking shoes and bring water -- very little shade until you reach the stadium.",September 2019,Delphi,https://www.tripadvisor.com/Attraction_Review-g189408-d523823-Reviews-Delphi-Delphi_Phocis_Region_Central_Greece.html,"Delphi, Greece",attractions,5.0,5.0
