title,text,date,place,placeURL,placeLocation,placeType,reviewScore,avgScore
one of my favorites,"This restaurant has been our ""go to"" for family celebrations and nicer nights out for a long time. We go for birthdays, anniversaries, get togethers, good report cards, someone got a raise, all kinds of ""special events."" I would say we are there about once a month, for the past 8 years? We go to Roots or Ruths Chris from time to time, but I have to say I cannot see that it is that much better than a comfortable night with good food and down to earth service at Longhorn! I love that they have great steak, the sides are good, and that they are always bringing new things to try. While they do work with you if you are gluten free, I wish they had a few more options as far as appetizers, sides and desserts for us. My favorite is the Outlaw Ribeye. I have never had a bad one yet. We usually have competent friendly service, we have had a few newbies who goofed something up but always fixed it when it was brought to their attention.
The other night my daughter and I went to celebrate straight A's on midterms (any excuse will do!) and had one of the best experiences we have ever had there, all due to a remarkable server named Gina or Jean? She was incredible. I actually spoke to the manager about her, she was so engaging and excellent. After all the times I have been here, and I am fairly critical, and very much a carnivore, I cannot comprehend the complainers. Maybe they should examine their expectations and attitudes. I love this place!",November 2013,LongHorn Steakhouse,https://www.tripadvisor.com/Restaurant_Review-g46715-d2587148-Reviews-LongHorn_Steakhouse-Parsippany_Morris_County_New_Jersey.html,"Parsippany, New Jersey",restaurants,4.0,4.0
A DC gem,"We stayed here while visiting washington DC. I selected it because I like the consistency of Hampton Inns, it passed the bed bug registry test, and for being so close to DC in the high season, the rates were very affordable. We needed two rooms for 7 people.
The hotel staff and management here are superior. What a difference it makes to have the people at the front desk so cheerful, friendly, helpful and welcoming! The facility is clean as a whistle throughout. The breakfast area is very nice and was well stocked. The rooms in this hotel are smaller than typical for a Hampton, and there are no queen beds-something I found is the case throughout the DC area! Only King or double. We were very cramped in one room-a king with sofa bed, no room at all for a cot for the teenager. If we were traveling with just two or three, it would be plenty spacious. The rooms were well appointed, exceptionally clean, and quiet. The pool is outdoors, has an accessiblity hoist, there is no hot tub.
This hotel is very near to easy access to the freeway into DC, and near the subway station (there is a free shuttle to the subway/train station) so while traffic is very heavy certain times of day, the access is as good as one can ask. There are many fine restaurants and family restaurants as well as a superb healthy grocery store and a mall nearby.
I was exceptionally pleased with this hotel and plan to make it our home away from home any time we travel to DC.",June 2013,Hampton Inn Alexandria/Pentagon South,https://www.tripadvisor.com/Hotel_Review-g30226-d83906-Reviews-Hampton_Inn_Alexandria_Pentagon_South-Alexandria_Virginia.html,"Alexandria, Virginia",hotels,5.0,4.5
Do NOT miss this!,"What a pleasant afternoon we spent wandering the pretty pathways, feeding the ducks, and shopping the cute stores. Friendly service in all the shops, wonderful treats.",June 2013,Olde Mistick Village,https://www.tripadvisor.com/Attraction_Review-g33845-d105370-Reviews-Olde_Mistick_Village-Mystic_Mystic_Country_Connecticut.html,"Mystic, Connecticut",attractions,5.0,4.0
a new favorite,"We got tired of waiting for a table at the Black Pearl, and were enticed into the Candy Store porch level here and boy were we delighted! It was elegant and shady, but the service was top notch and the brunch menu was spectacular. We dined overlooking Bannister's wharf, every morsel of food was excellent-I had the blue cheese bacon burger, hubby had a seafood eggs benedict, Dad had seafood salad, Mom had an egg dish, all was superb. We enjoyed the live piano music playing while we ate. It all felt very gilded age...
We will definitely be back!",June 2013,Clarke Cooke House,https://www.tripadvisor.com/Restaurant_Review-g60978-d443118-Reviews-Clarke_Cooke_House-Newport_Rhode_Island.html,"Newport, Rhode Island",restaurants,5.0,4.0
exceeded expectations,"I made reservations for our 35th wedding anniversary by phone with the most helpful representative ever. She offered me an Ocean front king jacuzzi room at a great price and I jumped on it.
I had read some mixed reviews of this place. Still, it looked like what I was wishing for so decided to give it a try.
I found them to be very friendly and welcoming. We checked in and the bellman told us an easier way to get from parking to our room given my disability. I appreciated that. We were wished a happy anniversary, and she mentioned she was sending up a bottle of champagne!
The location is excellent, right on the sand with a boardwalk leading out. There used to be a line of palm trees, all are cut off a few feet from the ground; not sure if they got too tall and obstructed views or if they suffered hurricane damage. They do look a bit silly. The view of the ocean from our room was wonderful, but to my disappointment, the balcony is NOT ocean front, but ocean view, from the side. Because ours was right on the patio with the hot tubs outside the pool and lounge area, we did not use it as we felt like we were in a fishbowl, and it was noisy. I was really sad about that. I had so counted on early morning coffee looking out to sea.
The room was clean as a whistle, no complaints there at all, but a bit worn and dated. The chair was so stained I could not bring myself to sit in it. The bed, a tempurpedic, was clean, newer, and very comfortable. The kitchenette was well stocked and there was a full size fridge. Good to know for a future visit. The heart shaped jacuzzi tub was great, and worked very well, although it is worn and stained, and the carpet around it is worn and shabby.
I was thinking on the days we were there that if I ever came back, I would beg for a room higher up-we were looking forward to a quiet romantic retreat, but the noise from the adjacent pool, and the early morning shouts of children swimming or on the beach was hard for us. If we had been higher up, it would have been perfect.
We found out when we checked out, that we had been charged for the champagne, and when we disputed it, discovered that we had originally been slated for a fifth floor room, which would have been perfect, and was apparently nicer, but that the owners had extended their stay and bumped us to one of the lower hotel rooms. I almost cried. Our weekend was lovely, but it could have been perfect!! They did deduct the champagne; apparently our free bottle was sent to the original room, lol, so the one we got was thought to be a second order.
If not for knowing that, I would probably not come back-maybe check out one of the other nice resorts we saw along the strip-but because they were so nice, and because it might have been better if the people had not bumped us, we are thinking of giving it another try, maybe in September for my birthday. What I care most about is safe, clean, good service and easy parking, and we had all that, plus an ocean view. I think you will like it.",April 2013,Princess Royale Oceanfront Resort,https://www.tripadvisor.com/Hotel_Review-g41298-d89489-Reviews-Princess_Royale_Oceanfront_Resort-Ocean_City_Maryland.html,"Ocean City, Maryland",hotels,4.0,4.5
a delightful trip,"On a weekend trip to Ocean City MD, we decided to drive down the Jersey shore and spend the afternoon in Cape May, then take the ferry across. We had never done this before, thinking that the expense was ridiculous given that we could drive the long way around for ""free.""
SO GLAD we took the ferry! We chose the 6 o:clock ferry after an afternoon of lunch and walking the shops in Cape May, waited in line at the ferry where when we checked in we were given a happy anniversary card! When I made the reservations, they asked if I had any coupons, or was with a group, and I said no, just the two of us on our 35th wedding anniversary getaway. They remembered that and several signed a card to give us when we checked in, along with a free drink coupon!
We so enjoyed sitting outside with the gentle rolling watching the sunset. Saw some dolphins (which the captain announced over the pa system.) and then went inside for the remainder of the trip. It was such a restful, pleasant interlude in our busy day, we could stroll, chat, snack, and all the while enjoy the gentle rolling, the sea, the sunset. It was a bit pricey at $38, but in my opinion it was worth every penny!
The loading was quick and efficient. The only thing to know is that the stairway up from the parking deck to services was steep and long. There is an elevator if you need it with advance notice. Also, take a jacket...it can get breezy and chilly even on a warm day and you dont want to have to go all the way back down, and shinny between the cars to get yours.",April 2013,Cape May-Lewes Ferry,https://www.tripadvisor.com/Attraction_Review-g34028-d1172802-Reviews-Cape_May_Lewes_Ferry-Lewes_Delaware.html,"Lewes, Delaware",attractions,4.0,4.5
Pleasant luncheon,"We had a list of the five best places to eat from Tripadvisor in hand, when we arrived in Cape May looking for lunch. We had tried to find George's, but turned out the GPS directions are wrong, and when we called to correct them, found out they were not yet opening for lunch in the season. Disappointed, we decided to look for parking and wander the shops. We found a spot and right in front of us was the back of Tisha's, with its patio seating. Checked the menu and decided it was worth a try. Loved it! Husband had crab cakes, I had a fantastic burger, the service was superb and friendly, it was a lovely day to be on the patio smelling the sea air. The inside is decorated beautifully, and the bill was quite reasonable. Will definitely be back.",April 2013,Tisha's,https://www.tripadvisor.com/Restaurant_Review-g46341-d393804-Reviews-Tisha_s-Cape_May_Cape_May_County_New_Jersey.html,"Cape May, New Jersey",restaurants,4.0,4.5
Still my favorite exchange,"This was our second experience with this property, our first was in January of 2009. We were delighted once again. Check in was fast, friendly, and organized. We had a three bedroom-be advised! This three bedroom, which was absolutely gorgeous, was actually a two bedroom with a loft. The loft, which technically overlooks the living room, was spacious and had two twin beds, and would be perfect for kids. We had two adults staying up there, and they were very comfortable, but when anyone is up downstairs, lights are on and noise goes right there. The master suite was incredible with a jacuzzi the size of a small pool, and a freestanding shower and separate toilet. The other bedroom was huge, with two queens, attached to a beautiful bathroom.
Full kitchen, washer dryer, and screened balcony overlooking grounds and pond made it perfect.
The resort is amazing, with 14 pools, onsite restaurants, quick store, deli, krispy kreme, game room, movies, and security. They have tennis, horseshoes, paddleboats, all kinds of things we never used because we were at the Disney parks all day. parking was excellent.
My one and only complaint, and it is a big one, is the EGREGIOUS fees for wifi. SERIOUSLY, in this day and age, it feels like absolute terrorism to charge anything at all, much less 10 dollars a day, for wifi. It is free for owners, but NOT exchangers. It left a very bitter taste in my mouth. Other than that, from BOTH my experiences here, it is as close to perfect as anywhere we have ever stayed.",February 2013,Westgate Vacation Villas Resort,https://www.tripadvisor.com/Hotel_Review-g34352-d84886-Reviews-Westgate_Vacation_Villas_Resort-Kissimmee_Florida.html,"Kissimmee, Florida",hotels,4.0,3.5
Perfect experience worth every penny.,"We tried to get reservations here on our previous visits to WDW and it was booked. I booked well in advance this time, and now I understand why it is so popular. This was the consummate experience-perfect service, excellent atmosphere, and superb food. Canadian french style food, some of the best steak I have ever eaten, and they provided for me, who is gluten free, the best rolls I have ever eaten. The maple creme brulee is the perfect topper for the meal-it was absolutely delectable. You MUST have the potatoes poutine. The description-french fries with reduction sauce and cheese-sounds iffy. But I am telling you, I could have eaten the entire serving bowl-rich, garlicky, it just defies description. I am planning a trip back just to go back to Le Cellier!",February 2013,Le Cellier Steakhouse,https://www.tripadvisor.com/Restaurant_Review-g34515-d492929-Reviews-Le_Cellier_Steakhouse-Orlando_Florida.html,"Orlando, Florida",restaurants,5.0,4.0
it gets better and better!,"We have been eating at The Old Spaghetti factory since we lived in Denver in the 1980's. We loved it then, and though we moved, we make it one of our first choices when we visit Denver. I love the ambience-the quirky decor, stained glass, the railroad car inside, the tucked away booths. But the Spaghetti, most particularly the Mizthra cheese and browned butter, is incredible. To my delight, they now have an extensive Gluten Free menu, so I was able to enjoy my old favorite even though I was recently diagnosed with Celiac disease. Our server was excellent, and the food was served hot and delicious, and the cream sodas (you get to keep the glass!) are delightful. My only disappointment is that there isnt one near me in New Jersey!!!!! Love you, OSF!",January 2013,The Old Spaghetti Factory,https://www.tripadvisor.com/Restaurant_Review-g33388-d380634-Reviews-The_Old_Spaghetti_Factory-Denver_Colorado.html,"Denver, Colorado",restaurants,5.0,4.0
