title,text,date,place,placeURL,placeLocation,placeType,reviewScore,avgScore
has not disappointed us yet!,"Every time we have been, I have been delighted with the perfect service, pleasant relaxing ambiance, and most of all the excellent food. There are always a ton of options that are gluten free that are not salad or grilled fish/chicken like most places. These gluten free meals are as delicious and creative as what gluten eaters can have! My husband loves their paella, so he gets it every time. I get something different every time because the food is so good and it is so rare I get so many good options!!! There are excellent appetizers as well. I just wish they would make their dessert menu more GF friendly. We get soooo tired of ice cream as the only options.",January 2020,Olive Lucy's Kitchen Table,https://www.tripadvisor.com/Restaurant_Review-g60906-d3929686-Reviews-Olive_Lucy_s_Kitchen_Table-Morristown_Morris_County_New_Jersey.html,"Morristown, New Jersey",restaurants,5.0,4.0
exceeded expectations,"This place was amazing! From the actual steles, statues and pillars (most of what you see on the Acropolis is actually replicated to protect the originals from further decay) displays on how they were made, what they meant, what they looked like originally (I never knew they were actually painted bright colors!) glass floors where you walk over actual ongoing excavations, and a phenomenal lego recreation with a humorous eplanatory table, we wished we had allowed more time to explore. We look forward to going back, and will spring for a tour next time going into deeper explanations. It was simply amazing to all of us- don't miss this. I resisted it, thinking we had seen everything at the acropolis itself. Don't make that mistake! It was incredible.",December 2019,Acropolis Museum,https://www.tripadvisor.com/Attraction_Review-g189400-d735521-Reviews-Acropolis_Museum-Athens_Attica.html,"Athens, Greece",attractions,4.0,4.5
You have to do it. And you can. If you are brave. But it is so worth it!,"I am mobility impaired. I thought the Acropolis would be one of places that would be off limits to me. We were smart enough to book the Viator full day Athens private tour, and our wonderful driver knew exactly where to take me and who to talk to. (There is a discount for disabled people and their one companion.) He took me as close as possible to the chair lift that goes to the elevator. Without that you are looking at what would for me have been an impossible climb up hundreds of rough uneven stone flights of steps. The lift is a platform that slowly ascends up the long stairway. Those stairs are shallow and doable if you can walk at all. When you get to the top of that you then are taken into an industrial cage elevator that ascends the vertical cliff. This elevator is NOT for the faint of heart; in fact I was asked in broken English if I had any heart problems. I am severely claustrophobic but this elevator, being an open gauge cage, did not bother me at all. It takes you in your chair slowly up the face of that cliff and when you roll out, facing the magnificent parthenon, and slowly roll past the 7 maidens of the temple, you will find you cannot catch your breath because of the spectacular scale and beauty before you. Pictures fail, words fail, nothing can prepare you for the spirit and aura of this place. The views are incredible- all of Athens, Lycabettus hill, churches and mosques, the entire Agora, Mars Hill, the far mountains, even the coast on a clear day. It was difficult to navigate up at the top- much of the terrain is very rough even for my sturdy chair. Even where you can navigate the chair, prepare to have your kidneys rattled. But I am so so so grateful to the extremely helpful and encouraging staff, my family, and my knowledgable driver for making this possible for me. It more than exceeded anything I could have imagined.",December 2019,Acropolis,https://www.tripadvisor.com/Attraction_Review-g189400-d198706-Reviews-Acropolis-Athens_Attica.html,"Athens, Greece",attractions,5.0,4.5
Exceeded expectations,"This was a last minute booking and I was afraid the 3 pm time slot would shortchange us. It turned out to be perfect! We saw things we needed to see by daylight and then watched the sunset from the top of the spanish steps with St Peter’s in the background- it was amazing.
Our guide Nora was exceptional- knowledgeable, funny, interesting, personable and thoughtful. She took us places even my husband, a multiple visitor to Rome, had not seen and gave us tidbits and backgrounds even on the things he was familiar with.
Seeing Rome by Gil art was one of the best tours we have done. I am mobility impaired and was able to see everything I wanted to, and my family ( husband, adult son and daughter in law) saw more than they expected to or could have on foot. I HIGHLY RECOMMEND THIS TOUR for anyone- first timer or not.",December 2019,Rome by Golf Cart Private Tour,https://www.tripadvisor.com/AttractionProductReview-g187791-d11455545-Rome_by_Golf_Cart_Private_Tour-Rome_Lazio.html,"Rome, Italy",activities,5.0,5.0
MUST see Cant Miss for Duluth,"This is our favorite and standard visitor fare when people come to see us at our bakehouse in Wisconsin. We take a day to bring them to Duluth, to Canal Park, where we start with the LS Maritime Visitor Center. Excellent intro to learning about the lake and shipping industry, history of how Duluth beat out Superior for the harbor, fascinating story behind the Edmund Fitzgerald, even a fun replica of a ship's bridge. There are films depicting the formation of the Great lakes, and of ore boats being filled, emptied, and piloted. We always find it interesting and never get bored, oh- and it s FREE, they have clean bathrooms, a friendly gift shop, and you can watch the ships come in the harbor from inside on a cold day. If it is a nice day, we go outside, watch the bridge come up and wave to the crew on the incoming or outgoing ships. We wander the shops and then finish up with dinner at Grandma's and it is always a big hit of a day.",September 2019,Lake Superior Maritime Visitor Center,https://www.tripadvisor.com/Attraction_Review-g43018-d143787-Reviews-Lake_Superior_Maritime_Visitor_Center-Duluth_Minnesota.html,"Duluth, Minnesota",attractions,5.0,4.5
"Historic. But go for dinner, not lunch.","So I have wanted to dine here for a long time based on reminiscences of family members from days gone by. My cousin brought me here for lunch on my birthday. I was a little disappointed. The building is fascinating, lots of great pictures from old days, historic pictures, tons of carved woodwork and ornate details. The service was prompt and professional, the food was ok, but the view I heard so much about was very underwhelming- basically a great view of the parking lot and another restaurant with a distant view of some lake. Much better views at the Boat Club a block down. Apparently, for dinner, there are white table cloths and a full menu including delectable steaks and so on. The lunch menu was more limited. My cousin had walleye he said was pretty good. I had the specialty burger on the plate (no bun) which brings me to my biggest disappointment- not a great place for lunch if you are gluten free. No GF bread option (Boat Club does.) and I couldn't have the fries or famous chips because they are not fried in a separate fryer, the soup and chili had flour in it, which left me with a choice of sautéed zucchini and squash. And my burger laying naked and shivering on the plate. Perhaps the dinner options of a steak or fish with a baked potato are better for we Celiacs but in terms of service and quality of the food we got, and the ambiance of the historic building I would go back and give the dinner menu a shot.",September 2019,PIckwick Restaurant & Pub,https://www.tripadvisor.com/Restaurant_Review-g43018-d409415-Reviews-PIckwick_Restaurant_Pub-Duluth_Minnesota.html,"Duluth, Minnesota",restaurants,4.0,4.0
stunning surprise,"We did not know about these murals before we arrived in Ashland. We saw one, and then decided to drive down main street to look at the quaint old buildings and happened to see a few more. Stunning! Stopped by the Ashland Historical Museum on main street to find out more, got a brochure and found 15 of the 18. Apparently, there is a guided trolley tour of them in the summer, and I think I will try that next year. I loved reading about the artists, the murals, and the fact that they are real people and places depicted in these murals. Some are tucked away, so the brochure was very helpful. The veteran one brought me to tears, the main street stores one was my favorite, I love the lighthouse keepers...goodness, they were ALL so good! Look for the German candy store painted like a gingerbread house evoking Hansel and Gretel!!! And do not miss the phenomenal mosaic mural on the wall of the food co-op- breathtaking! And even the garbage cans on main street have mosaics! Ashland, GREAT job!!!",August 2019,The Mural Walk in Ashland,https://www.tripadvisor.com/Attraction_Review-g30341-d3332470-Reviews-The_Mural_Walk_in_Ashland-Ashland_Wisconsin.html,"Ashland, Wisconsin",attractions,5.0,4.5
lovely respite in the day.,"This restaurant, formerly the Molly Cooper? recently opened in the downstairs of the Best Western Chequamegon Hotel. The hotel is worth seeing; though it was built in the 80's it was built to look like and capture the ambience of a grand old victorian hotel, with lots of old timey woodwork and antiques. The restaurant is bow shaped, looks out on the water, and has a cool, peaceful decor and ambience to it with soft music and lots of windows. The menu is small but well balanced, and interesting modern classics. I had the chicken with brie and prosciutto wrapped asparagus, my friend had the lemon garlic chicken wings appetizer for her main and took home enough for dinner, too. We splurged on the Swedish Cream award winning dessert and my goodness, they deserved that award! A generous portion of almondy thick cream- like a panda cotta almost, with a layer of lingonberry jam and topped with big fat blackberries and raspberries- it was the highlight of the day and worth the trip by itself. The service was a bit harried- only two girls working- but very friendly and we lacked for nothing. My only wish is that it was a leeeetle bit more Celiac friendly. The server seemed lost about gluten and had to ask about everything- but having said that, the kitchen clearly understood, made adaptations and I did not get glutened.",August 2019,Chequamegon Grill,https://www.tripadvisor.com/Restaurant_Review-g30341-d17640223-Reviews-Chequamegon_Grill-Ashland_Wisconsin.html,"Ashland, Wisconsin",restaurants,4.0,4.5
start here!,"We stopped in to see if they had a map of the murals, and spent an hour absolutely entranced. There are lovely antiques, fascinating historical displays and lots of wonderful miniature mock ups, as well as photos- my favorite was the display of then and now photos. The volunteers are friendly , informed, and helpful, and the gift things are very appropriate and affordable. Loved the display of interesting rocks found in Lake Superior. And, we got our brochure for best seeing the murals. Great stop.",August 2019,Ashland Historical Museum,https://www.tripadvisor.com/Attraction_Review-g30341-d8057375-Reviews-Ashland_Historical_Museum-Ashland_Wisconsin.html,"Ashland, Wisconsin",attractions,5.0,4.5
absolute must.,"we stopped here on the way by, and frankly we just wanted to use the bathrooms. We figured we have been to sooooooo many visitor centers and they are usually clean bathrooms and tons of brochures, maybe an anemic display or two. THIS. PLACE. ROCKS. Seriously, they should charge admission. Better than most museums I have been to. We spent hours, learned SO MUCH, watched a super cool film about shipwrecks of the great lakes, and could have stayed longer but had someplace we had to get to. I cannot express how awesome this place is- it should be a destination and everyone who passes within this region should absolutely make it their first stop.",August 2019,Northern Great Lakes Visitor Center,https://www.tripadvisor.com/Attraction_Review-g30341-d2302518-Reviews-Northern_Great_Lakes_Visitor_Center-Ashland_Wisconsin.html,"Ashland, Wisconsin",attractions,5.0,5.0
escaped with our lives.,"Cannot speak for the food as it turns out. Arrived on a Sunday afternoon, came in to be greeted diffidently by a young woman who seemed irritated by our very presence. There were four occupied tables and about 6 unoccupied VERY DIRTY un- bussed tables. Second young lady came up, asked how many, we told her three- she said ""well, its at least a 25-35 minute wait."" I looked around questioningly, she said ""there are a LOT of people waiting for these tables."" However, we saw no one waiting save two or three on the patio out front. We figured with the unwelcoming attitude, the filthy tables, and lack of apparent servers, they must be woefully and unexpectedly understaffed. We doubted we would have a good experience and left.",August 2019,Vanilla Bean Restaurant,https://www.tripadvisor.com/Restaurant_Review-g43583-d606530-Reviews-Vanilla_Bean_Restaurant-Two_Harbors_Minnesota.html,"Two Harbors, Minnesota",restaurants,1.0,4.0
Wonderful surprise,"I am baffled by the terrible reviews. The restaurant was beautiful, cool clean tones, tastefully decorated, with absolutely stunning views of the lake. The service was friendly and impeccable. The menu for lunch was small and select, but varied. One of us had the crab cakes. She grew up in Maryland and pronounced them very, very good. One of us had the grilled chicken sandwich and normally she is a nibbler but she devoured the entire meal. I had the maple bacon burger, on a gluten free bun, and had a tomato bisque soup in place of the fries (the fries are NOT and cannot be gluten free.)Can I tell you that the soup was absolutely heaven on a spoon, and the burger was the best burger I have ever eaten. I called the server back twice to double check that it was in fact a gluten free bun as it was so soft and delicious. I cannot understand the negative reviews. I will give it another try but as far as I was concerned, we found a new go to place.",July 2019,Boat Club Restaurant,https://www.tripadvisor.com/Restaurant_Review-g43018-d12328849-Reviews-Boat_Club_Restaurant-Duluth_Minnesota.html,"Duluth, Minnesota",restaurants,5.0,3.5
iffy,"Ok, we went here last year and had a wonderful experience with great food and a nice chat with the owner. Wanted to get back this year and this time it was not so great. Sunday afternoon, we stopped by for lunch while out enjoying a drive. Only one other couple in the place. Greeter seemed nice but reserved- said hi and went back to her work, while we finally awkwardly chose a seat. The young lady doing the cooking seemed irritated we were interrupting her day. The advertised gluten free bun was ""no longer available"" and the cook then asked me if I wanted it on a regular bun instead. Um, CELIAC. I asked for gluten free bun because I CAN NOT HAVE WHEAT. Then the potato wedges looked battered. I asked, server said she would ask cook. Cook said no flour. So I ate three, when the server then came back and said the cook isn't ""FOR SURE"" they aren't battered, she had thrown the box they came in away! IT IS REALLY IMPORTANT TO KNOW THESE THINGS. I cant just take a chance on it. I ate no more and lost confidence in the safety of the food. Too bad because the meat was cooked juicy and just right, and my partner loved his mama burger. I just felt like we wandered in rather unwelcome and got the babysitters trying to run things. Most disappointing. If you do not have food allergies, you will love this cute, clean, adorable place with cute menus and excellent burgers. I hear the chicken is very very good, too. Also my partner has had the blueberry pancakes and thinks they were the best he has ever had. Nice stop on a nice day bumming around the lake.",May 2019,Bear Paw Cafe,https://www.tripadvisor.com/Restaurant_Review-g60201-d8447013-Reviews-Bear_Paw_Cafe-Port_Wing_Wisconsin.html,"Port Wing, Wisconsin",restaurants,3.0,4.5
Perfect stopping point,"This hotel was well within the expected Hampton quality, cleanliness and friendliness I count on. Looks like they are in the process of updating and upgrading. It was safe, comfortable, quiet. Perfect.",April 2019,Hampton Inn & Suites Hoffman Estates,https://www.tripadvisor.com/Hotel_Review-g36141-d224317-Reviews-Hampton_Inn_Suites_Hoffman_Estates-Hoffman_Estates_Illinois.html,"Hoffman Estates, Illinois",hotels,4.0,4.0
nice and new,"Clean, new property has a few wrinkles to iron out. The decor Hampton is trying out is trying to hard trendy, and I hope it passes quickly- barn door sliding shower doors and closet/bathroom door...bed in a weird place making it awkward to watch tv or get to the bathroom. But it was quiet, good location, priced well and mostly friendly.",January 2018,Hampton Inn Denver Tech Center South,https://www.tripadvisor.com/Hotel_Review-g609128-d12384295-Reviews-Hampton_Inn_Denver_Tech_Center_South-Centennial_Colorado.html,"Centennial, Colorado",hotels,4.0,4.5
cannot beat the value,"We stay here on our trips from NJ to Wi, because the service is excellent, the breakfast always good, and the rooms are impeccably clean. They are a little dated perhaps, not the fanciest Hamptons, but for the money, it is beyond an excellent place to stay- right off I-90 but tucked in a corner so it is quiet, plenty of well lit parking, and several restaurants very close by.",August 2017,Hampton Inn Chicago/Elgin,https://www.tripadvisor.com/Hotel_Review-g35942-d90648-Reviews-Hampton_Inn_Chicago_Elgin-Elgin_Illinois.html,"Elgin, Illinois",hotels,4.0,4.0
phenomenal photography with real life and artistry,"This gallery is filled three floors with the artistic wildlife and landscape photography of this amazing artist. The life he captures is breathtaking. There are also books of his work and DVD's available, and the prices on these works (which can also be found hanging in the JH airport) include three types of mounting/framing. They will also ship for you. I have seen a lot of nature photographs but nothing that draws you in and captivates you like Tom's does. The staff are helpful and friendly, ask for Rita. We thoroughly enjoyed our time and plan to head back when we make our decisions about what we want!",January 2017,Images of Nature by Thomas Mangelsen,https://www.tripadvisor.com/Attraction_Review-g60491-d3565054-Reviews-Images_of_Nature_by_Thomas_Mangelsen-Jackson_Jackson_Hole_Wyoming.html,"Jackson, Wyoming",attractions,4.0,5.0
great coffee bar,"They grind their own blends of coffee, and serve up some unusual style latte's such as Mexican mocha(smooth with a nice kick) and huckleberry mud pie among others. Friendly place to take a load off and enjoy a hot drink on a cold day- and you can buy their coffee ground to your liking to make at home.",January 2017,Cowboy Coffee Co.,https://www.tripadvisor.com/Restaurant_Review-g60491-d3365591-Reviews-Cowboy_Coffee_Co-Jackson_Jackson_Hole_Wyoming.html,"Jackson, Wyoming",restaurants,4.0,4.5
different and tasty,"We had heard a lot about this place, had seen its reviews on Tripadvisor, our guide mentioned it, and it came up in a recommended gluten free restaurants site. Perhaps it was overhyped, or perhaps I was fatigued from my journey but It wasn't what I expected at all.
First of all, it is very, very small and cramped. The tables were unclean because it was very busy. There were very very few gluten free options after all. I had a most delicious and unique omelet, with cauliflower and other vegetables and herbs in a wonderful sauce and I was not disappointed. Husband had the croque madame and loved the flavorful ham and gruyere cheese on a hearty slice of artisan bread. Not something you generally find anywhere else. But there were very few pastries or treats at all, and only one gluten free. I was told they usually had a rich chocolate brownie type cookie that was gluten free but was sold out. Came the next day to try it, and again, it was ""sold out."" Either it is THAT GOOD, or there isn't much demand for it so they don't make it or make enough, I don't know.
I might try this place again just because the food was so unique and tasty, but I won't count it on my gluten safe list. When a place lists itself as gluten free friendly, but don't even have a gluten free bread for their many sandwiches, or gluten free bakery items, it is disappointing. Perhaps in the summertime with the influx of visitors, they have more. I recommend you give it a try, though. Unless you are claustrophobic.",January 2017,Persephone Bakery,https://www.tripadvisor.com/Restaurant_Review-g60491-d4453231-Reviews-Persephone_Bakery-Jackson_Jackson_Hole_Wyoming.html,"Jackson, Wyoming",restaurants,4.0,4.5
"Best Chili, best experience!","We found this on Tripadvisor and decided to give it a try after a long day negotiating the hordes in DC Easter Weekend. What a treat! It is a small, relaxed kind of place, very warm and welcoming. Our server brought us drinks and two sampler trays of the chili and explained them. She complimented all of our choices, and she was right, they were all superb! Tater tot dish, chili burger, chicken alamo, and a corn bread chili dish were delectable, perfectly seasoned and hearty. Drinks kept coming, and we left full, satisfied, comforted, renewed, and only sorry there isn't one of these near us in New Jersey! I actually tried to buy the seasoning packet for their Texas meat chili on their website, where they have several things available, but the shipping was more than the product so guess I will just have to find another reason to make the DC trip again!",March 2016,Hard Times Cafe,https://www.tripadvisor.com/Restaurant_Review-g30226-d465354-Reviews-Hard_Times_Cafe-Alexandria_Virginia.html,"Alexandria, Virginia",restaurants,5.0,4.0
"clean, reasonable, convenient","We have stayed at this hotel before with family members. It is an exceptionally well maintained, clean, nicely appointed hotel very convenient to the city but with great rates and free parking. My only concern this trip was that the staff seemed cold and preoccupied, and did not greet us when we came in or out, appeared to be almost surly when interrupted. Others in the elevator commented on this as well, so it reassured me that it was not just me. This was not the case the last time we stayed so perhaps it was an aberration. I hope so. It is called the hospitality industry for a reason- people want to feel welcomed and trusting. There are restaurants within easy distance of this hotel, and it feels like a clean safe area, and only took us 15 or 20 minutes to zip into DC. Be aware that they, like most hotels in the DC area, have king beds or double beds- finding two queens in the DC area is very hard to do. This hotel has only an outdoor pool, but since we no longer have young kids, that is no big deal to us. The food service is good- waffles, the usual omelets or scrambled eggs and sausage, even gluten free cheerios for we Celiacs. Great coffee, and cookies and fruit round the clock. We love Hampton Inn!",March 2016,Hampton Inn Alexandria/Pentagon South,https://www.tripadvisor.com/Hotel_Review-g30226-d83906-Reviews-Hampton_Inn_Alexandria_Pentagon_South-Alexandria_Virginia.html,"Alexandria, Virginia",hotels,4.0,4.5
it adds up.,"A friend suggested this cafe because I am Celiac, and they offer gluten free options-a relative rarity in New Jersey. I live in Summit, but have never tried this little cafe across from the theater on Springfield Ave. I looked up the menu and was impressed.
This is not a sit down and be served cafe. You line up, order soup, salad and or sandwiches, and wait til they call your name-sort of Panera lite.
It is small, clean, modernly spare decor, the staff was friendly.
My first disappointment was that there were 4 soups and the only GF offering was cream of mushroom. Blech. Mushrooms are a distinctive flavor. You like it or hate it. Im in the latter camp.
The sandwiches look good and they offer Udi's GF bread as an option.
The custom salads are superb. You take a menu and circle your choices of greens, veggies and add ons and dressing. They make it, and call your number.
But first, you pay...and i mean PAY. The custom salad base price is 7.95. With that you choose one of four greens, and three veggie choices. And a dressing. Good variety, fresh quality. But each additional veggie is a dollar, and then there are add ons, ranging from 2-4 dollars each-bacon, chicken, boiled egg, cheese, avocado, etc. Before you know it, your yummy custom salad is twice that. I had a kale salad with onion, bacon, and avocado, cucumber and beets. It still seemed mostly kale- and cost me 15 dollars.
I can see how it could easily have added up to twice that if I put on it what I would at a help yourself salad bar.
My other beef is that when you pay, they turn the screen around and ask you to enter a tip. Your choices are no tip, 15, 18 or 20 percent. It made me feel backed into a corner. Why should I tip for no service? You get your own soup, your own drink, and you come up to the counter and pick up your own food. But if I put no tip, I seem a cheapskate. And I have no way of knowing if I would get ""punished"" for that.
I may give this place another try- on a day with a GF soup I like and try the sandwich. Will probably avoid the fresh and tasty but overpriced custom salad because it is too easy to circle the add ons. It is tasty and clean, but a little tinny in the noise department, and the bill will be much higher than you expected. Adjust for that and you will like it just fine.",January 2016,Batavia Cafe,https://www.tripadvisor.com/Restaurant_Review-g46855-d5563019-Reviews-Batavia_Cafe-Summit_New_Jersey.html,"Summit, New Jersey",restaurants,3.0,4.0
