title,text,date,place,placeURL,placeLocation,placeType,reviewScore,avgScore
one of a kind service from a chain...,"I love this chain. Like any chain, some are excellent, some are, shall we say, complacent. This one definitely cares.
I have two allergies that make chinese food dangerous- celiac disease (gluten-wheat, rye and barley) and shellfish. For the most part, I avoid asian cuisine because they use fish or oyster sauce, soy sauce, and it just turns out to be a problem. Not so here!
The chain has a special menu tailored for allergies. I only have a few options but all are excellent.
The service at this particular establishment was superb-I felt heard, cared for, safe, and catered to. It was clean, pervasively friendly without being intrusive, and if I lived anywhere near here I would be such a regular they would know my name.
Now, if we can just get PF Changs to bring back Phillips better lemon chicken!!!!!!!!!!!!!!!!!!",December 2015,PF Chang's,https://www.tripadvisor.com/Restaurant_Review-g29144-d2458220-Reviews-PF_Chang_s-Aurora_Colorado.html,"Aurora, Colorado",restaurants,4.0,4.0
not gonna make it...,"With a prime location right next door to the MAYO and some interesting fare, a quirky decor, and having started out well, I was hopeful. Subsequent trips back have left me unhappy in more ways than one.
For starters, we had reservations made months in advance for a 5:45 seating. When they started to seat us in THE most undesirable table in the entire restaurant, a table smack in the middle of high traffic, in the line of gale force winds each time the door opens, we asked if we could have the booth sitting empty instead. I am disabled and have trouble maintaining my balance on the ridiculously uncomfortable tiny round bistro seats. We were told no. I asked if it had been specifically reserved and was told no, but that it was a ""timing issue."" We explained the problem, and they politely but steadfastly refused to accommodate us. 15 minutes later another group of four came in and were given the booth. I was miserable the entire meal. Had to wear my coat as cold causes my body to seize up. Had to have help maintaining my seat. Just awful and no one could give me a reasonable explanation as to why we could not be moved to another table.
Secondly, I have doubts about their understanding of gluten free. The server is happy to go ask, but three times she went to ask and never came back with the answer. I questioned two things- how could a polenta made with pumpkin ALE and a pudding made with STOUT be gluten free? No one ever could tell me, so I was afraid to eat it.
Which brings me to another issue- I love the movement toward smaller, specialized seasonal menus locally sourced. But this is the SAME EXACT TINY MENU we have had since we came in August, October, and December. I have now had all three things I care to try. And there are only the same three desserts, only one of which is truly gluten free.
I also need to give some feedback about the drinks-they sound wonderful! They sound AMAZING! and they taste...well...kinda gross. I tried the cucumber mint and the pomegranate lemonade and the apple fizz. Husband had the spiced harvest tea. All of them are TOOOOO SWEEET and the taste is lost in the heavy hand of cinnamon or mint and simple syrup. Tone that back and bring out some of the natural flavors.
The duck was good, the hanger steak good but nothing special, the braised lamb was excellent, the hamburger was tasty and the fries are good, daughter said the pork chop was the best she had ever had. There is...or was...potential, but they need to tune it up a bit.
Im not sure I have it in me to try again- it was chaotic, and I was left so cold by the absolute refusal to accommodate my needs-with so many many excellent choices within walking distance (and parking is a real issue for this restaurant as well) I think I will expand my horizons for before or after shows.",December 2015,South+Pine American Eatery,https://www.tripadvisor.com/Restaurant_Review-g60906-d8336430-Reviews-South_Pine_American_Eatery-Morristown_Morris_County_New_Jersey.html,"Morristown, New Jersey",restaurants,3.0,4.0
"perfect location, great food.","We decided to give this new place a try mainly because of the location, smack next door to the Mayo Performing Arts in Morristown. The reviews commended the food, so we thought it was worth a try. It was.
The atmosphere is interesting quirky, shabby chic and eclectic, with painted doors and old windows hung on the wall, copper cookware as art and yet beaded glass chandeliers. I loved it! The waitstaff are friendly and easy to spot with their matching black tee shirts, and at least ours, Alex, was VERY knowledgable about the menu and clearly up to speed on the Gluten factor, something important to me with Celiac. While it did appear at times that the staff were running in circles or things were a little chaotic, the reality was our service was friendly, attentive without being intrusive, timely, and efficient.
The food was excellent. I like the smaller menu. One feels the food is fresh and done right rather than yanked from the freezer and quickly done up. The food is interesting and a little different without being weird and too artsy. I had the Black Garlic Caesar salad, with perfect kale, shaved parmesan, chick peas, and a tangy garlic dressing. Simple, but delectable. Daughter had the Apple salad, which she said was excellent, with the sweetness of the fruits contrasting nicely with the tartness of the dressing. She ate every bite. We shared the signature burger, without the bun. I asked for the egg to be cooked hard, as I dislike gooey yolk. I know Chef's hate that, but it was my preference and it came out with the white cooked crisp and the yolk still uncooked. Not soft, I mean, totally wet. Alex apologized and offered to take it back but I preferred to remove the egg and eat the cheeseburger. It was otherwise cooked perfectly and very tasty.
Husband wanted the duck, but Alex explained that it was already sold out (at 5:45 on a Saturday night-Im guessing for whatever reason they just didnt have any that day, which happens. We will try back.) so he went with the Chatham Cod, which came in a chowder sauce with a nice chorizo crisp sprinkled on it. He said it was excellent and filling.
We finished up with the Chocolate Stout pudding with pretzel topping for husband, which came in a generous bowl, and which he cleaned up and almost licked the bowl, and the Pumpkin Panna Cotta, without the graham cracker streusel for we ladies. It was served in a mason jar, rich with pumpkin pie flavor and with a heartier texture than typical panna cotta. I loved it.
The only iffiness of the night was with the drinks- while I enjoyed very much the cucumber mint cooler, a refreshing maceration of cucumber with mint in club soda, my table mates did not care for it at all. Their Autumn spice ice tea (think constant comment meets chai) and Pomegranate lemonade were both excruciatingly sweet. The tea was consumed by both but the Pomegranate lemonade was all sweet and no flavor-maybe a bad batch? They left it, and after I tasted it, I didnt blame them.
We left feeling delighted with the restaurant on whole, and looking forward to coming back for the Hanger steak, the missing duck, and the lamb shank. I hope the menu changes seasonally, because it is very small, but I must say it is done right and I hope South&Pine make it in the cutthroat Morristown scene-not just because of their perfect location for the show, but because chef Leia Gaccione has something special and remarkable to offer.",October 2015,South+Pine American Eatery,https://www.tripadvisor.com/Restaurant_Review-g60906-d8336430-Reviews-South_Pine_American_Eatery-Morristown_Morris_County_New_Jersey.html,"Morristown, New Jersey",restaurants,4.0,4.0
like dining at a friend's house,"Our extended family has been vacationing or living at Lake Nebagamon since 1930, so we have seen a lot of restaurants in the area come and go. We just bought a house in Lake Nebagamon, and made three trips in as many months in the process. Each trip included one or two visits to Twin Gables.
It is small, the front is a restaurant room and the back is a bar. The menu is substantial, and enhanced by specials written on the chalkboard wall. But when you walk in, you walk into a warm, friendly, welcoming place run by the ever present and smiley Sherry, and as she is hugging and greeting regulars and locals by name, one thinks of ""Cheers, where everybody knows your name, and you are really glad you came.""
They are known for their fish frys (whitefish on Friday, Walleye on Saturday, broiled or fried) their ""Broached"" chicken in its crispy batter, and the fall off the bone ribs in tangy sauce. And their pies-oh, dear Lord, their PIES! The strawberry Rhubarb was perfection in a flaky crust. There is a selection of fruit pies and a cheesecake or two, maybe a chocolate silk...if you have room. If not, trust me, ask for it to go and take it home.
The service is excellent, the salad bar fresh and varied, and watching Sherry run around making it all look easy puts a smile on your face and a hug in your heart.
This place has been around a long time, and i hope it is around forever somehow. You can't go wrong, unless you come in expecting New York Dining or have a bad attitude. This is down home cooking in a down home atmosphere and it just doesn't get any better than that.",October 2015,Twin Gables Cafe & Lounge,https://www.tripadvisor.com/Restaurant_Review-g59739-d4919560-Reviews-Twin_Gables_Cafe_Lounge-Brule_Wisconsin.html,"Brule, Wisconsin",restaurants,4.0,4.5
clean and helpful,"I love Culvers. And not just for their flavor of the day ice cream. While the ice cream (custard style) is the ultimate in creamy and flavorful without being cloyingly sweet, and with the infinite variety of flavors, styles and add ons, they also have a solid menu that grinds all other ""fast food"" into the dirt. There is a reason that across the street, the golden arches employees were bored while the lot here was full and the drive through here was four cars deep.
From a perfect burger with a warm, soft, gluten free bun, to the pot roast sandwich, they offer things you can't get other places. The usual suspects of burgers, chicken fingers, etc are surprisingly fresh tasting, and the fries are hot and crispy every time. EVERY. TIME.
But what really sets it apart for me is the fresh faced friendly helpful go out of their way to make it a good experience staff. No waiting at the counter with a dozen other milling people-they deliver it to your table, hot and ready. They take your order cheerfully and patiently, bring it while it is hot, and ask what else they can do for you.
This is a well run chain, and Superior has an especially well managed restaurant with a well trained staff who keeps the place clean as a whistle and filled with happy faces.
And they offer free wifi-and that, my friend, is like the cherry on the top of a perfect Sundae-which they also have in spades.",October 2015,Culver's,https://www.tripadvisor.com/Restaurant_Review-g60320-d409545-Reviews-Culver_s-Superior_Wisconsin.html,"Superior, Wisconsin",restaurants,4.0,4.0
a favorite that gets better and better,"For many many decades, our extended family has been stopping at Tobies as the ""halfway point"" between the Twin Cities and the North Woods where we own cabins. It used to be a pull off of the highway into the lot, for the bakery and a few tables for soup and sandwiches, and now it is a big bakery, restaurant, and more at the interchange. But it still makes the BEST pecan rolls and Limpa bread you can get anywhere. In recent years, they have added more foods, gifts, treats, and souvenirs, but the best thing they have added is the selection of gluten free items for the Celiacs among us who watched enviously as the others devoured cinnamon rolls and pies and smacked their lips. On a recent trip, the Gluten free offerings included cinnamon rolls, pies, flaky biscuits, lemon bars, carrot cake and coffee cake. We stocked up as usual with bread, limpa, carmel pecan rolls, cinnamon buns, pies and so on for the week, and stoked up with coffee and jams, and as we left, as we have every trip, we blessed the friendly servers and the excellent baked goods, which despite the growth and touristy feel, have maintained their quality no matter what.",October 2015,Tobies Restaurant and Bakery,https://www.tripadvisor.com/Restaurant_Review-g43164-d508358-Reviews-Tobies_Restaurant_and_Bakery-Hinckley_Minnesota.html,"Hinckley, Minnesota",restaurants,5.0,3.5
clean and quiet.,"I stay at Hampton Inns because they are consistent-great beds, good food, clean, and friendly. We chose this one because we wanted to be out of the city toward the North where we were headed.
The staff were friendly and professional, the room was clean and exceptionally quiet. I was surprised that the bathroom door knob was hanging loose-Hamptons are usually on the ball with this kind of thing, and as with most of the older Hamptons there are a lack of grab bars for safety in the bathroom. I wish wish wish hotels would protect themselves from liability and guests from injury stepping into and out of the shower/tubs where the floors are frequently wet and often at a different level by simply putting a grab bar on the wall next to it for grabbing as one enters or exits the shower.
This Hampton was otherwise in great condition, with a quiet and efficient cooling system, solidly built and quiet, clean as a whistle, and helpful-one of the staff brought me water when she overheard me tell my husband I was terribly thirsty when we arrived, and another cleaning the breakfast area saw me having difficulty and jumped to help me manage my coffee and plate.
We will definitely make this our regular stopping point when we fly into MSP and drive up to our vacation house in the Northlands.",October 2015,Hampton Inn & Suites Lino Lakes,https://www.tripadvisor.com/Hotel_Review-g43259-d674762-Reviews-Hampton_Inn_Suites_Lino_Lakes-Lino_Lakes_Minnesota.html,"Lino Lakes, Minnesota",hotels,4.0,4.5
Never fails to impress me.,"There is a reason why it is hard to get in to this restaurant. Make your reservations in advance. This visit, we decided to give lunch a try, since booking a month in advance still had no dinner time options that worked for us.
I find it perplexing and amusing to read reviews from people saying it was ""gloomy"" and overpriced. Clearly people from sunny, cheap regions who are accustomed to plain hearty tasteless fare.
We have eaten here many times, and have eaten at almost all of the Epcot restaurants over the years. Most are very good to very okay. This is superlative.
I love the atmosphere-far from gloomy, I find it cozy, cool and quiet. The service is some of Disney's finest, and that is saying something since most of the retail world could learn from Disney's service training.
I always mention in my reservation that I have Celiac (gluten allergy) and they always have fresh, hot, delicious GF rolls for me, and are very knowledgable about what is safe for me to eat. I have never gotten ""glutened"" by accident there.
From the OUTSTANDING Poutine-homecut fries slathered with a garlicky red wine reduction and topped with fresh cheese curds and truffle salt- (I could eat this every day and never ever tire of it.) to the fresh crisp and tangy salads, to the absolute perfection of the steaks, and finishing with our favorite Maple Creme Brûlée, we are always stuffed, satisfied, and eager to come back. Husband really likes the beer cheese soup, and the maple glazed salmon, as well. The wines are very good and pair nicely.
I rarely bother to review someplace every time I go, but I am always so pleased with this choice, I felt I needed to let people know-it is still excellent, it is worth every penny, and I look forward to it all year.",April 2015,Le Cellier Steakhouse,https://www.tripadvisor.com/Restaurant_Review-g34515-d492929-Reviews-Le_Cellier_Steakhouse-Orlando_Florida.html,"Orlando, Florida",restaurants,5.0,4.0
Nice venture into exotic dishes,"I loved the spices used in the Moroccan lamb sausage, the rack of lamb was done perfectly and very tasty, and husband thoroughly enjoyed the trio of Baklava for dessert. Service was friendly and professional, we sat on the covered patio with marginal views of the Illuminations fireworks show- it is billed as a good viewing spot, but the reality is that the show takes place in the lagoon on the other side of the center island, so the view is obstructed somewhat. Still, we could see it, we were out of the rain, and it was a pleasant and tasty meal at a good price for what we got. My only real disappointment is how few gluten free options there are for we Celiacs. Kudos, however, to the well trained knowledgable wait staff-they knew what was safe to eat and what was not. It was nice to visit, but I doubt I will be back.",April 2015,Spice Road Table,https://www.tripadvisor.com/Restaurant_Review-g34515-d6024259-Reviews-Spice_Road_Table-Orlando_Florida.html,"Orlando, Florida",restaurants,4.0,4.0
Around the world without leaving the USA,"I love the World Showcase. It is a fun way to sample different flavors and unique imports for countries around the world, all staffed by actual nationals of that country, who are eager for the most part to answer questions and share their heritage. The shows are well done and entertaining, as well as informative, and the gardens are spectacular. Try to get a good seat for the Illuminations show-it is wonderful and uplifting-a perfect end to a great day at Epcot.",April 2015,Epcot World Showcase,https://www.tripadvisor.com/Attraction_Review-g34515-d1036082-Reviews-Epcot_World_Showcase-Orlando_Florida.html,"Orlando, Florida",attractions,5.0,4.5
Couldn't be better!,"This Spanish influence restaurant in the heart of the old town, right off the pedestrian walk, was the whole package for lunch. We sat in a bright atrium area, had a funny, interesting server (David the fisherman) and I had many gluten free choices to select from. We shared the 1905 salad, I had the Palomilla steak, which was delicious, husband had a combo of Mixto Cuban sandwich, black bean soup, and an empanada, and pronounced it all ""excellent.""
Cant wait to go back! Kept waiting for Desi Arnaz to start crooning, ""Babaloooo!""",April 2015,Columbia Restaurant,https://www.tripadvisor.com/Restaurant_Review-g34599-d390355-Reviews-Columbia_Restaurant-St_Augustine_Florida.html,"St. Augustine, Florida",restaurants,5.0,4.0
Why is this place not packed???,"I generally do not put hotel restaurants high on my list. My experience has been that they tend to be very over-priced, with not a lot of concern for the quality that guarantees repeat business. Based on trip advisor reviews, we decided to give Blue Morel a chance for something new.
I was dismayed when we were seated, because there were only three tables taken. That remained the case for the evening. I wondered uneasily if there was a reason for it-do people know something I don't know?
Then we had the most wonderful evening! Two particular superlatives I must give high credit for. This is THE ONLY restaurant in this entire region I have been to where they brought me gluten free bread, without my even requesting it. The mid atlantic is woefully behind in meeting the needs of those of us with Celiac. I let the waiter know when I asked about my choices, and the next thing I knew, to my delighted surprise, they came with warm GF rolls. Wow!!!! The waiter was very knowledgeable about what I could eat and I felt very safe.
The second is that according to dear husband, they have absolutely the BEST wine by the glass menu he has ever seen.
We were there on a sunday evening. The sunday menu is Prix Fixe-select an appetizer, entree, and dessert from the varied and ample choices, with a handful of extra choices for an up charge.
I was impressed by the creative but not weird offerings. I had the apple compote squash soup and it was very good. Husband found the duck confit odd- a patty on greens-but tasty. His sea Bass was PERFECT, and my rib eye steak was better and cooked more perfectly than any I have had at any steakhouse in this area. I was stunned into delicious silence. Everything we had, down to the chocolate brioche husband devoured to the three scoops of sorbet (coconut, cranberry, and blood orange) was prepared perfectly, served beautifully, and scrumptious.
The service was warm and professional, present without hovering. The ambience was subtle and peaceful, and I loved being able to converse without competing with loud music, and chattering crowds.
I have no idea why this place was not crowded with regular customers. Either it was the sunday afternoon, or word needs to get out. Why would anyone want to deal with Morristown's parking issues, jostle the crowds, and shout over meals to be heard, when there was a top New York City quality food and service with easy parking and lovely surroundings just a little down the road?
We will not only be back-often-but we plan to start encouraging our friends to enjoy what we did.",March 2015,Blue Morel Restaurant and Wine Bar,https://www.tripadvisor.com/Restaurant_Review-g60906-d2298253-Reviews-Blue_Morel_Restaurant_and_Wine_Bar-Morristown_Morris_County_New_Jersey.html,"Morristown, New Jersey",restaurants,5.0,4.0
Still loving it!,"This restaurant, housed since the mid 1970's in a 125 year old former cable car and powerhouse building in gentrifying downtown Denver is a family favorite since 1979. It is so much fun to take our adult children and their wives there and regale them with tales of our past-""right there, in the Cable car tables, I told your dad I was expecting you!!!""
In all that time, it has only gotten better and better. The food is solid American style Italian, trustworthy pasta, chicken Parm, salads, etc. It is the ONLY place I have ever found that serves their delicious Mizithra cheese and browned butter sauce. It comes with a decent salad and is followed up with Pistachio or other ice cream. They have fun drinks that come in keepsake glasses (of which we now have a full set, lol.) All around are antiques, tiffany glass, old repurposed stained glass windows, and nostalgic prints. There is some kind of magic in the air there, that makes the food taste better, the heart sing, and laughter flow! It has recently been remodeled, but retains its unique and cozy decor and ambience. I love that the area is now so clean and safe and that parking is improving. This is our go-to whenever we visit our kids in Denver, and you simply must not miss this place.",August 2014,The Old Spaghetti Factory,https://www.tripadvisor.com/Restaurant_Review-g33388-d380634-Reviews-The_Old_Spaghetti_Factory-Denver_Colorado.html,"Denver, Colorado",restaurants,5.0,4.0
