title,text,date,place,placeURL,placeLocation,placeType,reviewScore,avgScore
Good room and good service,Stayed for one night on the way to Yellowstone and one night on the return and found the room very clean and the staff very friendly. Room was on the Ground Floor. Had dinner in the dining room - Grilled Salmon burger was excellent and the staff were very service friendly. The main reception area had a lovely fire and was very comfortable. Bed was very comfortable as well. Breakfast was ample and exactly what I ordered. I would stay here again for sure.,February 2017,Holiday Inn Bozeman,https://www.tripadvisor.com/Hotel_Review-g45095-d91180-Reviews-Holiday_Inn_Bozeman-Bozeman_Montana.html,"Bozeman, Montana",hotels,4.0,3.5
Just breathtaking,"This is such an incredible Resort with hosts Wolfgang and Renate providing the ultimate in customer service. Catering for a small amount of guests, it is an easy 20 minutes drive out of Whitehorse where it offers solitude and opportunities to photograph the Northern Lights and skies without the glare of the city lights. The Chalets were immaculate - I was in the Enzian - my daughter and son-in-law in the Arnika and both were so comfortable and warm especially in the minus 30 degree temperatures outside. Home cooked meals are served in the main house and are delicious. Breakfasts are not the heavy usual but are light and enough to get you going to start the day. Dinners are incredible. I would thoroughly recommend the Resort to anyone who wants a quiet but exciting time in Winter. If I didn't live on the other side of the world I would go here in all seasons.",February 2017,Northern Lights Resort & Spa,https://www.tripadvisor.com/Hotel_Review-g155047-d2483758-Reviews-Northern_Lights_Resort_Spa-Whitehorse_Yukon.html,"Whitehorse, Canada",hotels,5.0,5.0
Good but not as good as the main Nicks Seafood.,"There were 17 of us for our work Christmas Lunch - seating was a bit cramped but that is to be expected as this time of year. A hot day - waiters brought out jugs of tap water with ice - unfortunately not enough time to cool down but enough to quench our thirst. The Antipasto Plate to share between 4 was OK - then we ordered the meals. For an entree - I had the Tempura Soft Shell crab with ginger and sweet chilli dipping sauce - was OK. The main I chose Grilled Fillet of Barramundi with creamy mashed potato, broccolini & sauteed spinach with lemon oil was nice but nothing flash. Dessert was typical pavlova but no fresh fruit only stewed strawberries and no passionfruit in the coulis - we paid $75 per person for the four courses. Just a word of advice to the chefs / waiters - put little flags on the steaks to say well done, medium rare etc. 3 of ours were incorrect and had to be returned. Everything was OK but I wouldn't go back.",December 2016,Nick's Bar and Grill,https://www.tripadvisor.com/Restaurant_Review-g255060-d756787-Reviews-Nick_s_Bar_and_Grill-Sydney_New_South_Wales.html,"Sydney, Australia",restaurants,3.0,3.5
Magical walk,"Not far from the carpark area which is situated in a wonderful picnic area - it is an easy walk along the well constructed pathway with plenty of places to stop and enjoy.
There are several water cascades along the way which are very relaxing and loads of great photo opportunities especially early in the morning.",August 2016,Leura Cascades,https://www.tripadvisor.com/Attraction_Review-g261620-d4973047-Reviews-Leura_Cascades-Leura_Blue_Mountains_New_South_Wales.html,"Leura, Australia",attractions,5.0,4.5
Wonderful outlook over the valley,This is a great place for sunrise photography. Make sure you get there well before first light as it is a popular spot. A word of warning - Winter mornings can be bitterly cold so make sure you rug up. Once the light starts it truly is magical and when the light hits the waterfall to the right of the main lookout you realise what a great place this is. Plenty or parking and an amenities building that is clean.,August 2016,Govetts Leap,https://www.tripadvisor.com/Attraction_Review-g504238-d1672633-Reviews-Govetts_Leap-Blackheath_Blue_Mountains_New_South_Wales.html,"Blackheath, Australia",attractions,5.0,4.5
Breathtaking,Carpark area is small but large enough as I do not think it is a place that ever gets crowded - the walk down to the lookout is easy but some uneven areas so take care. The walk back up is not too good for the knees but take it easy and stop along the way it's OK. Once at the lookout the views are breathtaking - especially across to Govetts Leap. There are three viewing levels - the first is at the end of the main walk and then you can go down another uneven path to the second level and then down a set of well enclosed stairs to the third and final level which is only small.,August 2016,Pulpit Rock Lookout,https://www.tripadvisor.com/Attraction_Review-g1136446-d9731719-Reviews-Pulpit_Rock_Lookout-Blue_Mountains_National_Park_Blue_Mountains_New_South_Wales.html,"Blue Mountains National Park, Australia",attractions,5.0,5.0
An oldie but a goodie,"No matter how many times you visit 'The Girls', the views are still jaw dropping. If you get over the fact that you have to pay for street parking here, the valleys surrounding the area are so huge and wonderful you will be glad you came. Excellent amenities and souvenir shop (of course) - the walking area is paved and level so wheelchairs and strollers will have no problems. Best bet is to get there really early - around 8 or 9am if you can before all the tourist buses arrive.",August 2016,The Three Sisters,https://www.tripadvisor.com/Attraction_Review-g261618-d1672637-Reviews-The_Three_Sisters-Katoomba_Blue_Mountains_New_South_Wales.html,"Katoomba, Australia",attractions,5.0,4.5
Excellent service,"First time flying Emirates and I was not disappointed. Both seat and leg room were spacious even for Economy. Food was great - the only drawback was there was egg dishes on both choices for breakfast which doesn't help if you don't eat eggs. Apart from that - the service, entertainment and amenities were also great. Definitely would fly Emirates again for long haul Sydney - London - transit times are better than Qantas.",January 2016,Emirates,https://www.tripadvisor.com/Airline_Review-d8729069-Reviews-Emirates,World,flights,5.0,4.0
