title,text,date,place,placeURL,placeLocation,placeType,reviewScore,avgScore
Amazing light show,"This is one amazing place. Very dark when you first enter but as your eyes get accustomed you discover a world of light and movement that will leave you walking around with an amazed look on your face. No tripods are allowed so it's basically phones or hand held cameras with a high ISO. Features appear in one room - disappear and then appear somewhere else. Flowery animals wander around from place to place, and there are 'anchored' displays like the waterfall but it's wonderful to stand there and be covered by water, butterflies and flowers. The only down side was the Light and Sound show. While being incredible in itself it is in a small room and when there are loads of people it becomes very hot and cramped. With the lights and the music it gets a bit overpowering and if you can find a seat on the floor it's a bonus. Standing around the wall for around 15 minutes was a bit much. Maybe needs seating around the perimeter? This place is definitely a must if you are close by - bookings are essential and when we went the queue was an hour long but it kept moving so it wasn't too bad. I would definitely go back to this one and also visit the Planets.",November 2018,teamLab Borderless,https://www.tripadvisor.com/Attraction_Review-g1066449-d14450735-Reviews-TeamLab_Borderless-Koto_Tokyo_Tokyo_Prefecture_Kanto.html,"Koto, Japan",attractions,5.0,4.5
Clean and comfortable,A very friendly hotel with clean rooms and comfortable beds. Breakfasts have a varied assortment of hot and cold continental and Japanese foods. Close to railway - had to pay extra for early check in but that was OK. Staff were friendly but spoke limited English. I would stay here again.,November 2018,Comfort Hotel Tokyo Higashi Kanda,https://www.tripadvisor.com/Hotel_Review-g1066443-d12037290-Reviews-Comfort_Hotel_Tokyo_Higashi_Kanda-Chiyoda_Tokyo_Tokyo_Prefecture_Kanto.html,"Chiyoda, Japan",hotels,4.0,4.0
Scrumptious pies!,"Had always gone past but called in for the first time as we travelled up the coast.
Their mushroom and beef and the beef and burgundy pies were scrumptious. Lots of different varieties of pies both normal size and family size. Service was good although we did get our order mixed up with another but that was easy fixed. Coffee was very good also. Very busy and had to park across the road. Pies were so good we called in on the way back to Sydney to buy some to take home for dinner.",August 2018,Heatherbrae's Pies,https://www.tripadvisor.com/Restaurant_Review-g529017-d3683745-Reviews-Heatherbrae_s_Pies-Port_Stephens_Greater_Newcastle_New_South_Wales.html,"Port Stephens, Australia",restaurants,4.0,3.5
Great food and service,"We were here for our work Christmas Lunch and were not disappointed in our choice. Situated on Cockle Bay Wharf, we had excellent water views of Darling Harbour. Once seated the waiter came for our drinks order and then he brought water to the table. This was the only downside - on a hot day the last thing you want is room temperature water. Some ice in the serving jug would have been nice, but instead we had to ask for glasses of ice. We started with Mixed Breads and then Tasting Plates to Share (between two) - Grilled Prawns; Salt & Pepper Calamari; Buffalo Chicken Wings and Grilled Scallops. Once we were given time to digest and rest we then had the Main Course - Meat & Seafood Platter to Share (between two) - Grilled Sirloin Steak; Fillet Mignon; Garlic Prawns; Chicken Skewers; Half Pork Rack Ribs; Tempura Soft Shell Crab and Lamb Rack Cutlets. Mains were served with Onion Rings and Caesar salads The food was well cooked and delicious. I thought the bottled wine was overpriced as it is with all restaurants along the wharf. Cloudy Bay Sav Blanc at $73 per bottle when you can buy for around $30 at liquor stores - but I suppose you have to pay for the upkeep. Dessert Platter was excellent as was the service. Overall everything was well cooked and was not overly 'heavy' with the modern dressing that seem to be used these days.",November 2017,I'm Angus Steakhouse,https://www.tripadvisor.com/Restaurant_Review-g255060-d887375-Reviews-I_m_Angus_Steakhouse-Sydney_New_South_Wales.html,"Sydney, Australia",restaurants,4.0,4.0
"Lovely, calming garden",A privately owned garden and surrounds that is well looked after. Photography opportunities are around every corner with bees and birds making their own sounds as you sit on one of the benches and listen. a truly magical place -,November 2017,Stokes Bay Bush Garden,https://www.tripadvisor.com/Attraction_Review-g3733348-d3507639-Reviews-Stokes_Bay_Bush_Garden-Stokes_Bay_Kangaroo_Island_South_Australia.html,"Kangaroo Island, Australia",attractions,4.0,4.5
Wonderful viewing,The people that operate Raptor Domain have so much care and love for these birds that is not only shows on their faces but their winged friends as well. Very audience friendly especially for the youngsters it is a wonderful place to get up close to some of of the birds that you may never see in the wild. There is also a reptile showing at a different time when you can handle lizards and some snakes but not being a fan of these is why there are no photos. A great place for all the family - the staff are exceptional.,November 2017,Raptor Domain,https://www.tripadvisor.com/Attraction_Review-g7179521-d1931139-Reviews-Raptor_Domain-Seal_Bay_Kangaroo_Island_South_Australia.html,"Kangaroo Island, Australia",attractions,5.0,5.0
Dolphins galore,"A wonderful day with dolphins, cormorants and pelicans. Andrew was so enthusiastic in his love for the area it carried over to the rest of our photography group.
When we found the dolphins Andrew created wake after wake so that the dolphins could have some fun surfing and leaping about creating many great photography opportunities. it was a fabulous day and our picnic lunch of fresh sandwiches and wraps was delicious. Heading back to the wharf we spotted cormorants and a young eagle. Truly, it was a difficult decision where we should aim our cameras as there was action all around. Thanks Andrew and Nina (hope I got the name right) it was an incredible experience. Only one complaint - the water was too cold for me to go swimming with the dolphins. Have to come back when it warms up.",November 2017,Kangaroo Island Marine Adventures,https://www.tripadvisor.com/Attraction_Review-g261647-d2486532-Reviews-Kangaroo_Island_Marine_Adventures-Kingscote_Kangaroo_Island_South_Australia.html,"Kangaroo Island, Australia",attractions,5.0,5.0
A great relaxing walk,The footbridge at Urunga is a great way to relax. Around 10 minutes walk to the beach but it is best to take your time - take a look around and appreciate the surroundings. There are stairs down to the lagoon in places and you can walk over to the mangroves at low tide.,September 2017,The Boardwalk,https://www.tripadvisor.com/Attraction_Review-g529038-d4156569-Reviews-The_Boardwalk-Urunga_New_South_Wales.html,"Urunga, Australia",attractions,5.0,5.0
Great place to stay,"Staying in the Satin Bower Bird cabin (#8) we found there was plenty of room for the 3 of us. A lovely verandah with table and chairs and inside there is an aircon unit. One room with a queen bed, one room with bunks, a kitchen/dining/with lounge that was ample size. TV has foxtel. The kitchen was well equipped and had a welcome pack with tea, coffee, sugar and milk in the fridge so that we could sit and relax before heading to the shops which are only a 5 minute walk. A good BBQ area for the cabins and free wi-fi to 100MB per day (but who comes here to check emails?) It is around a 2 minute walk to the footbridge which offers a lovely walk out to the beach. Great to lie in bed of a night and listen to the ocean. The only down side is the sea lido at the riverfront of the park which desperately needs to be dredged. This used to be an excellent swimming area but is now so full of sand it is only knee deep. Apart from that the park is well maintained and safe for families. The sites for tents and caravans are excellent and I would definitely recommend this park to everyone.",September 2017,Reflections Holiday Parks Urunga,https://www.tripadvisor.com/Hotel_Review-g529038-d1845552-Reviews-Reflections_Holiday_Parks_Urunga-Urunga_New_South_Wales.html,"Urunga, Australia",hotels,5.0,4.5
Great seafood,"Always come to the co-op every time I am in Coffs. Visited twice in the past week and found the food still excellent. I had the crumbed flathead tails which were very fresh you could taste the ocean and the chips were lovely and crisp. My son had the crumbed whiting fillets and my grandson had the prawn cutlets, they both said they were delicious. The outside eating area is always packed but we were lucky enough to jag a table straight away. For the range of fresh seafood - prawns etc there was not much choice but we ended up getting the Eastern King Prawns for dinner that night back in Urunga - (bit pricey but were delicious).
You cannot go wrong with the food but be prepared for a crowd for the undercover seating. I remember when it was just a shed with plenty of local seafood but with no hot food.",September 2017,Coffs Harbour Fishermen's Co-Op,https://www.tripadvisor.com/Restaurant_Review-g255059-d1224664-Reviews-Coffs_Harbour_Fishermen_s_Co_Op-Coffs_Harbour_New_South_Wales.html,"Coffs Harbour, Australia",restaurants,5.0,3.5
Good food,Mainly Chinese cuisine but there are other options as well. The restaurant is a nice size with clean tableware and good service. We started with the mini Spring Rolls (10 in a serve) which were very crisp and served with a sweet and sour sauce.. I had the Garlic Beef which was very tasty and tender. My mother had the Honey Chicken which looked and smelt good. Both these meals were served with rice; you could choose boiled or fried. My grandson had the Chicken Snitzel that was huge. This was served with a side salad. The prawn chips were a bit on the oily side but that was the only downer on the meal.,September 2017,Urunga Bowling Club Chinese Restaurant,https://www.tripadvisor.com/Restaurant_Review-g529038-d3487770-Reviews-Urunga_Bowling_Club_Chinese_Restaurant-Urunga_New_South_Wales.html,"Urunga, Australia",restaurants,4.0,4.0
Time for a change,"I always looked forward to Lunch at The View - that is until around 5 years ago and the food was not as good as it was and it was overpriced then. Having not visited for 5 years I thought maybe things had improved. Alas they hadn't. I ordered the Beer Batter Fish9 $25) (they do not have grilled anymore). When it arrived it looked delicious - and then I ate.
The chips were less than warm - the batter was oily and soggy and the fish was gluey. I do not know what fish it was but it definitely had a very high bouquet. The serving of rocket was soaked so much in dressing it just lay there limp. I would say the only good things were the lemon wedge and the aoili dressing in a separate dish. The wine ($8 per glass), about 5-6cm of it was served in a large glass and looked ridiculous.
I will not be visiting again that's for sure. I paid $33.00 for a meal that was inedible and no, I did not bring it to the attention of the staff as they seemed more disinterested than me.",September 2017,The View,https://www.tripadvisor.com/Restaurant_Review-g552107-d8779626-Reviews-The_View-Mosman_Greater_Sydney_New_South_Wales.html,"Mosman, Australia",restaurants,2.0,3.5
The best Halibut,"In February there was not much on offer at Fisherman's Wharf so we opted for the Halibut takeaway from The Fish Store. The service was great and the food was excellent. The fish cooked to perfection, not too much batter or grease and the chips and coleslaw were nice and crunchy. Served with tartare sauce and lemon - it was overall a very filling and tasty meal. As we sat at the picnic tables and chairs out the front we were entertained by the local flipper brigade. You can buy small plates of raw fish for them and we had a wonderful time saying hello.",February 2017,The Fish Store at Fisherman's Wharf,https://www.tripadvisor.com/Restaurant_Review-g154945-d3183310-Reviews-The_Fish_Store_at_Fisherman_s_Wharf-Victoria_Victoria_Capital_Regional_District_V.html,"Vancouver Island, Canada",restaurants,5.0,4.5
My favourite plane,I preferred to fly this route because the A380 to LAX was a disaster for me with insufficient leg room. The leg room on the 747 is OK and as I love flying there are virtually no complaints about this flight. Seat 52A was just behind the wing but noice cancelling headphones took out most of the noise. I will select further back next time. The preselection of meals on line was very good as was the food although the breakfast was not as good as it used to be. Overall I enjoyed the journey.,February 2017,Qantas,https://www.tripadvisor.com/Airline_Review-d8729133-Reviews-Qantas,World,flights,4.0,4.0
A great airline,"On the plane - very friendly staff - seating and leg room was very good. The inflight beverage service was good with juice or sodas served free of charge with a cookie or you could order other food and items if you wished.
A very enjoyable journey with Alaska Airlines.",February 2017,Alaska Airlines,https://www.tripadvisor.com/Airline_Review-d8729017-Reviews-Alaska-Airlines,World,flights,5.0,4.0
An adventurous time.,Due to severe storms and snow in Seattle our flight was delayed around 4 hours with the prospect of being cancelled altogether. The lady at the gate was extremely rude (yes she must have had a bad day) and could give us no information whatsoever. Another lady with a trainee badge was more than helpful (which has earned the Excellent rating) and updated us with information as soon as it came to hand - the other lady disappeared. The flight itself was enjoyable with the staff very friendly. Seat 9E was near the propeller but the noise was not a problem. Views from this seat were good.,February 2017,Alaska Airlines,https://www.tripadvisor.com/Airline_Review-d8729017-Reviews-Alaska-Airlines,World,flights,5.0,4.0
Great flight,"Originally seated in 2A, I was moved further back so that I could have a row to myself which was a nice gesture and did not create any problems.. Check in and service was very good and the plane was very comfortable. The attendants on the plane were well mannered and courteous. This seems to be a friendly company and I would be glad to recommend it to anyone.",February 2017,Air North (Canada),https://www.tripadvisor.com/Airline_Review-d10816875-Reviews-Air-North-Canada,World,flights,5.0,4.5
Disappointing and not what was advertised,"We were looking forward to the Half Day Multi Activity Tour and after what we had read on the web it promised to be a great time. Getting on the small bus in Whitehorse to take us up the mountain, the two guides/drivers were more intent on talking to each other about their personal night time activities and journeys and did not seem interested in any of us nor telling us about the countryside or what we were going to do. On arrival, we took turns at the different activities - my son-in-law and myself were snowmobiling first up and were given safety helmets just in case. This snowmobiling turned out to be the two guides on a snow mobile while we sat in a sled being dragged along behind. We stopped on the frozen lake to take photos. Next up was the dog sled - not as the ad says sit back and enjoy the scenery as you are pulled by a strong team of well-trained huskies - in actual fact it was sitting upright astride a plank of wood hanging on for grim death and not being able to enjoy anything especially as we took a corner too fast and ended up face down in the snow with the 'sled' on my leg. We stopped once to take photos. We gave the tobogganing a miss as it was not a gentle slope and the last activity was the snowshoe walk down the path and across the frozen lake. We did see some of our bus group who chose to do the ice fishing which entailed sitting in a chair with a line in a hole in the ice and we were shown how to dig a hole in the ice. Overall I was definitely not impressed with anything on this tour and felt that I had wasted my money. On the way back to Whitehorse the guides were back talking to themselves. At CAD195 per person - just a hint Up North - when you choose your guides they should have a bit of interest in the paying customers and your activities should reflect what you advertise.. We were very disappointed with this tour and would not recommend it to anyone, although maybe we just got a bad day.",February 2017,Up North Adventures,https://www.tripadvisor.com/Attraction_Review-g155047-d2476965-Reviews-Up_North_Adventures-Whitehorse_Yukon.html,"Whitehorse, Canada",attractions,2.0,4.5
Great location,"I stayed in a Deluxe King Suite with a water view - it had an excellent view over the harbour - so there is always something to look at if you are in the room. There was plenty of space for suitcases and enough power outlets to charge photo equipment. The large bathroom was very clean and the shower was of a good pressure. Overall the suite was great. Room service was a bit slow - had to call twice. We had breakfast in the Lure Restaurant on the main floor - good outlook. The orange juice was watered down and tasteless but the service was good. The dress code of the staff left a bit to be desired. For such a classy hotel I would have expected the staff to be dressed and not to be so casual. The valet service on arrival was very professional, on leaving is was more lay back with us having to wait about 20 minutes for the car. I would stay here again - -",February 2017,Delta Hotels Victoria Ocean Pointe Resort,https://www.tripadvisor.com/Hotel_Review-g154945-d155900-Reviews-Delta_Hotels_Victoria_Ocean_Pointe_Resort-Victoria_Victoria_Capital_Regional_District_V.html,"Vancouver Island, Canada",hotels,5.0,4.5
Handy to airport but small rooms,"We choose this hotel because of the location - it is about 10-15 minute drive to Vancouver Airport but don't worry, there is no noise from the aircraft. Easy to find; check in was pleasant but the car parking is down a side alley and around the block and through a back entrance. Parking is secure; we parked up a few levels and near the entrance to the hallway and the elevators to the suites. We stayed for 2 nights - one going to Whitehorse and one coming back. The suite on the first evening was very small for 3 of us. Not much room at all in the bedrooms but the bathrooms seemed OK. Everything was clean so no problems there. We did have to ask for luggage racks as there were none provided in the suite. The kitchen area was spacious enough and well stocked with cutlery and crockery if you are staying for a few nights. On our return we requested a bigger suite - it was bigger but not much. Overall a good place to stay and I would definitely stay there again.",February 2017,Executive Hotel Vancouver Airport,https://www.tripadvisor.com/Hotel_Review-g181716-d184309-Reviews-Executive_Hotel_Vancouver_Airport-Richmond_British_Columbia.html,"Richmond, Canada",hotels,4.0,3.5
Wonderful in Winter,"I have visited Mammoth Springs in Summer and it was incredible but this visit in February was even more spectacular. The amount of snow that covered the Lower Terrace of Palette Spring was breathtaking - the walk from the Terrace Grill was a bit uphill and in the drier, thinner air was a bit hard going but do-able even if you are not really fit. Granted- you do not get the multiple layers of trickling water at a great speed but it is something you have to see. I do not know if you can walk to the top from another area - did not have enough time to investigate.",February 2017,Mammoth Hot Springs,https://www.tripadvisor.com/Attraction_Review-g60999-d126750-Reviews-Mammoth_Hot_Springs-Yellowstone_National_Park_Wyoming.html,"Yellowstone National Park, Wyoming",attractions,5.0,4.5
Another one off the bucket list!,"Snow coaching into the Lodge was a great trip although the coach was a tad packed - maybe look at limiting the numbers in future - we arrived at night and the staff at check in were incredible - the only problem was one man who continually wanted to push his way in front of everyone. Just a hint - just because you are 'old' doesn't give you the right to be rude. My room was 2023 - very spacious and everything was clean including the bathroom. The bed was really comfortable. My morning view when I opened the shutters was l-o-n-g icicles hanging from the window and lots and lots of snow - incredible.
Within walking distance of Old Faithful and the trails - we had so much snow and had to be careful to walk in footsteps that were already there so that our legs didn't disappear from view. We did the Steam & Stars except that there were lots of clouds and no stars but we still had a great time just listening to the sounds of the night. Our guide Jesse was incredibly knowledgeable and the hot chocolate in the special mugs at the end of the tour was well received. We also did the Photo Tour with Lisa Culpepper, another great personality and helped us get some great photos. Once again, the snow coach was cramped. Xanterra must allow for people and their camera gear. We had two more tours which after finding out they were fully booked and not wanting the same cramped situation, we decided to cancel and book a full day private tour - this was great as we had the snow coach just for us and our cameras. Jenna was our guide and she was another who did a great job - taking us wherever we wanted to go. Consequently we went over the allotted time and had to pay extra but that didn't matter as we saw just about everything that Yellowstone had to offer.
The only really disappointing point staying at the Lodge was the Obsidian Grill. The first day for breakfast - the service and the food was great. After that it fell away for both breakfasts (buffet was nearly cold) and dinners. I ordered a steak on the second night and could not eat it as there was so much fat and gristle covered in sauce. Needless to say I gave the dinners here a miss until my last night and just ordered a salmon fillet with none of the fancy extras that went with it. Breakfasts on some mornings were fast paced with what seemed not enough staff to get the people in and out so that they did not have to rush when they had tours booked. The dinners were the same with us having to wait about an hour past our reservation time. The Geyser Grill was good for small meal/snacks but closed early. I think that Xanterra should look at the eating facilities as there doesn't seem to be enough to cope with the amount of people.
Overall - it was more positive than not and I would thoroughly recommend the Snow Lodge. The only reason I gave a Very Good and not Excellent was the lousy service in the Restaurant, the inedible steak and being crammed into Snow Coaches.",February 2017,Old Faithful Snow Lodge & Cabins,https://www.tripadvisor.com/Hotel_Review-g60999-d145601-Reviews-Old_Faithful_Snow_Lodge_Cabins-Yellowstone_National_Park_Wyoming.html,"Yellowstone National Park, Wyoming",hotels,4.0,4.0
Not spectacular,"Stayed at the Snow Lodge and this restaurant was highly recommended. I found the a la carte breakfast and service on the first morning was excellent. Breakfasts from then on were from the buffet and nearly cold. Hint - get the food from the bottom of the tray - still not hot but better than on top. Service had fallen off - hardly anyone seemed interested especially when there were loads of people waiting for a table and some were worried they would miss their tours. Took forever to order toast. Maybe there should be a toaster at the buffet?
First Dinner and I was looking forward to the steak with mushrooms - it looked delicious when it arrived but I soon discovered it was very tough and fatty with lots of gristle. By the time I cut all that away the steak was about 2 inches square and I had lost my appetite. I only visited one more time for dinner and ordered a salmon fillet with mashed potatoes. The staff checked to see if that was what I really wanted as I did not want all the other extras. Looking around, the portions seemed large - sometimes too large but then again I am not a big eater. The surroundings were very rustic and most enjoyable and the chairs at the tables comfortable. There is a lot of things in my opinion that could be improved. Maybe I just struck a bad time.",February 2017,Obsidian Dining Room,https://www.tripadvisor.com/Restaurant_Review-g60999-d519503-Reviews-Obsidian_Dining_Room-Yellowstone_National_Park_Wyoming.html,"Yellowstone National Park, Wyoming",restaurants,3.0,3.5
Better in Winter,"Have been in Summer when it is just too crowded and the wait time is long - this time Winter was the choice. Obviously the queues were non existent and the service was much better as they had plenty of time. Lunch consisted of a rather bland hot dog which was served with chips. My son-in-law had the chicken tenders which were still pink inside so had to be taken back. One good point - both the eating area and the amenities were clean.
Whilst waiting for the shuttle to the Snow Lodge we took a walk to the Lower Terraces which were not far away. Front steps tend to be icy so watch your step.",February 2017,Mammoth Terrace Grill,https://www.tripadvisor.com/Restaurant_Review-g60999-d532460-Reviews-Mammoth_Terrace_Grill-Yellowstone_National_Park_Wyoming.html,"Yellowstone National Park, Wyoming",restaurants,3.0,3.0
