title,text,date,place,placeURL,placeLocation,placeType,reviewScore,avgScore
Full of beautiful Delphi artefacts,Entrance is included with the Delphi ticket. A museum full of artefacts that have been unearthed from the Delphi site. Lots of information as you walk around and sometimes lots of tour groups that just take over but you can get away from them if you want. Staff were very friendly and very helpful. Look at the way the statues and pediments were created - the workmanship is unbelievable considering how long ago they were created.,September 2019,Delphi Archaeological Museum,https://www.tripadvisor.com/Attraction_Review-g189408-d199057-Reviews-Delphi_Archaeological_Museum-Delphi_Phocis_Region_Central_Greece.html,"Delphi, Greece",attractions,5.0,4.5
Temples and Scenery PLUS,"I did an organised tour which included Delphi - home of The Oracle - and our guide was excellent and very informative. The temples and the scenery are spectacular - and as she told us the history and stories that went with it, my imagination took off and Delphi came back to life. It is a bit of a hike up through the ruins but if you take your time it's fine. The Theatre is further up the hill and then the Stadium is further up lots of stairs. There is a museum before the entrance at the bottom and that has the famous Charioteer of Delphi. The museum is included in the ticket price. We did not hike down the hill to see the Temple of Athena - but after viewing it from afar I would suggest that if you are not on a tour take the time to visit.",September 2019,Delphi,https://www.tripadvisor.com/Attraction_Review-g189408-d523823-Reviews-Delphi-Delphi_Phocis_Region_Central_Greece.html,"Delphi, Greece",attractions,5.0,5.0
Incredible history,"Incredible, magnificent, unbelievable - what more can you say? Definitely a must see if you plan on visiting Athens but try and avoid the hot times of the day and most of the crowds. Early morning or late afternoon is best. It is a long climb up but totally doable - there are plenty of places to rest so take your time - venture off the path to get a birds eye view of the Odeon. Once you go up the stairs - be careful climbing over the tourist groups who just stop and sit on the steps - past the Monument of Agrippa and through the magnificent Propylaea, you are greeted by the magnificent Parthenon. You can see the restoration that has been happening as this is shown as the white marble. Wear shoes that can grip the ground and try not to walk on parts of the path that are marble as they are very slippery - find the sides of the path or the gaps with lots of pebbles. The toilet block is basic but adequate and the water from the dispenser outside is refreshing. The former museum has now been emptied and its treasures now reside in the New Acropolis Museum. The Caryatids on site are copies and most of the originals are in the New Museum which is at the bottom of the Acropolis before you enter and start the climb. Do some research before you go - this place just begs to be admired but respect it by not climbing over the ropes or smoking which a lot of tourists seem to do until the officials start blowing whistles. Also - please do not touch the marble columns - they are not magic and you will not get a thrill!",September 2019,Acropolis,https://www.tripadvisor.com/Attraction_Review-g189400-d198706-Reviews-Acropolis-Athens_Attica.html,"Athens, Greece",attractions,5.0,4.5
An incredible museum with Olympic artefacts,A wonderful museum situated in the Olympia complex that is well worth the visit. So many pieces that are familiar if you love history. Do some online research and you will enjoy every minute. Take your time and just wander around - some tour groups but they tend to head for the 'big name' items. There is a lot more to see if you look - -,September 2019,Archaeological Museum of Olympia,https://www.tripadvisor.com/Attraction_Review-g189487-d243257-Reviews-Archaeological_Museum_of_Olympia-Olympia_Elis_Region_West_Greece.html,"Olympia, Greece",attractions,5.0,4.5
History PLUS imagination,"An amazing site to walk around and imagine the Olympic Games in action. So many incredible places that are familiar through the media - do lots of research so that you can enjoy at your leisure - there are lots of information plaques around to help you out. The only down part were some tour groups who were on a tight schedule pushed and shoved and talked over the guides who were doing their best, but the place is so big you can get away from them. Every now and again sit under the trees and imagine being there in ancient times. The stadium is pretty sparse except for the starting blocks and the track and it always has those souls who want to run the length. Definitely a place for history - and then visit the on site museum.",September 2019,Archaeological Site of Olympia,https://www.tripadvisor.com/Attraction_Review-g189487-d243256-Reviews-Archaeological_Site_of_Olympia-Olympia_Elis_Region_West_Greece.html,"Olympia, Greece",attractions,5.0,4.5
A huge complex,There is more to Epidaurus than just the famous theatre. The Sanctuary of Asklepios - God of Medicine and Healing - is huge and is situated outside the Theatre. Read the signs and information placards that are situated at the major points of interest. There is a small museum full of artefacts that have been discovered around the sanctuary and is well worth a visit. Another place of wonderful history.,September 2019,Sanctuary of Asklepios,https://www.tripadvisor.com/Attraction_Review-g815573-d11917603-Reviews-Sanctuary_of_Asklepios-Epidavros_Argolis_Region_Peloponnese.html,"Epidavros, Greece",attractions,5.0,4.5
Take a seat - and listen,The Great Theatre is only one place of interest at the great site of Epidaurus. It looks bigger in photos and film but it did not seem to be that big in real life. Don't get me wrong it is still a big complex and maybe it was the intimacy of the place and the way the seating is arranged that made it seem smaller. The steps to the top are slippery and there are no handrails but if you are careful and take your time you should be OK - just go slow. Stand on the marker and test the acoustics - they are incredible. Tour groups and their leaders always give a rendition of something.,September 2019,The Great Theatre of Epidaurus,https://www.tripadvisor.com/Attraction_Review-g815573-d198893-Reviews-The_Great_Theatre_of_Epidaurus-Epidavros_Argolis_Region_Peloponnese.html,"Epidavros, Greece",attractions,5.0,5.0
A definite visit,Some would say there is nothing to see - it is just an empty structure but what to see is the incredible inside and the way it was built. The Treasury of Atreus or the Tomb of Agamemnon is a short walk from the main Mycenae complex. There are no artefacts inside - just a huge area but it is full of history when you realise it was built around 1250 BC. Be careful when you step inside - it is very dark so your eyes have to adjust.,September 2019,Citadel and Treasury of Atreus,https://www.tripadvisor.com/Attraction_Review-g189486-d243267-Reviews-Citadel_and_Treasury_of_Atreus-Mycenae_Argolis_Region_Peloponnese.html,"Mycenae, Greece",attractions,4.0,4.5
History revealed,Mycenae - legendary kingdom of Agamemnon - is a place of unbelievable history. In reality what place in Greece is not? With Mycenae there is the Lions Gate and the grave circles where those golden treasures were discovered - most of which are now in the Archaeological Museum in Athens. Walk around the graves and imagine the gold that was buried within. With any ancient site there is a lot of rubble but there is a lot of information on the walkways so you will have to read up and use your imagination but it is definitely a place to visit. The pathway up to the palace is steep and not the best to walk on a hot day. There is a wonderful little museum full of interesting artefacts and well worth the visit. On another note the toilets are clean and well maintained.,September 2019,Archaeological Site Mycenae,https://www.tripadvisor.com/Attraction_Review-g189486-d522565-Reviews-Archaeological_Site_Mycenae-Mycenae_Argolis_Region_Peloponnese.html,"Mycenae, Greece",attractions,5.0,4.5
Very interesting,"A hot day to explore ancient Corinth - maybe not a good idea. Some research prior to visiting would not go astray and that will help you when you are looking at the ruins. The Temple of Apollo is impressive - as is Temple E, otherwise known as the Temple of Octavia. The complex covers a large area and is totally walkable but sometimes the ground is uneven so wear suitable shoes. If you are interested in St Paul, you can stand in front of the Rostra and Bema where he was tried, and thankfully found not guilty. Acrocorinth is situated on the high plateau - too much of a climb for me so I admired from afar.",September 2019,Ancient Corinth (Archaia Korinthos),https://www.tripadvisor.com/Attraction_Review-g189484-d243253-Reviews-Ancient_Corinth_Archaia_Korinthos-Corinth_Corinthia_Region_Peloponnese.html,"Corinth, Greece",attractions,5.0,4.5
Amazing,"This canal that links the Corinth Gulf with the Saronic Gulf, is realistically, not a jaw dropping moment but to stand and look at what human effort can achieve is amazing to say the least. Walk across the footbridge and look at the narrow ribbon of blue water below and the sheer sides and you can get a sense of 'how on earth did they do that?' At one end there is a vehicle bridge that submerges under the canal water to let the boats through - unfortunately I did not get to see that.",September 2019,Corinth Canal,https://www.tripadvisor.com/Attraction_Review-g1188932-d2454053-Reviews-Corinth_Canal-Isthmia_Loutraki_Corinthia_Region_Peloponnese.html,"Isthmia, Greece",attractions,5.0,4.5
So Beautiful,"A little over an hour's drive along the coast you will catch a glimpse of the Temple of Poseidon standing proudly at Cape Sounion. It is an incredible place with views overlooking the Aegean and if it is a clear day, the blue of the ocean and the sky are great backdrops for this temple. Even though most of it lies in ruins, it can make your imagination run wild. There are a few stairs and ramps to climb but they are easy to manage - just take your time, stop and look around. Quite a few tourists when I went and the ever present whistle blowing officer telling people not to climb on the ruins. When will people be more respectful of history? You can walk all the way around the Temple - cannot see where Lord Byron scratched his name - but that's a minor thing. There is a souvenir shop and also a cafe that can be a godsend if you want to take refuge from the heat in Summer. I did one of the afternoon tours so could not stay for the sunset and that was disappointing.",September 2019,Temple of Poseidon,https://www.tripadvisor.com/Attraction_Review-g562628-d312283-Reviews-Temple_of_Poseidon-Sounio_East_Attica_Region_Attica.html,"Sounio, Greece",attractions,5.0,4.5
Incredible,"First - the entrance to the Temple is not near Hadrian's Arch. If you are walking from Syntagma then veer left down the street just before you get to the Arch. It is only a short distance on the right hand side of the street. Once in the Temple surrounds, you will be amazed at the sheet size and incredible workmanship (especially the
Corinthian columns) of what is left. Taking nearly 700 years to complete, the original temple had 104 columns, only 15 remain today, with one collapsed on the ground. There is only the temple columns to see but find a seat in the shade and imagine how splendid this once was. Public toilets are at the Hadrian's Arch end of the complex. Some restoration work when I was there but not enough to cover the columns. Another",September 2019,Temple of Olympian Zeus,https://www.tripadvisor.com/Attraction_Review-g189400-d242844-Reviews-Temple_of_Olympian_Zeus-Athens_Attica.html,"Athens, Greece",attractions,5.0,4.0
Another Hadrian Triumph,"The Arch of Hadrian is an incredible gateway that reminds one of a Triumphal arch that you would see in Rome. It is on the main road through Athens and is about a 10 minute walk from Syntagma Square. It stands near the Temple of Olympian Zeus. Last time I was here it was covered for restoration so it was good to finally see it naked. It could do with a further clean but that's just my opinion, I would suggest you research the arch on line as there is no information boards around it.",September 2019,Arch of Hadrian (Pili tou Adrianou),https://www.tripadvisor.com/Attraction_Review-g189400-d242820-Reviews-Arch_of_Hadrian_Pili_tou_Adrianou-Athens_Attica.html,"Athens, Greece",attractions,5.0,4.0
Incredible History,"If you are in Athens and you love history then this is the place to go. This is the most incredible museum of Greek and Greek related treasures. Everything from early Cycladic to the Classical Age to the Romans all in one building. Every historic site has a museum but to see items from everywhere in one place is a feast for the eyes. You may need two visits if you want to stand and wonder - The Mask of Agamemnon and the Gold of Mycenae; Poseidon or Zeus Artemesian Bronze, the Bronze Horse and Jockey; Classical statues and Grave Stele it's all here. It was a tad crowded when I visited but you can walk around and get away from the crowds to a certain degree. The only irritating point was the tour groups that seemed to spread over the entire room and who were so loud it was practically unbearable. Still that is only a minor irritation. What you see is well worth the effort.",September 2019,National Archaeological Museum,https://www.tripadvisor.com/Attraction_Review-g189400-d198713-Reviews-National_Archaeological_Museum-Athens_Attica.html,"Athens, Greece",attractions,5.0,4.5
Very solemn and moving,Although the Changing of the Guard takes place every hour every day - the best time to go if you can is Sunday at 11am when they do a full ceremony with band and guard. Unfortunately there are loads of people and you may have to jostle for position or even get there 30 minutes or so before. It is a very solemn ceremony when the Evzone guard changes at the Tomb of the Unknown Soldier. I would thoroughly recommend this if you like the history and majesty of Greece.,September 2019,Changing of the Guard Ceremony,https://www.tripadvisor.com/Attraction_Review-g189400-d12064411-Reviews-Changing_of_the_Guard_Ceremony-Athens_Attica.html,"Athens, Greece",attractions,5.0,4.5
Always worth it.,"Every time I travel on one of these HOHO buses I thoroughly enjoy myself seeing most everything a city has to offer. Athens was no different. The extra day was great and the young lass made a note of when I wanted to use the extra day as I would be traveling out of Athens for 2 days. The service by sellers and drivers was great and the route through Athens covered everything you need. A bit hot upstairs if there is no roof and hold onto your hat as you drive along. After doing the full loop you can plan where you want to stop and spend more time, it's the best way to beat the crowds and you get to see some great views. Best time of day is first thing in the morning - but the last at night is good although a bit crowded.",September 2019,City Sightseeing Athens & Beach Riviera Hop-On Hop-Off Bus Tour,https://www.tripadvisor.com/AttractionProductReview-g189400-d11448070-City_Sightseeing_Athens_Beach_Riviera_Hop_On_Hop_Off_Bus_Tour-Athens_Attica.html,"Athens, Greece",activities,5.0,4.0
Great Iced Latte,On an unseasonably hot Athens Day - nothing better than an icy cold latte from this wonderful oasis. Situated near the Amalia Hotel - the service was great. Even though it is a small venue the friendliness of the staff and the powerful coffee smell was fabulous. I visited about 4 or 5 times and everything was perfect every time.,September 2019,Coffee Island,https://www.tripadvisor.com/Restaurant_Review-g189400-d12627172-Reviews-Coffee_Island-Athens_Attica.html,"Athens, Greece",restaurants,5.0,4.5
Great Hotel - Great Location,"I stayed here 4 times over my 4 week holiday in Greece and the Islands and was not disappointed in any of the rooms. As a single traveller, I had single rooms booked - 301 and 201 were small rooms tucked away in the corner of the hotel. The bathroom was tiny, tiny but as I was in the room only to shower and sleep they were OK. Room 217 was bigger and did not feel so claustrophobic - on my last stay I ended up with Room 403 which was a balcony room - loads of room with a great view over the National Gardens across the road. The traffic was no problem once the door was closed. The staff were very helpful, the breakfasts were great with loads of variety. This hotel is close walking distance to anything you want to see in Athens. Take the elevator to level 7 and enjoy the rooftop views - especially at night. I can thoroughly recommend the Amalia to anyone wanting a great, centrally located hotel. Great internet service and also complimentary yummy Turkish Delight and cool water in the foyer when you return from sightseeing",September 2019,Amalia Hotel,https://www.tripadvisor.com/Hotel_Review-g189400-d233049-Reviews-Amalia_Hotel-Athens_Attica.html,"Athens, Greece",hotels,5.0,4.5
Great food,"Made booking for 6,30pm and when we arrived the place was packed. We were seated inside but still had a view of Darling Harbour and the fireworks. Service was great - we started with Garlic Bruschetta which was deliciously hot when it arrived. Next the main - I had Veal Saltimbocca which was pan fried veal with sage, prosciutto and lemon butter sauce. Vegetables were sliced capsicum, green beans and sugar snap peas - everything was wonderful. The amount of veal was just too much, but they were glad to put it along with the remaining veggies in a take-away container. All the other meals looked great and were heartily devoured. For birthday celebrations of which there were many, they brought out a cake with sparklers and this was delivered to the birthday person by a group of guys banging a dirty big drum. How exciting.",June 2019,Criniti's Darling Harbour,https://www.tripadvisor.com/Restaurant_Review-g255060-d2405947-Reviews-Criniti_s_Darling_Harbour-Sydney_New_South_Wales.html,"Sydney, Australia",restaurants,4.0,3.5
Hard pastry,Arriving around 7pm - we went and had some of Harry's famous pies. The filling of the Steak and Mushrooms was delicious BUT the pastry was so hard you could use the top as a frisbee. Maybe it was the lateness of the hour but it seems they had been in the warmers far too long and there was no moisture. If it wasn't for this and the fact that I paid $5.90 for some filling because I could not eat the pastry was a bit much.,January 2019,Harry's Cafe de Wheels - Penrith,https://www.tripadvisor.com/Restaurant_Review-g255060-d10831579-Reviews-Harry_s_Cafe_de_Wheels_Penrith-Sydney_New_South_Wales.html,"Sydney, Australia",restaurants,3.0,4.0
Not as good as hoped,Long queue out the front but seemed to move quickly. Finally got inside and then had to wait again for somewhere to sit. Ended upstairs - quite nice. Ordered what I thought was tuna sushi and some tempura but what arrived definitely was not tuna - and was gluey. The tempura however was delicious. Service was good. In hindsight - I would have preferred to stay in the nearby markets and have the street food.,November 2018,Sushizanmai Honjin,https://www.tripadvisor.com/Restaurant_Review-g14129610-d3597151-Reviews-Sushizanmai_Honjin-Tsukiji_Chuo_Tokyo_Tokyo_Prefecture_Kanto.html,"Tsukiji, Japan",restaurants,3.0,4.5
Great views,"On arriving it seemed to be a very touristy place . The lift to the 450 Floor was very quick and once arrived the viewing area was great - surprisingly not a lot of people in the late afternoon but the crowds sure grew as night fell. Taking photos and using a tripod was a challenge but most people were polite. There were others that were the typical rude tourists - pushing and shoving. We got there early on a very misty afternoon but as the lights came on throughout Tokyo the views got better. Our stay was about 2-3 hours but that is only because we were photographers on tour. You most probably do not need this much time - but pick what time of day you want to go.
This floor was decked out in all sorts of Christmas decorations and the plaza on ground level was the same. It turned into a magical Santaland for sure. Definitely enjoyed myself.",November 2018,Tokyo Skytree,https://www.tripadvisor.com/Attraction_Review-g14134337-d1872416-Reviews-Tokyo_Skytree-Oshiage_Sumida_Tokyo_Tokyo_Prefecture_Kanto.html,"Oshiage, Japan",attractions,4.0,4.0
Carnaby Street on steroids!,"I am talking about the Carnaby Street in London around 1965. Takeshita Street is a fascinating place if you love to people watch. Even though it was extremely crowded, people seemed to move freely - even people with dogs in prams! The clothes on display are something to behold - shops selling everything you could imagine. Animals made out of refreshing gelato means a visit to Eiswelt Gelato at the end of the street. This place is definitely a must - as are the shops that sell crepes filled with all sorts of treats. It is only a narrow street so there are not many places to sit and rest although I did find a bench in a side street where I could still see the main parade of characters. A great place to visit and experience the 'modern' Japan and it's youth.",November 2018,Takeshita Street,https://www.tripadvisor.com/Attraction_Review-g1066456-d1373790-Reviews-Takeshita_Street-Shibuya_Tokyo_Tokyo_Prefecture_Kanto.html,"Shibuya, Japan",attractions,5.0,4.0
Very calming,"This Buddhist temple – it’s history dates back to 1617 – is unlike any other, especially in terms of its architecture - it is very Indian/Asian in appearance. A wonderful welcome by a Buddhist Priest after we climb the stairs and we are advised if we want to go inside the Temple we need not remove our shoes. He gave us a lovely little booklet together with a paper keepsake and explained in hushed tones what was going on. He requests that we be quiet and then tells us we can take photos but please no flash. A very calming experience amidst the hustle and bustle of a big city. Definitely take time out to visit - you will not be disappointed.",November 2018,Tsukiji Hongwanji Temple,https://www.tripadvisor.com/Attraction_Review-g14129610-d561503-Reviews-Tsukiji_Hongwanji_Temple-Tsukiji_Chuo_Tokyo_Tokyo_Prefecture_Kanto.html,"Tsukiji, Japan",attractions,5.0,4.0
Needs work to be more interesting,"Very disappointed with the lack of anything of interest at the Fish Market after the auctions are finished.. Apparently all the auctions occur around 5am and by the time we arrived around 8am it was all over. There is a large observation deck and you can look through the glass down to the selling area, It was rather like being in a sterile situation. The sushi restaurants were packed but we managed to find a little place out of the way that we could get a toasted sandwich and coffee. Vegetable Market was a bit better - still up and away from the action and looking through glass walls to what is happening below. Didn't seem to live up to expectations but hopefully things will improve as it is only new and still has to get some character. At this stage I would only stay for an hour max unless you want to go to the early morning auctions.",November 2018,Toyosu Market,https://www.tripadvisor.com/Attraction_Review-g14134359-d15216764-Reviews-Toyosu_Market-Toyosu_Koto_Tokyo_Tokyo_Prefecture_Kanto.html,"Toyosu, Japan",attractions,2.0,3.5
Excellent place to stay,"Nice comfortable, traditional hotel close to Snow Monkey Park. The owner, Mr Yumoto ran a shuttle service for our photography group from the railway station and then again to Snow Monkey park the next day and back to the station. Nothing was too much trouble. Room was cosy and warm and the bathroom and toilet were very clean. Lots of extra bedding if you want a higher mattress. Our group only stayed for 1 night and the breakfast next morning was enjoyable and filling. The owner Mr Ichiro Yumoto, his wife and their staff made us feel very welcome. He is very proud of the artwork that people from around the world send him. A wonderful place to stay. I would give it 30 out of 10!!",November 2018,Shimaya,https://www.tripadvisor.com/Hotel_Review-g1117904-d598464-Reviews-Shimaya-Yamanouchi_machi_Shimotakai_gun_Nagano_Prefecture_Koshinetsu_Chubu.html,"Yamanouchi-machi, Japan",hotels,5.0,4.5
Japanese know how at it's best,"Whilst I have never been a true fan of Japanese comic book or animated characters this statue left me gob smacked. It is huge and standing there looking at it, I expected lights to flash, electronic voices to suddenly boom out and for him to move around - that is how real he looks. We were not lucky enough to be there as he came to life - maybe next visit. Outside Diver City, it is definitely one for the kids - both young and old.",November 2018,Unicorn Gundam Statue,https://www.tripadvisor.com/Attraction_Review-g1066449-d13428361-Reviews-Unicorn_Gundam_Statue-Koto_Tokyo_Tokyo_Prefecture_Kanto.html,"Koto, Japan",attractions,5.0,4.0
