title,text,date,place,placeURL,placeLocation,placeType,reviewScore,avgScore
Great location. Great friendly/quick,"Great location. Great friendly/quick service. Not expensive especially considering the location. Mixed fish fish very impressive. Poached egg, smashed avocado on toast is really good. Nice fresh salads. Lovely view of the beach/sea. Clean. Have gone a few times this week!",August 2020,Casablanca,https://www.tripadvisor.com/Restaurant_Review-g652147-d928994-Reviews-Casablanca-Guardamar_del_Segura_Costa_Blanca_Province_of_Alicante_Valencian_Countr.html,"Guardamar del Segura, Spain",restaurants,4.0,3.5
Don’t bother. Expensive tourist trap,Tourist trap. Expensive. 3.50€ for a small tinto. It seemed like a hassle to have to see ice me. Don’t bother. Achieved 2 stars as it’s the only bar on the beach so it’s got that.,August 2020,Passeig de Gómiz,https://www.tripadvisor.com/Attraction_Review-g1064230-d8403424-Reviews-Passeig_de_Gomiz-Alicante_Costa_Blanca_Province_of_Alicante_Valencian_Country.html,"Alicante, Spain",attractions,2.0,4.0
Nice little family run bar,Nice little family run bar surrounded by bars and restaurants. They don’t do full dinner service in the evening but they do have Cornish pasties (to die for!) and sausage rolls in the eve. But it’s manly a bar. They have a TV outside and football is always on. Great place to see the sun go down. Very friendly and welcoming.,August 2020,The Breeze Bar,https://www.tripadvisor.com/Restaurant_Review-g2419912-d5113324-Reviews-The_Breeze_Bar-Benijofar_Province_of_Alicante_Valencian_Country.html,"Benijofar, Spain",restaurants,4.0,4.0
Loved this place. Stop looking for restaurants and go to this one!,"Loved this place. Great service. Was friendly (seemed mainly English) and efficient. Tables spread apart (COVID). Great menu del dia. I had nachos, then crispy duck pancakes followed by the green curry. All had so much flavour! Oh, and I may have also had the baileys ice cream dessert, but only cos it was included! Would have it all again. Highly recommended and some nice bars in the square to finish the evening after.",August 2020,GONG,https://www.tripadvisor.com/Restaurant_Review-g12708498-d14004807-Reviews-GONG-Orihuela_Costa_Costa_Blanca_Province_of_Alicante_Valencian_Country.html,"Orihuela Costa, Spain",restaurants,5.0,5.0
They have got this right.,"They have got this right. Aircon (unusual in this part of spain) or an outside terrace. Airy. Big. Clean. Good atmos. Lots of staff (all British), so you’re never waiting long. The Sunday roast is better than most I’ve had in London. ALL the trimmings. Swimming in gravy. The cod and chips is huge (there’s a mini special which is still more than enough!). It tastes great and comes with tartar sauce. Not expensive (roast is 7.50€ and a pint of HopHouse13 or Heineken is 3€). Highly recommended.",August 2020,Quesada Fish & Chips,https://www.tripadvisor.com/Restaurant_Review-g1898634-d2325460-Reviews-Quesada_Fish_Chips-Ciudad_Quesada_Province_of_Alicante_Valencian_Country.html,"Ciudad Quesada, Spain",restaurants,5.0,4.0
Great location on the beach.,"Great location on the beach. Lots of parking if you get there early. They get very busy for lunch as menu is good. BUT staff are very rude. No interaction. Stand around chatting by the door and impossible to get their attention. Wait ages for the bill once you do. They set up for lunch at 11am and if you haven’t booked a table you have no chance of even sitting down for a quick beer even if the table isn’t booked til 2pm. All they are interested in is booking you in for the menu del dia......if run better/more polite staff, this would be a 5 star for sure.",August 2020,Restaurante Candela,https://www.tripadvisor.com/Restaurant_Review-g1078807-d3461207-Reviews-Restaurante_Candela-La_Marina_Costa_Blanca_Province_of_Alicante_Valencian_Countr.html,"La Marina, Spain",restaurants,2.0,3.5
Great place for food and a drink,Good friendly staff who speak every language possible! The daily deals are always good. Especially the rump steak on Sunday and Wednesday’s. Great location to watch the sunset behind the mountains. Would recommend.,July 2020,El Mundo de Espana,https://www.tripadvisor.com/Attraction_Review-g2419912-d5907938-Reviews-El_Mundo_de_Espana-Benijofar_Province_of_Alicante_Valencian_Country.html,"Benijofar, Spain",attractions,5.0,3.5
Make it adult only,"Used to be a great place to go and relax and have a cocktail. Since JR’s has closed, its more of a crèche for scouse kids. Currently a dozen kids running round and in the pool screaming and shouting while their parents get pissed on cocktails on a sunbed. Shame as the service is good. Friendly barman (Brandon), new sunbeds, good cocktails and great spot. And the food isn’t bad either. I hope JRs opens again soon!",July 2020,The Clubhouse - Restaurant and Bar,https://www.tripadvisor.com/Restaurant_Review-g1064248-d6373041-Reviews-The_Clubhouse_Restaurant_and_Bar-Rojales_Costa_Blanca_Province_of_Alicante_Valen.html,"Rojales, Spain",restaurants,3.0,4.0
Has potential but couldn’t get served so left,"It was in November so out of season. Maybe 20 people in the bar. I sat outside, like most, but following being given the menu, I waited 20 minutes to find a waiter to get served. Couldn’t. So gave up and left. Food and drinks were expensive anyway. It’s a nice little secluded location on a somewhat unimpressive stretch of beach. And in the middle of nowhere. You have to drive or walk miles like I did to get there. Maybe in season it’s much better. But not this time of year. Won’t be going back.",November 2019,Balux Cafe,https://www.tripadvisor.com/Restaurant_Review-g562630-d858035-Reviews-Balux_Cafe-Glyfada_Attica.html,"Glyfada, Greece",restaurants,2.0,4.0
Don’t bother,This wasn’t really a beach. More of clear bit of land with gravel. I wouldn’t come for the day and want to spend it here. Compare it to a nice golden Spanish beach and it gets 1/10. No sand. No bars/restaurants. Wasn’t impressed and stayed about 5 minutes.,November 2019,Glyfada Beach,https://www.tripadvisor.com/Attraction_Review-g562630-d2709301-Reviews-Glyfada_Beach-Glyfada_Attica.html,"Glyfada, Greece",attractions,1.0,4.0
It’s a must see while in Athens,"But the view is much better from the bottom than the top. It’s not a difficult walk up. In November there were no queues and wasn’t having to shuffle behind anyone. Lots of room. That was until I got up top. It was very busy. Mainly with cruise ship day visitors. Coming down was slow! View was nice. But as with anything like that, looking at it from a distance is much more impressive. It’s a must do to tick a box.",November 2019,Acropolis,https://www.tripadvisor.com/Attraction_Review-g189400-d198706-Reviews-Acropolis-Athens_Attica.html,"Athens, Greece",attractions,3.0,4.5
Can’t go wrong in a HRC,"Smaller than most but they still had the signature cocktails, band, some memorabilia but not much that I saw. Lots of staff on hand so service was quick. Wasn’t very busy for 10pm on a Friday night was a friendly atmosphere as ever.",November 2019,Hard Rock Cafe Athens,https://www.tripadvisor.com/Restaurant_Review-g189400-d4550050-Reviews-Hard_Rock_Cafe_Athens-Athens_Attica.html,"Athens, Greece",restaurants,4.0,3.5
Don’t bother. Nothing to see,"5 euros to literally go in, walk around what you can, then leave. There were 20 people there and they had run out of audio guides. You can see everything from the outside. Don’t waste your money. Have a beer instead.",November 2019,Panathenaic Stadium,https://www.tripadvisor.com/Attraction_Review-g189400-d245991-Reviews-Panathenaic_Stadium-Athens_Attica.html,"Athens, Greece",attractions,2.0,4.5
Best bar in Athens IMO,"Found this place while searching for bars to go. And it’s down a street you would never go down if you didn’t know it was there. You wouldn’t go in if you were passing either. But once you go down the stairs and put the back to the I’ve double layered garden, you’re be pleased you did. Lots of tables. Good atmos. All age groups. Fast service (food and drink). Very nice staff. Good beer. Good food (I had the wings). 5/5.",November 2019,six d.o.g.s,https://www.tripadvisor.com/Restaurant_Review-g189400-d3935963-Reviews-Six_d_o_g_s-Athens_Attica.html,"Athens, Greece",restaurants,5.0,4.5
"Great gyros, service and atmosphere",Just had the best gyro since I’ve been here. Great service. Sat outside people watching. Cheap food and drink. Coming back tomorrow!,November 2019,O Thanasis,https://www.tripadvisor.com/Restaurant_Review-g189400-d929471-Reviews-O_Thanasis-Athens_Attica.html,"Athens, Greece",restaurants,5.0,4.0
If you like Greek history then it will be worth a visit,I wondered round to tick the box before heading up. Lots of old marble across 4 floors. Not my thing and wouldn’t take a kid there as they will be very bored.,November 2019,Acropolis Museum,https://www.tripadvisor.com/Attraction_Review-g189400-d735521-Reviews-Acropolis_Museum-Athens_Attica.html,"Athens, Greece",attractions,3.0,4.5
Find somewhere else,Love an Irish pub. Took a while to get served even though it wasn’t busy. Barman wasn’t interested. Tried to order food but couldn’t get his attention. He was busy chatting to some locals. No live music. Moved on.,November 2019,The James Joyce Irish Pub & Restaurant,https://www.tripadvisor.com/Restaurant_Review-g189400-d2661414-Reviews-The_James_Joyce_Irish_Pub_Restaurant-Athens_Attica.html,"Athens, Greece",restaurants,2.0,4.5
Great fun afternoon tour of the outskirts of Prague,"Firstly, note you have to take a tram for 7 stops to collect your segways. So don’t expect to tour the city on one of these things as they are banned.
We opted for the 3 hour tour, which end to end lasted over 4 hours. Which was great. This included a large beer at the oldest ministry in Prague. Just over £50.
We had Anezka as our guide and she was brilliant. Great fun. Knowledgeable. Spoke great English. Wasn’t boring. Chatted to us a lot.
We had some great views of Prague from the hills surrounding the city. Lots of time spent on the segways but with plenty of rest stops to see the sights.
Would highly recommend.",August 2019,Segway Experience Prague,https://www.tripadvisor.com/Attraction_Review-g274707-d1382440-Reviews-Segway_Experience_Prague-Prague_Bohemia.html,"Prague, Czech Republic",attractions,5.0,5.0
Great place,"Always a great curry. Great service. Good quality food. Good deals.
Best in brick lane.
Recommend it. Open til 2am!",July 2019,The Famous Curry Bazaar,https://www.tripadvisor.com/Restaurant_Review-g186338-d2014346-Reviews-The_Famous_Curry_Bazaar-London_England.html,"London, United Kingdom",restaurants,5.0,4.5
"Good for older kids, not adults","It’s only 10 bucks so can’t complain too much. It’s more of an interactive games area for older kids rather than a sports museum.
They have different sports for kids to try. Like jumping for basketball. Pitching for baseball. A car racing game.
They do have a few sporting memorabilia, but not enough to spend more than 20 minutes nosing around.
Have teenage kids? Take a visit.",July 2019,Chicago Sports Museum,https://www.tripadvisor.com/Attraction_Review-g35805-d2103668-Reviews-Chicago_Sports_Museum-Chicago_Illinois.html,"Chicago, Illinois",attractions,3.0,4.0
"Over priced, nothing special","A friend and I ate there yesterday. We both had the 10oz fillet, shared 2 sides and had a glass of red each. The total bill came to over 225 dollars.
The steak was good (not brilliant), service was ok, the place wasn’t very busy (20% full).
The mash was basic mash.
The side sauce was bland.
I’ve been to wildfire before a couple of times and much preferred it.
Won’t be going back.",July 2019,STK,https://www.tripadvisor.com/Restaurant_Review-g35805-d8674457-Reviews-STK-Chicago_Illinois.html,"Chicago, Illinois",restaurants,3.0,4.5
Good food. Good service. Great staff,"We went here on a recommendation and weren’t disappointed. They staff were great with the kids and one of them comes round and performs magic for the kids.
The food menu had lots of options and the cocktail menu had more.
Quality was what you would expect and the staff were even better.",May 2019,The Joker Kitchen Cafe & Bar,https://www.tripadvisor.com/Restaurant_Review-g663346-d4342029-Reviews-The_Joker_Kitchen_Cafe_Bar-Sarigerme_Mugla_Province_Turkish_Aegean_Coast.html,"Sarigerme, Turkey",restaurants,4.0,4.5
Absolutely brilliant!,"If you’re reading this cos you’re sceptical of an all inclusive in turkey, don’t be! This resort is fantastic. The staff, the pools, the food, the entertainment, the beer! All excellent.
This was my first all inclusive / package holiday for 15 years. And we are looking to go back next year.

From the moment we arrived, checkin was quick, smooth, efficient and an entire coach load was sorted and in bed within minutes. Sabri was in charge of this process and he and his staff couldn’t have run a smoother process. Above and beyond for sure.

The main pool was a good size with a couple of proper slides for the kids. The other pools were scattered around the large resort. A baby pool. A toddlers pool. A relaxation pool. An indoor pool. Whatever you wanted.

We didn’t spend much time on the beach cos the facilities were so good by the pool. But if you’re a beach person, you have everything you need. Sunbeds. Shade. Towels. Water sports. Sea!

There are bars and fridges with bottles of water everywhere. So you can’t get thirsty. You never have to wait to be served. Always lots of staff who are friendly, quick and efficient. Lots of cocktails to pick from.

Evening entertainment was definitely aimed at the kids. Surprisingly it didn’t finish til 11pm (way past the adults bed time!). But always something different to keep them entertained.

Food was the best bit. The buffet was plentiful and great quality. They mixed it up every evening and had different themes (Chinese, local, international) and there was something for even the fussiest eater. The lunch buffet was by the pool and was open from 11.30 til late afternoon.

If you fancy venturing out the resort, there’s a village of about a dozen shops (selling fake cloths), a couple of small supermarkets and about half a dozen restaurants. It’s about 20 minute walk (don’t let anyone tell you it’s less!) or a 3 minute taxi for a couple of pounds.

Great food, facilities, staff, rooms, entertainment, pools and everything was clean/spotless. What more can you be looking for?

Well done team! See you next year.",May 2019,TUI BLUE Tropical,https://www.tripadvisor.com/Hotel_Review-g663346-d619821-Reviews-TUI_BLUE_Tropical-Sarigerme_Mugla_Province_Turkish_Aegean_Coast.html,"Sarigerme, Turkey",hotels,5.0,4.5
Perfect location. Very friendly service,"This hotel is all about the location. It’s on the river in the heart of the main set of restaurants and bars along the east side of the river.
It’s a 3 min walk to the Dom (cathedral) and to the main shopping area.

The 2 guys that were there over the weekend were brilliant. Very friendly and helpful.

Room was small but comfy. Didn’t spend much time in there so didn’t matter.

The only negative is the noise from the bars below. I had one of the quietest rooms and it felt like the DJ and his speakers were in my room. They do finish by midnight. So best of joining them then going to bed.

Would definitely stay there again.",April 2018,Hotel An Der Philharmonie,https://www.tripadvisor.com/Hotel_Review-g187371-d293305-Reviews-Hotel_An_Der_Philharmonie-Cologne_North_Rhine_Westphalia.html,"Cologne, Germany",hotels,4.0,3.5
Worth a look but nothing special,"Long queues to get a ticket on a quiet Monday morning.

You get a couple of freebies and get to see one of the Lindt chocks being made end to end.

With a visit but not really worth be entrance fee.",April 2018,Chocolate Museum,https://www.tripadvisor.com/Attraction_Review-g187371-d194326-Reviews-Chocolate_Museum-Cologne_North_Rhine_Westphalia.html,"Cologne, Germany",attractions,3.0,4.0
Typical german brewery house,"This is typical of 100s of german brewery houses across the county. This one is close to the Dom and has a nice seating area outside.

Service is very typical of one of these places. And old man in while overalls throwing beer and food at you from a distance ensuring he hasn’t smiled for at least 50 years.

Food is more expensive then the other options close by and mass produced. 2€ for 2 mouthful of beer with a typical german head that’s half the glass.

Go for a quick drink. Don’t bother with food.",April 2018,Frueh am Dom,https://www.tripadvisor.com/Restaurant_Review-g187371-d7235024-Reviews-Frueh_am_Dom-Cologne_North_Rhine_Westphalia.html,"Cologne, Germany",restaurants,3.0,4.0
Great zoo and loads of room for the animals,"Love a zoo and this one didn’t disappoint. Loads of room for most the animals.

I went when it opened at 9.15 just after it opened and most the animals were still shut away for the night. They gradually were let out. Had to wait til 10.30 got the elephants to be let out.

Suggest you go at 11ish. All the animals are out then and about to be fed from 11.30 onwards. The sea lions being fed are definitely worth a watch. Impressive.

Would go again. Worth the entrance fee.",April 2018,Koelner Zoo,https://www.tripadvisor.com/Attraction_Review-g187371-d1808713-Reviews-Koelner_Zoo-Cologne_North_Rhine_Westphalia.html,"Cologne, Germany",attractions,4.0,4.5
5 minute view of the city,"This is only 3€ so can’t complain. It’s only 28 stories high and nothing up there except a 360 view.

Nice for a pic. You will be up there 5-10 mins max.",April 2018,KölnTriangle,https://www.tripadvisor.com/Attraction_Review-g187371-d2177810-Reviews-KolnTriangle-Cologne_North_Rhine_Westphalia.html,"Cologne, Germany",attractions,2.0,4.5
Not bad for a free walking tour,"I dumped my bag at the hotel and went and did the tour straight away.

30 people was far too many for a tour with no headsets. In some of the busier areas you couldn’t hear what he was saying.

It was a bit too scripted for me. I’ve been on these before where they reel off facts but it doesn’t sound scripted. This did.

Was informative and he didn’t keep going on about the fact it was ‘free’ and he only works on tips. Money wasn’t even mentioned til the very end when he passed round a hat. So that was good.

Worth doing if you want to learn a bit about the city and you have a few hours to kill.",April 2018,Freewalk Cologne,https://www.tripadvisor.com/Attraction_Review-g187371-d8855188-Reviews-Freewalk_Cologne-Cologne_North_Rhine_Westphalia.html,"Cologne, Germany",attractions,3.0,5.0
Nice facility. Needs between signage,"Previous comments have mentioned this but all the signs are in german and none in English. So it’s impossible for a tourist to find their way. I went 3 times and each time I accidentally found a brand new area I hadn’t known about the time before. They give you a map, but it doesn’t show how to get to the areas.

It’s also difficult to know which areas you where a swim suit and which you don’t. A lot of it you have to be naked. Some parts you are not allowed to be naked. Just copy everyone else!

Be careful going into the Dead Sea floatation pool as you have to pay 5€ every time you go in there. That’s on top of the extra 5€ you pay to get into that sauna area. And this isn’t explained on entry. They tried charging me 33€. I got it back down to 20€ after complaining.

The actual pools are lively. Inside and out. Pools, sitting pools, whirl pools, hot tubs, saunas, steam rooms. Loads of areas.

I definitely will be going back in the summer.",April 2018,Claudius Therme,https://www.tripadvisor.com/Attraction_Review-g187371-d622349-Reviews-Claudius_Therme-Cologne_North_Rhine_Westphalia.html,"Cologne, Germany",attractions,4.0,4.0
1 hour cruise - don’t bother,"To be honest, I’m not sure they can do much about this as there’s only about a few hundred meters of the bank to see. As cologne is very small and all in one area (where to boat leaves from).

This seemed more about making money from selling you drinks onboard that about anything else.

You went 20 mins right. Turned round. 30 mins back. 10 mins back to pier. A recording spoke every 10 minutes about cologne in general.

Not worth it.",April 2018,KD Day Cruises,https://www.tripadvisor.com/Attraction_Review-g187371-d2360968-Reviews-KD_Day_Cruises-Cologne_North_Rhine_Westphalia.html,"Cologne, Germany",attractions,2.0,4.0
Best Thai outside Asia,"I love Thai food. And this is one of the best I’ve been to outside Asia.

I had Phad Thai once and Phad Kao the next visit. Both full of flavour.

Good service. Nice seating area on the river bank. They have Singa beer too.

Defo worth a visit. And not expensive.",April 2018,Karibik,https://www.tripadvisor.com/Restaurant_Review-g187371-d2018927-Reviews-Karibik-Cologne_North_Rhine_Westphalia.html,"Cologne, Germany",restaurants,4.0,3.5
Best pineapple burger in London,"5th or 6th visit and never disappoints, the burgers are so juicy and taste incredible! I wish I could cook sweet potato fries like this at home!",May 2018,Kua 'Aina,https://www.tripadvisor.com/Restaurant_Review-g186338-d2140493-Reviews-Kua_Aina-London_England.html,"London, United Kingdom",restaurants,5.0,4.5
Find somewhere else,"Well I stupidly ignored the other comments on this site and took a gamble. Which didn’t pay off.
The only positive I can say about this hotel is the location. It couldn’t be better. And that’s why I picked it. It’s 2 mins from the main square.
The customer service was 1 star, if that, as per the comments below. The staff in Reception couldn’t care less. They were not interested in the fact the bathroom smelt like sewage, or that a dozen kids were causing havoc of the floor or I was, or even that the door lock was broken and didn’t lock.
The hotel is old, tired, needs a make over and new staff to manage and run it.
Walls are paper thin. So you can hear every conversation and at least 3 other TVs at once. Plus the noise from outside is loud. There’s a cafe/bar opposite that had a lock-in Saturday nite. Was still going (with loud music) at 10am Sunday.
Breakfast had a nice view of the town hall but was very basic. Can’t complain as it was free.
Wouldn’t stay here again. Certainly wouldn’t recommend it. Find somewhere else.",February 2018,Floris Arlequin Grand Place,https://www.tripadvisor.com/Hotel_Review-g188644-d232005-Reviews-Floris_Arlequin_Grand_Place-Brussels.html,"Brussels, Belgium",hotels,2.0,3.5
Can’t decide on its purpose,"It’s quite a way from the city centre and a bit random. 15€ to get up there seems steep and I wouldn’t pay it again. You’re so far from the city you can’t really much out. Although you are right next to a modern football stadium and something called Euroland.
Lots of steps inside. 80 up. 127 down. This is as well as the lift and escalators. Not instead of. So beware if you’re not fit!
The top ball is small and I’m sure in the summer months it gets cramped up there.
Wouldn’t bother going. Enough to do in the city that you don’t have to venture 45 mins from Grand Place.",February 2018,Atomium,https://www.tripadvisor.com/Attraction_Review-g188644-d196160-Reviews-Atomium-Brussels.html,"Brussels, Belgium",attractions,2.0,4.0
Great tour and Pete was very entertaining,"Top free walking tour on this site for s reason. Guides put the effort in that’s for sure. As they aren’t paid up front, they really put the effort in.
We had Pete. A Liverpudlian (think he said he was a big Beatles fan and a big reds fan). He had lived there for 7+ years and was very interesting and knew the city well. And it’s history. He didn’t make a big thing about the money. Just mentioned at the start and at the end. They expect 10/15€ pp which is fair.
Last 2.5 hours and plenty of time for pics and questions. Plus you stop at Scott’s for a beer/hot chocolate half way through for 20 mins. Which is handy to warm up on a cold day!
Would certainly recommend this tour. And Pete as a guide!",February 2018,SANDEMANs NEW Europe - Brussels,https://www.tripadvisor.com/Attraction_Review-g188644-d4431670-Reviews-SANDEMANs_NEW_Europe_Brussels-Brussels.html,"Brussels, Belgium",attractions,5.0,5.0
A pain to get to portmouth from here,"Standard travelodge with polite, friendly staff. Bed a little hard but ok.
The issue here is it’s on the A27 at a service station. The noise was not an issue as I was out the back. But although it’s just over 5 minutes to get to it from Portmouth. It’s 25 minutes (with no traffic) to get back again. As you have to go 8 miles up to Chichester, go round the roundabout and all the way back again.
This isn’t an issue or you’re coming from the east and going back to the east.",February 2018,Travelodge Chichester Emsworth,https://www.tripadvisor.com/Hotel_Review-g503827-d254789-Reviews-Travelodge_Chichester_Emsworth-Emsworth_Hampshire_England.html,"Emsworth, United Kingdom",hotels,3.0,4.5
