title,text,date,place,placeURL,placeLocation,placeType,reviewScore,avgScore
Great way to see Athens and Piraeus,"It was great over looking the scenery from the top level, the kids loved it and so did we, it great being able to hop and and off as much as you like and there have a constant shcedual. Highly recommend.",October 2019,City Sightseeing Athens & Beach Riviera Hop-On Hop-Off Bus Tour,https://www.tripadvisor.com/AttractionProductReview-g189400-d11448070-City_Sightseeing_Athens_Beach_Riviera_Hop_On_Hop_Off_Bus_Tour-Athens_Attica.html,"Athens, Greece",activities,5.0,4.0
Simply Amazing,"Breath taking,to be in the presences of such magnificent hystory, it was worth the walk up to see. You can see all of Athens from up there.
Make sure you wear good shoes it can be a little slippery.",October 2019,Acropolis,https://www.tripadvisor.com/Attraction_Review-g189400-d198706-Reviews-Acropolis-Athens_Attica.html,"Athens, Greece",attractions,5.0,4.5
Beautiful Hystory,"This was a must see for me, getting the opertunity to visit the Acropolis museum was amazing, they have truly put on a great display with tremendous detail and knowledge. So much history of a great nation. Go see it!",October 2019,Skip the Line: Athens New Acropolis Museum Ticket,https://www.tripadvisor.com/AttractionProductReview-g189400-d12835132-Skip_the_Line_Athens_New_Acropolis_Museum_Ticket-Athens_Attica.html,"Athens, Greece",activities,5.0,4.5
Go and see for yourself,"Amazing location, I took my wife there on a friend's recommendation. Looking out and seeing the acropolis is simply stunning! Staff were exceptional, especially Cristos behind the Bar who made our night that much more enjoyable, he went above and beyond. If you have the opertunity to visit Electra Hotel Athens please do yourself a favor and drop in.",October 2019,Electra Hotel Athens,https://www.tripadvisor.com/Hotel_Review-g189400-d228883-Reviews-Electra_Hotel_Athens-Athens_Attica.html,"Athens, Greece",hotels,5.0,4.0
