title,text,date,place,placeURL,placeLocation,placeType,reviewScore,avgScore
Nice walkway,Nice walkway with shade from the sun at the middle and end. We saw plenty of people fishing or just watching the fish like us also by the way. Parking was $2.50 ph at the car park and can be topped up by phone if you have a US mobile No.,August 2018,Naples Pier,https://www.tripadvisor.com/Attraction_Review-g34467-d144916-Reviews-Naples_Pier-Naples_Florida.html,"Naples, Florida",attractions,5.0,4.5
Very poor property,"We booked in here for 6 nights whilst in Florida. We were in block 6 to begin with and the room was filthy with stains on the seating and walls. We asked to be moved to block 7 and were moved to another room which we initially thought was better. But on closer inspection we noticed that the bedding had stains on it but it was past midnight and with children was too late to move that evening. My wife did not sleep at all and the next morning we went to complaint and ask for a refund. We were asked by raj who was very understanding if we wanted to check one more room out in block 10 which was far better than either of the other room being at least clean and more like a hotel room than the other two which were motel rooms.
We stayed as we wanted to get on and enjoy our holiday and not waste time look for accommodation. This room also had really noisy ac which we asked to be fixed however the problem was not resolved in the next 2 nights we stayed. I would also note that when we complained there was another guest also complaining about how dirty his room was and that his family were upset plus he had a dog next door to him which was barking all night.
We were due to spend 2 night here on our way back but have cancelled them as one of the staff told us that they regularly have to move guests due to the condition of the rooms.
I have uploaded some pictures of the dirty chair, skirting boards
and shower rails. Whilst none of the rooms were great, it seemed to us that the family suites are terrible and should be avoided.",August 2018,Wyndham Orlando Resort International Drive,https://www.tripadvisor.com/Hotel_Review-g34515-d85393-Reviews-Wyndham_Orlando_Resort_International_Drive-Orlando_Florida.html,"Orlando, Florida",hotels,2.0,3.5
Airboat tour,"We had a good tour here and saw 4 alligators. Captain Kevin shared his local knowledge and a good tour of the area.
We also got to hold a baby alligator at the end which was a fun experience.
My only suggestion would be to provide some more information about the bird life and other wildlife.
Fun tour, Good price, nice people and only 45 mins from Naples.",August 2018,Capt Mitch's - Everglades Private Airboat Tours,https://www.tripadvisor.com/Attraction_Review-g34210-d2511699-Reviews-Capt_Mitch_s_Everglades_Private_Airboat_Tours-Everglades_City_Florida.html,"Everglades City, Florida",attractions,4.0,4.5
Tired property,"We were booked into this property by a travel agent on their recommendation and did not do our own research - big mistake.
When arrived the property it was clear to see that it has seen better times and that the professional photographs are generous to the resort.
The front desk staff went through the motions of checking us in to our beach side room.
We were given directions to our room and went across the pool area and instantly knew that our first impression were correct. This property is very tired and lacking in basic maintenance. We arrived at our room and the door would not open without a shoulder to loosen it. We walked into the room and almost straight back out. The room was dark, dated, damp, peeling paintwork, dirty carpets. This may only be a 3* but that doesn’t mean it should be dirty and not maintained. I should have taken pictures as it was like the Bates motel but you will find these on some other peoples reviews. We went out the the beach and the patio was equally disgusting. My family could not stay there so we checked out immediately. Mariett was very good about this which made me think it was not an unusual occurrence. It may be that they have better rooms on the property but that they would think that this was acceptable is unbelievable. We are awaiting our travel agent to obtain our refund in due course as promised by reception. Also the hotel smells awful due to red tide which they cannot be blamed for.",August 2018,Sandcastle Resort at Lido Beach,https://www.tripadvisor.com/Hotel_Review-g34618-d86103-Reviews-Sandcastle_Resort_at_Lido_Beach-Sarasota_Florida.html,"Sarasota, Florida",hotels,1.0,3.5
Nice meal,"We had a family meal here and the food was great. The service from our waiter was amusing as he was pretty useless but that made us all laugh so no harm done.
I would definitely recommend for good food in a pleasant and relaxing environment.",August 2018,Columbia Restaurant,https://www.tripadvisor.com/Restaurant_Review-g34618-d391584-Reviews-Columbia_Restaurant-Sarasota_Florida.html,"Sarasota, Florida",restaurants,3.0,4.0
Sadly in decline,"I decided to go back to San Carlo a few years since our last visit, even though I’d been told that it had gone down hill and to try somewhere else.
We arrived on time and were asked if we wanted to be seated or go to the bar for a drink and we elected to be seated only to be told that they needed to clear the table so to have a seat at the bar. After 30 mins at the bar and seeing 2 ‘walk ups’ ask for a table and be given one we enquired about our table whereby the surly girl on reception said she check what had happened and after 5 mins came back to us and arrange for our table, no explanation, apology and we carried our own glasses, bottle and coats to the table.
Our food was average at best and the service was again poor. The focaccia was particularly bad and we had to query if they had even given us the right order as it was like no focaccia we’d ever eaten before.
Our desert came with desert wine which we had to remind them about as they had forgotten to bring with the order.
All in all a really disappointing visit and sadly I get the impression that they have forgotten that every customer is a chance to impress with great service and food or too disappoint. Unfortunately it seems to me that they are trading off their hard earned reputation rather than providing the good experience it used to be some years ago. I’m sure they think that they did a good job though as they added a service charge to the bill 12.5%
It seems like my friends advise was correct and that we should have taken our business elsewhere.",July 2018,San Carlo,https://www.tripadvisor.com/Restaurant_Review-g187069-d730221-Reviews-San_Carlo-Manchester_Greater_Manchester_England.html,"Manchester, United Kingdom",restaurants,2.0,3.5
Drinks,Lovely bar and great staff. We were there on a quiet Sunday and enjoyed cocktails. It was nice at the end of the evening that the bar staff went around the few couples remaining asking if we wanted a last drink before they closed - nice touch.,July 2018,Australasia Restaurant and Bar,https://www.tripadvisor.com/Restaurant_Review-g187069-d2172575-Reviews-Australasia_Restaurant_and_Bar-Manchester_Greater_Manchester_England.html,"Manchester, United Kingdom",restaurants,4.0,4.5
Nice contemporary hotel,"We stayed here for a night and found the service superb. All staff were very engaging yet respectful. The rooms and general areas of the hotel are beautifully detailed and everything fits with the Gotham theme. My only minor negative would be the price of the drinks in the brass bar which were expensive £25 for a margarita and gin and tonic. Also was a bit concerned that some of the other guests were going to be partying all night as they had music coming out of their room on the two occasions we passed; however this proved not be a problem when we returned to our room later and luckily we weren’t staying next too them so weren’t disturbed.
I would recommend this hotel as very classy with great staff and attention to detail. I look forward to staying again and will try the restaurant next time.",July 2018,Hotel Gotham,https://www.tripadvisor.com/Hotel_Review-g187069-d7389212-Reviews-Hotel_Gotham-Manchester_Greater_Manchester_England.html,"Manchester, United Kingdom",hotels,4.0,4.5
Great Italian,"We’ve visited Luigi”s several times as a couple, with friends or just family.
Always a warm welcome and good selection of Italian food with everything you would expect.
What I like especially about this restaurant is how they always make an effort to make you feel special without being over the top, just a generally warm reception.",June 2018,Luigi's Italian Ristorante and Pizzeria,https://www.tripadvisor.com/Restaurant_Review-g1930421-d2360327-Reviews-Luigi_s_Italian_Ristorante_and_Pizzeria-Upper_Poppleton_North_Yorkshire_England.html,"Upper Poppleton, United Kingdom",restaurants,4.0,4.0
Best fish and chip in Yorkshire,"Simply put the best fish and chips in North Yorkshire.
Either sitting in and having a cuppa and slice of bread with you fish and chips or going to the take away, it’s the same result great fish and chips.",July 2018,The Wetherby Whaler,https://www.tripadvisor.com/Restaurant_Review-g1873585-d2167807-Reviews-The_Wetherby_Whaler-Nether_Poppleton_York_North_Yorkshire_England.html,"Nether Poppleton, United Kingdom",restaurants,5.0,4.5
"Great food, average service.","We ate her on a Sunday afternoon whilst having a cheeky beer. Good number of options all really fresh and enjoyable. The starter of Nachos with chilli were particularly nice. Service was slow, we had to chase them after sitting down for 15 mins to take our drinks order. and asked for side plates to eat our food on which never arrived and consequently our meals dropped all over the tables as it is street food and eaten by hand.
We sat outside and people were pestered by street sellers for magazines on several occasions.
Wahaca have a great app which allows you to pay your bill without needing to ask the waiter which we used and found brilliant, so quick and easy.
All in all a good experience and we will be returning.",July 2018,Wahaca Manchester,https://www.tripadvisor.com/Restaurant_Review-g187069-d8518915-Reviews-Wahaca_Manchester-Manchester_Greater_Manchester_England.html,"Manchester, United Kingdom",restaurants,4.0,4.5
Disappointing hotel,"I always try to be fair when doing reviews however, even with this in mind I still find myself having to rate this hotel poorly. We checked in at reception and despite there only being rooms to check in this still took 25 mins plus they could locate our details. We were allocated the wrong rooms and had to go back to reception to be allocated an additional room. Well as a one off you can understand that this was just an error, however it was just the start of how unorganised this hotel appears to be. We were also advised that we could only use the Spa facilities on 3 occasions during our stay and that on 2 of those occasions we would need to use the spa prior to 5pm, which when you are skiing is generally when you are out on the slopes therefore rendering it pointless. I did however attempt to use the spa on a day that I had finished early only to be told that it only had capacity for 12 people and was full. Now if you bear in mind that this hotel has hundreds of guests, the chances of ever getting to use the facilities are extremely rare. I did query this with reception and was told by the manager that I should book and finish skiing early - this to me is absurd, if you advertise and charge in the price for a Spa facility it should be able to cope with more than a tiny percentage of guests.
My main disappointment with this hotel though was the quality of food and the unprofessional staff, but more on them later.
The food served and quality to some degree depended on when you arrived as unless you were early the food tended to be either cold or had run out. I can understand that they need to be aware of waste, however subject to arriving within the meal times I would expect to be served a full variety of dishes and not what is left. The food itself was not to my liking, nor to my friends who are more adventurous in their food choices, even to the extent that they ate the snails that were served, so I don’t think we can be classed as to picky. Additionally there was no hot drinks except at breakfast which left the options of soft drinks or wine only (the wine is poor).
My biggest concern with this hotel is the staff and especially management appear to be very unprofessional. Now let me clarify what I mean as they were never rude and I would not wish to give that impression. The staff dress in a works shirt and then many had jeans, trainer and some had hoodies on occasion, although one of the managers wore the same woollen hoodie all week (no name badge) but he always had scruffy jumper/hoodie and glasses on his head. Alan by comparison was always well dressed and looked the part.
The tables in the dining room were always left with trays and food on them as the clean up team could not cope with turning the tables quickly enough - it resembles a messy school canteen where you often have to find and clear your own table. What is particularly frustrating about all this is that the other staff are always stood around talking to each other and joking around rather than helping out, there appears to be no oversight or management control, in fact often they are joining in or up to 3 stood at the door welcoming people late into service rather than helping out or organising. A further small bug bear of mine is that the staff eat their meals in the same area and not screened off. This may sound picky, however when they are all messing about and being noisy it looks unprofessional and not something I have seen or want to see at a hotel I stay at. As an example they was one occasion when they were throwing bread rolls about. I understand that they are young people, but this should not happen in sight of paying guests, who are sat in a messy room because of lack of staff to clear up. Often mugs at breakfast run out as do glasses in the lunch and evening service, I had to ask most days for staff to get some which they always did politely, but this is indicative of a lack of proactive staff. They appear to do the minimum required.

As mentioned by other contributors they rooms are very small and have 6 hangers for a weeks stay for 2 people. One last bug bear was that the balcony is thick with ice making it a real hazard to use. I understand it’s a ski resort and that it was particularly snowy when I was there however it appeared to be weeks old and was really thick. I’ve had balconies in many ski resorts and never had thick ice like this before.

All in all I would say that this hotel could do so much better than it is currently doing and provide much better service if it was better run.

Very disappointing stay.",January 2018,Hotel Club MMV Les Arolles,https://www.tripadvisor.com/Hotel_Review-g196716-d669640-Reviews-Hotel_Club_MMV_Les_Arolles-Val_Thorens_Saint_Martin_de_Belleville_Les_Belleville_Savoie.html,"Val Thorens, France",hotels,2.0,4.0
Must see,"If you've never been then you're probably wondering what to expect and wonder if it's safe. I would say if you have an open mind then visit. The best time is early evening and night time, plenty of couples and bars to drink in. If your still there later in the night and a bit worse for wear then be careful as the atmosphere does change and one of our group was pick pocketed.",December 2016,Red Light District,https://www.tripadvisor.com/Attraction_Review-g188590-d190584-Reviews-Red_Light_District-Amsterdam_North_Holland_Province.html,"Amsterdam, The Netherlands",attractions,5.0,4.0
Excellent step back in history,This is a fascinating step back in time which is difficult to believe ever happened. The museum itself consists mainly of the house. The queues to get in were over an hour.,December 2016,Anne Frank House,https://www.tripadvisor.com/Attraction_Review-g188590-d190555-Reviews-Anne_Frank_House-Amsterdam_North_Holland_Province.html,"Amsterdam, The Netherlands",attractions,4.0,4.5
Great city,"Lisbon is great for a short City break. The locals are friendly and we felt very welcome. I would recommend taking a free tour with Sandermanns to get to know the city.
It is clear that the country has been very wealthy in the past but fell on hard time during the dictatorship.
Highlights include Time Out market, Fatima, Praco do Comercio, plus general cafe stops and people watching.
The metro is very easy to use and regular as are the trams.",July 2017,Discover Lisbon,https://www.tripadvisor.com/Attraction_Review-g189158-d10113758-Reviews-Discover_Lisbon-Lisbon_Lisbon_District_Central_Portugal.html,"Lisbon, Portugal",attractions,4.0,5.0
Brilliant,"Great exhibits and wonderful animals.
I would advise to pass by the first few viewing area as they are very busy as the are probably 20+ other areas for the same tank.
The aquarium is based around one huge main tank with the same fish to view, however it is fascinating and along with Sydney aquarium the best I have every visited.",July 2017,Oceanário de Lisboa,https://www.tripadvisor.com/Attraction_Review-g189158-d195144-Reviews-Oceanario_de_Lisboa-Lisbon_Lisbon_District_Central_Portugal.html,"Lisbon, Portugal",attractions,5.0,4.5
Great food,"Good for an evening with brilliant atmosphere and lots of families eating together.
The were lots of locals as well as tourists eating there on the weekends.
The service can be somewhat lacking given that it is not overly cheap at some kiosks, however the food is still delicious.",July 2017,Time Out Market Lisboa,https://www.tripadvisor.com/Attraction_Review-g189158-d3214902-Reviews-Time_Out_Market_Lisboa-Lisbon_Lisbon_District_Central_Portugal.html,"Lisbon, Portugal",attractions,5.0,4.5
It's a tram,"Great to look at and for photographs, bit of a bone shaker at times, however not much more to say than 'it's a tram' - give it a go and watch out for the pick pockets. We didn't see any (guess that's the point) but did receive constant warnings.",July 2017,Tram 28,https://www.tripadvisor.com/Attraction_Review-g189158-d262792-Reviews-Tram_28-Lisbon_Lisbon_District_Central_Portugal.html,"Lisbon, Portugal",attractions,3.0,4.0
Alfama,"Interesting section of the old town built on a hillside of bedrock.
There are 2 lifts to get you up to the top as walking in the heat can be a challenge, much better to get the lifts up(free) and to walk down.
My wife loved the area and wanted to go back again. I have to be honest though and say for me there was nothing distinguishing it from many other older neighbourhoods in old European cities.",July 2017,Alfama,https://www.tripadvisor.com/Attraction_Review-g189158-d195649-Reviews-Alfama-Lisbon_Lisbon_District_Central_Portugal.html,"Lisbon, Portugal",attractions,3.0,4.5
Santa Justa Lift,"We stayed just a block away from here and noticed there was always a queue approx 1-2 to use the lift. You are able to go onto the bridge that connects to it at the top for free with the same views and I wait.
We used the free escalators in the metro just a block along to get to the top and then walked on the bridge to take photos, saving us waiting in the heat.",July 2017,Elevador de Santa Justa,https://www.tripadvisor.com/Attraction_Review-g189158-d195646-Reviews-Elevador_de_Santa_Justa-Lisbon_Lisbon_District_Central_Portugal.html,"Lisbon, Portugal",attractions,4.0,3.5
Free tour with Ian,"We have done many free tours with SANDEMANs in lots of cities and decided to do so again in Lisbon. Our guide Ian is from Merseyside which has a local rivalry with the area I am from back in the U.K. So it was always going to be hard to win me over the minute I saw 'you'll never walk alone'. I have to say that Ian was brilliant and one of the most passionate and informative guides we have had and he brought all the history together without ever making it hard work to keep up , just enough information without overloading you. He we're so impressed that we booked onto the afternoon paid tour to Alfama as we understood I would be guiding that also.
It transpired that we had a different guide Francisco and I have to say his style was not to our liking, he was very laconic and seemed generally to be going through the motions. I have read some favourable reviews of his free tours therefore can only conclude he was having an off day and perhaps we were unlucky.",July 2017,SANDEMANs NEW Europe - Lisbon,https://www.tripadvisor.com/Attraction_Review-g189158-d4541477-Reviews-SANDEMANs_NEW_Europe_Lisbon-Lisbon_Lisbon_District_Central_Portugal.html,"Lisbon, Portugal",attractions,5.0,5.0
Very disappointing stay,"I have stayed at Devere herons reach on several occasions but my last stay was very disappointing, I booked and paid for a double room requesting a quiet room. I was given a twin room with an adjoining door through which I could clearly hear next doors TV and later snoring. Also the soap dispenser in the shower was empty and the shower/bath was not clean. Unusually for this hotel when I came back the reception had approx 40 youths all very loud and drunk, I needed to use the stairs as the lift was broken and spotted bottles were strewn throughout. All in all a very disappointing stay considering I paid £90 for a standard double room.",November 2013,Village Hotel Blackpool,https://www.tripadvisor.com/Hotel_Review-g186332-d191526-Reviews-Village_Hotel_Blackpool-Blackpool_Lancashire_England.html,"Blackpool, United Kingdom",hotels,2.0,3.5
Good guest house,"On a recent ski trip to Austria with Inghams I stayed at the Hotel Eggerwirt in Soll Austria. My initial impressions of the hotel was how friendly the owner is and how hard she works, reception, waiting own and always with a smile and some friendly banter. The hotel itself is a 3* establishment, which I would agree with. The rooms are small but functional with plenty of wardrobe space, balcony (more for summer guests) our room had a bath although our friends who were in a triple room did not. The rooms would benefit from being updated which is not to say they are shabby just a little dated. The food in the restaurant is pleasant and wholesome and portion control good for somebody such as myself who likes to over indulge, ensuring I did not over eat but was adequately fed. If you are after al'carte then this is not the place for you but again the service is generally very good with the owner again helping make the meal with her witty banter, drinks can be a little slow in coming but nothing too serious. I did not use the sauna facilities but noted a sign which indicated that it was only in use on certain days of the week so bear this in mind if you like a daily sauna. Wifi is free which is great as many hotel in Austria have started to charge, it can be very frustrating though as it is only available in reception and around the dining room. It is also very patchy and getting connected can be a lottery, meaning people on my trip were trying to catch up with email, photos home at meal times if they were lucky enough to get online. All in all you get what you pay for and this is a well run, pleasant 3* which I would recommend to others.",February 2013,Hotel & Restaurant Eggerwirt,https://www.tripadvisor.com/Hotel_Review-g608680-d500461-Reviews-Hotel_Restaurant_Eggerwirt-Soll_Tirol_Austrian_Alps.html,"Soll, Austria",hotels,3.0,4.5
Great Venue,"This venue is as good as the pictures that you've seen and more. Firstly I rang on a Friday for a Saturday booking but was advised they were unfortunately fully booked, 20 mins later we received a call to say there had been a cancellation and that they could fit us in which I thought was great service. When you arrive you are seated in the potting shed where your orders are taken whilst drinks are served. When your table is ready you are taken from the potting shed into the main restaurant which can be rightly said to be magical. I would have too say that the food itself is good but not exceptional, however the service is excellent some of the best I have experienced even in Michelin starred restaurants.",August 2012,The Treehouse Restaurant at the Alnwick Garden,https://www.tripadvisor.com/Restaurant_Review-g504032-d731944-Reviews-The_Treehouse_Restaurant_at_the_Alnwick_Garden-Alnwick_Northumberland_England.html,"Alnwick, United Kingdom",restaurants,4.0,4.0
Interesting day out,"Whilst staying in Northumberland I spend a rainy day at Cragside house and gardens. There is the usual national trust visitors centre and all you would expect. The house is incredibly well looked after and presented. There are games for the kids to play as you go around which are necessary will little ones in tow.
Great day out and I will be going back as more to see than I could fit into one visit.",August 2012,Cragside House and Gardens,https://www.tripadvisor.com/Attraction_Review-g674031-d592125-Reviews-Cragside_House_and_Gardens-Rothbury_Northumberland_National_Park_Northumberland_En.html,"Rothbury, United Kingdom",attractions,4.0,5.0
