title,text,date,place,placeURL,placeLocation,placeType,reviewScore,avgScore
Nice property if not the right one for us this time,"Lovely location and rooms as well appointed and clean if a little small for a junior suite. As mentioned by other there are a lot of stairs, however this is in keeping with the other hotels in this area. Milen and Argiro on reception are excellent and very professional. Milen in particular suggested and booked yacht and car hire for us and is a credit to the Dana.
In my opinion this hotel should be classed as adult only as we had our daughter (15) with us and whilst we were never made to feel awkward by the staff we were the only travellers who were not in a couple. By way of illustration the loungers by the pool are joined in the middle and fold together and all tables are set up for two. All other guests were polite, however the majority seemed obsessed with taking selfies presumably to post on Instagram.
The pool staff are polite, however they wear their masks under their chins as some kind of fashion accessory and never covering their face as you would expect, this was the same throughout our 4 days at the Dana.
One final mention must go the the porters who are heroic in collecting and carrying you cases (plural) up and down the stairs for you and to our car - they were magnificent and deserve every tip that they get.
The Dana Villas and Suites is a lovely property but one that I would suggest if for adults only, especially if you like selfies.",September 2020,Dana Villas & Infinity Suites,https://www.tripadvisor.com/Hotel_Review-g635607-d196091-Reviews-Dana_Villas_Infinity_Suites-Firostefani_Santorini_Cyclades_South_Aegean.html,"Santorini, Greece",hotels,4.0,4.5
Nice restaurant with good menu,Nice restaurant with good selection on the menu and great service from the staff. If I’m Santorini I would visit again.,September 2020,Vanilia,https://www.tripadvisor.com/Restaurant_Review-g482942-d1105737-Reviews-Vanilia-Fira_Santorini_Cyclades_South_Aegean.html,"Santorini, Greece",restaurants,4.0,4.0
Semi private platinum day cruise,"We were recommended and booked with Vista Yachting by our hotel. Our party of 3 included our daughter and we wanted to ensure that we did not end up on a booze cruise. We decided on the semi private platinum day cruise as we were advised that would be the most appropriate and it was a great experience. There were 12 people including another family of 3 on our boat and it was a fun classy environment. Maria was our main host backed up by Eddie and Christou and they were all very attentive with Maria full of amusing commentary throughout. The food was a really good standard especially when you consider a good portion was cooked fresh onboard on a bbq at the back of the boat.
Hats of to Vista Yachting for providing a super trip.",September 2020,ViSta Yachting,https://www.tripadvisor.com/Attraction_Review-g189433-d12603570-Reviews-ViSta_Yachting-Santorini_Cyclades_South_Aegean.html,"Santorini, Greece",attractions,5.0,5.0
Lovely service and atmosphere,"Lovely service and atmosphere at this family run restaurant. Throughout our travels in Greece we have eaten out at least twice a day and this place is the quaintest, most relaxing place we have eaten.
The food was good and even though it is a little way of the strip my advice is make the effort and you will be rewarded with a charming atmosphere and good food.",September 2020,Parea Local Cuisine,https://www.tripadvisor.com/Restaurant_Review-g642171-d10714986-Reviews-Parea_Local_Cuisine-Parikia_Paros_Cyclades_South_Aegean.html,"Paros, Greece",restaurants,4.0,5.0
Lovely stay,"We stayed her for 3 nights and had a great stay at a lovely property with nice gardens. We stayed in a superior sea view room with a lovely sized balcony with great views of the harbour. The path to the beach is right on your doorstep and makes access to Marcello beach really easy.
The food at breakfast is good with plenty of variety and the restaurant which we ate at twice in the evenings had some of the best food we ate on our trip.
There is a complimentary bus into the town however it is quite infrequent and in my opinion could do with being more frequent as I see no reason for it not to run hourly in the morning till 12 and again later in the day 4pm until 12.
We visited during the covid pandemic and it is understandable and expected that there would be certain restrictions in place to keep both guests and staff safe. All the notices were present and the staff always wore masks, however that’s more than could be said for some of the guests. It must be a difficult balancing act for the resort to maintain safety for all guests whilst ensuring that they do not impose too much on their guests. However for me there is room for improvement at Agnanti as whilst there are notes on the doors to the breakfast area about using the hand sanitisers (provided on all tables) , wearing masks indoors in common areas and no more than 6 people in the breakfast serving area at any time these are not enforced nor are guests politely reminded to improve adherence. I would say that the 50% of the guests complied, however there were a number of families and couples who either through ignorance or choice did not follow the advice regarding masks, sanitiser and numbers which I would suggest could be fixed by a gentle reminder to all tables as they are seated of the rules to keep everyone safe. The service for drinks can also be a little slow, which is frustrating waiting for 20 minutes for 2 cocktails when all appears to be quiet, however if ordered at the pool bar during the day they take 5 mins. The pool is lovely with great loungers and the young lady serving was excellent. It is not too crowded and loungers spaced out to give you some privacy.
I used the gym whilst there which was perfectly adequate for my holiday needs.
Overall I would recommend the Agnanti if you like a quiet stay and do not want to be in the hubbub and a little isolated. If visiting Paros again I would be happy to stay at the Agnanti as my lasting impression is of a
nice room, great terrace/balcony and attentive if sometimes slow staff.",August 2020,Paros Agnanti Resort,https://www.tripadvisor.com/Hotel_Review-g642171-d241776-Reviews-Paros_Agnanti_Resort-Parikia_Paros_Cyclades_South_Aegean.html,"Paros, Greece",hotels,5.0,4.5
Exceeded expectations,"I’ve just finished a trip to Mykonos staying at the Aeolos resort and feel more than ever the need to review our experience.
We are travelling through Greece for a few weeks and don’t often do summer beach trips and were somewhat apprehensive about visiting Mykonos as we felt it may be too busy for us especially with a young daughter.
From being collected at the port, checked in with a warm welcome from the owner Panos we were definitely looked after superbly.
We were offered the choice of the room being upgraded from our original booking to a family room if we wanted to have the extra space.
However our initial fears disappeared as Panos and his team made our stay wonderful; It has been mentioned in many of the reviews that the service here is good, however I would go further and say that the service exceeds the star rating the property has. Panos and his team always seemed to anticipate what you were thinking or wanted, be it walking over with a towel for your lounger, collecting your cases, offering a lift to town, recommending a trip for the day to arranging car hire - simply put this is 5 star service but never overbearing, there is a lot that other owners could learn from Panos and his team. The service here is better than some 5 star hotels we have stayed in and Panos should be very proud of what he has achieved.",August 2020,Aeolos Resort,https://www.tripadvisor.com/Hotel_Review-g662620-d529847-Reviews-Aeolos_Resort-Mykonos_Town_Mykonos_Cyclades_South_Aegean.html,"Mykonos, Greece",hotels,5.0,5.0
WOW - You only Live Twice,"Been here twice and it didn’t disappoint either time. My wife and family were sceptical when I suggested a trip having been before on a ski trip with friends. However the place won them over and was a highlight on our family ski trip to neighbouring Obergurgl.
I can’t imagine how much they must have spent on this place but it feels like going into a Bond villains top secret lair, all highly polished concrete and spectacular views across the mountain range.
Definitely somewhere I will visit again in the future and the attached restaurant is also great.",February 2020,007 Elements,https://www.tripadvisor.com/Attraction_Review-g608679-d14929084-Reviews-007_Elements-Solden_Tirol_Austrian_Alps.html,"Solden, Austria",attractions,5.0,4.5
Great atmosphere,"Great fun and typically cheesy atmosphere.
The music is cheesy, the dancing generational and wholehearted with typical good quality Tyrollean food.",February 2020,Nederhuette,https://www.tripadvisor.com/Restaurant_Review-g608674-d2054819-Reviews-Nederhuette-Obergurgl_Tirol_Austrian_Alps.html,"Obergurgl, Austria",restaurants,5.0,5.0
Wonderful stay,"Modern contemporary hotel that manages to pull off a homely feel.
We stayed here during the busy February half term (UK) and the staff were at all times never too busy to help answer a query or provide help.
Special mention must go to Peter in the restaurant who looked after us all so well during the week and made our daughter feel special by always anticipating what she would and wouldn’t want to provide alternatives to the a la carte menu.
The spa is a good size whilst not huge and benefits from having an adults only section as well as one for families which we used.
Great trip and we will be back again.",February 2020,Hotel Gurglhof,https://www.tripadvisor.com/Hotel_Review-g608674-d497733-Reviews-Hotel_Gurglhof-Obergurgl_Tirol_Austrian_Alps.html,"Obergurgl, Austria",hotels,5.0,4.5
Stunning,"We had wanted to see this for some years and when we finally got to visit it did not disappoint.
There is no denying it is HOT however well worth a couple of hours sweat and toil walking up for the views that await.
We were advised to use the south entrance as it is less busy and the views are the same, also to avoid late mornings as that’s when most of the organised tours are there. We were fortunate that Athens was quiet when we visited, however the guides told us that up to 26,000 people a day visit at peaks times.",August 2020,Acropolis,https://www.tripadvisor.com/Attraction_Review-g189400-d198706-Reviews-Acropolis-Athens_Attica.html,"Athens, Greece",attractions,5.0,4.5
Great visit,"Great museum and thoroughly enjoyed our visit.
We decided to go midday to escape the 36’ temperatures in the air conditioned rooms.
Worth a visit but don’t go too late as it closes at 4pm",August 2020,Acropolis Museum,https://www.tripadvisor.com/Attraction_Review-g189400-d735521-Reviews-Acropolis_Museum-Athens_Attica.html,"Athens, Greece",attractions,5.0,4.5
Should be better,"This is a nice hotel located next to the old Olympic stadium about 15 Mins walk from the Acropolis.
The room we stayed in is large and it has clearly been well thought out and finished to a high standard when new. The receptionist who greeted us was very enthusiastic and even brought us 3 cans of beer and suggested we go to the roof top terrace to get a view of the Acropolis and it is fair to say we were very impressed.
On closer inspection the next morning we noticed that the room whilst not dirty had only had a surface clean and not what my wife would call a proper clean. The room as a whole is modern and stylish although it lacks some privacy with as you are able to see into the room from both the stairwell and the seating area downstairs. The bathroom has 3 lights (see picture) which are part of the styling and 2 of them did not work and the drencher shower head was broken and mainly spilled water out of the side rather than through the head itself. We mentioned these issues to the receptionist in the morning who said that she would fix or get the owner to fix, neither of which happened during our 4 night stay. Incidentally the receptionists are different each day plus is only there early morning and appear to be the cleaner and cook for breakfast omelettes also, this was fine for us as independent travellers but may not suit all.
Overall I would say that it was clearly a nice hotel initially but it looks to have dropped its standards, certainly in our room (room1) and the public areas that we used included the chipped and damaged furniture in the breakfast room, the roof terrace whilst amazing views has poorly completed workmanship to the flooring and lighting and throughout our whole stay there was a large water stain on the floor in reception that was never cleaned.
It wouldn’t take much effort to put this hotel right and hopefully they will do this in the future as it is a shame.",August 2020,Pi Athens,https://www.tripadvisor.com/Hotel_Review-g189400-d11737945-Reviews-Pi_Athens-Athens_Attica.html,"Athens, Greece",hotels,3.0,4.5
Make sure you visit....,"What an amazing gem! Cosy and friendly atmosphere, great hosts, gorgeous food and tasty wine. What more could you want? First time here and will definitely be back. Highly recommend.",January 2020,Buongiorno,https://www.tripadvisor.com/Restaurant_Review-g186346-d16668248-Reviews-Buongiorno-York_North_Yorkshire_England.html,"York, United Kingdom",restaurants,5.0,5.0
Great location,"We attend here on the 31st floor for 4 nights at the start of a trip across western Canada.
Reception staff advised us after trailing for 18hrs that they no longer had any of the rooms we had booked available (2 double beds). This was not ideal, however they gave us a larger room with a harbour view and placed a casual bed in the room which was ok if not ideal.
The hotel is clean with staff always courteous and a Starbucks in reception.
The hotel is located within 5 mins walk of the places we wanted to visit or collect transport too.",August 2019,Hyatt Regency Vancouver,https://www.tripadvisor.com/Hotel_Review-g154943-d182528-Reviews-Hyatt_Regency_Vancouver-Vancouver_British_Columbia.html,"Vancouver, Canada",hotels,5.0,4.5
Good orientation to the city,"We had Logan as a guide and he was really enthusiastic and had a sound knowledge of the city.
There was a nice icebreaker at the beginning when everyone introduced themselves and told an interesting fact, which I haven’t experienced on a free walking tour before.
The tour covered the main city centre tourist attractions along with some of the more challenging areas of the city.
Logan was a great guide and made the effort to go around the group talking to everyone individually at some point.
The only slight drawback for us was that the break halfway through was at a bar which mean that due to licensing laws we couldn’t take part as we had our 14yr old with us.
All in all I would recommend Toonie tours and Logan for anyone visiting Vancouver who wants to orientate themselves and learn a little about the city’s history.",August 2019,Toonie Tours Vancouver,https://www.tripadvisor.com/Attraction_Review-g154943-d14014678-Reviews-Toonie_Tours_Vancouver-Vancouver_British_Columbia.html,"Vancouver, Canada",attractions,4.0,5.0
Worth a visit,"We had not researched this before booking tickets so were pleasantly surprised with how good it was.
The gondola is well organised into time slots to reduce queue times although you are time
limited at the top and given a return gondola slot also. That said the time at the top was sufficient for us and did not inhibit our enjoyment.
There is a great boardwalk up to the old weather station with stunning views along the way of the surrounding mountains and valley.
There is a lovely restaurant at the top which I will make sure to book the next time I’m in Banff.
Whilst at the top we saw squirrels everywhere along with a marmot and mountain goat.",August 2019,Banff Gondola,https://www.tripadvisor.com/Attraction_Review-g154911-d184443-Reviews-Banff_Gondola-Banff_Banff_National_Park_Alberta.html,"Banff, Canada",attractions,5.0,4.5
Disappointed,"The tour consists of basically driving around in a loud noisy vehicle hoping to see some wildlife from the roadside.
Our guide Ronnie was enthusiastic, however told us nothing that anyone with a passing interest or some common sense would not already know. We saw far more wildlife on our own car journeys during the previous week.
The only animals we saw (along with everyone else who stopped in their own cars) were a group of Elk. Whilst everyone else gets out of their cars, you have to sit on the bus and look through the windows.
Really disappointing as whilst you book the trip in knowledge that the animals are wild, we had expected to be taken to some of the less travelled areas and not the main routes throughout Banff which everyone uses.
In my experience poor value for money, however if I had ‘chanced’ upon a grizzly bear I may have viewed this differently.
Lastly, I would say that friends also took a tour and did not see anything either - perhaps I should have taken more note.",August 2019,Discover Banff Tours,https://www.tripadvisor.com/Attraction_Review-g154911-d775889-Reviews-Discover_Banff_Tours-Banff_Banff_National_Park_Alberta.html,"Banff, Canada",attractions,2.0,4.5
Lovely stay,"Nice property, rooms were comfortable and well appointed, although starting to show their age in places.
Staff are first class and made our stay, a special mention should Noman on reception who was excellent in making suggestions and booking us a whale trip.",August 2019,The Oswego Hotel,https://www.tripadvisor.com/Hotel_Review-g154945-d634286-Reviews-The_Oswego_Hotel-Victoria_Victoria_Capital_Regional_District_Vancouver_Island_British_C.html,"Vancouver Island, Canada",hotels,5.0,4.5
Bristol highlight,Any visitor to Bristol should visit the Clifton suspension bridge and visitors centre to see this impressive piece of Engineering.,March 2019,Clifton Suspension Bridge,https://www.tripadvisor.com/Attraction_Review-g186220-d206437-Reviews-Clifton_Suspension_Bridge-Bristol_England.html,"Bristol, United Kingdom",attractions,4.0,4.5
Good tour,"I was in Bristol with my wife for a weekend break and decided to book this tour based on reviews on trip advisor. Our guide was Luke who was excellent, very knowledgeable with entertaining delivery. The tours street art and general Bristol history and I would recommend it as good value.",March 2019,Blackbeard to Banksy the Ultimate Bristol Walking Tour,https://www.tripadvisor.com/Attraction_Review-g186220-d7157810-Reviews-Blackbeard_to_Banksy_the_Ultimate_Bristol_Walking_Tour-Bristol_England.html,"Bristol, United Kingdom",attractions,5.0,5.0
Good food great service,"I recently visited Nederhütte and as mentioned in other reviews, the service is quick, polite and friendly.

The food is excellent and portions are generous. I had the grostel and kids Snitchell both where lovely and reasonable value.

The Après is a mixture of Euro songs and rock songs that you will know, it’s very popular and people love it.",January 2019,Nederhuette,https://www.tripadvisor.com/Restaurant_Review-g608674-d2054819-Reviews-Nederhuette-Obergurgl_Tirol_Austrian_Alps.html,"Obergurgl, Austria",restaurants,4.0,5.0
Disappointing,"This restaurant bar if located in terminal 2 Manchester Airport and is part bar with some craft ales and also serves food. The restaurant itself is nicely styled and looks great. My review focuses on the food as I just had a standard bottle of beer so can’t comment on the ales.
I had a Korean chicken burger which was pretty disappointing and poor value for money. The burger was just a small fried chicken breast with some mildly flavoured coleslaw on it. The coleslaw was straight out of the fridge and freezing cold and so wet that the bun just disintegrated as you were eating it. Whilst you expect to pay a bit more at an airport (although no reason I know of for that other than being a captive audience) however £16 for a small burger and chip still feels excessive given the standard of food. I now understand why the queue for the Burger King was so long and the spinning Jenny was far more quiet.",October 2018,Spinning Jenny,https://www.tripadvisor.com/Restaurant_Review-g9783973-d8452816-Reviews-Spinning_Jenny-Ringway_Greater_Manchester_England.html,"Ringway, United Kingdom",restaurants,3.0,2.5
Traditional Disney,"This park is exactly as you see on the adverts immaculate, magical and special. So why 3* from me then.
This was not the first visit with our daughter but the first for a few years. Now that she is older we realise that Magic Kingdom is aimed more at the younger kids for which it does an incredible job.
There is a long wait in the summer sun whilst having bags checked and then a monorail or ferry crossing to enter the park, all in all it took us 50 mins from parking the car to entering the park.
The rides are outdated now for anything but young children. Perhaps our time here is done for now until we have the pitter patter of grandchildren (Many years from now)...
However I would say that the castle and end of night fireworks show is still as impressive as ever.",September 2018,Magic Kingdom Park,https://www.tripadvisor.com/Attraction_Review-g34515-d143395-Reviews-Magic_Kingdom_Park-Orlando_Florida.html,"Orlando, Florida",attractions,3.0,4.5
Family holiday,"We stayed in a two bedroom apartment in block 14. De”Andra on reception arranged our rate and was superb in making us feel welcomed.
The room was well appointed and we were very pleased with the pool outside also which was surprisingly quiet given it was labour day weekend.
There was a little noise from the neighbours upstairs but not enough to impact on our stay.
We will definitely be coming back again.",September 2018,"Sheraton Vistana Resort Villas, Lake Buena Vista/Orlando",https://www.tripadvisor.com/Hotel_Review-g34515-d115389-Reviews-Sheraton_Vistana_Resort_Villas_Lake_Buena_Vista_Orlando-Orlando_Florida.html,"Orlando, Florida",hotels,5.0,4.5
Cockroaches in room,"We were due too stay 2 nights here but after finding cockroaches in our room and when more than a cursory inspection exposes poor cleaning we left. Also there is a cover charge of $30 per night to park your car which we they agreed to waive due to the problems we encountered.
The common areas and pool look impressive, however the rooms are small and very old with cosmetic improvements only.
I would have given this property one star were it not for the common areas and Alexey on reception who was great as was the concierge.
We were told whilst in ft.Lauderdale that the hotels main tower is being made into residential premises and that it is known locally to suffer a bug problem.",August 2018,Pier Sixty-Six Hotel & Marina,https://www.tripadvisor.com/Hotel_Review-g34227-d120426-Reviews-Pier_Sixty_Six_Hotel_Marina-Fort_Lauderdale_Broward_County_Florida.html,"Fort Lauderdale, Florida",hotels,2.0,4.0
Great way to see the city,We did a tour on the water taxi and found the commentary on who owns which house and history of the waterway fun to listen too as well as a good way to get around town.,August 2018,Water Taxi,https://www.tripadvisor.com/Attraction_Review-g34227-d1449782-Reviews-Water_Taxi-Fort_Lauderdale_Broward_County_Florida.html,"Fort Lauderdale, Florida",attractions,5.0,4.5
Fun visit,"We have visited Bubba gum in New York and Hong Kong and they are all pretty much the same. It mainly depends on the staff member who serves you.
The food is ok if a little pricey and our server in ft Lauderdale was ok if uninspiring, whereas in New York the server was really interactive even giving us a Forrest Gump quiz.",August 2018,Bubba Gump Shrimp Co.,https://www.tripadvisor.com/Restaurant_Review-g34227-d758237-Reviews-Bubba_Gump_Shrimp_Co-Fort_Lauderdale_Broward_County_Florida.html,"Fort Lauderdale, Florida",restaurants,3.0,4.0
Great food,We came across this place and what a find. We had chicken pot pie and apple pie with both being excellent. The visit was made all the better by the great service we received from Derrick 5* service and always anticipating when we needed a drink top up - he was excellent and a credit to the restaurant.,August 2018,Cracker Barrel,https://www.tripadvisor.com/Restaurant_Review-g34731-d403893-Reviews-Cracker_Barrel-West_Palm_Beach_Florida.html,"West Palm Beach, Florida",restaurants,5.0,4.0
Good hotel,"We were walk up guests and Robin at reception got us a great deal and made us feel very welcome.
We had a two bed suite which was a great size and allowed us to have a relaxing stay and relax.
We used the pool one morning which whilst small did have some nice loungers and cabanas.
Great staff and nicely appointed rooms.
If your looking for contemporary rooms or a large pool then this isn’t the hotel for you but for us it was just fine.",August 2018,Bellasera Resort,https://www.tripadvisor.com/Hotel_Review-g34467-d301420-Reviews-Bellasera_Resort-Naples_Florida.html,"Naples, Florida",hotels,5.0,4.5
Solid budget hotel,"We stayed here for 1 night and found it to be very clean with small but nice pool and common areas. Breakfast had all the elements you’d expect and was included in our rate.
There are 2 reasons for me not giving a higher star rating 1: The rooms has a slight damp feel to them; I could not fault the cleanliness even though the room is old and could do with modernising.
2: The rooms were located some 8 miles out from the main centre we wanted to spend our time on 5th Avenue.
All in all good solid hotel that gives you what you paid for nothing more, nothing less.",August 2018,Hawthorn Suites by Wyndham Naples,https://www.tripadvisor.com/Hotel_Review-g34467-d225181-Reviews-Hawthorn_Suites_by_Wyndham_Naples-Naples_Florida.html,"Naples, Florida",hotels,4.0,4.5
