title,text,date,place,placeURL,placeLocation,placeType,reviewScore,avgScore
Beautiful Setting!,I have seen signs for this place all of my life. First visit for me. It is truly beautiful although since it is all outside it is very hot in the summer! Wonderful rock formations and lots of beautiful plants. We enjoyed seeing the deer also!,June 2015,Rock City,https://www.tripadvisor.com/Attraction_Review-g35073-d105864-Reviews-Rock_City-Lookout_Mountain_Georgia.html,"Lookout Mountain, Georgia",attractions,4.0,4.5
Delicious Lasagna,"My friend and I had dinner at Maggiano's last week. We shared the eggplant parmigiano and the lasagna and found it to be excellent! It was more than we could eat, and to top it off, we were brought two MORE meals to take home! I don't know if this is standard practice or just a special deal but it made our day! I highly recommend this restaurant!",September 2014,Maggiano's Little Italy,https://www.tripadvisor.com/Restaurant_Review-g60898-d477995-Reviews-Maggiano_s_Little_Italy-Atlanta_Georgia.html,"Atlanta, Georgia",restaurants,5.0,4.0
Great Steak,My friend took me to Bones for my birthday. This was my first visit. I had the smallest steak on the menu and my friend had salmon. Both were excellent. I enjoyed a glass of house Zinfindel with my meal and my friend had tea. They brought out a very large slice of ice cream cake for dessert as a free birthday gift. The price was a bit high at $115 + tip but it was fun and a great meal!,September 2014,Bone's Restaurant,https://www.tripadvisor.com/Restaurant_Review-g60898-d435880-Reviews-Bone_s_Restaurant-Atlanta_Georgia.html,"Atlanta, Georgia",restaurants,4.0,4.5
Breakfast!,I frequently stop at Chick-fil-A for a chicken biscuit in the morning. They are always tasty and the coffee isn't bad either. They stay quite busy but the staff is always pleasant and efficient.,September 2014,Chick-fil-A,https://www.tripadvisor.com/Restaurant_Review-g60898-d4163300-Reviews-Chick_fil_A-Atlanta_Georgia.html,"Atlanta, Georgia",restaurants,5.0,4.5
Groupon Visit,We tried this restaurant because it had a great Groupon offer for dinner with wine for two. The food and service was very good but we were disappointed when we left that we had a $36 bill for what we assumed was a mandatory gratuity. We could not get an understandable explanation for the charge. The Groupon cost plus the gratuity made it a pretty expensive dinner...,July 2014,Red and Green Brazilian Steakhouse,https://www.tripadvisor.com/Restaurant_Review-g60898-d3219976-Reviews-Red_and_Green_Brazilian_Steakhouse-Atlanta_Georgia.html,"Atlanta, Georgia",restaurants,4.0,3.0
Frequent Visitor,"We have been to the Fox many, many times over the years. There are really no ""terrible"" seats anywhere. We love the architecture and ambience of the building. Always a great time!",June 2014,Fox Theatre,https://www.tripadvisor.com/Attraction_Review-g60898-d105199-Reviews-Fox_Theatre-Atlanta_Georgia.html,"Atlanta, Georgia",attractions,5.0,4.5
